title,rating,body,author,date
Hace buen café pero programación del temporizador se podría mejorar,"3,0 de 5 estrellas","Hace buen café y no es ruidosa, aunque tienes que tener en cuenta que es muy grande y ocupa bastante, como la mayoría de electrodomésticos de esta marca. Russell Hobbs hace la mayoría de sus electrodomésticos para cocinas grandes con mucha encimera. Es algo que hay que tener en cuenta. Aparte del tema del tamaño tengo que quitarle una estrella porque esperaba que hubiesen mejorado mucho más el sistema de programación: está genial contar con una pantalla LED pero sigue habiendo dos cosas que yo mejoraría

- No distingue qué día es y no puedes programar una hora diferente para los días en los que no te levantas tan temprano. Cuando le pones que quieres el café para las 7 y media de la mañana es esa misma hora de lunes a domingo. Todo lo que puedes hacer es no prepararla con agua ni con café molido nuevo para los días en que no quieres el café a esa hora. Si no tiene agua, la cafetera se encenderá pero se parará en cuanto detecte que no hay agua (en unos segundos)

- Si hay un corte eléctrico o se desenchufa pierde la programación. Aquí en Galicia durante el invierno son frecuentes los microcortes: cortes de luz que pueden ir de un segundo a un par de minutos. En cada uno de esos microcortes todo lo que no tenga una batería interna que le ayude a guardar los datos pierde la hora y la programación. Por eso todos los enchufes programables que tengo en casa tienen batería interna, porque de otra forma me vería re programando todo varias veces a la semana. Esta cafetera no guarda la hora y la programación más de un par de segundos, así que conque haya un solo micro corte que dure más que eso ya no tendré mi café hecho cuando me levante",Marieta,Revisado en España el 26 de octubre de 2018
No me gusta que no tiene boton de encendido/apagado.,"4,0 de 5 estrellas","Me gusta el sabor del cafe ,pero no tiene boton de agagar.Siempre hay que desenchufar.",Ana,Revisado en España el 26 de octubre de 2020
Buena cafetera,"4,0 de 5 estrellas",Vengo de usar una de cápsulas pero estos modelos son más baratos y sinceramente el café me sabe mejor.,Isabel,Revisado en España el 25 de junio de 2020
buena relación calidad precio,"4,0 de 5 estrellas",recomendable,jheral,Revisado en España el 10 de febrero de 2021
Que se puede programar,"4,0 de 5 estrellas",Para que salga un buen café hay que echarle mucha cantidad,Concha,Revisado en España el 22 de junio de 2020
Muy Buena Estética,"4,0 de 5 estrellas","Estética Perfecta
Hace Muy Bien su función
Difícil cargar el Agua
La entrega la Caja está Abierta sin Precinto de Seguridad la Empresa DHL",VICKO,Revisado en España el 5 de agosto de 2019
Muy bonita y funcional,"4,0 de 5 estrellas",Muy bonita y funcional. Una buena compra.,Isabel Ruedas,Revisado en España el 5 de julio de 2020
buena cafetera,"4,0 de 5 estrellas","buen articulo. Fácil de utilizar, pero a mi opiñon el temporizador le puesto a 60 minutos.",Cliente Amazon,Revisado en España el 5 de mayo de 2019
Buena presencia y fácil manejo,"4,0 de 5 estrellas",Adecuada calidad - precio,Cliente Amazon,Revisado en España el 17 de julio de 2020
Muy buena cafetera de goteo,"4,0 de 5 estrellas",Es muy util y la calidad del cafe es top,Cliente Amazon,Revisado en España el 3 de enero de 2020
Excelente Cafetera,"4,0 de 5 estrellas",Muy buen funcionamiento! Buena cafetera de goteo,Francisco Reyes,Revisado en España el 5 de enero de 2020
Su sistema,"4,0 de 5 estrellas",Buena calidad,juan carlos,Revisado en España el 14 de enero de 2019
Buen café casero,"4,0 de 5 estrellas","Cumple su función perfectamente. Además es bonita pero algo grande, la verdad. De todos modos la recomiendo",M. A. Frias,Revisado en España el 15 de mayo de 2022
Buena cafetera,"4,0 de 5 estrellas",Funciona muy bien,Elena,Revisado en España el 28 de abril de 2022
Perfecta para el desayuno o la oficina,"4,0 de 5 estrellas","Es una cafetera de calidad de jarra de cristal de gran tamaño, para filtro de papel. Con el reloj incorporado puede programarse para que arranque y haga una cafetera a una hora predeterminada, y así tener café recien hecho al despertarte, o al llegar al trabajo.

Se hecha de menos que no traiga ningun filtro reutilizable, pero ninguna de las Hobbs que he tenido lo ha traido. La mayor pega es que los genericos que hay por ahí suelen quedarse pequeños para hacer cafeteras grandes y muy cargadas.

Si se nota un poco como el dispersor de agua aprovecha mas el sabor del café, sin tener que cargarlo tanto que se inunde el filtro y acaben pasando posos, así que ese es un punto positivo para los que les gusta el café solo, o aprovechan variedades con aromas, así que esta bien para sibaritas del café (aunque personalmente ese no es mi caso).",DioxCorp,Revisado en España el 15 de octubre de 2018
facil de usar y a buen precio,"4,0 de 5 estrellas",Es una cafetera de diseño muy bonita y de uso muy intuitivo. Es perfecta para los que aman el cafè americano. A este precio es bastante complicado encontrar una cafetera digital y programable en condiciones. Destacar también que él precio en tienda física suele ser bastante más alto por lo tanto la relación calidad precio es satisfactoria.,AivliS,Revisado en España el 10 de enero de 2019
El tiempo que ahorro lo invierto en dormir,"4,0 de 5 estrellas","Es la segunda cafetera de este tipo que compró, la primera vez se me ocurrió que podría dormir un poco más a las mañanas, lo que suelo hacer es a la noche dejar el café puesto dentro del filtro llenar el depósito, y por último dejar la programación hecha, para cuando me levanto ya tengo el café caliente y me ducho tranquilamente, tiene la eficacia y la sencillez de la cafetera de goteo de toda la vida, Unido a la practicidad del programador que nos consigue unos minutos más de sueño, para mí merece la pena sin ninguna clase de dudas",imanol,Revisado en España el 12 de octubre de 2018
Fácil y bonita,"4,0 de 5 estrellas","Cafetera de color muy bonito con programación y pantalla LCD. Trae un novedoso sistema de reparto de agua ya que estaba acostumbrado a ver el típico goteo y este no es así, este es en forma circular para que el agua se reparta por todo el filtro y no deje café sin mojar.
Vale para diez tazas siendo grande la jarra.",Javier,Revisado en España el 9 de octubre de 2018
Estupenda,"4,0 de 5 estrellas",Tenía una parecida pero sin temporizador y me pedí esta por esta razón. Me encantan estas cafeteras. Las uso muchísimo y funcionan muy bien. Económicas y muy bonitas. Muy buen producto.,Niet,Revisado en España el 15 de octubre de 2018
No esta mal,"4,0 de 5 estrellas",No lleva filtro y hace que aunque pongas de papel salten muchos posos,Cliente Amazon,Revisado en España el 6 de septiembre de 2020
Bonita y fácil de usar,"5,0 de 5 estrellas",Lo que más nos ha gustado es que se puede programar una hora a la que empiece a hacer el café. Así lo tenemos listo en la mañana.,Carolina lopez,Revisado en España el 22 de diciembre de 2021
Funciona muy bien,"5,0 de 5 estrellas","Cafetera que hace buen café y que por ahora aún no se ha calcificado. La tengo 4 meses y todavía tarda en hacer el café lo mismo que el primer día, cosa que con otras cafeteras, a estas alturas, ya tardaba un montón. Lo que comentan otros usuarios es verdad: hay que poner un poquito más de café de lo habitual, pero sale sabroso.",Beatriz Lozano-Ruiz,Revisado en España el 24 de julio de 2020
Muy buena cafetera para el precio que tiene,"5,0 de 5 estrellas",Funciona todo correctamente. Con las funciones precisas y obtiene el café de manera bastante decente.,FRE,Revisado en España el 24 de mayo de 2022
hace buen café,"5,0 de 5 estrellas","Sencilla de usar, hace un café que nos gusta, por ponerle algún defecto debería tener apertura de depósito independiente del agua para facilitar el llenado.",dora,Revisado en España el 16 de enero de 2022
Es la segunda que tengo,"5,0 de 5 estrellas","Me decanté por esta marca por que ya tenia una una que me ha durado muchos años, hace café bueno y rápido. Además es muy bonito su diseño.",Cristina,Revisado en España el 11 de diciembre de 2021
Muy buena calidad precio.,"5,0 de 5 estrellas","Pedí este producto a la 1 de la mañana y al día siguiente ya lo tenia. Muy buen producto para el precio que tiene. En cuanto al producto el café sale bastante caliente y rápido, es bastante voluminoso pero no creo que suponga mucho problema. No puedo ponerle ninguna pega. Lo volvería a comprar",Cliente Amazon,Revisado en España el 6 de noviembre de 2019
MUY COMPLETA RELACION CALIDAD PRECIO,"5,0 de 5 estrellas","EL cafe delicioso,aprovecha al maximo el cafe,por su sistema. Facil de limpiar,esteticamente moderna y estilizada",Sevillacret,Revisado en España el 9 de mayo de 2022
Genial!,"5,0 de 5 estrellas","Perfecta! Muy bonita, viene en la caja con todos los detalles, tiene timer (lo más)! Llegó super rápido y me encanta!",ANA,Revisado en España el 22 de diciembre de 2021
Como todas las cafeteras Russel Hobbs ….,"5,0 de 5 estrellas","…. son perfectas, por calidad de acabado, funcionamiento, fiabilidad y diseño. Luego aparte está el café, que sale de delicia.",Antonio Iglesias,Revisado en España el 27 de diciembre de 2021
Funciona muy bien,"5,0 de 5 estrellas",Funciona muy bien y tiene la posibilidad de programarse la hora de inicio de cafe,Cástor,Revisado en España el 3 de marzo de 2022
"En perfecto estado,ya la probé.","5,0 de 5 estrellas","No me gustó q no especificara q no trae filtro permanente,se usan filtros d papel n4.",Any,Revisado en España el 4 de enero de 2022
Me gusta mucho,"5,0 de 5 estrellas","Me encanta, de echo compré dos... Lo único a lo que le pongo pega es que cuando saco la jarra y está echando el café, sigue echando, no para... Y eso... Pero es bonita y hace un buen café",Imilbuc,Revisado en España el 3 de febrero de 2021
Despiértate con el olor del café recién hecho,"5,0 de 5 estrellas","Muy buena cafetera de tipo americano. El sabor no es aguado como otras, además es muy fácil de preparar y rápida. Aconsejo usar filtro reutilizable porque es más fácil y ecológico. ¿Lo mejor? Dejarla programada la noche anterior para despertarte con toda la casa oliendo a café recién hecho ❤️",Javier,Revisado en España el 29 de febrero de 2020
Buen diseño y capacidad,"5,0 de 5 estrellas","Tiene capacidad para hacer mucha cantidad, es muy rápida. Fácil de limpiar. Es grande. El diseño es muy bonito y moderno.Me encanta.",Msercas,Revisado en España el 11 de julio de 2021
Rápida y café muy bueno,"5,0 de 5 estrellas","Muy buena cafetera. Hace muy buen café sin apenas ruido. Es muy rápida, en tres minutos está listo para tomar. Diseño bonito y fácil manejo del programador. El único pero es que tuve que buscar en la página oficial las instrucciones de uso, que no vienen en la caja.",Alfonso,Revisado en España el 13 de febrero de 2020
Fácil de usar,"5,0 de 5 estrellas",Cafetera de goteo ideal. Necesitaba una cafetera que mantuviera el café caliente para ir sirviéndome. Trabajando en casa tomo más café y lo quería más suave. Es perfecta. Puedes programarla para la hora q quieras y es muy fácil de usar. La recomiendo 100%!!!,Sally,Revisado en España el 18 de abril de 2020
"Bonita, práctica y facil de usar","5,0 de 5 estrellas",La estetica es preciosa. Es muy sencilla de usar y puedse ponerle un temporizado para que cuando te levantes tengas el café recien hecho. Relacion calidad precio muy buena,Carluma,Revisado en España el 5 de abril de 2021
No esta nada mal!,"5,0 de 5 estrellas","De alta calidad, y el kafe no gotea mientras que coges la jarra para llenar te la tasa. Aun q el uso es poco intuitivo.",Amzn Enemy,Revisado en España el 28 de febrero de 2021
Todo correcto.,"5,0 de 5 estrellas",Efectiva. Espero que no me salga defectuosa.,JULIA BARREIRA ZORRILLA,Revisado en España el 17 de marzo de 2022
Muy buena maquina,"5,0 de 5 estrellas",Fácil de usar - mi marido está encantado,Linda Angelus Sañudo,Revisado en España el 5 de enero de 2022
Muy buena cafetera,"5,0 de 5 estrellas","Hace un buen café y jarra con bastante capacidad.Sale después de hecho muy caliente y aguanta después muy bien la temperatura.Tarda como unos 8 min.en hacer el café.Me gusta,un buen producto.
Muy contento con la compra.",pablo,Revisado en España el 24 de enero de 2020
Café americano,"5,0 de 5 estrellas","Se trataba de un regalo, y a día de hoy, se que el propietario de la cafetera, esta muy contento con ella.",Ángelyega,Revisado en España el 14 de enero de 2021
Compra recomendable,"5,0 de 5 estrellas","Es una maravilla, facilisimo hacer cafe y si quieres en gran cantidad, se limpia super rapido. Encatado de la compra. No lleva filtro pero en mercadona tienes paquete de cien filtros por 0.70 céntimos.
Lo recomiendo 100 por 100.",armando,Revisado en España el 17 de septiembre de 2019
Buena opción calidad-precio,"5,0 de 5 estrellas","Muy fácil de usar, el café esta muy bueno y el café aguanta caliente bastante bien. Por sacar algún defecto, un poco plasticosa, pero acorde con el precio.",JPant,Revisado en España el 6 de mayo de 2020
Buena calidad.,"5,0 de 5 estrellas",Buena calidad en materiales y acabado. El antigoteo funciona siempre. El anillo de goteo al dispersar el agua sobre el café resulta en café más aromático. Lo recomiendo.,AMF,Revisado en España el 17 de agosto de 2020
Fantástica cafetera,"5,0 de 5 estrellas","No defrauda, todo lo que parece en imagen y en descripción lo cumple, es fantástica. Pena que no venga con filtro, recomiendo comprar uno o habrá que usar desechables.",LaraLozano,Revisado en España el 29 de julio de 2020
Buena cafetera y bonita,"5,0 de 5 estrellas",Nos ha encantado. Es fácil de usar y es muy bonita,miren. Mj,Revisado en España el 26 de agosto de 2021
Rápida y programable,"5,0 de 5 estrellas","Es perfecta, solo le falta limpiarse sola y autorrecargarse. Muy recomendable. Por ponerle una pega, mejor de otro color, que en el rojo brillante se notan mucho las manchas de la cocina.",Virginia Calcerrada,Revisado en España el 4 de enero de 2020
Encantada.,"5,0 de 5 estrellas","Encantada, esta firma nunca defrauda, fue una pena no haberlo comprado antes, café espectacular y un ahorro de tiempo enorme.",MOLLY,Revisado en España el 29 de octubre de 2020
