title,rating,body,author,date
Muy bonita,"5,0 de 5 estrellas","La cafetera me ha encantado es preciosa, en verdad como mucho para dos personas esta bien",francisca ariza guijarro,Revisado en España el 20 de septiembre de 2023
Estupenda,"5,0 de 5 estrellas","Perfecta cafetera para uso doméstico, acabo d preparar el primer café con ella y funciona genial y es muy rápida, el café bastante bueno",Paola,Revisado en España el 7 de julio de 2023
Muy práctico,"5,0 de 5 estrellas",Estaba cansada de las cápsulas y me decidí a comprarla tengo una cafetera italiana eléctrica para hacer el café que he usado toda la vida,Cliente Amazon,Revisado en España el 9 de agosto de 2023
Café expreso delicioso,"5,0 de 5 estrellas",Muy buen producto a precio muy competitivo...,Jungle's George,Revisado en España el 11 de noviembre de 2023
Buen precio,"5,0 de 5 estrellas",Muy aficionado a tomar cafe y este modelo es muy fácil de transportar,José L.,Revisado en España el 19 de septiembre de 2023
"Práctica ,cómoda fácil de transportar","5,0 de 5 estrellas","Práctica ,cómoda fácil de transportar",Yania,Revisado en España el 14 de octubre de 2023
Lo rápido que llego su entrega a su hija,"5,0 de 5 estrellas",El artículo comprado excelente quiero na provecho para decir que Amazon está tardando muchos días para hacer la entrega esta vez hasido fenomenal gracias pero tengo artículos pendientes rosando ya los 10 días fatal,Gloria Evangelina Cachafeiro Colon,Revisado en España el 17 de mayo de 2023
