title,rating,body,author,date
Buena cafetera,"5,0 de 5 estrellas","Muy buena cafetera, merece la pena la inversión. La uso en placa de inducción y tarda muy poco en hacer el café. Es práctica y fácil de limpiar. Y vierte el café sin derramar una gota. Muy contenta con la compra.",Nola073,Revisado en España el 28 de junio de 2024
Espectacular,"5,0 de 5 estrellas","La cafetera funciona perfectamente, hace un café muy rico y lo hace bastante rápido, pedí la más pequeña y aún así fácilmente te da para 3 tazas, la quería solo para mi y al final la usa toda la familia porque les ha encantado, creo que es de muy buena calidad",Cliente Amazon,Revisado en España el 15 de junio de 2024
Pésima calidad,"1,0 de 5 estrellas","Comprada ayer y en menos de 24 horas procedemos a devolverla. Siguiendo las instrucciones, antes de su primer uso, la cargamos 3 veces de agua y café. En todas las ocasiones pierde agua, por supuesto, estaba bien cerrada. Diseño bonito, calidad lamentable",Joan,Revisado en España el 14 de junio de 2024
Bonito diseño y robusta,"4,0 de 5 estrellas","Es robusta y hay una cosa que me llama la atención respecto de otras cafeteras de este tipo, cuando echas el café en la taza, no se derrama nada.",Ramón Rueda Aragón,Revisado en España el 3 de junio de 2024
El mango no quema,"5,0 de 5 estrellas",Cómo buena enamorada del café os diré que es una cafetera de gran capacidad y muy cómoda. Sorprendentemente el mango aunque también es de acero no quema...Me encanta mi cafetera muchísimas gracias,Raquel,Revisado en España el 30 de mayo de 2024
Resistente.,"5,0 de 5 estrellas","La compré porque los mangos de plástico de otros modelos acababan rompiéndose. Esta es de acero completamente excepto el sello de silicona, por lo que espero que dure muchísimo.",Darío Fernández Saro,Revisado en España el 26 de mayo de 2024
Excelente,"5,0 de 5 estrellas",Desde el principio funciona de maravilla y hace un café buenísimo,Javier Gimenez,Revisado en España el 22 de mayo de 2024
Bonita y de calidad.,"5,0 de 5 estrellas","Muy buen tamaño y muy buena calidad. Completamente de acero inoxidable, construcción muy sólida.
El mango es completamente metálico y va soldado al cuerpo de la cafetera, es decir, durará mucho tiempo. Compra recomendada.",Daniel,Revisado en España el 13 de mayo de 2024
Muy recomendable,"5,0 de 5 estrellas","La cafetera es buena , muy sólida y hace un café de 10.",Patricia O.,Revisado en España el 13 de mayo de 2024
Buenas,"5,0 de 5 estrellas",De momento sin problema,Rafael Alcaraz Sapiña,Revisado en España el 9 de mayo de 2024
300 cc ideal para dos personas,"5,0 de 5 estrellas",Robusta y elegante,Cliente de Amazon,Revisado en España el 17 de abril de 2024
Muy util,"5,0 de 5 estrellas",Me ha encantado. Es muy eficiente,Emilio,Revisado en España el 16 de abril de 2024
Cafetera,"5,0 de 5 estrellas",Porque el ☕️ es mucho mejor que cual que otro !!!!,chantal,Revisado en España el 13 de abril de 2024
Muy recomendable,"5,0 de 5 estrellas","Se nota que es de buena calidad, sólida y pesada. el mango no se calienta si el fuego no sobresale de la base. El café, buenísimo pero hay que seguir las instrucciones y desechar los 3 primeros cafés.",Amalia CG,Revisado en España el 1 de abril de 2024
Tiene una tara en la tapa,"5,0 de 5 estrellas","Tiene una muesca en la tapa, quiero cambiarla por otra. Me gusta muchísimo y confío en que una en perfectas condiciones me va a durar muchos años",Mª Esther Colmenarejo Rodriguez,Revisado en España el 22 de marzo de 2024
Preocupante,"1,0 de 5 estrellas","No acaba de enroscar bien y eso, además de incómodo, podría llegar a ser bastante peligroso. El sabor del café tampoco me parece el mejor (de momento sabe muy aguado) y parece mancharse mucho. Ah, y quema muchísimo el mango: imposible cogerlo al acabar de salir el café. Toca usar guante protector o esperar. En unos días decido si la devuelvo o no.",jp,Revisado en España el 22 de marzo de 2024
Muy buena calidad,"5,0 de 5 estrellas","Robusta, elegante y muy resistente, nada más cogerla se nota que es de muy buena calidad, use una de “ las economícas y estalló “, ah y sale el café buenísimo",Francisco,Revisado en España el 20 de marzo de 2024
Muy buena calidad,"5,0 de 5 estrellas",Hace buen café es compacta y de muy buena calidad.,josep,Revisado en España el 17 de marzo de 2024
Me gusta mucho antes tenía otra creo que es de aluminio pero esta me encanta,"5,0 de 5 estrellas",Muy buena,Mihail,Revisado en España el 17 de marzo de 2024
Muy buena,"5,0 de 5 estrellas",Muy bien todo,Pablo S,Revisado en España el 17 de marzo de 2024
Cafetera,"3,0 de 5 estrellas","Pesa cuando está llena para las personas que tienen dificultad en el brazo.
Buena para hacer el café.",María,Revisado en España el 16 de marzo de 2024
Cafetera,"5,0 de 5 estrellas",Buena calidad y tamaño,URBANO,Revisado en España el 5 de marzo de 2024
De momento todo bien .,"3,0 de 5 estrellas","Buena calidad .
Buenas prestaciones .
Precio un poco alto",Emilio,Revisado en España el 3 de marzo de 2024
Muy cara y producto dañado con el uso,"2,0 de 5 estrellas",La tapa que cierra el café se daña con muy poco uso. Además no cierra bien la cafetera,Alberto,Revisado en España el 2 de marzo de 2024
SALE AGUA,"1,0 de 5 estrellas","Sale agua por la unión entre la parte inferior y superior. No sella bien, mala calidad",Luis Miguel Sánchez García,Revisado en España el 2 de marzo de 2024
Calidad 100/°,"5,0 de 5 estrellas",Muy buena auténtica,Ane,Revisado en España el 27 de febrero de 2024
Sólida pero pequeña,"5,0 de 5 estrellas",Tiene menos cantidad de la anunciada.,AbuDaud,Revisado en España el 26 de febrero de 2024
Perfecta,"5,0 de 5 estrellas",Buena calidad y bonita,Cliente Amazon,Revisado en España el 23 de febrero de 2024
Maravillosa,"5,0 de 5 estrellas",Funciona super bien👌,sergio g.,Revisado en España el 19 de febrero de 2024
Bonita y rápida en inducción,"5,0 de 5 estrellas",Hace un par de meses que la usamos a diario y muy contentos. Nos preocupaba la compatibilidad con la placa de induccion porque la anterior que tuvimos tardaba muchísimo en hacer el café. Esta en un par de minutos hace que suba. De capacidad está muy bien para una familia cafetera. Es bonita. No molesta a la vista si la dejas sobre la placa. Ya actualizaré si sale rana.,Cliente Amazon,Revisado en España el 5 de febrero de 2024
Cafetera perfecta,"5,0 de 5 estrellas",Buen café y estéticamente es Preciosa,Conchita,Revisado en España el 27 de enero de 2024
Hace un café estupendo,"5,0 de 5 estrellas","Es una cafetera que hace un muy buen café. He comprado el modelo pequeño porque la que tenía se me quedó sin asa, y estoy encantada con la elección que he hecho.
El asa es estupenda y el asa es estupenda y muy separada de la cafetera por lo que no hay problema con las quemaduras la tapa es hueca y también evita las quemaduras.
Mi problema era que la anterior cafetera tardaba en ser detectada por la inducción y me pasaba el tiempo frotando con algo metálico la base o poniendo un cazo junto con la cafetera para que me funcionase, con esta ningún problema estoy más que encantada",Cliente Amazon,Revisado en España el 23 de enero de 2024
Rosca muy dura,"2,0 de 5 estrellas",La rosca va muy dura,Cliente Amazon,Revisado en España el 14 de enero de 2024
Muy bonita y práctica,"4,0 de 5 estrellas","No entiendo mucho de café por lo que mi valoración en cuanto al sabor es muy personal, me parece que está bien, no el mejor café que he probado pero seguramente tiene que ver también con el café que he utilizado hasta ahora. Es muy bonita y fácil de utilizar y de limpiar. Lo único es que una de las piezas del interior ya tiene una mancha de café que no se quita (pero como es por dentro no se ve). Por lo demás de momento estoy muy contenta.",NGB,Revisado en España el 9 de enero de 2024
MUY BONITA,"5,0 de 5 estrellas","De momento no puedo opinar sobre como funciona es Nueva,es para regalo,no se a probado,pero tiene muy buena calidad, grandecita es la de 500ml. seguiré informando cuando se utilice😉☕",Maria,Revisado en España el 4 de enero de 2024
Muy buena calidad,"5,0 de 5 estrellas","Me parece muy sólida, enrosca muy bien, lo que es fundamental para que pueda hacerse el café. Es realmente cara pero espero que merezca la pena. El diseño también es muy bonito",Begoña,Revisado en España el 23 de diciembre de 2023
Muy buena calidad,"5,0 de 5 estrellas","Muy bonita y de calidad, funciona perfecto en mi placa de inducción.",Luis,Revisado en España el 18 de diciembre de 2023
No es lo que esperaba,"1,0 de 5 estrellas","Cuando la saque de la caja para ver cómo venía,la volví a meter porque biene muy rayada por el culo,se ve que la han usado bastante y limpiado con estropajos de aluminio,no es lo que esperaba por 52 €.",Verónica,Revisado en España el 9 de diciembre de 2023
Buen café y muy rápido.,"5,0 de 5 estrellas",El café muy bueno. No gotea. Es muy rápida.,José Manuel Díaz Cañas,Revisado en España el 4 de diciembre de 2023
Calidad pero china,"4,0 de 5 estrellas",En ali solo 44 lereles. Si lo llego a saber!!! Ya por no devolverla. Para ser xina buenismia calidad,Alejandro,Revisado en España el 30 de noviembre de 2023
Diseño,"5,0 de 5 estrellas","Cafetera elegante, de buena construcción, que hace muy buen café. Encantado con ella, mi mujer más.",ártabro,Revisado en España el 18 de noviembre de 2023
Hace un rico café,"5,0 de 5 estrellas","Me gusta mucho el café que hace, se limpia fácilmente y el diseño es bonito. Parece una tontería pero no sabe igual el café en unas cafeteras que en otras, aunque el sistema sea el mismo.",Cliente Amazon,Revisado en España el 18 de noviembre de 2023
La tapa muy molesta,"3,0 de 5 estrellas","La parte de abajo está muy bien pero la parte de arriba no me gusta tanto, es que la tapa molesta mucho y el mango también",ILEANA,Revisado en España el 16 de noviembre de 2023
Cafetera italiana,"5,0 de 5 estrellas",Es bonita y limpia,Cuchillo de caza,Revisado en España el 14 de noviembre de 2023
fácil de limpiar,"5,0 de 5 estrellas","un poco corta de capacidad para mi.
saludos.",FRANCISCO JAVIER MAROTO,Revisado en España el 5 de noviembre de 2023
Calidad del material superior,"5,0 de 5 estrellas","He estado buscando una buena cafetera desde hace algún tiempo. Nunca encontré ninguna a mi gusto. Finalmente me he comprado esta pequeña porque la mayoría de las reseñas son positivas. La cafetera es de acero inoxidable de una muy buena calidad. El café sabe súper rico! Yo lo tomo sin leche ni azúcar, así que se nota muy bien la calidad. En el librito que acompaña la cafetera, dicen que queda agua en depósito para evitar que se estropea. No gotea tampoco. La única ""pega"" que hay es que se seca al aire con manchas, a pesar de usar una buena marca de lavavajillas. Es cuestión de secarla directamente. Yo uso 200ml de agua y en butano se prepara el café en menos de 6 minutos. El asa se calienta, una pena. Pero no gotea al verter el café en la taza.
Con fecha del 16 de noviembre añado un comentario más, mejor dicho: una corrección. Al no poner el fuego muy alto, el asa no se calienta y sin embargo el café se prepara en el mismo tiempo.

Unos meses después de hacer uso intensivo de la cafetera quiero añadir que al hacer el café a fuego bajo la caetera se queda bonita.
La cantidad de café que sale es de unos 175 ml",Jose Francisco,Revisado en España el 28 de octubre de 2023
Bueniiiisima cafetera italina 500 cc,"5,0 de 5 estrellas",Sale el café en 5 minutos o antes. Perfecta.,Ana C.,Revisado en España el 21 de octubre de 2023
Magnifico producto,"5,0 de 5 estrellas",Su tamaño y calidad,Diego Rogelio Rojas,Revisado en España el 2 de octubre de 2023
Cafetera italiana,"3,0 de 5 estrellas","La cafetera es muy robusta y parece súper duradera. El café sale bueno, a mi me gusta suave. La mayor pega que tienen, que ya lo había leído en otros comentarios, es que queda bastante agua en el depósito de abajo y que yo pedí una de 6 tazas y me la bebo toda yo. Vamos, que es muy pequeña.",Cati Mascaró,Revisado en España el 2 de octubre de 2023
Funciona muy bien,"5,0 de 5 estrellas",Funciona muy bien,Lourdes Morato,Revisado en España el 30 de septiembre de 2023
calidad de los marteriales,"5,0 de 5 estrellas","La verdad es que hace un cafe muy bueno,siempre y cuando te guste este tipo de cafe,facil de limpiar y de preparar",Kimo,Revisado en España el 30 de septiembre de 2023
Buena,"4,0 de 5 estrellas",Buen producto,Luisao,Revisado en España el 20 de septiembre de 2023
Defectuoso,"1,0 de 5 estrellas",Se sale el agua por la junta a pesar de colocar agua por debajo de la válvula y cerrarlo de mil maneras. Es una lástima porque había visto muy buenos comentarios. La devolveré.,Sergio Jose Lafuente Mendez,Revisado en España el 14 de septiembre de 2023
Dejo de hacer café,"2,0 de 5 estrellas",En una semana dejo de hacer café.,David,Revisado en España el 14 de septiembre de 2023
Preciosa.,"5,0 de 5 estrellas","Es muy bonita y de calidad, vale a pena el precio .",Iracelia,Revisado en España el 12 de septiembre de 2023
Super cafetera,"5,0 de 5 estrellas","Muy buena cafetera, sale el café muy rápido y muy rico. Yo tengo inducción y me va perfecta. La recomiendo 100%",Almu,Revisado en España el 7 de septiembre de 2023
Cómoda y de calidad,"4,0 de 5 estrellas",El asa no se calienta. Con inducción el café sube en un par de minutos. Fácil de limpiar. Vierte muy bien. El aluminio que está en contacto con la inducción cambia de color oscureciendose con el uso pero supongo pasa con todas. Es un producto de calidad,Cliente Amazon,Revisado en España el 17 de agosto de 2023
Buena calidad,"5,0 de 5 estrellas","Me gusta mucho, es bonita y la calidad muy buena y lo mas importante, hace muy buen cafe",Mª José Jaén Bermudez,Revisado en España el 8 de agosto de 2023
Buena cafetera,"5,0 de 5 estrellas","Una buena cafetera, por ahora ningún problema, estéticamente bonita. La recomendaría.",Sara López,Revisado en España el 19 de julio de 2023
El tamaño no corresponde.,"1,0 de 5 estrellas",Más grande que 2-4tazas.,Martina,Revisado en España el 17 de julio de 2023
Preciosa y el café delicioso!,"5,0 de 5 estrellas","La cafetera es muy bonita y robusta, el café queda delicioso! Estoy encantada con la cafetera y la compré a buen precio aprovechando el prime day. Recomendable 100% para todos los amantes del café!",Ysa,Revisado en España el 16 de julio de 2023
Con inducción es perfecta,"5,0 de 5 estrellas","Además de bonita y elegante, su cierre es suave (sin bloquearse como ocurre con otras) y el café sube en menos de dos minutos.
Sólo tiene una cosa que es mejorable, y es que el espacio para el café es justo. Con la cafetera llena, sale un poco claro (también es cuestión de gustos)",JoséMel,Revisado en España el 12 de julio de 2023
No funciona muy bien en induccion,"2,0 de 5 estrellas",A veces falla en placa de inducción.,Juan Antonio Mesonero Escuredo,Revisado en España el 10 de julio de 2023
Hace buurn café sin que se quede óxido x dentro,"5,0 de 5 estrellas",Que no se derrama x el pitorro,EDU,Revisado en España el 30 de junio de 2023
Precio no conforme al producto,"2,0 de 5 estrellas","No es un mal producto pero no tiene la calidad para el precio que se paga.
La tapa podría estar soldada a ambos lados en lugar de sólo uno.

El mango no se calienta, lo que cumple con mis expectativas. Aunque después del primer uso, se percibe la parte del mango donde está soldada a la cafetera. Al precio que se pega, se espera que detalles como estos se cuiden.

Es muy similar a la que se vende en cecotec, sin embargo quería en plata y me decidí por comprarla en esta otra marca.",Felipe,Revisado en España el 29 de junio de 2023
Buena cafetera. Amazon mal,"5,0 de 5 estrellas","La cafetera está muy bien, cuando consigues que Amazon te envíe una en condiciones. Me ha costado pedirla 4 veces para que llegará una que no hubiera sido devuelta antes. Gracias",Juana,Revisado en España el 18 de junio de 2023
Decepcionada,"1,0 de 5 estrellas","Decepcionada. Se sale el agua por la rosca y lo he probado todo ....la lleno por debajo del nivel, le pongo el café justo, la enrosco con fuerza , etc y no hay manera. Todos los días me toca limpiar la vitro porque deja cerco.",Amalia,Revisado en España el 18 de junio de 2023
Buena calidad pero excesivamente cara....,"3,0 de 5 estrellas","La compré porque era la única que en las valoraciones de sabor que tenía casi 5 estrellas. Pues bien, el café sale igual que en cualquier otra cafetera del estilo. Está claro que a mejor calidad del café mejor bebida obtendrás, pero la cuestión es que la cafetera, en este caso, no determina nada por lo que hay miles de opciones más baratas.",MODE MARTÍNEZ PALENZUELA,Revisado en España el 29 de mayo de 2023
Muy bien,"5,0 de 5 estrellas",Buen material. Robusta. Gran capacidad.,Diego,Revisado en España el 22 de mayo de 2023
Magnifica Cafetera,"5,0 de 5 estrellas","De esta cafetera me gusta todo.Tiene muy buena calidad de acero,hace un café excelente y lo que más me gusta es que al ser estrecha se abre y cierra con facilidad porque está a la medida de la mano sin tener que agarrar el asa para hacerlo.
La anterior que tuve una abra me falló el asa por ese motivo.",Amaia,Revisado en España el 16 de mayo de 2023
Acabo de estrenarla y se ve muy buena aparentemente y además tiene un diseño muy bonito,"5,0 de 5 estrellas",Me ha encantado,Mila,Revisado en España el 9 de mayo de 2023
Gran calidad,"5,0 de 5 estrellas","Es lo que esperas, un producto de calidad, bien construido y que funciona genial. Quizas algo caro, pero tiene pinta de durar mucho",Fernando,Revisado en España el 28 de abril de 2023
Cumple mis expectativas,"5,0 de 5 estrellas",Bonito diseño y funciona perfectamente,Concha,Revisado en España el 21 de abril de 2023
Robusta,"5,0 de 5 estrellas",Muy buena calidad hace el café muy rica,Cliente Amazon,Revisado en España el 21 de abril de 2023
Decepción,"2,0 de 5 estrellas","Me gusta la estética que tiene y no me gusta que la tapadera se mueve mucho, vino suelta y suena mucho.",Cliente Amazon,Revisado en España el 8 de abril de 2023
Se oxida al mes de usarla,"1,0 de 5 estrellas","Malísima para su precio, cierra bien y hace bien el café vale. Pero al mes de usarla de oxida por dentro y se desprende la pintura tanto de dentro, que es lo que más preocupa porque salen restos de óxido en el agua, como por fuera , que se quita la pintura a la tercera vez de ponerla en la vitro, y encima deja la marca de la pintura quemada en la vitrocerámica. Un completo desastre, nada recomendado",Carlos,Revisado en España el 26 de marzo de 2023
No soy de escribir pero bueno,"5,0 de 5 estrellas","La cafetera está muy bien, la uso a diario para hacerme un cafe solo y de momento genial.
La uso en la vitro de induccion y cero manchas la verdad.
Porponerle una pega siempre se me queda agua sin subir, no se si es normal o que pero a mi no me importa ya que para mi taza es perfecto.
No se la verdad que está muy bien se ve recia de materiales y no he tenido ningun fallo en casi 4 meses o asi usandola a diario 2 veces",javier,Revisado en España el 20 de marzo de 2023
Práctica y resistente.,"5,0 de 5 estrellas",Recomendada para el día a día. Da para 2-3 tazas. Fácil de limpiar y práctica.,Luis,Revisado en España el 15 de marzo de 2023
CAFETERA ITALIANA,"5,0 de 5 estrellas","Elegante cafetera, tipo italiano, de buen acero inoxidable. Admite todo tipo de fuegos, incluido inducción. Hace un café muy bueno.",Jose Manuel,Revisado en España el 14 de marzo de 2023
Elegancia y funcionalidad,"5,0 de 5 estrellas","Siempre me han parecido feas las cafeteras de toda la vida. Buscaba una que fuera funcional y a la vez bonita. Acerté con esta cafetera, lleva un baño en el depósito para que no formen esos depósitos calcáreos. Hace muy buen café y no gotea nada. Queda un pelín de agua para que no se queme la base, para mi es ideal en todos los sentidos",Almudena,Revisado en España el 11 de marzo de 2023
Me llegó en mal estado,"1,0 de 5 estrellas","Caja abierta y con golpes
Cafetera deformada no cierra bien
Arañazos
Manchas",Cliente Amazon,Revisado en España el 6 de marzo de 2023
Buena cafetera,"5,0 de 5 estrellas",Tiene poca capacidad para lo que yo buscaba. Por lo demás es muy buena,conchi,Revisado en España el 3 de marzo de 2023
Estupenda cafetera,"5,0 de 5 estrellas","Acabamos de comprar esta cafetera y después de una semana de uso podemos decir que ha sido un completo acierto. Hace el café rápido y muy rico. Es robusta, con el asa metálica, de buenos materiales. Es muy bonita (esto es subjetivo, claro, pero a nosotros nos lo parece; el metal en contraste con la parte inferior en negro le da un toque), se limpia de forma muy fácil y, en principio, aunque aún es pronto para valorarlo, parece que tenemos cafetera para años. No es la opción más barata de las que te van a aparecer en las búsquedas, pero con la anterior que tuvimos, de aluminio, no acabamos nada contentos. En definitiva, recomendadísima.",Igor,Revisado en España el 12 de julio de 2024
Excelente cafetera,"5,0 de 5 estrellas",Buen producto y mucha estetica,Genoveva,Revisado en España el 21 de julio de 2024
La peor cafetera que he tenido,"1,0 de 5 estrellas","Si alguien quiere practicar el estoicismo, que se compre esta cafetera. 60 eurazos, preciosa eso sí, pero ni un solo café sin quemar, a baja intensidad de llama no sale apenas, pasan los minutos y nada , optas pues por darle intensidad y se quema, sale muy irregular. Ya es difícil hacer mal una cafetera italiana, pues lo han conseguido, la lástima es que por un día no la puedo devolver, culpa mía porque he hecho todo tipo de pruebas por si era yo , la llama, el horóscopo , Putin, etc…. Al final he comprado otro modelo, de otra marca claro, con un poco menos de glamur, y va de maravilla.",vicent mira barrachina,Revisado en España el 2 de febrero de 2023
Muy buena aunque cars,"4,0 de 5 estrellas",De momento bien parece más robusta,J.M.A.,Revisado en España el 15 de julio de 2024
Todo correcto,"5,0 de 5 estrellas",Vino como lo esperaba,Xabi,Revisado en España el 17 de julio de 2024
Estupenda,"5,0 de 5 estrellas","La calidad de la cafetera, se nota desde que la coges en la mano y el café estupendo",Ana,Revisado en España el 1 de julio de 2024
Tiene un diseño muy bonito.,"5,0 de 5 estrellas",Una cafetera que cumple su función y tiene un diseño muy bonito.,Karin Nestrojil,Revisado en España el 5 de julio de 2024
Ok,"5,0 de 5 estrellas",Muy bien,Luis C.,Revisado en España el 1 de julio de 2024
No se oxida,"5,0 de 5 estrellas","Por fin encontré una buena cafetera, un poco cara pero bueno, lo merece ya que es de buena calidad. Estuve pensándolo mucho por los comentarios. La verdad que estoy contenta, los comentarios que dicen que se sale el agua por la junta es por que la llenan mucho de café y no puede cerrar bien. A mi me pasó y he probado de todas las maneras hasta que di con la solución. Se debe de poner agua hasta por debajo del tornillo de válvula y poner café si sobrepasar una montaña, de está manera te sale el café mejor aún de sabor, no sale aguado, sale todo el agua sin quedar nada en el depósito y cierra bien sin pérdidas. Es verdad que en el depósito toma algo de color como he visto en una foto y en la base del culete de la cafetera, pero yo creo que eso es normal pero OXIDO no. También he decir que lo que menos me gusta que de 12 tazas no tiene nada, es un poco pequeña, pero eso a mi no me preocupa tanto. Sale 500 mm medidos con una jarra con medidor. E n fin....buena cafetera.",luisa maria,Revisado en España el 7 de enero de 2023
Descontenta,"2,0 de 5 estrellas","Es una cafetera muy robusta, pero siempre se queda en el depósito algo de agua.
Lo peor esque me quema la placa de induccion, y donde la deje, deja cerco quemado.",REBECA,Revisado en España el 30 de junio de 2024
Buena cafetera para plaça de inducción,"5,0 de 5 estrellas","No estaba segura que mi placa de inducción detectara la cafetera. Compré el tamaño grande para que la base fuera más grande y así la probabilidad de que funcionara fuera mayor y al final funciona perfectamente. Mi placa es Bosch y el fuego pequeño es de 16 cm.
Vi un poco raro que antes de poder usarla haya que preparar café 3 veces y desecharlo. Normalmente antes del primer uso se utiliza sólo con agua.
En cuanto a la limpieza es fácil y rápida porque recomiendan sólo con agua y yo utilizo agua caliente para que quede mejor. Lo que no entiendo es que como es apta para el lavavajillas, en ese caso ya se limpiaría con jabón. Creo que es mejor limpiarla a mano.
La capacidad de la cafetera grande indicaba que era de 300 ml pero en realidad el depósito tiene más capacidad, casi los 400 ml, teniendo en cuenta que no puedes sobrepasar la válvula. Si pones esta cantidad de agua, después te acaba quedando 300 ml netos de café por lo que se acaba perdiendo y porque siempre en el depósito queda un poco de agua.
El café queda bien. En general estoy contenta con la compra.",Cliente Amazon,Revisado en España el 24 de enero de 2022
Chica,"2,0 de 5 estrellas",La devolví porque era súper chica para el precio que tiene,Camila Cuitiño,Revisado en España el 5 de julio de 2024
Calidad precio está perfecta la recomiendo,"4,0 de 5 estrellas","Es fácil de limpiar y está el acero muy bien pulido por lo q apenas se mancha
La recomiendo .",Antonio,Revisado en España el 15 de enero de 2023
