title,rating,body,author,date
Cambia de color.,"3,0 de 5 estrellas","La cafetera es muy bonita.
Tras varias semanas en uso me ha decepcionado. La utilizo en placa de inducción y la base de la cafetera se ha oscurecido, ósea, ha cambiado de color, como si le dieran llamas de fuego. No hay manera de quitar ese oscurecimiento de la base.
Por dentro tiene la típica ranura que complica la limpieza.
En resumen, no la volvería a comprar, ni la recomiendo. Además por lo que és .... el precio es excesivo.",Begonya,Revisado en España el 5 de septiembre de 2022
Con corrosión,"1,0 de 5 estrellas","A los 6 meses de uso, sin frotar en el interior, ya que tengo por costumbre no fregar por dentro la cafetera, solo por fuera, aparece con corrosión. Una pena",Cliente Amazon,Revisado en España el 9 de julio de 2024
Bonita y sólida,"5,0 de 5 estrellas","Nos ha parecido bonita y sólida, aunque un poco más cara que las demás, tiene muy buen diseño, funciona perfectamente y el mango parece muy firme, que fue el motivo por el que elegimos este modelo. A lo largo de los años se nos han ido rompiendo las otras cafeteras precisamente por el mango. A ver qué tal sale esta.",Nuria,Revisado en España el 24 de enero de 2023
Magnifica cafetera,"5,0 de 5 estrellas","Tenía dudas de comprarla por algunas criticas, pero después de unos dias mi opinión es que es una cafetera magnifica, bien construida, muy bonita y la relación calidad precio es inmejorable, No entiendo alguna de las criticas. La cafetera funciona correctamente en cocinas de vitrocerámica, la calidad es impresionante y el café muy bueno.",jose ramon isiegas gil,Revisado en España el 6 de febrero de 2023
Buena compra,"5,0 de 5 estrellas","Quería tener una cafetera en casa porque se me rompió la que tenia. Funciona fenomenal el la cocina de inducción, el asa no quema y de momento no se ha oxidado ni manchado. Trae un accesorio para poner en depósito de café por si quieres hacer menos café e indica como utilizarlo en las instalaciones que trae.
La caja llegó algo golpeada pero el contenido perfecto.
Si en un tiempo veo que hay algún problema lo indicaré.",María Ángeles,Revisado en España el 3 de junio de 2022
Para placa de inducción,"5,0 de 5 estrellas","Al cambiar la placa de la cocina necesitábamos cambiar también la cafetera italiana ya que la antigua con la de inducción no funcionaba.

Compramos esta cafetera y la calidad y el diseño es espectacular.
Funciona perfectamente con inducción
La única pega que le pongo es que da sólo para dos cafés, y no muy largos. Si lo hubiera sabido hubiera comprado un tamaño superior.",Juan,Revisado en España el 19 de junio de 2022
Café muy bueno y aunque algo cara muy buena calidad,"5,0 de 5 estrellas","Compré la de 12 tazas y hace un café muy bueno, y la calidad de la cafetera parece muy buena. Ya veremos como envejece pero las primeras impresiones son muy positivas. Suele quedar un poco de agua sin salir, pero nada preocupante ni malo",Victor Elul Pérez-Castejón,Revisado en España el 2 de enero de 2023
No está mal,"3,0 de 5 estrellas","Algunas veces no sale el café, no sé si es porque hecho demasiado o por qué pero el caso es que no siempre sale el café, algunas veces no enrosca bien, pero bueno, puede pasar.",Cesar,Revisado en España el 20 de diciembre de 2022
CUMPLE SU FUNCION,"3,0 de 5 estrellas","Esta correcta,pero hacia mejor café la que yo tenía antes,que era una marca italiana",Maravillas,Revisado en España el 12 de febrero de 2023
"Tiene recubrimiento de teflón (tóxico, disruptor endocrino) La devolucion me costó 25€,","2,0 de 5 estrellas","No me gustó que está recubierta internamente de un material toxico (teflón , es un disruptor endocrino), esto lo hacen cuando el acero es de mala calidad y es susceptible de tener corrosión, cuando el acero es bueno (18/10) no se corroe y no le hace falta ningún recubrimiento. por el precio (49€) pensé que era de acero bueno, pero no , es de acero malo, de ese que se cooroe, y me cobraron los gastos de devolucion 25€. Si me gustó la tapadera aislante. Despues de verla no lo recomendaría nunca",Cliente Amazon,Revisado en España el 3 de julio de 2022
Que el mango no se mueve,"5,0 de 5 estrellas","Me gusta que el mango va soldado y no con un tornillo, lo que te da seguridad, es toda de acero inoxidable, es perfecta",julio prieto herrera,Revisado en España el 2 de diciembre de 2022
Perfecta para placas de inducción,"5,0 de 5 estrellas","Me gusta mucho su diseño, sencillo y limpio, muy fácil de limpiar. Tiene doble filtro de acero inoxidable para hacer más o menos tazas de café. El café está buenísimo.",Pilar,Revisado en España el 17 de septiembre de 2022
Ruido ensordecedor,"2,0 de 5 estrellas","La cafetera es preciosa, hace buen café y va genial con las placas de inducción pero cada vez que ponemos la cafetera es un infierno el ruido que hace. No entendemos muy bien si es un problema de junta o no pero hace el mismo ruido que si pasara un tren de vapor por dentro de casa, horroroso, hasta tal punto que vamos a solicitar la devolución puesto que no tiene ni 6 meses y la cosa ha ido a más.",Cliente Amazon,Revisado en España el 15 de septiembre de 2022
Se adapta muy bien a la inducción,"5,0 de 5 estrellas",Además de estéticamente muy bonita se adapta muy bien a la inducción,Daniel,Revisado en España el 3 de diciembre de 2022
Pierde café por la junta y cierra mal. Siempre quedan 2 dedos de agua en el fondo sin subie,"1,0 de 5 estrellas",Me gustó el diseño. Pero no funciona adecuadamente. Cierra mal. Pierde cafe por la junta y mancha siempre el mantel. No sube toda el agua. Me llevé una gran decepcion porque me encantaba su diseño. Por eso pagué un precio mas alto que otras. La devolveré,Ana M.,Revisado en España el 25 de septiembre de 2022
"La cafetera parece lo que no es, se oxida el interior a los dos días de tenerla,","1,0 de 5 estrellas","Me gusta su línea, no tiene calidad para el precio que tiene, se oxida el interior.",Pedro Alcazar Chartes,Revisado en España el 20 de septiembre de 2022
Deja el café tibio,"1,0 de 5 estrellas",Si algo no le gusta del café es tomarlo tibio. Está cafetería parece que deja subir el agua muy tibia. Es bastante raro,Javier,Revisado en los Estados Unidos el 8 de febrero de 2024
El asa se calienta muchísimo,"1,0 de 5 estrellas",Muy rico el café pero se calienta mucho fl asa tienes que coger lo con agarraderas y tener cuidado porque es muy muy caliente,Yamile Perez,Revisado en los Estados Unidos el 4 de febrero de 2024
Llegó usado,"1,0 de 5 estrellas","Este artículo llego usado, lo acabo de recibir y llamé",Bertha Lukacsko,Revisado en los Estados Unidos el 25 de mayo de 2023
La agarradera se calienta demasiado.,"1,0 de 5 estrellas",No puedo usarla porque la agarradera se calienta demasiado. Pérdida de dinero.,César Vallejo,Revisado en los Estados Unidos el 7 de septiembre de 2022
Muy pequeña,"2,0 de 5 estrellas","Compré el poducto de 7 oz y no es para 4 tazas como lo dice en la descripción... solamente le cabe agua para una sola taza de café.
En cuanto a los materiales, se ven y sienten de buena calidad.",Alejandro Ibarra,Revisado en México el 29 de abril de 2024
En realidad es de 10 tazas,"3,0 de 5 estrellas","Lo compré porque tengo uno de otra marca de 10 tazas. Aunque este es más alto y parece más grande, le cabe la misma cantidad de agua y hasta un chirris menos de café que el de 10 tazas.
Por eso le doy 3 estrellas, por lo demas funciona bien y el cafe es sabroso.",napuseno,Revisado en México el 9 de junio de 2023
Me decepcionó,"3,0 de 5 estrellas","Es muy bonita y los materiales del producto son de buena calidad y muy fuertes. El café sube enuy poco tiempo. El gran problema está en la base o parte de abajo donde se coloca el agua, está se torna oscura desde el inicio, ésto no tiene nada que ver con el fuego, más bien, con el material con el que está hecho.",LL,Revisado en los Estados Unidos el 28 de diciembre de 2023
El buen comprador,"3,0 de 5 estrellas",Hice notorio mi compra en Amazon cosa que fui bien atendido y asesorado por el departamento de servicio al cliente ahora estoy viendo cómo conpro lo que necesito,roberto huambachano,Revisado en los Estados Unidos el 11 de febrero de 2023
Excelente opción si tomas poco café,"4,0 de 5 estrellas",Producto de gran calidad en un embalaje muy bueno el grosor del acero es bastante bueno sin embargo en la capacidad del tanque de agua es muy pequeña aunque lo anuncian para cuatro tazas son cuatro tazas de expreso muy pequeñas si no eres de los que toma grandes cantidades de café es una excelente opción,Carlos,Revisado en México el 22 de octubre de 2021
"Hermoso diseño, solo algunos detalles","4,0 de 5 estrellas","Lindo diseño, se siente durable el material. solo tengo dos comentarios, el asa para servir se caliente, así que hay que tener cuidado, y para abrirlo siento que no encuentro un buen punto de apoyo y puedo y cuido de no apoyarme en la tapa por que se siente muy sensible la union de la tapa con el cuerpo. Pero me encanta",Eric,Revisado en México el 19 de agosto de 2021
"llego con tapadera chueca, no tiene caja","4,0 de 5 estrellas","llego con tapadera chueca, no tiene caja",Adolfo E,Revisado en México el 26 de julio de 2022
Good,"4,0 de 5 estrellas",Es rapido,Amazon Customer,Revisado en los Estados Unidos el 8 de abril de 2022
"Es preciosa, toda de acero inoxidable y de calidad","5,0 de 5 estrellas",La calidad y el diseño,Marisol,Revisado en España el 25 de octubre de 2022
Pequeña y cómoda,"5,0 de 5 estrellas",Pues es una cafetera pequeña para 3 cafés de desayuno. Tiene un diseño muy bonito. El mango es en una pieza por lo que no es fácil que se desmonte. Muy elegante para dejar en la mesa.,Paco,Revisado en España el 24 de septiembre de 2021
Lo volvería a comprar sin duda.,"5,0 de 5 estrellas",Me ha encantado lo fácil que se limpia y lo elegante que queda en la cocina.,Lara R.,Revisado en España el 3 de octubre de 2022
Excelente,"5,0 de 5 estrellas",Sin duda la mejor cafetera.,Vicky,Revisado en España el 13 de febrero de 2023
Buena cafetera,"5,0 de 5 estrellas","Hasta ahora va muy bien, es muy bonita y no le veo pegas.",Onelia G.,Revisado en España el 5 de agosto de 2022
Practica y no se pone negro la base,"5,0 de 5 estrellas",Cafetera buena calidad precio de acero y buscaba con parte de abajo negra para evitar el frotar. Salen dos tazas para cafe con leche. Contenta con la compra,Helen,Revisado en España el 5 de noviembre de 2021
Cumple muy bien,"5,0 de 5 estrellas","Es estupenda. Fácil de montar y limpiar. El mango es muy fácil de coger, no quema y parece resistente. Fácil para seduce el café.",Carlos,Revisado en España el 27 de enero de 2022
Perfecta Calidad-precio,"5,0 de 5 estrellas",Muy buena cafetera. Cómoda para limpieza. Fácil de abrir y cerrar. Se corresponde la calidad con su precio. La recomiendo.,Beatriz,Revisado en España el 12 de febrero de 2022
"Perfecto, elegante y de buen calidad!","5,0 de 5 estrellas","Perfecto, elegante de buen calidad.",Elena,Revisado en España el 2 de octubre de 2022
"Esta perfecta, muy bonita con excelente calidad!","5,0 de 5 estrellas","Mejor cafetera que tenia, ha superado mis expectativas 👌🏻",Cliente Amazon,Revisado en España el 5 de mayo de 2022
Encantada con ella,"5,0 de 5 estrellas","Muy manejable, no queda agua en la base y el café exquisito!!! Hasta ahora la mejor hasta ahora que he tenido",Carmen,Revisado en España el 18 de mayo de 2022
Cafetera italiana,"5,0 de 5 estrellas","Excelente calidad, y el café sale excelente",Juan Rodríguez Peñaflor,Revisado en México el 8 de marzo de 2023
