title,rating,body,author,date
Muy pequeño,"3,0 de 5 estrellas",El producto se ve de muy buena calidad pero muy pequeño,Juan N Evelyn Dominguez,Revisado en los Estados Unidos el 4 de mayo de 2024
Perfecta,"5,0 de 5 estrellas",No traspasa si cae agua o café es muy buena lo recomiendo,Erika Leiva,Revisado en los Estados Unidos el 24 de abril de 2024
"Esta demasiado chico, del tamaño de un tapete de mesa individual","1,0 de 5 estrellas","No me gusto y no cumple con expectativa de uso. En la imagen se ve más grande, pero es del tamaño de un mantel de mesa individual. Muy caro para lo que realmente es. No lo recomiendo!",Alex,Revisado en México el 4 de mayo de 2023
Perfecta en tamaño,"5,0 de 5 estrellas","Perfecta también para la mesa de la cocina, protege y además es muy fácil mantenerla limpia.",Luz Maria Negrete Prieto,Revisado en México el 8 de agosto de 2023
Me gusto el tapete,"5,0 de 5 estrellas",Buen tapete para lo que necesitaba,Ivonne Ponce,Revisado en México el 26 de agosto de 2022
Perfecta para mi barra de café,"5,0 de 5 estrellas","Funciona muy en mi barra de café, fácil de limpiar.",Janine,Revisado en los Estados Unidos el 11 de julio de 2024
Un buen producto,"4,0 de 5 estrellas","Un producto eficiente, seca rápidamente el agua y evita la acumulación de fluidos en la encimera. Es un poco pequeño y se debe elegir bien el color para que combine con tu cocina.",Yimmy Restrepo,Revisado en los Estados Unidos el 28 de octubre de 2023
No sirve para lo que dice,"1,0 de 5 estrellas","Definitivamente no sirve para lo que dice, se llena de agua, no se seca rápido, es un desperdicio gastar dinero en este tipo de compras, no recomiendo la compra de este artículo!",Hernan Herrera,Revisado en los Estados Unidos el 16 de diciembre de 2023
Mala calidad,"1,0 de 5 estrellas","Después de tres meses de utilizar se peló , el material es muy malo",ed,Revisado en los Estados Unidos el 27 de diciembre de 2023
Es mucho mas pequeno de lo que aparenta en la foto,"3,0 de 5 estrellas",No me agrado tanto el tamano y seria genial tener diferentes optiones de tamaño,ilse,Revisado en los Estados Unidos el 10 de septiembre de 2022
