title,rating,body,author,date
Paqui,"1,0 de 5 estrellas","Al abrir la caja para sacar la cafetera lleva Una rotura en el depósito del agua igual que la e sacado la e vuelto a meter para la devolución , el plástico frontal viene casi suelto la compré porque tenía buena reseñas y que era una buena cafetera pero el plástico es muy malo una pena. , y además ya había comprado cápsulas lo curioso es que ka caja no tiene ningún golpe osea que la an mandado así muy fuerte","PAQUI,COMPRE ESTA CAFETERA POR LAS RESEÑAS BUENAS QUE VI AL ABRIR LA CAJA A SALIDO EL DEPÓSITO DEL AGUA ROTO O SEA PARA DEVOLVER, EL PLÁSTICO DEL FRONTAL CASI SUELTO NO TIENE BUENA CALIDAD ES UNA PENA",Revisado en España el 12 de septiembre de 2023
Pésima experiencia,"1,0 de 5 estrellas","Compre 2 cafeteras iguales porque el servicio técnico de Philips no me ofrecía ninguna solución , en 4 meses y 2 cafeteras compradas estamos sin café y con las cafeteras en la entrada de casa que ninguna funciona . Encima llega la caja rota y nadie se hace responsable . No lo recomiendo a nadie . Compraros cualquier marca menos esta .",Nella,Revisado en España el 25 de septiembre de 2023
Dos averiadas la ultima comprada el 25 de marzo y a 1 mayo para devolver,"1,0 de 5 estrellas","Hace buen cafe , pero aceria segura",Cliente Amazon,Revisado en España el 2 de mayo de 2024
Malisima,"1,0 de 5 estrellas",Es la tercera cafetera de cápsulas que tengo. Esta es con diferencia la que peor cafe hace.,MANUEL JOSE,Revisado en España el 11 de abril de 2024
Duró un día,"1,0 de 5 estrellas","No creia las malas reseñas y me arriesgue, pues la cafetra duró un día, el primer dia todo bien pero al segundó dia la cafetera dejó de sacar cafe y empezo a tirar toda el agua por debajo, a partir del segundo dia no hubo forma de hacer otro café asi que a devolver. Lo que rompe los c**** es que compré una supuesta promocion donde te regalaban 10 cajas de cafe que al momento de pagar me di cuenta que se generó como 2 pedidos distintos lo cual pues no me importó en ese momento pero luego para devolver la cafetera resulta que las capsulas que segun venian gratis no se pueden regresar por lo que solo me van a regresar una parte del pedido osea que de gratis nada. tened mucho cuidado",David,Revisado en España el 30 de junio de 2022
El provedor muy mal,"1,0 de 5 estrellas","Salió mal la cafetera y de 69€ me devolvieron 40 alegándo que estaba un poco sucia la cafetera. No sabía que una cafetera que no funcionaba había que enviarla impoluta. No me avisaron que iban a recógela ellos y de repente llaman a la puerta para llevársela, cuando a mi me ponía que tenía que enviarla yo. Las cafeteras no son malas pero la mia salió mal y que me devolvieran poco más de la mitad me parece fatal. Muy muy disconforme.",Claudia,Revisado en España el 11 de mayo de 2023
"Compra nada recomendable, parece tener un problema importante de diseño","1,0 de 5 estrellas","Al sólo un mes de utilizarla no perforaba las cápsulas y sólo echaba agua. Hicimos una descalcificación, a pesar de haber pasado sólo un mes y de únicamente emplear agua mineral embotellada el 100% de las ocasiones, en ningún momento empleamos agua del grifo. Esto lo solucionó temporalmente, pero el problema se volvía a repetir con frecuencia a lo largo de tres meses, a veces tenías que realizar 7 intentos de hacer café hasta que por fin perforaba la cápsula y salía café en lugar de agua. En los comentarios de otros usuarios vimos que esto le sucedía a más clientes y no parecía un problema puntual de nuestra unidad. Amazon (genial el soporte al cliente, como siempre) aceptó la devolución sin problemas y compramos en su lugar una KRUPS, con la que ya habíamos tenido buena experiencia. A mayores, hemos de decir que el mecanismo que se manipula (palanca más émbolo/pistón, si es que esto se llama así, no tengo ni idea sobre estos temas) es de un material plástico que no hacía pensar que durara años, en comparación con otros materiales utilizados en otras marcas, pero esto es sólo una especulación, por supuesto.",ralorin,Revisado en España el 14 de noviembre de 2020
Defraudado,"1,0 de 5 estrellas","Estaba usada , nada recomendable , según me llegó la devolví",Pablo,Revisado en España el 28 de marzo de 2024
Obsolescencia programada,"1,0 de 5 estrellas","Se ha roto a los dos años y tres meses de comprar, al poco de terminar el periodo de garantía ¿casualidad? Diría que no.

El problema que tiene es que tira agua por el sitio en el que se alojan las cápsulas. ¿Qué dice el servicio técnico? Unos sesenta euros de piezas más mano de obra... La cafetera entera cuesta menos. Eso sí, me ofrecen un descuento del 25% en la próxima, pero el la web de Philips, que es el doble de cara que Amazon.

¿Qué se ha roto realmente? Una pieza de plástico que lleva una pestaña para sujetar la capsula cuando se hace el café. Mucho mejor de plástico, que con el tiempo y el calor se romperá, que una de inox, que será para siempre, y no sé venderán cafeteras.

Se podría cambiar la pieza sola, claro, por menos de un euro, pero hay que cambiar ¡¡todo el grupo de vapor!! De ahí los 60 euros en piezas.

RESUMEN : no la compres, no va a durar, está diseñada para romperse",ANTONIO,Revisado en España el 22 de abril de 2021
FATAL,"1,0 de 5 estrellas","El paquete llegó en muy mal estado, y lo que es peor la cajita de café que va en el interior estaba abierta y rota...",Pilar,Revisado en España el 30 de enero de 2024
En 4 meses 3 averias y devuelto,"1,0 de 5 estrellas","Tenía una cafetera nespresso DeLongi desde hacía 7 años que funcionaba perfectamente, pero decidí comprar esta porque permitía hacer dos cafés a la vez
Estuvo funcionando bien dos meses, hasta que dejó de pinchar las capsulas. La envié al servicio tecnico y a los 20 dias me la devuelven
Le habian cambiado el sistema de insercion de cápsulas por otro que se veía claramente que era recuperado de otra máquina, ya que la palanca esta rota y al tirar se abría por la mitad y además se atrancaba y no giraba con suavidad
Así que lo devolví otra vez al servicio tecnico. Me lo devolvieron a los 18 dias y ahora sí le habian puesto un sistema nuevo
Siguió funcionando otros dos meses y de nuevo la avería original (NO pinchaba las capsulas)
Ya aburrido, decidí que Amazón me devolviera el dinero y me he comprado otra DeLongi que hasta la fecha funciona perfectamente
Resumiendo: Tuve la cafetera 4 meses de los cuales un mes y medio se tiró reparando en el servicio tecnico y tuvo 3 averías
No la recomiendo para nada",kx0,Revisado en España el 4 de diciembre de 2019
La Máquina se ha des configurado en una semana,"1,0 de 5 estrellas","Producto defectuoso, he enviado una solicitud de apoyo por el problema y no he recibido respuesta.
Voy a devolver el producto.",juan carlos garzón martín,Revisado en España el 13 de febrero de 2024
Mal funcionamiento.,"1,0 de 5 estrellas","Al año de uso se ha estropeado sin motivo aparente.
El agua no atraviesa la cápsula.
En espera de que la garantía lo cubra.
Sin noticias de momento 😔",Angel C.,Revisado en España el 17 de diciembre de 2023
Estado poco profesional,"1,0 de 5 estrellas","A pesar de que la cafetera en sí es genial, no recomiendo comprarla por este vendedor.
El estado tanto de la caja como de la máquina en sí han sido de vergüenza.
La caja original estaba medio destrozada y la cafetera estaba muy muy sucia, casi como si la hubieran usado o hubiese estado como muestra/exposición.",Álvaro Fernández,Revisado en España el 19 de mayo de 2023
Entrega desastrosa y perdida de agua,"1,0 de 5 estrellas","Hoy me llego la cafetera en una caja destrozada y sin embalaje de Amazon que es la primera vez que me llega algo así, al abrir la caja no venía ningún papel de instrucciones ni ningún panfleto que suele venir ni nada de nada, al conectar la cafetera pierde muchísimo agua por la base, un desastre todo.",David Garcia Avila,Revisado en España el 11 de mayo de 2023
Producto usado,"1,0 de 5 estrellas","Llegó dentro de plazo. La caja con los precintos abiertos. La cafetera sin los precintos de nueva y con alguna rayada lateral. Pensé que si funcionaba bien me la quedaba igualmente y probé con agua. Se salía toda por la parte de abajo. No sólo me enviaron un producto ya usado, si no que estaba roto. Devolución al acto.",Serfont,Revisado en España el 28 de abril de 2023
No funciona,"1,0 de 5 estrellas",Que me den una solución porque está con el botón de encendido parpadeando y no funciona me parece increíble que no den respuestas ni reemplazos,691841839,Revisado en España el 22 de noviembre de 2023
A ver,"1,0 de 5 estrellas","A ver cuanto va ha durar el sistema para poner la cápsula se bloquea muchas veces, esto no aguantará mucho como la última un año, es désespérante la mas barata del mercado si, pero no muy fiable",Patrick,Revisado en España el 28 de agosto de 2023
No la compréis!!,"1,0 de 5 estrellas","Un mes después de comprarla no funcionaba, la repararon y ha durado 3 días y ya no funciona.",parashakti,Revisado en España el 23 de noviembre de 2023
Leer mi comentario,"1,0 de 5 estrellas","Máquina muy buena parece ser por los comentarios, yo no he tenido esa buena experiencia dado que la mía llegó defectuosa, era nueva totalmente embalada y precintada, no estaba usada, pero si que emitía un ruido horrible por ello la decidí devolver, esta reseña la pongo por eso mismo, pero se que que es una máquina increíble, dada mi experiencia tengo que valorar 1 estrella.",Mariano Hidalgo Calero,Revisado en España el 11 de enero de 2023
Terrible,"1,0 de 5 estrellas","La peor compra que he hecho en mi vida, solo sale agua si al depósito lo metes a la fuerza. La tapa donde metes el café sólo cierra de vez en cuando. Hablé con el servicio técnico de Amazon para su reparación y no me pusieron ninguna pega, pero por motivos de trabajo nunca pude enviarlo.
No recomiendo su compra.",Cliente Amazon,Revisado en España el 27 de enero de 2023
Fracaso,"1,0 de 5 estrellas","Faltal la máquina desde el primer momento hace cafés malisimos siendo las mismas cápsulas q en otra cafetera salen como tienen que salir
Un gusto a plástico y muy malo
La experiencia fatal",santiago,Revisado en España el 17 de julio de 2023
No recomiendo comprar esta cafetera,"1,0 de 5 estrellas","El pedido no me llegó directamente. Parece ser que lo han mandado a otro país. Lo pedí en el Black Friday con toda mi ilusión a un buen precio y no han conseguido enviármela. Pero la misma cafetera sigue posteada a un mayor precio ahora. Una completa estafa la verdad, pero no hay mal que por bien no venga porque fui a verla en persona a un súper y para meter la cápsula hay una complicación muy gorda. No sólo tienes que levantar la tapa sino que hay que sacar una especie de metal para meterla y luego le cuesta cerrar. Estoy hasta contenta de que no me haya llegado y voy a comprar una Nespresso.",Samantha Preston,Revisado en España el 10 de diciembre de 2020
No ha durado no 3 meses. Mala compra!,"1,0 de 5 estrellas","Se ha bloqueado y no baja la carga de cápsulas. He tenido que mandarla a reparar, cuando me la devuelven editaré la reseña, pero hasta ahora no cumplido las expectativas, no ha durado ni 3 meses. Mala compra

Edito reseña: Se ha vuelto a estropear, me he puesto en contacto con el servicio de atención al cliente de Amazon Prime y lo único que me ofrecen es enviar la cafetera la reparación y quedarme de 20 a 30 días sin cafetera!!!
Si antes nos la recomendaba, ahora menos!!!",Belén AC,Revisado en España el 2 de agosto de 2021
Ya roto en 5 meses,"1,0 de 5 estrellas","Funcionó bien durante 5 meses.
Puse una taza de café de la misma marca, cerré la tapa y escuché que se rompía, y ahora está rota. ¡Muy decepcionado!

Pedí una cafetera normal con filtro, ya que esta era mi cuarta máquina del mismo tipo (diferentes marcas). Estas máquinas son de construcción muy débil y no están hechas para durar mucho.",Fer,Revisado en España el 23 de agosto de 2022
Detestable trato por parte de Amazon,"1,0 de 5 estrellas","La cafetera no funciona bien y como han pasado 2 días del mes que la recibí, voy a estar 20 días sin cafetera para ver si tiene reparación.",Pedro R. Imbernón,Revisado en España el 8 de junio de 2023
Grande y calidad mala,"1,0 de 5 estrellas","Tanto como el método que tiene para introducir las capsulas, que se parece al de una escopeta al recargarla, hace un rudio como si se fuera a desmontar, luego te das cuenta de que ese ruido viene del plástico de calidad baja que tiene que todo en si tiene unas tolerancias bastante holgadas, parece que todo se desmonta porque todo tiene holgura. Realmente te das cuenta de lo mala que es cuando desmontas el dispensador, hazlo con cuidado si sigues adelante con esta compra, como te caiga de las manos a la mesa se te va a romper.

Si estas leyendo esto, sinceramente de un comprador a otro, comprate otra cafetera. Yo si estuviese a tiempo esta la devolvía.

Un saludo.",Isaac,Revisado en España el 14 de enero de 2020
No respetan garantía ni devoluciones.,"1,0 de 5 estrellas","Sin cumplir dos meses el producto, no funciona. El vendedor lejos de asumir su responsabilidad conforme a la normativa de consumo, se limita a remitirnos a la web de la marca.
Llevo muchísimas compras y es la primera vez que me ocurre. VENDEDOR A EVITAR!!!",Andrés,Revisado en España el 9 de febrero de 2023
Pierde agua en su primer encendido.,"1,0 de 5 estrellas","Acabo de recibir la cafetera hace 20 min.
Voy a seguir las instrucciones y comienzo von la puesta en marcha.

Tira todo el agua por debajo de la cafetera, con el miedo de un cortocircuito.

Está defectuosa, y veo que no soy el único al que le ocurre.

Voy a devolverla y espero que la segunda que me manden funcione bien aunque estoy bastante desilusionado.",Javier Delgado Moreno,Revisado en España el 17 de mayo de 2022
La 2a que compro y las 2 se han estropeado en nada,"1,0 de 5 estrellas",Es tirar el dinero,Adriana,Revisado en España el 10 de diciembre de 2023
"Le doy 1 estrella vino defectuosa, ni sale café ni sale agua,a la espera de una solución.","1,0 de 5 estrellas","No puedo opinar porque vino mal hace mucho ruido y ni sale agua ni sale cafe,muy decepcionado, estoy a la espera de una solución, una decepción total, después de 6 días aquí sigue la cafetera sin ninguna solución, no recomendable, y nadie se pone en contacto para darme una solución, de pena.",Marcelino,Revisado en España el 1 de febrero de 2023
La peor experiencia de compra,"1,0 de 5 estrellas","La máquina ha dejado de funcionar en poco tiempo. Amazon no reemplaza el producto, te dicen que (con lo que pesa y lo enorme que es) te la lleves a Correos a que un servicio de técnicos te la miren y dan de plazo casi un mes para obtener respuesta.

Me parece irrisorio, terrible servicio post venta, la primera vez en muchos años pagando prime que Amazon no hace un reemplazo y punto. No vuelvo a comprar aquí y aconsejo a todos los demás que no compren esta cafetera porque es PESIMA.",Black Sky,Revisado en España el 14 de noviembre de 2020
Plástico de mala calidad,"1,0 de 5 estrellas","Creo que va a tener poca vida útil, se desprendió la s dos boquillas, fraude",Cliente Amazon,Revisado en España el 24 de agosto de 2023
Venden productos usados como nuevos y con restos del anterior🤮,"1,0 de 5 estrellas","Compré la cafetera y el anuncio la vende como producto novedoso. Cuando me llega, me llega sin ningún precinto de la casa, solo de Prime a los lados y cuando la saco y piezas me encuentro en el deposito 2 cápsulas de Nesspreso usadas.
Voy a cancelar mi suscripción a Prime. ES UN FRAUDE.",José Antonio Gonzalez,Revisado en España el 12 de agosto de 2022
Decepcionado,"1,0 de 5 estrellas","Es de esos productos que te calientan la cabeza, muy bonito pero...
En absoluto cumple con la exigencia de los cafeteros nespreso, ninguna de sus opciones de cápsula ni de cantidad de agua consiguen el efecto de café exprés denso y cremoso.
El resultado es en cualquier modalidad un café bastante aguado, no parece que la máquina caliente y aplique la presión necesaria como para que el resultado sea el deseado, después de 12 años con una krups essenza esta es un juguete.
Ya va de vuelta.",dupus,Revisado en España el 23 de noviembre de 2020
"La duración es ridícula, se estropea muy rápido.","1,0 de 5 estrellas","Solo me ha durado 2 meses y haciendo un café cada 2 o 3 días, las capsulas ya no se pinchan y solo sale agua. Compré 2, y la segunda que regale a mi hermano, ha durado todavía menos, con el mismo problema, solo sale agua.",Salvador,Revisado en España el 8 de septiembre de 2022
Compra decepcionante,"1,0 de 5 estrellas",Elegí este producto porque tenía una Nespresso y quería variar de marca de cafetera pero el sabor del café no es el que yo esperaba porque lo encuentro aguado y no muy caliente. Probé una de las cápsulas que vienen con la cafetera y otra de nespresso que tenía yo en casa y con ninguna de las dos me gustó su sabor. Además de esto el método para introducir las cápsulas de café me parece bastante endeble y con el tiempo puede llegar a fallar...por todos estos motivos la devolví enseguida y volví a comprar una cafetera nespresso.,Merce,Revisado en España el 19 de diciembre de 2019
La compre por nueva y no fue así.,"1,0 de 5 estrellas","No la utilice. Era para hacer un regalo.
La devolví, venía la caja abierta y rallada por un lado. Se notaba que me habían enviado la que otros clientes devolvieron.
No puedo creer que Amazon le haga esto a sus clientes. He dejado de comprar productos de este tipo por este motivo, me pasó lo mismo con una plancha de ropa.
Espero que les sirva de ayuda.",Mary,Revisado en España el 28 de diciembre de 2021
Sigue sin funcionar correctamente.,"1,0 de 5 estrellas","Hola me pongo en contacto para hacerles llegar esta queja, realice una solicitud de reparación del producto que si bien tardo poco tiempo en ser reparado se ve que no con todas las garantias, ya que vuelve a fallar de la misma manera y he de decir que el sabor del cafe cada vez es peor, algunas veces pincha las capsulas y otros no, sinceramente no estoy conforme con la reparación o la compra. y me gustaria que me diesen una solución adecuada y definitiva. gracias.",Cliente Amazon,Revisado en España el 11 de mayo de 2020
Cómo es posible que esto pase con Lor y vendido por Amazon siendo supuestamente un producto nuevo.,"1,0 de 5 estrellas","Caja destrozada, producto con pinta de haber sido usado, y encima roto, una pena.",n0k,Revisado en España el 11 de mayo de 2023
Es buena pero….cuidao si quieres devolverla.,"1,0 de 5 estrellas","En mi caso,quería devolverla y los costes de envío son bastante elevados,por su peso y tamaño,(por correo normal).Fallo mío,lo reconozco,no leí bien las condiciones…",Txema,Revisado en España el 25 de diciembre de 2022
No tiene presión.,"1,0 de 5 estrellas","No conseguía hacer café, perdía presión y el agua salía sin hacer café. La devolví por no funcionar. Me pareció muy grande y poco versátil.",Isama,Revisado en España el 23 de febrero de 2023
Deficiente,"1,0 de 5 estrellas","No lo recomiendo para nada. No me ha durado ni 6 meses. El mecanismo para introducir las capsulas da problemas enseguida y ya directamente no cierra y cuando lo hace no perfora la capsula y solo sale agua.

Mucho anuncio en la tele pero es un producto malisimo.

El cafe encima sale con bastante menos cuerpo que otras cafeteras de capsulas y las capsulas dobles tienen un precio elevado y no hay de marcas blancas.",Alejandro,Revisado en España el 18 de octubre de 2020
"Bonita, grande y funcional, pero.. no dura más de 4 meses","1,0 de 5 estrellas","La compré en noviembre y al principio iba fenomenal, pero desde hace un par de semanas me encuentro con dos problemas que veo que se repiten:
1.- A veces la cápsula no se perfora y lo que sale es solo agua (y ésto no pasó nunca al principio y ahora ya me ha ocurrido con regularidad).
2.- Últimamente está comenzando a gotear agua tras finalizar el ciclo, como si tuviera pérdidas o tardara más en finalizar una vez acaba el proceso y se apaga",Ramón R.,Revisado en España el 19 de febrero de 2020
Fallo a los 3 meses de uso,"1,0 de 5 estrellas","A los 3 meses de uso se ha estropeado la palanca de introducción de cápsulas. Pendiente de reparación o cambio, es evidente que éste es el punto débil de este modelo de cafetera.",AnnaC,Revisado en España el 2 de octubre de 2022
Malísima,"1,0 de 5 estrellas",Es la tercera que compró todas me han durado 2 meses esta última 3 dias,Lali,Revisado en España el 10 de abril de 2023
Decepcionada,"1,0 de 5 estrellas","El café no sale suficientemente caliente, tengo que calentarlo en el microondas",Carmen,Revisado en España el 24 de abril de 2023
QUE SEUR NO TE LO LLEVA. TE LO DEJA EN UN PUNTO. Y NO TE DA INFO. LAMENTABLE,"1,0 de 5 estrellas","El producto Ok pero Seur hace lio y a la segunda vez, ni pasa por casa.
Un desastre.",José h.,Revisado en España el 10 de marzo de 2023
Embalaje,"1,0 de 5 estrellas",Así ha llegado la caja a simple vista se ve un producto usado y encima ha llegado roto la caja por un lado tiene aspecto de una devolución anterior se revisará y se procederá a su devolución si es necesario no parece correcto enviar un producto de esta forma,sergio r.,Revisado en España el 18 de noviembre de 2021
Producto abierto,"1,0 de 5 estrellas","Pues no la he probado porque es un regalo para navidad, el caso es que sabiendo en las fechas que estamos, no entiendo como me ha llegado la caja de la cafetera que ha sido previamente abierta y con precinto, vamos que para un regalo me parece algo decepcionante, obviamente no la vamos a probar todavía.... pero que lástima y que desilusión.",Lorena,Revisado en España el 16 de diciembre de 2020
La he devuelto. Fatal.,"1,0 de 5 estrellas","Cafe con sabor a plástico. Probada durante una semana. Ni con cápsulas originales ni de otra marca y reutilizables ni por asomo.
La compré por cambiar la dolce gusto por tener para dos cafés y he vuelto a la dolce gusto que lleva sin fallar 5 años con una relación calidad precio más que aceptable con capsulas reutilizables de acero.",Abel Domínguez,Revisado en España el 3 de marzo de 2021
"Me a llegado rota, una grandísima decepcion ya que era un regalo. Fatal","1,0 de 5 estrellas","No la he podido estrenar ya que a llegado rota, estoy muy decepcionada y enfadada.",Lorena,Revisado en España el 25 de diciembre de 2022
MUY MALA MÁQUINA,"1,0 de 5 estrellas","Después de haber estado en el servicio técnico durante 14 días me han devuelto la máquina que sigue sin funcionar.Desde el principio he tenido problemas con esta máquina, que en su día comunique .Ahora mismo pasa que no perfora las cápsulas por lo que solamente sale agua que es el mismo motivo por el que la envíe para arreglar.Creo que deberían de sustituir la máquina por otra o proceder al reembolso.",JOSE M.,Revisado en España el 5 de julio de 2020
El café sale frío,"1,0 de 5 estrellas","Cuando vas a hacer el café sale “caliente”, después de 2 minutos el café está helado, es una pena",Isabel Martín Domínguez,Revisado en España el 9 de febrero de 2023
Cafetera rota,"1,0 de 5 estrellas","La cafetera venía usada, y rota, no la pudimos ni usar ni un solo café ha hecho",Quim,Revisado en España el 6 de diciembre de 2022
Defectuosa,"1,0 de 5 estrellas","Se rompió a la semanda, donde entran las capsulas salto un muella y ya no encaja lo tuve que devolver",jjbcgr,Revisado en España el 20 de enero de 2023
Ha fallado dos veces,"1,0 de 5 estrellas","Funciona bien y es rápida, pero deja de pinchar las cápsulas al cabo de un tiempo (1 año con poco uso). La mandé a reparar con el servicio de reparacioned de amazon, se reparó y al cabo de menos de un mes de uso, vuelve a fallar.",Cliente_amazon,Revisado en España el 21 de julio de 2021
No revisan los productos reacondicionados,"1,0 de 5 estrellas",Amazon debería revisar sus productos antes de volver a venderlos no funcionaba,Marcos R.,Revisado en España el 23 de febrero de 2023
No me funciona adecuadamente,"1,0 de 5 estrellas","El agua después de hacer la purga correctamente, al poner la cápsula se sale el agua por debajo",Cristobal Merinero Ruiz,Revisado en España el 26 de octubre de 2022
3 usos me ha durado,"1,0 de 5 estrellas",Al cuarto uso ha dejado de funcionar. No pincha las capsulas y no extrae el cafe. Parece que le pasa a mucha gente como he estado leyendo,Pseudonimo,Revisado en España el 3 de agosto de 2022
Decepcinado,"1,0 de 5 estrellas","Compré esta máquina por 100€, pensando que su rendimiento iba a ser superior a las otras nespresso de precio más bajo.
Al principio bien, buen café. Ahora sabe a quemado y ni huele a café.
Le hice la limpieza antical como recomiendan, cuando tocaba..
Total, que me ha durado un par de meses más o menos, por lo que me ha costado y durado me salía más a cuenta 2 Nespresso más pequeñas..",maxim,Revisado en España el 19 de septiembre de 2019
No la compres,"1,0 de 5 estrellas","No funciona. Es una caja con luces que hace ruido y no perfora las cápsulas. Puesto en contacto con el fabricante, me reconoce el defecto y devuelta. Eso si muy bonita.",CARLOS E,Revisado en España el 8 de junio de 2022
No sale bueno,"1,0 de 5 estrellas","Cafetera Philips L`OR BARISTA LM8012/60 . Me a gustado la estética y el deposito del agua que cabe 1L , pero me a engañado ya con casi tres meses que la tengo , se me esta desmontando algunas piezas de la cafetera o sea no los aconsejo .",Mª Eulalia Gispert Espuny,Revisado en España el 10 de febrero de 2021
