title,rating,body,author,date
Super bueno,"5,0 de 5 estrellas",Super bueno,eduardojzr,Revisado en España el 25 de julio de 2024
Muy buena,"5,0 de 5 estrellas",Lo tengo hace 2 años más o menos y va genial,Brahian,Revisado en España el 18 de julio de 2024
Tamaño...,"4,0 de 5 estrellas","Me ha sorprendido..un poco más pequeña que el otro modelo pero igual de eficiente...
Muy recomendable por el precio..",Francisco Escaño lopez,Revisado en España el 27 de junio de 2024
Bo producto,"5,0 de 5 estrellas",Realmente práctica e bo funcionamento. Estou encantado con ela.,Fran,Revisado en España el 18 de julio de 2024
Gran compra.,"4,0 de 5 estrellas","No puedo decir nada malo de ella, salvo que podía ser un poquito más pequeña.
Su precio es una ganga, el café cremoso y concentrado. Fácil de limpiar y, lo que más me gustó, es que tiene un compartimento donde ella sola deja las cápsulas usadas.
Encantado con la compra",Javier Durán Mareque,Revisado en España el 21 de mayo de 2024
Funciona perfectamente,"5,0 de 5 estrellas",Llevo ya tiempo con ella y hasta el momento no me ha fallado estoy encantada con esta cafetera,sandrac,Revisado en España el 11 de julio de 2024
Bastante bien,"5,0 de 5 estrellas",Muy rico el café con las cápsulas marcilla,ana,Revisado en España el 14 de julio de 2024
CAFÉ MUY RICO,"5,0 de 5 estrellas","Sale un café muy rico con espuma. Lo de las capsulas es un poco lió por las cantidades, a ves sale poco, así que le doy a la tecla de longo y paro cuando quiero.",Angel Perez,Revisado en España el 17 de junio de 2024
Hace muy buen cafe,"5,0 de 5 estrellas","Hace una semana que la tengo y con cápsulas del Mercadona no funciona bien, café malísimo y no perfora bien las cápsulas, pero con cápsulas lor hace un café cremoso muy bueno y de momento no me ha fallado, hace poco ruido y muy rápido calienta el agua, a ver que dura",Juan Jesús Barranquero Ruiz,Revisado en España el 8 de junio de 2024
No me la esperaba,"5,0 de 5 estrellas",Muy buena cafetera,Diego,Revisado en España el 12 de julio de 2024
Ha llegado con un pequeño defecto,"4,0 de 5 estrellas","La máquina ha llegado con unas rayas en el plástico lateral, pero no afecta a su funcionamiento. No la cambio por otra porque no tengo tiempo y funcionar funciona.",Enrique,Revisado en España el 23 de mayo de 2024
Funcional,"5,0 de 5 estrellas",Precio competitivo y funciona con cualquier cápsula.,antonio,Revisado en España el 2 de julio de 2024
"Buen producto, pero me llegó uno usado","3,0 de 5 estrellas","Igual que con otro producto que compre por el Amazon Prime Day, me llegó uno usado con la caja en mal estado. Me siento como si se hubiesen aprovechado ya que son solo 2 días y en caso de devolverlo y tener que volver a comprar otro, estaría a precio normal... todo lo que me llegó para el Amazon Prime Day, era usado, y yo lo compré con la opción de ""nuevo"". En sí la cafetera funciona muy bien.",Ivan.,Revisado en España el 7 de agosto de 2024
Perfecta,"5,0 de 5 estrellas","No puedo decir nada mejor, es perfecta, tamaño, calidad, variedad de cafés, silenciosa, rápida, y bonita. Me encanta, tengo una cafetería y me gusta más esta cafetera.",Olga F.,Revisado en España el 13 de junio de 2024
Excelente cafetera!,"5,0 de 5 estrellas",Muy contenta. El producto es tal cual dice en la página. Callenta muy bien y hace un delicioso café. Cumple con su función así que recomendado!,Paula A.,Revisado en España el 13 de junio de 2024
satisfacción con la compra,"5,0 de 5 estrellas","Con esta ya son dos las que tengo, creo que con eso lo digo todo.",Cliente Amazon,Revisado en España el 15 de junio de 2024
Buen café con algún pequeño problema,"3,0 de 5 estrellas","Philips l'Or Barista Sublime LM9012/60

En general me gusta mucho esta cafetera. El café está bueno, sale caliente en su punto óptimo para consumir y con buen espesor y espuma (probada solo con cápsulas L'Or). El diseño de la máquina es elegante pero el plástico es de calidad media, sobre todo la pieza de los grifos es de plástico muy fino y endeble.

Lo que más me gusta: que no tiene botón de encendido, directamente pones la cápsula y le das al tipo de café que quieres, corto, medio y largo (ristretto, espresso y lungo). También se puede programar. Otra cosa que me gusta es que no hace mucho ruido y el café sale caliente en su punto óptimo para tomar al instante.

Lo que no me gusta: el depósito es de sólo 800 ml y el depósito de cápsulas se llena con unas 10 cápsulas más o menos.

Problemas:

Tuve un problema tras una semana de uso. De normal siempre cae algo de agua por detrás al depósito, lo cual es normal. Pero luego vi que se salía líquido de la junta tras los grifos (ver fotos). Según el FAQ de problemas de la página de Philips, las fugas son porque la pieza de los grifos no está bien acoplada y se solucionan retirando la pieza de los grifos y volviendo a acoplarla a conciencia pero no, en mi caso estaba bien puesta y de hecho, la volví a colocar bien y al poco uso volvía a salirse líquido. Esto ocurre la mayoría de las veces al hacer un ciclo de limpieza (que es hacer un café sin cápsula), saliéndo un chorrito de agua por detrás de la pieza que cae hasta abajo (foto) y también ocurre al hacer café con cápsula, pero en este caso, cayendo sólo algunas gotitas que casi siempre se quedan en la parte de arriba y no bajan hasta abajo (foto).

Pienso que esto es algo que no debería pasar. Consulté el manual y no mencionaba nada al respecto. Consulté a Philips y en principio no sabían si era normal o no, dijeron que lo iban a investigar. Consulté en preguntas y respuestas Amazon y otros clientes me dijeron que no les parecía normal o que no recordaban que les hubiera pasado.

Pensando que estaba defectuosa, decidí pedir otra cafetera nueva y ésta tenía el mismo problema, por lo que parece ser que no es fallo aislado, sino algo generalizado en este modelo en concreto o al menos, en una remesa concreta de unidades.

Al final decidí quedarme la cafetera porque me ha salido tirada de precio, ya que Amazon ha asumido parte del problema. No es algo que sea 100% una solución, ya que tendré que lidiar con este problema, pero el café sale bueno y me gusta, por lo que así se queda. El tiempo dirá si no aparecerán nuevos problemas o seguirá funcionando bien en lo que se refiere hacer café.",dmc,Revisado en España el 9 de abril de 2022
Bien,"5,0 de 5 estrellas",Lo esperado,Martine,Revisado en España el 2 de julio de 2024
Buena máquina.,"4,0 de 5 estrellas","No esperaba por precio una cafetera así, me encanta las capsulas XXL, el café sale muy bueno y de calidad.",JORDI,Revisado en España el 8 de mayo de 2024
Café esplendido,"5,0 de 5 estrellas",Junto con el batidor es el mejor café para tu día a dia,Carlos Alfredo Rojas,Revisado en España el 11 de junio de 2024
Buen café,"5,0 de 5 estrellas","Me gusta mucho la cafetera por si capacidad del depósito y por poder adaptar cápsulas ,hace muy buen café ,buena crema y no tengo nada malo que decir ,me encanta",DORINA,Revisado en España el 1 de junio de 2024
Cafetera,"5,0 de 5 estrellas",Me parece muy cómoda toda ella,Sonsoles,Revisado en España el 13 de junio de 2024
La cafetera muy bien,"5,0 de 5 estrellas",Muy buena cafetera. Cuando recibí el paquete tenía un golpe en una esquina de la caja. El transportista tiró la cafetera a través de la valla al jardín. Suerte que no ha pasado nada. Pero esa práctica es poco profesional y producirá muchas devoluciones y roturas.,Carles Pons,Revisado en España el 15 de mayo de 2024
"Genial, fácil y cómodo. Cafés deliciosos","5,0 de 5 estrellas","Nos ha gustado mucho la cafetera , es muy facilita y cómoda cabe en cualquier lado de cualquier forma",Paula,Revisado en España el 9 de julio de 2024
Contenta con esta compra,"5,0 de 5 estrellas","Me encanta, superó mis expectativas, buen diseño, súper rápida y sobre todo los cafés los hace espectaculares, más que recomendada.",gretchen,Revisado en España el 9 de junio de 2024
Gran cafetera.,"4,0 de 5 estrellas","Esta cafetera es la que utilizo personalmente y estoy encantado, tiene una gran variedad de capsulas propias que son menos caras que las de otras marcas, pero además encontraras otras muchísimas marcas que son compatibles con esta cafetera.

Es bonita, cosa que se busca a día de hoy a la hora de comprar una cafetera ya que cada vez más las cocinas intentan ser de diseño, tiene un tamaño considerable, por lo que no la consideraría portátil, o pequeña pero tampoco es demasiado grande.

En el video se ve la manera de utilizarlo, y es realmente sencilla, enciendes, metes la capsula, elijes el programa( Corto, medio, largo ) y ya sale el café. En el video además podéis ver las dimensiones de la cafetera de manera más certera.

Creo que tiene un precio muy asequible, y es muuuy sencilla de usar. Así que por lo que a mi respecta, gran elección.",Gelan,Revisado en España el 20 de enero de 2024
2 cafés en 1 = desayuno + llevar al trabajo/2 cafès en 1 = esmorzar + endur a la feina,"5,0 de 5 estrellas","La opción de poder poner cápsulas XL está genial, especialmente si tomáis café más de uno en casa. Va perfecto para preparar a la vez un café para desayunar a casa y el otro para ponerlo en el termo para el trabajo. Parecía un dispositivo muy grande pero no es exagerado. Las partes lavables se desmontan muy fácilmente y aunque el depósito parece pequeño, es suficiente. El diseño es elegante, tal cual aparece en las fotos. El café sale rápido -mucho más que la que teníamos antes- y te da 3 opciones: corto, expreso o largo, tanto para la versión estándar de la cápsula como para la gigante, que puedes comprar también por Amazon, si no la encuentras en tu tienda de siempre. Por lo que se refiere al ruido, el habitual en este tipo de cafeteras. A su favor también el depósito de agua más grande que en otras, lo que te evita tener que estar cargando ""a cada momento"". Cuando se acaba el agua parpadea el piloto. Mejorable que avisase cuando queda poca

👌 Vistos estos puntos la conclusión es que cumple con su objetivo: recomendable

Espero que la reseña te sea útil y te ayude a tomar una decisión informada

---

L'opció de poder posar càpsules XL està genial, especialment si preneu cafè més d'una persona a casa. Va perfecte per preparar al mateix temps un cafè per esmorzar a casa i un altre per posar-lo al termo per la feina. Semblava un dispositiu molt gran però no és exagerat. Les parts rentables es desmonten molt fàcilment. Tot i que el dipòsit sembla petit, és suficient. El disseny és elegant, com es veu a les fotos. El cafè surt ràpid -molt més que la que teníem abans- i et dona 3 opcions: curt, exprès o llarg, tant en la versió estàndar com amb la càpsula gegant, que pots comprar també a Amazon, si no la trobes a la teva botiga de sempre. Pel que fa al soroll, l'habitual en aquest tipus de cafeteres. Al seu favor també el dipòsit d'aigua més gran que en d'altres, fet que agraeixes per no haver d'estar recarregant ""a cada moment"". Quan s'acaba l'aigua el pilot parpelleja. Millorable que t'avisés quan queda poca.

👌 Vistos aquests punts la conclusió és que compleix el seu objectiu: recomanable

Espero que la ressenya et sigui útil i t'ajudi a prendre una decisió informada",Words & Cherries 👍👎🍀,Revisado en España el 20 de diciembre de 2020
Excelente producto por precio Genial,"5,0 de 5 estrellas",Muy buen producto y sobre todo porque la compre en oferta flash por 49€.,Juanjo González,Revisado en España el 4 de junio de 2024
CAFETERA,"4,0 de 5 estrellas",PRESSION De Poco Un FALTA LE QUE PARERCE ME ERO PRODUCTO Buen Muy,perez joseph,Revisado en España el 30 de abril de 2024
buen precio,"5,0 de 5 estrellas",La compré columna oferta y desde hace ya varios años y hasta ahora ningún problema,Maximo Decimo,Revisado en España el 31 de mayo de 2024
Philips L'Or Barista Original,"5,0 de 5 estrellas","Buena calidad, precio.",anamaria m.,Revisado en España el 18 de junio de 2024
Excelente,"5,0 de 5 estrellas","Ya la conocía, excelente opción. Recomendada.",rocio garcia,Revisado en España el 7 de junio de 2024
Me encanta,"5,0 de 5 estrellas",Es muy buena. Estoy muy contento con ella,Rob,Revisado en España el 5 de junio de 2024
Boa relação de preço qualidade,"5,0 de 5 estrellas","Mais silenciosa que a anterior, depósitos grandes.",Filipa Marques,Revisado en España el 3 de junio de 2024
Comodísima,"5,0 de 5 estrellas","Me encanta, antes siempre compraba una marca concreta, compré está por cambiar, las otras muchas marca pero...fallaban enseguida. Estoy encantada con esta compra, me gusta mucho.",Nieves Fernández Riaño,Revisado en España el 18 de mayo de 2024
Que Aroma!!!,"5,0 de 5 estrellas","Anoche la saqué de la caja, la dejé preparada y purgada , y este es su primer café . El Aroma es increíble ! Buena compra !",Bi,Revisado en España el 8 de junio de 2024
Cafetera,"4,0 de 5 estrellas","Pocos dias de uso para juzgar.de momento muy bien ,facil uso y hace un cafe escelente",francisco,Revisado en España el 20 de abril de 2024
Articulo perfecto,"5,0 de 5 estrellas",El artículo responde a lo esperado,Alfonso,Revisado en España el 3 de junio de 2024
Buen café,"5,0 de 5 estrellas","El café está muy bueno, la verdad. Compatible con otras marcas de capsulas de aluminio. Las capsylas XL solo las he visto por Amazon.",Carlos Llorens,Revisado en España el 15 de mayo de 2024
Top,"5,0 de 5 estrellas",Máquina de café espetacular,Paulo Santos,Revisado en España el 5 de junio de 2024
Buenas cafetera,"5,0 de 5 estrellas",Calienta rápido el circuito de agua.,Goyo D,Revisado en España el 3 de junio de 2024
Rapidez,"4,0 de 5 estrellas",Le falta un poco más de temperatura por lo demás va bien,albert casas esteban,Revisado en España el 14 de abril de 2024
Cafetera,"5,0 de 5 estrellas",Es muy bonita es liviana y muy fácil de usar la limpieza es fácil. La recomiendo y el tamaño es perfecto.,Jennifer ocampo,Revisado en España el 15 de mayo de 2024
Cafetera,"5,0 de 5 estrellas","Hace muy buen café y valen prácticamente todas las cápsulas, la recomiendo",Toni,Revisado en España el 23 de mayo de 2024
Que funciona rápidamente.,"4,0 de 5 estrellas",El tener ya automatizados los largos del café.los materiales del cajón super delgados y muy costoso de deslizar el mismo para limpiar.,novato.,Revisado en España el 7 de abril de 2024
Esta muy bien,"4,0 de 5 estrellas","La verdad al principio me decepcionó muchísimo, pues los cafés salían muy auguados a pesar de usar intensidades altas (9/10) y estuve pensando en devolverla , un conocido me dijo que tuviera paciencia que las maquina necesitan varias tazas de café para que se adapte la maquina y que luego ya está, hice caso y la verdad me e quedado sorprendido, al cabo de el mes de azer cafés ya me empezaron a salir cremosos y intensos, muy buena compra 👍🏻👍🏻👍🏻👍🏻👍🏻",Cristian Romero saez,Revisado en España el 8 de enero de 2024
Pésimo servicio tecnico,"1,0 de 5 estrellas","Al mes h 3 dias de comprarla, se estropeó el mecanismo de meter las cápsulas.
Ya no habia posibilidad de reemplazo y hubo que mandarla a reparar.
Te dicen que 20 días laborables es el tiempo estipulado para repararla.
En ningún momento te informan de como va la reparación, he tenido que estar llamando yo a Amazon.
Y al final cuando ya se habian pasado los 20 dias, volvi a llamar a Amazon exigiendo el importe de la cafetera y casualmente al dia siguiente me escriben los de Philips diciendo que les ha llegado ese dia y que la han reparado y enviado de nuevo.
Descontenta con la calidad del servicio de reparación.
Todavia no la he recibido, veremos a ver si funciona bien.",Polivitaminica,Revisado en España el 27 de junio de 2024
"Nada recomendable ni el sistema Nespresso, ni mucho menos esta máquina en particular","1,0 de 5 estrellas","He comprado esta cafetera para usar en la casa de verano, y la verdad es que tras un mes de uso estoy bastante desencantado, tanto con el sistema Nespresso como con esta cafetera en particular.
En mi domicilio habitual dispongo de una cafetera express que ya tiene encima unos cuantos años, y aprovechando que había que cambiar la cafetera en la casa de verano, me pareció una buena opción comprar esta cafetera, y de paso probarla para cuando me toque sustituir la cafetera express de casa.
Sobre el sistema Nespresso, la verdad es que la calidad (tras probar tanto las cápsulas originales como unas cuantas compatibles) creo que se queda bastante lejos de lo que se puede conseguir un café mas o menos convencional en una cafetera express. Si tienes en cuenta el factor precio, pues la victoria de la máquina express ya es por goleada. Por ejemplo si quieres conseguir un café con leche en condiciones para el desayuno, tienes que irte a las capsulas dobles, o el café apenas es capaz de teñir la leche (usando una taza de las habituales de desayuno).
Dejando de lado mi opinión sobre el sistema de cápsulas (que me parece muy a tener en cuenta a la hora de comprar esta cafetera), la verdad es que tras unas semanas de uso, la máquina en cuestión presenta un problema de diseño o construcción, que hace que el sistema de palanca que usa para colocar y expulsar las capsulas, no funcione correctamente, y las mismas se queden atrancadas o mal colocadas de vez en cuando, y todo esto tras 4 semanas de uso, así que mucho me temo que el próximo verano los problemas se acrecentarán y tocará tirar de garantía.
La máquina a pesar de ser totalmente plástica, tiene un diseño agradable, y que aparenta una cierta calidad, pero si falla el sistema de carga de las cápsulas, la verdad es que el diseño importa mas bien poco.
En resumen, y por no alargarme en exceso, ni me ha gustado el sistema de cápsulas de Nespresso, ni me parece que la calidad de esta cafetera en concreto sea la adecuada, por lo que se le intuye una vida útil mas bien corta.
Nada recomendable, pero si has probado el sistema de capsulas de Nespresso y te convence, buscaría al menos una cafetera con un sistema de carga de las cápsulas mas ro",Miguel,Revisado en España el 5 de septiembre de 2021
Decepcionado,"1,0 de 5 estrellas","La compré porque tengo otra que funciona a la perfección. Me llegó en una caja que no era suya , sin capsulas y sin instrucciones, aun así me la quedé porque sabia como funcionaba y ya tenia capsulas para usar. Me a durado 2 meses y a dejado de funcionar. Quería sustituirla por otra igual pero me la envían a reparar , no devuelven el producto por el tiempo transcurrido. Ahora he de estar 1 mes sin cafetera a ver si la reparan o si me envían otra.
Decepcionado con el vendedor más que con la marca, creo que me envio un producto usado sin advertirlo",Alfonso Carrion,Revisado en España el 20 de junio de 2024
No compatible con todas las cápsulas tipo Nespresso,"1,0 de 5 estrellas","No es compatible con todas las cápsulas tipo Nespresso. Por ejemplo las de Mercadona las machaca y deja los posos alrededor de la zona de prensa, la que veis en la foto, consecuencias? Que luego no cierra la palanca. Tenéis que limpiar a fondo toda la zona que veís en la fotografía, incluso la zona interior donde se ve un círculo blanco, que es la prensa, una vez limpia esa zona la palanca ya vuelve a cerrar. Me parece imposible que esto no lo sepa el fabricante Philips, y que se venda como compatible cuando no lo es, seguro que lo han testado y conocen el problema. Así que tenéis que ir probando que marcas de cápsulas tipo Nespresso son compatibles y no las tritura la palanca que hace de prensa. Las de Mercadona, ya os digo que no funcionan bien, cada 7 u 8, tritura una, es un incordio tener que desatascar el dispositivo cada vez.",Cliente Amazon,Revisado en España el 8 de febrero de 2024
NO LO COMPRARÍA...,"1,0 de 5 estrellas","Apenas dis meses de uso y ya se ha estropeado.
El servicio técnico de Philips muy bien, parece que la han reparado, pero bastante inseguro de cuánto tardará en volver a estropearse...
No tengo claro si es un defecto de diseño o de fabricación, porque Philips obviamente no lo deja claro.
En definitiva, si hay duda yo te la resuelvo: NO LA COMPRES",Belén Conde Colmenero,Revisado en España el 9 de julio de 2024
Pierde agua,"1,0 de 5 estrellas","Estábamos muy ilusionados con la compra de esta cafetera. La hemos recibido hoy mismo, hemos probado algunos de los cafés degustación. Todo muy bien, estábamos muy contentos hasta que he empezado a escuchar ruidos, venían de la cafetera. Resulta que escupe agua estando apagada, tendremos que devolverla y probar con otro modelo, hemos leido que le ha pasado a más gente.",Eduardo Saelices,Revisado en España el 8 de julio de 2024
Cafetera con sistema de introducción de cápsulas endeble y resultado nefasto,"1,0 de 5 estrellas","Se trata de una cafetera de cápsulas L'Or compatible también con cápsulas Nespresso.

La cafetera, a priori, es bonita y práctica, ya que permite con las cápsulas adecuadas, hacer dos cafés a la vez. Las características técnicas en cuanto a bares de presión y tiempo de calentamiento son idénticas a cualquier otra cafetera de cápsulas del mercado.

Por otra parte hay que destacar que en general, las cápsulas de L'Or son bastante buenas y el café es bastante rico. Y hasta aqui la parte buena porque todo lo demás es un desproposito general.

Por un lado está la introducción de las cápsulas que se realice mediante una especie de palanca articulada que se encuentra en la parte superior y que desde el primer momento da una sensación de fragilidad preocupante, Desde el principio pensé que la cafetera tendría una escasa longevidad debido a dicho mecanismo pero lo cierto es que, aunque la he usado muy poco y ha dejado de funcionar, no ha sido esta parte la culpable del fallo...

La cuestión es que tras poco tiempo de uso, la cafetera no perfora las cápsulas y lo único que expulsa es agua. He revisado el sistema y aparentemente todo está bien pero la cuestión es que no se puede seguir utilizando. Afortunadamente todo ha ocurrido dentro del plazo de garantía y he podido realizar la devolución de la misma. Como siempre, en este sentido, un 10 para el departamento de atención al cliente de Amazon.

Huelga decir que he procedido a comprar otro modelo de cafetera que no tuviese nada que ver con Philips y afortunadamente con la nueva no he tenido problema alguno.

En definitiva: un diseño fallido de cafetera (de hecho cada vez están más baratas) que por si fuese poco, se averió tras poco tiempo de uso :(",Juan,Revisado en España el 20 de abril de 2020
Buena cafetera mal vendedor,"1,0 de 5 estrellas",La cafetera es buena como cabe esperar dela marca. El vendedor horrible llegó dañada el vendedor tardo 4 días en dar solución así que ya era tarde para cambiarla ya que es un regalo para el día de la madre. Total que voy a tener que regalarle a mi madre una cafetera con la caja y las cápsulas aplastadas .. y para el vendedor se arregla con devolverme 15 euros... Me ha parecido vergonzoso ny Amazon consiente que los vendedores externos traten así a sus clientes,luka,Revisado en España el 4 de mayo de 2024
Solo ha durado 5 meses viva,"1,0 de 5 estrellas","Compré esta cafetera en Diciembre y estábamos muy contentos con ella es bonita y hacía muy bien el café, pero el otro día de repente apareció un muelle donde caen las cápsulas viejas y ya no sale el cafe. Muy decepcionado la verdad, espero que me devuelvan el dinero.",Carlos Rivilla Bastante,Revisado en España el 7 de mayo de 2024
Mala calidad,"1,0 de 5 estrellas","La compré por la publicidad que tiene, pero comparado con la Nespresso que tenía anteriormente mente, es muy inferior, no la recomiendo",juanma73,Revisado en España el 26 de junio de 2024
A los pocos meses dejó de funcionar.,"1,0 de 5 estrellas",Buen café. Estaba contenta pero un buen día dejó de funcionar de repente 🥺 no tenia ni medio año de uso,Isabel,Revisado en España el 10 de julio de 2024
Producto dañado,"1,0 de 5 estrellas","La cafetera ha llegado dañada con el deposito de agua agrietado, era un regalo y he quedado muy mal",Francisco Lopez Hinojosa,Revisado en España el 10 de julio de 2024
Enorme,"1,0 de 5 estrellas",No me acaba de convencer es enorme.lo unico que se apaga sola,Liliana,Revisado en España el 16 de julio de 2024
Horroroso,"1,0 de 5 estrellas","Nada recomendable. Ha durado como un caramelo en la puerta de un colegio.
No la quiero ni gratis",manu,Revisado en España el 6 de junio de 2024
Mala calidad,"1,0 de 5 estrellas","Es la segunda que compro, (noviembre'23 ) y será la última, no solo hace un agua sucia en lugar de café, sino que te deja la encimera encharcada, creo que a 4 meses de la compra no me dejen devolverla por producto obviamente defectuoso no me parece logico",victoria higueras,Revisado en España el 27 de marzo de 2024
Está usado!,"1,0 de 5 estrellas",Yo no he pedido algo usado. Y además roto. Fatal,Juan Carlos,Revisado en España el 14 de junio de 2024
Muy incomoda,"1,0 de 5 estrellas","No entiendo como pueden fabricar una máquina de café tan incómoda.
No tiene botón de encendido, solo puede seleccionar una de las 3 diferentes cantidad.. y si te distrae y no ha puesto la taza abajo el café empieza a salir..
Además sale también si no está cerrada la 'puertecita' donde pones las cápsulas..
Una locura.. la verdad que estoy sin palabra de como pueden poner el el mercado un producto así.. desafortunadamente ya pasó el tiempo de devolución porque abrí el paquete muy tarde, pero seguro que la voy a tirar",Patrizia R.,Revisado en España el 29 de julio de 2023
