title,rating,body,author,date
"Si te gusta un buen café y no quieres esperar, es para ti.","5,0 de 5 estrellas","Cafetera muy fácil de usar y más fácil aún de limpiar (en 2-3 pasos y menos de 5 minutos está el café hecho y la cafetera completamente limpia).
Compré esta cafetera porque me apetecía empezar a tomar cafés a diario pero no me convencía la típica cafetera Krups ni tenía la paciencia para hacer el café en otro tipo de cafeteras más tradicionales.
Llevo usándola unos 4 meses y estoy profundamente encantada.

Las bebidas son muy sabrosas, y la gran variedad existente* de tipos y marcas da la opción de poder encontrar la que más se adecúa a tu gusto particular.
*La gran variedad incluye muchas marcas y variantes de: café americano, café solo (corto o largo), café con leche, capuccino, café latte, chocolate caliente, chai latte, infusiones...

La única pega que puedo ponerle es que solo se pueden utilizar las cápsulas oficiales debido al mecanismo que usa la cafetera para funcionar de forma automática.
Por lo demás, el precio de la cafetera es muy asequible y para comprar las cápsulas podemos acudir a casi cualquier supermercado y las habrá.

TIP, a título personal: para una mayor variedad de bebidas, packs de bebidas y accesorios, así como para tener opción de comprar con unos descuentos bastante jugosos recomiendo comprar las cápsulas en la página oficial de Tassimo.",Patricia,Revisado en España el 19 de abril de 2020
ESTOY MUY CONTENTA,"5,0 de 5 estrellas","El primer día casi me la cargo, porque ponía el agua, ponía la cápsula y no bajaba del todo la compuerta, no hacía “clac”, de forma que se perforaba un poco la cápsula, pero no hacía ni café ni nada...no hacía ningún ruido de motor o de agua. Después de desperdiciar 2 cápsulas, me di cuenta de que la máquina no estaba bien cerrada, pues empujé más hacia abajo la compuerta semicircular y oí el “clac” que hasta entonces no había escuchado. Lo malo fue que di con el quid de la cuestión cuando tenía colocada una de las cápsulas que había probado sin éxito y que ya tenía un pequeño orificio: cuando empezó a circular el agua, llené toda la máquina de churretes de café. Por tanto, dos consejos para el primer uso: 1) Hay que bajar la compuerta hasta que haga “clac” cuando hay una cápsula puesta (cuando no hay ninguna cápsula va suave y no hay que encajarla) y 2) Nunca hay que probar más de una vez con la misma cápsula, si ésta tiene algún pequeño orificio.
Al final, después de este ratito de desesperación, resultó que era facilísimo hacer café, chocolate, infusiones, etc., pues hay una gran variedad de bebidas diferentes que se pueden preparar. También puedes elegir entre varias marcas de café o de chocolate, por lo que no te limita la elección. Además, el precio es muy, muy asequible (a mí me costó 24 €). Estoy muy contenta.",Etel Carbonell,Revisado en España el 21 de noviembre de 2019
Para cocinas o espacios pequeños,"4,0 de 5 estrellas","Está genial, ya tenía otra pero más grande; se me había estropeado y ahora he conseguido arreglarla, pero a lo que vamos: ésta es más pequeña y ""cuquiña"" y ocupa mucho menos, pero como defectos veo que el espacio para el agua es como más falso, al tratarse de una solapa lateral en vez del depósito de la grande; y que no se pueden meter cápsulas de las grandes de las de chocolate (creo). Por lo demás, chapeau.
Su funcionamiento es sencillo, no hay ni que encender ni apagar; enchufando ya se enciente la lucecita y le damos al botón y sale el café, y si queremos aguarlo un poco (yo soy de esos...) pues cuando termine se le da otra vez y listo. Después se desenchufa (yo soy de esos también) y listo.
Para limpiarla es tan sencilla como la otra, con un paño o bayeta húmedos basta, o jabón neutro si tiene manchas, y es conveniente retirar las partes por las que sale el café (el pitorrito, vaya) para limpiarlo con frecuencia porque cambia MUCHO el sabor del café.
Antes de usarla es mejor hacer limpieza con la chapita al efecto, que viene en un lateral, yo no la encontré al principio pero está a simple vista.
Recomiendo su compra si está de oferta, y también la grande que es más cómoda pero más engorrosa en cuanto a ocupar más.
Como complemento, el dispensador de Hotussa de cajón con frente de madera es casi indispensable.
Recomiendo las tres compras (una cafetera o la otra según preferencias y el dispensador de cápsulas horizontal, un cajón encima del cual se coloca la cafetera).",RBK,Revisado en España el 14 de mayo de 2021
"Rápida, cómoda y poco ruidosa","5,0 de 5 estrellas","No puedo comparar con otras, porque no he tenido ninguna, pero lo que buscaba era una cafetera compacta, que no ocupara mucho sitio en la cocina, para un uso normal, barata y que tuviera variedad de bebidas. Esta cafetera cumple esto al 100% y además es poco ruidosa. El depósito de agua permite unas cuatro tazas, mas o menos, pero se llena en un segundo. Se limpia muy rápido también. Las cápsulas son baratas, no acepta marcas blancas pero no importa, hay cápsulas tassimo en cualquier super o a través de la web se puede comprar cafés, tés, chocolates, etc.",Fernando Cebrián,Revisado en España el 24 de septiembre de 2018
"Para muy cafeteros .,. pero .. No.","4,0 de 5 estrellas","la cafetera es la más barata de todas , casi siempre está en oferta La presentación es buena, el aparato es resistente y el sabor de los cafés es delicioso Aunque de las 4 marcas conocidas es la que tiene las capsulas más cara. además la máquina tiene lector de código de barras y es imposible encontrar marcas blancas . por último si te descuidas y colocas la capsula un poquito mal suele explotar , explosionar, de verdad. en fin casi un año después me he cansado de sus tonterías me cambio en breve a otra",raquel rs,Revisado en España el 2 de junio de 2021
Fallo de software,"4,0 de 5 estrellas","Le resto una estrella por un fallo de software.
Si le metes una cápsula pero no le das al botón mientras está encendido, la máquina ""se olvida"" que tiene una cápsula sin usar dentro, y por mucho que le das después al botón ya no arranca. No queda otra que abrir y volver a cerrar el compartimento de la cápsula, y como la cápsula ya está perforada, te cae polvo de café por el tubo en la taza.
Podría entender que la máquina se quedara sin información en la memoria si sufriera un corte de corriente, pero mientras esté conectada a la corriente debería ser capaz de memorizar que tiene una cápsula nueva dentro para poder usarla sin que haya un límite de tiempo entre que pones la cápsula y le das al botón.",Daniel Couto,Revisado en España el 6 de mayo de 2020
La mejor en calidad-precio,"5,0 de 5 estrellas","Tenía muchas dudas con respecto a qué tipo de cafetera comprar para tener en casa de mi novia. En mi casa tengo de cápsulas nespresso y senado. Por lo que me decidí a probar estar variedad animado por las cápsulas Tassimo y por el excelente precio del producto siendo de una marca prestigiosa como Bosch. No puedo estar más contento con el resultado, el café sale delicioso, las cápsulas en este formato de Marcilla están espectaculares, recomiendo a siempre darle al botón Intellibrew, para que la cafetera lea el código de barras y salga la cantidad justa.
En cuanto a calidad-precio-sabor esta es la mejor cafetera del mercado sin duda. El precio de las cápsulas oscila entre 5€ (16 cápsulas) y 6,5€(32 cápsulas con ofertas), y siempre está la posibilidad de comprar ofertas en la que vienen varios packs.
Muy recomendable, los que estéis dudando, esta opción es muy buena.",Ismagnar,Revisado en España el 17 de marzo de 2020
Pequeña y compacta,"4,0 de 5 estrellas","Me gusta el tamaño, porque es más pequeña que la Happy y tiene la misma función. La rapidez no es su virtud, pero para casa funciona bien. Salpica mucho, así que se debe usar una taza alta para no manchar todo.
En relación a las capsulas me parecen de precio medio entre 0,28 y 0,60 depende de lo que busques, el tema es que no tienes la opción de marca blanca ya que funciona por código de barras.
No tienes que medir el agua del café ya que el lo hace automático leyendo el código.
En resumen, bajo costo de máquina pero medio alto costo de cápsulas. (y poca variedad)",Simon Cardoza,Revisado en España el 7 de mayo de 2020
Fallo de cafetera Tassimo,"5,0 de 5 estrellas","Hola, estaba muy contenta con mi cafetera Tassimo, pero sin haberme dado problemas,durante el mes y poco que la tengo, hoy al ponerme a hacer mi café, ha empezado a salirse el agua sin parar y el café por supuesto no ha salido bien, pues sino paro la cafetera se habría salido todo el agua, no había manera de pararla, sino la desenchufo.
Quisiera saber qué debo hacer para que me manden una nueva, pues imagino que con un mes que tiene, tendrá una garantía.
He puesto la máxima puntuación porque me gusta mucho y es muy fácil de usar, pero debe de haberme salido defectuosa.
Espero me lo resuelvan cuanto antes.
Muchas gracias.
Un saludo.",Yoly,Revisado en España el 31 de octubre de 2020
Muy buena,"4,0 de 5 estrellas","es una cafetera muy buena,la marca tiene una amplia variedad de cafés,chocolates,infusiones,leche sola.Las cápsulas son redondas,se colocan en la parte superior de la cafetera,a mi me costó ponerla en marcha,porque no me había leído la parte de la instrucción que decía que se tiene q presionar 5 segundos en el botón del dibujo de la tazita.Abajo,en la parte izquierda tiene una ranura donde contiene una cápsula de plástico,ésta sirve para lavar la cafetera.Yo,antes de usarla x primera vez,recargué el agua,normal del grifo,le he puesto ésta cápsula del grifo y la he puesto a funcionar como si fuera un primer café para limpiarla x dentro.El defecto que le pondría es que:en el sitio donde va el agua siempre queda agua,no la puedes aprovechar toda,ya que la cafetera ya te pide que la recargues cuando se enciende un botón rojo.",Cliente Amazon,Revisado en España el 24 de agosto de 2017
La cafetera bien las cápsulas NO,"4,0 de 5 estrellas","La compré en una oferta por 24 euros y me a gustado bastante, es rapida y no muy ruidosa, la cafetera en sí es muy decente pero no me gusta que no haya cápsulas de marca blanca para tassimo, he visto de las marcas alteza, coviran incluso ,día más baratas sólo compatibles con Nespresso ,vamos que lo k me e ahorrado en cafetera me lo estoy gastando en cápsulas!
Es una pena porque supongo que esta la regalaré cuando me pueda comprar otra nescafe, solo por las cápsulas tan caras y sin posibilidad de marca blanca.. En el súper el capuchino 5e por 8 cápsulas! Muy caro!l",Mónica,Revisado en España el 24 de noviembre de 2019
Muy buena compra por el precio que tiene,"5,0 de 5 estrellas","Llevo usando este modelo de cafetera desde hace 3 años, antes usaba uno con boton de encendido. Este es de encendido y apagado automatico, hay que acostumbrarse. tarda muy poco en apagarse, es un minimo gasto pensando en lo que se puede ahorrar en energia si uno se olvidase el aparato encendido.
Su limpieza no es del todo sencilla, sobre todo la parte donde se coloca la capsula.
Recomiendo realizar limpizas periodicas del circuito, siguiendo las instrucciones.
Usé mis anteriores cafeteras de este modelo durante bastante tiempo con la luz de limpieza en rojo, no hubo inconvenientes aun estando encendida esa luz.
Compra recomendable 100%.
Calidad: 7/10
Precio: 9/10
Sabor: 8/10 ( Depende mucho de la marca que se elija )
Relacion Calidad/Precio: 9/10",N. Chilavert,Revisado en España el 14 de abril de 2020
"Para bebidas de café y chocolates va genial, facil y rápida.","5,0 de 5 estrellas","Pesa muy poco esta máquina (es todo plástico) pero para ser la más económica de Tassimo funciona muy bien por ahora.
De ruido, pues como todas, ruidosa.
Facil de rellenar el depósito de agua. Y tiene 4 o 5 tipos disntintos de chocolates (oreo, etc) y los niños no paran de usarla. El cafe la verdad es que prefiero la cafetera de brazo (tipo bar) que no tiene nada que ver.
Pero para otro tipo de bebidas está muy bien.
Las cápsulas mejor comprarlas en la tienda oficial, al registrar la máquina te mandan un par de cupones de 10€.
No pongo fotos porque no hay nada que destacar que no se vea en la descripción",Jacinto,Revisado en España el 9 de agosto de 2020
"Prometia por su precio, pero... lo barato sale caro.","3,0 de 5 estrellas","En si la cafetera no está mal, cumple su función, en minuto y medio tienes tu cafe listo, rapdio y limpio, es lo que buscaba, pero sacrificando algo que para mi es fundamental, el tomarse un cafe por la mañana recien levantado y espabilarte, la calidad y variedad del cafe que puedes tomar es aceptable, no tanto el gasto que llega a generar.
En 4 meses y medio e gastado en capsulas lo que antes en cafe para una italiana normal en un año, y me gusta el cafe, pero tambien que espabile. Es una pena la verdad pero visto lo visto, que lo barato sale caro, e decidido mejorar y comprar una espreso en condiciones y disfrutar del cafe como a mi me gusta.",carlos,Revisado en España el 2 de marzo de 2021
Me encantaaaa,"5,0 de 5 estrellas","El año pasado la compre por reyes a mis padres porque necesitaban una cafetera sencilla y me decidí por ésta. No ha fallado ni defraudado. Este año la he vuelto a comprar (esta vez en blanca) para regalar a mi chico pues también quiere una de éstas sin mucho rollo para el café mañanero. Está agotada en todos establecimientos pues de precio estaba genial y cumple su función perfectamente. Es rápida, práctica y ocupa poco espacio. Las cápsulas no son nada caras y el mantenimiento de la cafetera es bastante simple: rellenar el agua y limpiar el filtro de vez en cuando. No hace falta regular el agua ni meter 2 o 3 cápsulas para hacerte un cortado; viene todo listo y preparado para que la pongas una cápsula, des play y salga tu bebida calentita.",Cliente Amazon,Revisado en España el 19 de diciembre de 2017
Pequeña pero matona,"4,0 de 5 estrellas","Tassimo totalmente funcional, muy pequeña y manejable y fácil de usar. No llega al nivel de calidad de varios modelos superiores que he tenido en los últimos años, pero la diferencia de de prestaciones y de precio con ellos tampoco compensa el desembolso extra. El café aunque use las mismas capsulas de toda la linea es ligeramente más aguado y menos sabroso que el conseguido en modelos de gama alta y el depósito de baja capacidad te obliga a llenarlo con mucha frecuencia, pero por lo demás y si no le das mayor importancia a lo comentado es una inversión fantástica, no te arrepentirás de comprarla.",Vulcano,Revisado en España el 3 de junio de 2019
Mer,"4,0 de 5 estrellas","Es la primera cafetera de estas caracteristicas que utilizo me gusta los cafés que hace aunque sólo he utilizado una marca que es marcilla el resto de marcas son caras por eso pediria algo mas asequible al bolsillo y más variedad, a los fabricantes de Bosh les pediría como observación que en el libro de instrucciones se explicara un poco mejor su funcionamiento ya que las fotos ilustradas son un poco confusas, para ponerla en funcionamiento tuve que recurir al YouTube, no se si compensa comprar un producto económico como este si tienes que comprar las cápsulas que son bastante caras",Cliente Amazon,Revisado en España el 28 de septiembre de 2017
Me gusta mas que la nespresso,"5,0 de 5 estrellas","Hemos flipado con la tassimo. Queriamos una cafetera de capsulas porque mi marido tiene problemas de movilidad de una mano.

La cafetera es muy facil de usar, el deposito de agua es sencillo de rellenar y poner. El uso es sencillo, solo tiene un boton para todo, aunque las instrucciones no vienen demasiado claras.

Si pones la capsula la cafetera lee el codigo y pone el agua exacta, pero en mi caso me gusta el café más aguado de como viene... Si quieres poner más agua, manten presionado el botón hasta que esté a tu gusto, cuando sueltes el botón dejará de salir mas agua....

Lo explico porque me ha costado averiguarlo, no había manera.

Mi veredicto, me gusta más que la nespresso...

Y el cafe se compra en el super....

Genial...",EVA MARIA,Revisado en España el 4 de octubre de 2019
Excelente por donde se la mire,"5,0 de 5 estrellas","Primero que nada, hace rato que buscabamos una, y no nos terminabamos de convencer por el elevado precio de las Dolce Gusto. No queriamos Nespresso por que son diminutos los cafes, y queriamos tambien chocolates y demas bebidas. Esta ha cumplido con todo: Buena cantidad de bebida en la taza, amplisima variedad de capsulas, no hay que hacer nada, la cafetera pone el programa adecuado para la capsula. Silenciosa, y saca el cafe muy caliente como me gusta, y ademas, muy economica, la negra estaba a 28 euros.. Me salio casi lo mismo un porta capsulas. En Resumen: RECOMENDADISIMA.",Roberyto,Revisado en España el 20 de octubre de 2020
Es bonita y hace buenos cafés (y chocolates),"4,0 de 5 estrellas","La compré por una súper oferta sin saber muy bien qué tal era, pero ha sido una sorpresa. Los cafés están ricos y quedan tal cual te los muestran en las fotos. Una pasada, porque lee el código de barras de cada cápsula y la máquina opera según la han programado para ello.
El gran ""pero"" que tiene es que genera mucho residuo. Vale que es reciclable porque es plástico y papel de aluminio, pero da pena tirar tanto residuo para hacer un café (aunque en este sentido no es nada diferente a otros fabricantes)",TR,Revisado en España el 13 de febrero de 2019
BUENA,"4,0 de 5 estrellas","La compramos entre todos los compañeros para la sala de descanso del trabajo y la verdad que el sabor es muy aceptable para el precio que tiene. Llegó rápido como siempre. La única pega que le pongo son las cápsulas, no están en todos los supers y al ser muy diferentes al resto a veces son difíciles de encontrar. Pero con los packs que venden aquí en Amazon ya está bien.",Moñoñi,Revisado en España el 11 de mayo de 2020
facil de usar pero las capsulas son malisimas,"4,0 de 5 estrellas","La cefetera está bien, tarda un poco en hacer los cafes pero esta bien, lo que tengo que decir es que estas capsulas tassimo son malisimas, tengo que hacer media tasa con una capsula y media con otra para que no parezca agua sucia en vez de cafe.... muy mala, fue un error no haber gastado un poco mas y comprar una nespresso , pero aclaro que la cafetera hace su trabajo, el problema son las capsulas.",Fabri,Revisado en España el 2 de marzo de 2020
Cafetera cápsulas,"5,0 de 5 estrellas","Es la segunda cafetera que pido. Ambas son un regalo para mis padres. La primera era para una segunda vivienda y ésta para la vivienda habitual. Están encantados con ella. Muy fácil de usar. Diseño muy bonito. El sabor del café increíble.
La única pega es que trae la propia caja de la cafetera, no viene con embalaje de Amazon.",Mamen C.P.,Revisado en España el 26 de octubre de 2021
Cumple muy bien y los cafés son bastante buenos,"5,0 de 5 estrellas","Ya había probado cafeteras de este estilo Tassimo y la verdad que muy contento.
Suelo tomar el café Largo de Marcilla y está bastante bueno. Eso sí, siempre hay que gastar cuidado con el agua que se le eche dependiendo de la zona (por tema de cal obviamente).
Pero muy buena cafetera por el precio que tiene y muy fácil de usar (un único botón y a beber café jejejeje)",Marcos,Revisado en España el 29 de abril de 2021
Calidad y facilidad de uso,"5,0 de 5 estrellas","Nos encanta la cafetera ya que es muy sencilla de utilizar, sólo llenar el depósito de agua, introducir la cápsula y presionar el botón. Te saldrá una bebida fría o caliente, dependiendo el ""tassimo"" que hayas introducido. Las cápsulas tienen un código de barras que al leerlo la cafetera ya interpreta si precisa agua fría o caliente. Hemos probado varias preparaciones y los cafés son excelentes. No busquéis cápsulas de marca blanca ya que, de momento y que sepamos, no existen, será por el tema del código de barras.
En definitiva: buena compra si quieres calidad y buen precio (nosotros la adquirimos a un precio muy económico)",Quela,Revisado en España el 21 de marzo de 2019
Me encanta,"5,0 de 5 estrellas","Es super cómoda. Hay muchísima variedad de café y otras bebidas para elegir. Tienes que buscar las cápsulas tassimo, y ya ahí pues la marca que quieras. Yo todavía estoy probando. Por ejemplo el café largo no me gusta porque es tipo americano, pues le das al botón para que deje de echar agua y te queda uno normal. Está muy bien, solo que luego tienes que dar con el café que te gusta de toda la variedad que hay hasta dar con el tuyo. Yo la recomiendo totalmente porque es comodísima y rapidísima. A mi me gusta mucho",Cristina P.G.,Revisado en España el 19 de abril de 2020
Fácil uso pero cápsulas muy caras,"4,0 de 5 estrellas","El paquete llegó rápido, como el 90% de los pedidos de amazon. La cafetera en sí está bien, es sencilla de usar y tiene un buen depósito de agua. Pero solo hay cápsulas ""oficiales"", no hay marcas blancas compatibles y en una oficina con 4 trabajadores + clientes bebiendo café el dinero en cápsulas se va por las nubes. Lo mejor es que la preparas, pulsas el botón y la máquina se encarga de prepararlo sin tener que estar pendiente de si se vosa.",Adri,Revisado en España el 28 de diciembre de 2018
Decepcionada,"5,0 de 5 estrellas",Resulta que compró está cafetera para regalar a mi madre para navidad y me viene sin caja así tal cual! Cuál fue mi problema? Que yo vivo encima de mi madre y cuando hicieron la entrega no estaba en casa y lo recibió mi madre y claro ahora ya no puedo regalárselo para navidad porque la ha visto!! Podrían tapar los paquetes o meterlos en una caja que no cuesta nada!! Muy decepcionada es la segunda vez que me lo hacen,Anónimo,Revisado en España el 30 de noviembre de 2020
Calidad precio.,"4,0 de 5 estrellas","La acabo de recibir tengo otra en casa y está la he comprado para el trabajo, no la he probado todavía lo unico que la caja por abajo venía un poco abierta, si encuentro algún fallo en el funcionamiento volveré al comentario para exponerlo.",Ángel Lillo Fernández,Revisado en España el 19 de enero de 2021
Buena cafetera,"5,0 de 5 estrellas","Buena cafetera, el café sale muy bueno. Me gusta mucho la variedad que tiene para cafés y otras bebidas calientes. Me gustaría que tuviese la opccion de guardar una cantidad como por ejemplo el café largo. Me gusta el café largo pero no tan largo porque pierde intensidad. Por todo lo demás va muy bien",Cliente Amazon,Revisado en España el 28 de octubre de 2021
Buena calidad,"4,0 de 5 estrellas","Funciona muy bien. El único problema que le encuentro es que en invierno tengo que calentar la taza. Si no caliento bien la taza con agua hirviendo, el café sale tibio, casi frío. No se si las otras marcas tienen el mismo problema. Debería precalentar el mecanismo de salida del agua para que el café se sirva bien caliente. Si preparo 2 cafés seguidos, pasa lo mismo, se enfría al llegar a la taza.",Andrés,Revisado en España el 9 de enero de 2020
buena cafetera,"5,0 de 5 estrellas","excelente cafetera en su relacion calidad precio.Ideal para uso intermitente que es mi caso. las capsulas tassimo no tienen marca blanca ni son las mas extendidas en los super, pero buena variedad en su pagina aunque poco reciclables, para los mas ecologicos. Muy facil de usar, practicamente 2 botones pero el cierre de la capsula exige cierta dureza que al principio te da aprension. poco ruidosa. Solo he tenido el fallo de 1 capsula que al desbordarse exige retirada de piezas y pasar por agua. bien indicado en instrucciones. contento de la compra",obosan,Revisado en España el 23 de mayo de 2020
Funciona bien y las bebidas no estan mal y no son caras algunas,"4,0 de 5 estrellas","Facil de usar,sabor no esta mal y un engorro para limpiar sobretodo donde van las capsulas,por lo demas si tubiera mas deposito de agua perfecto..de momento la tengo un mes y algo,si no se rompe,recomendable con su precio",Jose lacal gil,Revisado en España el 30 de enero de 2021
Muy buena para su precio,"4,0 de 5 estrellas","Tuve un modelo anterior mucho más voluminosa y ruidosa, parece que eso lo han medio arreglado (sigue haciendo ruido pero no es excesivo) El envío llegó enseguida pero no en una caja de Amazon, directamente en la caja de la cafetera, cosa rara. No le doy 5 estrellas porque la máquina no tiene botón de on/off, se queda una luz encendida cuando deja de funcionar que se apaga al rato con lo cuál no sé si apagada gasta o no luz",Miguel Angel Hernández,Revisado en España el 20 de octubre de 2017
"Pequeño, práctico y fácil de usqr","4,0 de 5 estrellas","El producto está bien, pero es la segunda vez en una semana que Amazon describe un producto erróneamente.
En las características de este producto dice que el depósito de agua tiene un litro de capacidad. NO ES VERDAD.
Solo tiene 0,7 litros de capacidad.
Alguien debería corregir estos errores que inducen a comprar erróneas.",Luis,Revisado en España el 14 de junio de 2020
Calidad-precio correcta,"4,0 de 5 estrellas","La cafetera llegó a tiempo. En cuanto al resultado, cumple con las funcionalidades propias de este tipo de cafeteras. Relación calidad-precio correcta. La hemos comprado paralela a la que teníamos de cafe americano y cumple con su función. Ademas que la marca ofrece bastante variedad a elegir.",Rocio,Revisado en España el 14 de septiembre de 2020
