title,rating,body,author,date
Su calidad,"4,0 de 5 estrellas",Su diseño bonito,Saguntina,Revisado en España el 20 de febrero de 2024
Buen cafe y acepta capsulas de marca blanca,"4,0 de 5 estrellas",Buen tamaño y facil de usar. Puedes encontrar capsulas se marca blanca con lo que se ahorra. La recomiendo,Es economico y ejerce su funcion pero las teclas son de goma y no tienen mucha sensibilidad. Respecto a la cruceta para moverte por los menus hay que ejercer mucha presion en las teclas. Las señales de rebote no llegan al tv y si hay objeto entre la tv y el mando no llega la señal. El boton de control por voz es de adorno y no funciona.,Revisado en España el 9 de febrero de 2024
Muy contenta,"5,0 de 5 estrellas",Buen producto fácil de usar y café muy rico,Chelo Simón,Revisado en España el 30 de enero de 2024
Café horrible,"1,0 de 5 estrellas",Articulo devuelto. Café inbebible,"Calidad precio bien, me llegó tarde y aunque asigne un codigo de una tarjeta regalo al final pagué el precio sin el descuento; sigo esperando explicación aunque me he dirigido a atención al cliente ya que el pago que yo acepté fué descontando la tarjeta regalo.",Revisado en España el 15 de noviembre de 2023
Útil,"5,0 de 5 estrellas",Todo correcto,Cliente Amazon,Revisado en España el 10 de noviembre de 2023
Ya la conocía,"4,0 de 5 estrellas","La compré porque la anterior que tenía, de otro modelo, había empezado a fallar después de 10 años. No tengo experiencia en ninguna otra cafetera de cápsulas, pero he estado encantada con la que tenía, por lo que buscaba la que más se pareciera. Estoy contenta porque funciona igual de bien, pero no sé por qué ahora hacen en todos los modelos un depósito de agua mucho más pequeño. Supongo que habrá alguna razón, porque es muy poco práctico: hay que llenar el depósito cada 2 ó 3 cafés.",nubeblanca,Revisado en España el 28 de agosto de 2023
Resistente,"5,0 de 5 estrellas","El repartidor subió un grupo de cajas en un cesto a golpes en cada escalón, fueron dos pisos y medio y que cada golpe yo cerraba los ojos, cuándo llegó a mi rellano sacó la caja y la volvió a impactar en en rellano, junto dos paquetes más que me tenían que traer, cruzamos miradas de mi incredulidad y se piro corriendo escaleras abajo, total abrí la caja y saque la cafetera, funciona a la perfección, desde que salió de (sabadell) hasta llegar a (santa coloma) no quiero saber los metros que ha llegado a volar la cafetera lanzadola de almacén a furgoneta etc etc, así que es resistente y si hace buen café.",Georgio,Revisado en España el 18 de junio de 2023
No está mal,"3,0 de 5 estrellas",Pero después un año se rompió.,Mary,Revisado en España el 16 de junio de 2023
devolución,"1,0 de 5 estrellas","Esta cafetera ha sido devuelta. Cuando hice la petición de cafetera cápsulas universal, me apareció esta de Bosch- en mi casa somos de Bosch-, visto precio la solicité sin más. Al recibirla observo que las cápsulas que se detallan en su uso no son las que conozco, investigo en las cacterísticas de la cafetera y me dice que la cafetera solo utiliza cápsulas Tassimo. Motivo por el que declino esta cafetera. Saludos.",julio lópez sevilla,Revisado en España el 23 de mayo de 2023
Perfecta,"5,0 de 5 estrellas","Mucha variedad de sabores, ocupa muy poco espacio, es perfecta.",OLGA D.,Revisado en España el 11 de mayo de 2023
Producto fiable,"4,0 de 5 estrellas","La verdad es que hace exactamente lo que anuncian, aunque comparada con otras, quizás le falta un poco de presión para mi gusto.",Manuel FV,Revisado en España el 8 de mayo de 2023
Funcional,"5,0 de 5 estrellas",Funcional,653309900,Revisado en España el 16 de abril de 2023
COMODA// BUENA,"5,0 de 5 estrellas","Es muy comoda de usar y el café sale muy rico.
GRACIAS.",Neus Ferrer,Revisado en España el 10 de abril de 2023
Es lo mejor,"5,0 de 5 estrellas",Estoy muy contenta con la compra y hace buen café la única pega es que no hay cápsulas de marca blanca para esta cafetera lo cuál siempre tienes que comprar de tassimo pero sabes que es de calidad,Lalaloopsy17,Revisado en España el 28 de marzo de 2023
Practica,"5,0 de 5 estrellas",Pequeña,MARISA,Revisado en España el 12 de marzo de 2023
Muy buena,"5,0 de 5 estrellas",Muy buena,Nuria,Revisado en España el 20 de febrero de 2023
economica y hace buen cafe,"5,0 de 5 estrellas","un precio muy ajustado y funciona muy bien, con capsulas de Marcilla un cafe muy rico, ahora he comprado capsulas reutilizables",Arkamb r.,Revisado en España el 14 de febrero de 2023
Buen café,"5,0 de 5 estrellas","Hay poca disponibilidad de cápsulas, ya que sólo admite las suyas, a pesar que hace un buen café, por esta razón:
Hoy no la compraria",Jordi Estañol Franch,Revisado en España el 11 de diciembre de 2022
buen producto,"5,0 de 5 estrellas",buen producto relación calidad precio 👌,Leticia Sueiro,Revisado en España el 16 de noviembre de 2022
Buena cafetera,"5,0 de 5 estrellas",Buena cafetera de cápsulas. Fácil de usar.,PLOSTIS,Revisado en España el 9 de noviembre de 2022
Está bien,"4,0 de 5 estrellas","Funciona pero como se te ocurra poner mal la cápsula se te sale el café por todos lados y es un desastre. En lo que le agarras el truco no te vuelve a pasar. Me gusta que tienen muchas ofertas si compras en la página web de tassimo, te las envían periódicamente por email",PRS,Revisado en España el 23 de octubre de 2022
El tamaño,"3,0 de 5 estrellas","Tengo otro modelo en casa ( anterior más grande con la carga del agua posterior que me gusta mucho más, el doble de autonomía y más cómoda de usar",Eloisa,Revisado en España el 23 de octubre de 2022
No volvería a comprarla ni loco,"1,0 de 5 estrellas",Las cápsulas de su marca y ya. Pasando de productos cerrados.,Rafael,Revisado en España el 20 de octubre de 2022
Genial,"5,0 de 5 estrellas",Seguimos usándola tiempo después a diario y no ha dado problemas,Miguel,Revisado en España el 23 de septiembre de 2022
Muy práctica,"5,0 de 5 estrellas",Fácil de usar y rápida. El café tiene muy buen sabor además ocupa poco espacio y es robusta.,Vanessa,Revisado en España el 21 de septiembre de 2022
Muy bien,"5,0 de 5 estrellas","No somos grandes bebedores de café, solo alguno de vez en cuando, y esta cafetera nos parece que es ideal. Las cápsulas están muy buenas y se pueden conseguir en Mercadona. Te hace el café muy rápido y con gran sabor. Es algo ruidosa pero el ruido dura 10 segundos. Yo la recomiendo.",Naku,Revisado en España el 17 de septiembre de 2022
Gran Precio,"5,0 de 5 estrellas","para lo que hay por ahí, no tiene color el café que hace con lo que cuesta la cafetera…Es Insuperable
A partir de eso ya el tema encontrar las capsulas ,la variedad de las mismas y el,precio de las capsulas no puedo comparar…solo he tenido esta..y siempre bebo el mismo café
Ademas es super pequeña ,ideal en cocina con poca encimera",Javi,Revisado en España el 14 de septiembre de 2022
Hola la cafetera muy bien Gracias,"5,0 de 5 estrellas",Hola la cafetera muy bien porque es la segunda que compró la anterior me a durado bastante tiempo la tassimo los café muy buenos Gracias Amazon y al vendedor,Cliente Amazon,Revisado en España el 20 de agosto de 2022
2 cafeteras bosh,"1,0 de 5 estrellas","Compre dos cafeteras una para casa y una para mi hijo y ahora resulta que dejan de hacer café americano, es normal? Qué hago con las cafeteras? Indignada",Rosa V.,Revisado en España el 9 de agosto de 2022
LA MEJOR,"5,0 de 5 estrellas","Para mi, este modelo es el mejor. La he comprado de segunda mano y simplemente esta nueva, sin estrenar. Vale la pena ahorrar unos euros. Respecto a la cafetera: este modelo, el Vivy 2 , es para mi gusto, el que mejor cafés largos de marcilla hace... Tengo 3, una de cada color y una en cada lugar de residencia. Ni un solo problema con las anteriores y el sabor y la espuma del café es sencillamente espectacular... Buenísima comora",FRAN R.,Revisado en España el 16 de julio de 2022
ocupa poco sitio,"5,0 de 5 estrellas",ocupa poco sitio y el café lo saca bueno y buena espuma,Ismael,Revisado en España el 24 de junio de 2022
Es comoda de utilizar,"5,0 de 5 estrellas",Me encanta esta cafetera por todo comoda y fácil de usar,Escorpión,Revisado en España el 12 de junio de 2022
Así da gusto desayunar,"5,0 de 5 estrellas",En serio que da gusto desayunar con esta cafetera qie sin ser carisima cumple genial,Wismi,Revisado en España el 28 de mayo de 2022
Justo lo que buscaba,"5,0 de 5 estrellas",Es perfecta en tamaño y funcionamiento,Diego,Revisado en España el 26 de mayo de 2022
Muy mala calidad del pastico,"3,0 de 5 estrellas","Este modelo es de los peores ya que la tapa que aprieta la cápsula es muy frágil, incómoda y si no le prestas mucha atención puedes romper la tapa o desperdiciar una cápsula.

-Muy mala la verdad, no la recomiendo para nada.",Nastasia,Revisado en España el 18 de mayo de 2022
Muy fácil usar,"5,0 de 5 estrellas",Buena cafetera para mi y a buen precio,DONDO,Revisado en España el 16 de mayo de 2022
Blanca,"5,0 de 5 estrellas","Es blanca y súper bonita , lo único que las cápsulas son algo caras por buscarle algún pero ..",Juan,Revisado en España el 8 de mayo de 2022
"Mala nooooo, lo siguiente...","1,0 de 5 estrellas","la compré en diciembre 2021 y,a los 3 meses...(habré puesto unas 18 cápsulas) ya no las lee, además, pierde agua. Menos mal que soy ingenioso y toda la que pierde la uso para el WC...jajaja. Por otra parte, no veo ninguna opción donde reparar...ya que está en garantía, por ley.",V&S,Revisado en España el 6 de mayo de 2022
Es pequeña,"5,0 de 5 estrellas","Va muy bien,pones la cápsula y te olvidas y salen muy caliente los cafés.. ideal para invierno!!",Sergio,Revisado en España el 1 de mayo de 2022
Mi humilde opinión,"4,0 de 5 estrellas","Comprada en agosto de 2020 y tras usarla a diario (1 café por día) no ha llegado a durar 2 años. Apenas la devolví este pasado viernes y hoy me llega la de repuesto, ya que aún estaba en garantía.

El café sabe muy bien, siempre utilizo marcilla, y el modelo de café largo es genial para los cafeteros como yo. En tema sabor, espacio, ruido y facilidad le doy 5 estrellas, puesto que cumple perfectamente sus funciones.

Lo malo: Difícil de limpiar. Hay algunas veces (Me habrá pasado como 5 veces en 2 años) la cápsula no cierra bien, y se esparce el café por todos los lados. Quedan granitos de café por toda la zona de la cápsula que es super complicado de limpiar, por el surtidor, etc... Punto negativo.

Otro punto negativo es 'el porqué' se ha roto. Básicamente empezó a perder agua. Parece que el depósito no paraba de sacar agua y se inundaba todo el mármol de la cocina.

Para mi sería un 3,5 sobre 5. Puesto que es una máquina que sirve para el día a día, pero tiene algunas pegas que se podrían mejorar. Por el precio, nada mal.",Hector,Revisado en España el 25 de abril de 2022
"En menos de 4 meses, estropeada...","1,0 de 5 estrellas","En menos de 4 meses, una de cada 3 capsulas se procesa mal y genera una fuga de café que mancha toda la maquina y toda la mesa...No veo ninguna opción disponible para reparaciones ni cobertura de garantía.",Tomàs,Revisado en España el 16 de abril de 2022
Excelente!!,"5,0 de 5 estrellas","Fue un regalo de Navidad
Les gustó mucho, pero con el tiempo se dan cuenta, que para esta cafetera, no hay marcas blancas",veronica,Revisado en España el 13 de abril de 2022
Extraordinario,"5,0 de 5 estrellas","Espectacular! Cubrió todas mis expectativas y más, no pude elegir mejor!",Luisana,Revisado en España el 6 de abril de 2022
Buena compra,"5,0 de 5 estrellas",Todo genial. Lo único que no me gusta es que con el café largo saca demasiada agua y por eso el sabor no es tan bueno como con el café corto. Pero estamos muy contentos.,Cliente Amazon,Revisado en España el 3 de abril de 2022
Cómoda y el café muy rico,"5,0 de 5 estrellas",Funciona muy bien,raul,Revisado en España el 21 de marzo de 2022
Fácil y rápido,"5,0 de 5 estrellas","Variedad de bebidas en unos instantes.
Lo mejor la variedad, rapidez y facilidad de hacerlo con solo meter una cápsula y apretar un botón.
Lo peor que solo funciona con las cápsulas originales con su código que trae cada cápsula. No es que quiera ponerle de otra marca sino que son muy dificiles de encontrar en los supermercados. La opción más fácil es comprar las cápsulas por Amazon o en la web de la marca. Pero contenta con el precio que la adquirí.",Manolimo,Revisado en España el 8 de marzo de 2022
Se me ha estropeado en pocos meses y no consigo que me la cambien.,"1,0 de 5 estrellas",No la compren,Pedro López,Revisado en España el 7 de marzo de 2022
Creo que hay mejores opciones.,"4,0 de 5 estrellas","Estéticamente es bonita y de uso fácil pero en cuanto a la calidad y el sabor se sus cápsulas no es nada buena. Sería excelente que usará otras marcas de cápsulas,que seguro tendrán un mejor sabor.",Lilua,Revisado en España el 3 de marzo de 2022
La mejor cafetera de cápsulas,"5,0 de 5 estrellas","Me decidí por comprar esta cafetera porque me la recomendó un amigo, es verdad que las cápsulas son algo más caras que las de la competencia pero la calidad de esta es mucho mejor, tanto en sabor como en aroma no tienen nada que ver, la compré por Amazon porque tenía mejor precio que en ninguna otra tienda y el envío fue rapidísimo.",Selena,Revisado en España el 27 de febrero de 2022
Es rápida,"3,0 de 5 estrellas",Lo que no me gusta es que no hay en todas las grandes superficies cápsulas o si las hay poca variedad,M.Carmen,Revisado en España el 25 de febrero de 2022
Buenísima,"4,0 de 5 estrellas",Fabulosa. Desde que la tengo no he dejado de usarla. Compro cápsulas café con leche. No le doy cinco estrellas ya que las cápsulas son un poco caras y solo las hay de Tassimo.,amcap,Revisado en España el 12 de febrero de 2022
Se estropeó en 3 meses,"2,0 de 5 estrellas","Parecía buena, pero en 3 meses se estropeó. Empezó a echar agua por todas partes",Lys,Revisado en España el 10 de febrero de 2022
"Máquina barata, café rápido pero costoso","4,0 de 5 estrellas","POSITIVO: para hacer café de vez en cuando es ideal. Calienta muy rápido, hay cápsulas de la marca en casi cualquier supermercado y varias opciones (no demasiadas). Es muy barata y salvo alguna vez que la cápsula no se ajusto bien y derramó café, me está funcionando bien y llevo ya muchos usos. Con el lector de código de barras lee cada capsula y aplica el agua en función de la cápsula (café largo, cortado, etc..)

NEGATIVO: el gasto en cápsulas, generar mucho plástico por dosis de café. Opciones limitadas. Depósito algo pequeño. No es para alguien que adore el café y beba diariamente mucho. Hay que comprar cápsulas de la propia marca (lleva un lector de código de barras para preparar el tipo de bebida que sea).

CONCLUSIÓN: no recomendada para uso frecuente por el gasto en cápsulas al cabo del tiempo y todo el plástico y aluminio que genera. Ideal para ocasiones esporádicas. Su precio es muy económico y es fácil de usar y limpiar.",Cliente Amazon,Revisado en España el 9 de febrero de 2022
La rapidez que actúa.,"4,0 de 5 estrellas",Funcionan muy bien..,José Luis,Revisado en España el 9 de febrero de 2022
Muy bien,"5,0 de 5 estrellas","Va muy bien,el depósito un poco pequeño para mí gusto",Carmen,Revisado en España el 29 de enero de 2022
Buena inversión,"5,0 de 5 estrellas","Play Video
Muy fácil de usar.
Mi mejor inversión.
Cabe destacar que el café queda buenísimo.
Por poner alguna pega el depósito de agua me hubiera gustado mas grande.",Nilka,Revisado en España el 27 de enero de 2022
Encantado,"5,0 de 5 estrellas","Como bien digo de titulo estoy muy contento con la cafetera, si tuviese que poner alguna queja es que no existe leche sin lactosa como pueden tener otras marcas, pero por el resto no tengo ninguna queja",Amazon Customer,Revisado en España el 27 de enero de 2022
Bueno,"5,0 de 5 estrellas",K es muy ligera,Manuel Martínez castillo,Revisado en España el 25 de enero de 2022
La relación calidad -precio,"4,0 de 5 estrellas",Buena relación calidad-precio.,Manuel,Revisado en España el 23 de enero de 2022
Cumple con las expectativas.,"5,0 de 5 estrellas","Fácil de usar, de limpiar y ocupa poco espacio. De momento funciona correctamente. En general, muy bien calidad y precio.",Montserrat,Revisado en España el 23 de enero de 2022
Cafetera mini a precio mini,"5,0 de 5 estrellas","Compré esta cafetera a precio mini (29€) para tenerla para invitados, ya que en mi casa no se toma café. Fue un acierto, no ocupa apenas espacio, las cápsulas son fáciles de encontrar en cualquier súper, y el sabor es insuperable.

Hay que cogerle el tranquillo a colocar la cápsula. Es la única pega que le podría encontrar.",MSL,Revisado en España el 21 de enero de 2022
Excelente,"5,0 de 5 estrellas",Hace tiempo estaba buscando una cafetera así; es genial. La recomiendo 100%,Isabel Cristina Cazorla Larez,Revisado en España el 20 de enero de 2022
Calidad y precio,"5,0 de 5 estrellas",Me gusta lo práctico y rápido de la cafetera,Gustavo J.,Revisado en España el 16 de enero de 2022
Contentos,"5,0 de 5 estrellas","Es una máquina más pequeña que el modelo antiguo, por lo que permite tener más espacio en la encimera, a cambio, tiene menos depósito de agua. No tienes que encender la máquina cada vez que la usas, se enciende sola y el cajón del nivel de la taza es más sencillo.",Rocio,Revisado en España el 14 de enero de 2022
Manejo sencillo,"5,0 de 5 estrellas",Rápida respuesta a la puesta en marcha,Marinacm,Revisado en España el 13 de enero de 2022
Buena cafetera y pequeño tamaño,"5,0 de 5 estrellas","Funciona muy bien, ya tenían mis padres esta cafetera y ahora la hemos comprado nosotros.
Comprando las cápsulas con subscripción periódica sale bastante bien de precio.
La recomiendo.",Estefanía Samaniego,Revisado en España el 13 de enero de 2022
Una cafetera muy recomendable,"5,0 de 5 estrellas","La llevamos usando unas semanas y todo sin problema, el sistema esta muy bien y se puede comprar cafes en prácticamente todos los supermercados, de momento un 10",Ragnarok,Revisado en España el 12 de enero de 2022
Excelente compra!,"5,0 de 5 estrellas","Excelente compra! Muy buena relación calidad/precio. Fácil de usar, limpia. El café sale buenísimo.",Cliente Amazon,Revisado en España el 12 de enero de 2022
Buena cafetera pero cápsulas de plástico,"4,0 de 5 estrellas","Todo positivo, pero las cápsulas sólo pueden ser de la marca Tassimo, y son de plástico, lamentablemente. El fabricante debería plantearse la opción del aluminio, entre otras cosas porque la Unión Europea va a prohibir las cápsulas de plástico.",Louise,Revisado en España el 12 de enero de 2022
Es súper cómoda de utilizar...solo hay que estar pendiente de que tenga agua por que ella sola.,"5,0 de 5 estrellas",Fácil manejo lo hace todo,Cliente Amazon,Revisado en España el 11 de enero de 2022
Estupendo,"5,0 de 5 estrellas","Llegó súper rápido y la cafetera va genial
Además la registras y te dan 20€ de descuento en la web de tassimo
No se puede pedir más a ese módico precio",raquel,Revisado en España el 10 de enero de 2022
Sabor,"5,0 de 5 estrellas","Al principio me costó un poco ponerla a funcionar, porque hay qe bajar hasta el fondo el soporte de la capsula, y en un principio me daba miedo empujar más, hasta tal punto que pensé que estaba rota, error mio. Me parece un aparato muy compacto de fácil uso y muy cómodo. El café es excelente y más, teniendo en cuenta que las únicas capsulas que puedes encontrar en el mercado son las originales, que por otra parte hay en cualquier sitio. Prefiero un aparato original en todos los sentidos. Lo recomiendo",Eugenio Pastrana Carvajal,Revisado en España el 8 de enero de 2022
Es Bosch....,"5,0 de 5 estrellas","La he comprado por 29€. Empecemos por ahí. Pillé una super oferta en Amazon. Funciona perfectamente, la puede manejar hasta un mono y el sabor es muy bueno, claro que depende del tipo café y marca que se elija. Una pena que Mercadona no haga cápsulas Hacendado para Tassimo. Cómprala con los ojos cerrados.",Adrian,Revisado en España el 4 de enero de 2022
SABE FATAL,"1,0 de 5 estrellas",Las cápsulas saben fatal.,Antonio CE,Revisado en España el 4 de enero de 2022
Mala compra,"2,0 de 5 estrellas","No es mala cafetera de cápsulas, pero solo un par de marcas que tienen capsulas, por eso su precio...",Vicente,Revisado en España el 2 de enero de 2022
Barata y bonita pero sin cápsulas compatibles.,"3,0 de 5 estrellas",La máquina es bonita y barata pero solo existen cápsulas de marca y no compatibles. Además está muy limitado en café con leche y el sabor es como aguado. No nos ha gustado.,Javier T. S.,Revisado en España el 1 de enero de 2022
Perfecto,"5,0 de 5 estrellas",Buena relación calidad precio,Yla,Revisado en España el 1 de enero de 2022
Compacta y algo diferente a otras marcas,"4,0 de 5 estrellas",Por ahora le he usado pocas veces y al principio es un poco diferente comparado con otras marcas pero tiene buen sabor. Una vez que te lees las instrucciones ya es todo mas fluido y además bastante compacta ideal para cocinas pequeñas o con poco espacio.,DRG,Revisado en España el 29 de diciembre de 2021
"Buena, bonita y barata","5,0 de 5 estrellas","Una de las mejores compras que he hecho. Es pequeñita y muy bonita, además funciona fenomenal a muy buen precio",NMc,Revisado en España el 29 de diciembre de 2021
Me encanta,"5,0 de 5 estrellas","Fácil de usar, con mi café sabe genial, limpia, relación calidad precio muy muy buena, recomiendo mucho su compra",Laura,Revisado en España el 29 de diciembre de 2021
BUEN PRODUCTO,"5,0 de 5 estrellas","La cafetera funciona perfectamente, y la verdad con un precio muy adsequible",FRANCISCO DELGADO,Revisado en España el 29 de diciembre de 2021
GENIAL,"5,0 de 5 estrellas","Calidad increíble, ya la tuve y vuelvo a comprarla, el sabor del café es muy bueno y no tiene nada que envidiar a la otras cafeteras de capsulas.",F.J.I.G,Revisado en España el 26 de diciembre de 2021
Excelente,"5,0 de 5 estrellas","Está muy bien x el precio que tiene ,hace muy bien los cortados ,de buen tamaño y no aguados,para mí lo único malo es el precio de las cápsulas",jose,Revisado en España el 24 de diciembre de 2021
Que el producto cumpla con las expectativas esperadas por el cliente,"5,0 de 5 estrellas","Me ha gustado todo de la cafetera, sobretodo su tamaño, no ocupa mucho espacio en la encimera y es muy fácil de usar",José Alba,Revisado en España el 23 de diciembre de 2021
Buena maquina en general,"4,0 de 5 estrellas",El único pero es que el café con leche de tassimo deja mucho que desear,alejandro,Revisado en España el 18 de diciembre de 2021
Su simpleza.,"5,0 de 5 estrellas","Todo,como me esperaba,por calidad precio.",SHIVADHARMA,Revisado en España el 15 de diciembre de 2021
Facil de Usar,"5,0 de 5 estrellas",Falta mas productos descafeinados,Eugeni,Revisado en España el 11 de diciembre de 2021
Perfecta,"4,0 de 5 estrellas",La relacion calidad-precio es perfecta. Las capsulas de cortado son las mejores. La única pega es que no he encontrado un café expresso de mi gusto,Pako,Revisado en España el 11 de diciembre de 2021
Cafetera perfecta,"5,0 de 5 estrellas",Regalo de Reyes👑,Juan E.,Revisado en España el 9 de diciembre de 2021
Sencillez y eficiencia.,"5,0 de 5 estrellas","La compré para reemplazar otra de la misma marca pero de un modelo superior, pero está cumpliendo como una campeona.",Isidro Navares.,Revisado en España el 5 de diciembre de 2021
Me gusta,"5,0 de 5 estrellas","Hay esto debajo de la máquina, y saldrá agua caliente si la colocas. ¡Impresionante!",elena,Revisado en España el 4 de diciembre de 2021
MAS QUE UNA CAFETERA,"5,0 de 5 estrellas","He tenido la oportunidad de probar la cafetera VIVY2 gracias a TRND, y sinceramente ya simplemente al sacarla de la caja me enamore de ella, es compacta y de tamaño pequeño con un color rojo intenso, por su tamaño no ocupa casi sitio y la puedes poner en cualquier rinconcito. El sistema de autolimpieza al terminar de preparar cada bebida es una maravilla pues asi no se mezclan sabores. El sistema INTELLIBREW que lee los Nde barras d cada T DISC hace que la bebida quede en su punto. Es muy facil de usar tu insertas el T DISC de lo que te apetezca tomar en ese momento por ejemplo cafe con leche, la maquina al leer el codigo de barras ya sabe la cantidad de agua que debe añadir y calienta el agua a la temperatura idonea. Yo solo tengo que pulsar un boton y listo, el resto es automatico. Ademas tiene un sistema de ahorro de energia que hace que la cafetera se apague sola y se ponga en funcionamiento cuando le volvamos a insertar otra capsula. Hace un poco de ruido al leer el codigo de barras pero casi nada y al expulsar el vapor para la utolimpieza. Tiene muchas variedades de bebidas para preparar, cafe solo, cortado, cafe americano, cafe con leche, capuchino, chocolate, tes.... ademas con el disco amarillo que trae en un lateral en la base nos sale agua caliente con lo cual puedes preparar toda clase de infusiones. Diferentes marcas de cafe y de intensidades. Los cafes salen muy ricos en su justa medida no salen aguados, el chocolate a mis niños les encanta. Yo la recomiendo al 100% es mas tengo otra maquina de capsulas y no tiene ni punto de comparacion (ya la he guardado). El precio de los paquetes de capsulas estan bien de precio y eso tambien es importante porque a mi los de la que tenian me salian mas caros. Por lo de pronto ya os he pedido otra para una amiga",PILAR MENDEZ,Revisado en España el 1 de mayo de 2018
