title,rating,body,author,date
Buena cafetera de tamaño reducido,"5,0 de 5 estrellas","La cafetera en sí es muy elegante, de tamaño reducido comparada con las anteriores y de un funcionamiento más refinado (en mi opinión) que los anteriores modelos. La hemos cambiado al parecernos que al antigua no tenia un funcionamiento muy correcto y hemos acertado. Hace un café muy bueno, bastante mejor que Dolce Gusto por ejemplo a mi padecer, y funciona de maravilla. El deposito es un poco pequeño, pero suficiente para hacer unos 7/8 cafés expreso (80ml). Si quieres bebidas largas toca rellenar más, pero es tan sencilla de rellenar al tener el deposito lateral que no molesta gran cosa. En definitiva, por 35 euros una buena compra.",Jose Antonio,Revisado en España el 6 de mayo de 2018
Compacta y fácil.,"5,0 de 5 estrellas","Una cafetera ideal para pisos pequeños, aún así su depósito permite hacer bastantes bebidas antes de reponer el agua. La compré a 21€ y ha sido un chollo. Los T-Disc suelen costar algo más que otras cápsulas, pero Tassimo suele enviar vales dentro de las máquinas para utilizar en las primeras compras. Al ser inteligente la máquina echa el agua justa que necesita cada bebida y no hace falta preocuparse por la cantidad de agua. Plataforma del vaso es ajustable en altura.",CR,Revisado en España el 10 de julio de 2020
Genial,"5,0 de 5 estrellas","Llevaba usando este modelo de cafetera pero la versión 1 alrededor de 5 años.
Ya tocaba cambiarla y por el precio que se encuentra en amazon es un regalo. En cualquier gran superficie lo encuentras por el triple excepto en ofertas puntuales. La cafetera es muy fácil de usar y de limpiar. Lo único que no me ha gustado es que el cable de corriente es un poco más corto que el de la versión 1. El café que hace es bueno.
La única pega es el precio de las cápsulas Tassimo ya que no se pueden comprar de marca blanca. pero aun así es una compra muy recomendable.",bull,Revisado en España el 27 de noviembre de 2018
"Una observación, tonta","5,0 de 5 estrellas","Una cosa curiosa, que me ocurrió, es que cuando la encendí.. no era capaz de que hiciera café, pues la tontería más grande, era que debes de encender (dal al botón) con la cafeta abierta, y una vez que esté la luz ámbar cerrar con el cartucho para que pueda leer la cantidad de agua. Llevo unos meses, y me parece fantástica la compra.",Lorena,Revisado en España el 14 de enero de 2021
Hace bien su función,"4,0 de 5 estrellas","Es buena cafetera, que sea automática me gusta y lo de poder poner dos cafés a la vez también, lo que menos me ha gustado es la poca capacidad del depósito... por lo demás, hace bien su función",Grupo O.,Revisado en España el 5 de noviembre de 2020
BUENA CAFETERA PERSONAL !!!,"4,0 de 5 estrellas","Esta cafetera era para reponer una anterior que ya teníamos, que tenía un problema de descalcificación. Pero repetimos, ya que el producto es muy adecuado.",JOSE MARIA PLANAS GIFREU,Revisado en España el 2 de mayo de 2021
"buena, barata pero poco ecológica y demasiado automatizada","4,0 de 5 estrellas","La cafetera es buena. Funciona correctamente, pero no me convence ni el exagerado automatismo con su lector de códico de barras para dosificar el agua, ni el sistema Tassimo en general.
¡Mucho plástico y poco café!
¡Esto no es ecológico!",Jorge Ganzúa,Revisado en España el 21 de octubre de 2020
Regular,"4,0 de 5 estrellas","El sabor esta mas o menos bien.
Pero el golpe de vapor que suelta al inicio, ni me gusta ni lo veo seguro",Mª Angeles,Revisado en España el 13 de mayo de 2021
Está regu-bien...,"3,0 de 5 estrellas","La cafetera está bien, aunque hay varias cosas que no me agrandan
1- no viene con caja de amazon, viene con la propia caja de la cafetera y sellada para cerrala con el precinto amazon, por debajo de la caja no llega la caja cerrada del todo..se ve lo de dentro.
2-las instrucciones no las entiende ni dios...tuve que recurrir a youtube, porque al ponerla en marcha hay que poner una cosa amarilla que viene con la cafetera que no se ni para que sirve.
3-bastante ruido
4- este punto es el que menos me gusta de todos....si cojo la cafetera el agua que hay en el deposito se sale....no entiendo porque, he tenido la cafetera dolche gusto y no se me ha salido nunca el agua....",Jennyfer A.,Revisado en España el 15 de noviembre de 2017
IDEAL,"5,0 de 5 estrellas","Esta cafetera es ideal, ya tengo una Nespresso y probé una Dolce Gusto para el despacho (desastrosa).
La Tassimo calidad precio es buenísima, fácil de usar, límpia, cómoda , asequible, las cápsulas de café que he probado, tienen un aroma y sabor que poco tienen a envidiar a las capsulas de Nespresso. Conclusión; Estoy muy feliz con mi Bosch Vivy 2 :) Ah! Se me olvidaba... ES SILENCIOSA (comparando con la Nespresso)",Sia,Revisado en España el 13 de junio de 2020
"Buen precio, buen café","4,0 de 5 estrellas","La cafetera es fácil de usar y dicen que el café está bastante bueno
Las cápsulas son un poco más caras que otras marcas y no tiene marcas blancas pero como yo lo uso de manera esporádica no me importa",Sandra,Revisado en España el 21 de agosto de 2020
"Cafetera bonita, barata y de calidad","5,0 de 5 estrellas","Venía de una Dolce Gusto, y tengo que decir que esta me ha gustado más. El café Marcilla está muy bueno. Yo diría que es menos ruidosa que la DG, y además las cápsulas, una vez utilizadas, no gotean nada, a diferencia de las DG, que no había dónde meterlas. Para colmo las cápsulas DG abultan el doble que estas. La cafetera es automática, se para sola. El precio de las cápsulas es similar a DG, pero si comprando en Amazon mediante suscripción hay buenos descuentos. Estoy contento con el cambio.",Eduardo Uribe Mendieta,Revisado en España el 15 de agosto de 2018
CONTENTOS CON EL RESULTADO,"4,0 de 5 estrellas","Es una buena cafetera por el precio que tiene funciona bien y rápido, si le pongo alguna pega por poner alguna es que no hay capsulas de marca blanca, tiene que ser tassimo, pero bueno hay una gran variedad",ANNA PUJOLAR,Revisado en España el 21 de agosto de 2020
Un regalo estupendo,"5,0 de 5 estrellas","Tengo una y esta era para regalo... Estupenda. Me gusta que es compacta, elegante y sin tonterias. Robusta y bien acabada otra ventaja es poder encontrar mas variedad que en otras los sabores... De echo el de bailey me encantó. Me gusta que siempre haga la misma mezcla exacta del agua, porque siempre sale igual el café o Milka en mi casa. El no poder elegir exactamente ,lo largo corto de su dosificación, puede ser bueno para algunos y no agradar a otros... Yo prefiero tomarlo siempre con el mismo sabor.",Nayara,Revisado en España el 5 de julio de 2018
Cumple su función,"5,0 de 5 estrellas","Quería una cafeteraa estilo a estas y no dude en comprarla.
Me está yendo muy bien
Tema de cápsulas tiene que ser la marca Tassimo si no es esa marca no funciona.
Porque probé con otras marcas y no me funcionan.
En la caja te pone con qué marcas trabaja y cuáles serían las que se deben de usar.

He hecho buena compra ya que estoy contenta con la cafetera",Cliente Amazon,Revisado en España el 31 de marzo de 2020
Buena relación/precio,"5,0 de 5 estrellas","Para lo barata que es, hace unos cafés buenísimos desde el primero. Lo pones que se lea el código de barras y te olvidas, se apaga sola y cuando pones la capsula nueva se pone en marcha. Yo uso café Marcilla y para mi perfecto, hace 1 mes que lo tengo y mi familia esta encantada. lo recomiendo 100%.",Miguel,Revisado en España el 24 de enero de 2021
Bien.,"4,0 de 5 estrellas","Buena cafetera, lo malo son las cápsulas , son las más caras, hasta 5€, pero bueno, el café está más rico y son cafés más largos que la diócesis gusto, sale más producto sin aguar el resultado, en la dolce gusto , como te descuides, te haces un agua chirri en un momento. Contenta, era para un regalo, al receptor le ha encantado!",Rocío Gonza-Loz,Revisado en España el 16 de enero de 2019
Maquina barata,"4,0 de 5 estrellas","Me gusta mucho los cafes de esta maquina, pero estan muy caros. Para lo poco que vale la maquina, las capsulas estan super caras y pocas capsulas. Mas vale comprar una nespresso y poder comprar las capsulas conpatibles con la maquina. Para la tassisimo solo vale los cafe de la marca.",Deus Larisa,Revisado en España el 25 de febrero de 2019
Excelente cafetera para uso ocasional,"5,0 de 5 estrellas","Soy muy tradicional y prefiero mis cafés hechos en microondas y con solubles no obstante he de decir que la cafetera por su precio y su fácil uso es perfecta para tener a mano para usos ocasionales. Si recibes visitas inesperadas, si de repente tienes un antojo de un café de especialidad pues para eso viene perfecta.

En casa nos vendrá bien e iremos probando poco a poco las diferentes variedades y combinaciones de cápsulas que ofrece Tassimo. Ah!, es muy fácil de montar, usar y de limpiar.",Ray Cubías,Revisado en España el 24 de noviembre de 2018
Esta genial por precio y calidad,"5,0 de 5 estrellas","Estoy encantada !!! Funciona de maravilla, sin ruido, café delicioso mejor de lejos que a Nespresso! Merece a pena de verdad por el precio de las cápsulas y de la máquina. Las cápsulas compré en Carrefour que son más económicas, me salen como 28 céntimos cada cápsula. La máquina tiene un lector de código de barras que no te permitirá comprar cápsulas “genéricas” solamente de Tassimo pero eso está bien por la calidad del café y la cantidad de sabores.",Iara S.Pavan,Revisado en España el 8 de abril de 2019
Funciona y es rápido,"4,0 de 5 estrellas","Funciona bien aunque un dia dio error pero al desconectar y enchufar se arreglo.
Donde vivo no encuentro los tes...solo uso para cafe.",Lola,Revisado en España el 1 de noviembre de 2020
"Compacta, silenciosa y rápida","4,0 de 5 estrellas","Tengo que usarla más tiempo para quizás cambiar mi puntuación en el futuro. De momento sólo lo he usado una vez. Es rápida, no hace ruido apenas, es muy compacta y muy mona. Me llegó muy rápido. En cuanto al café sólo he probado el negro 100%colombiano y me parece muy aguado... Lo dicho, probaré otras versiones.",Ruth,Revisado en España el 8 de octubre de 2019
Su sabor,"4,0 de 5 estrellas",tiene un buen sabor,Cliente Amazon,Revisado en España el 2 de diciembre de 2021
Muy bien,"5,0 de 5 estrellas","Cumple su función perfectamente. Es fácil de usar y de limpiar. El contenedor de agua tiene un buen tamaño también, alcanza para varios cafes. Las cápsulas, yo tengo las de café largo y sirven pra dos tiradas perfectamente. Muy contenta con la comprar",Paola,Revisado en España el 1 de mayo de 2021
Un completo fiasco,"1,0 de 5 estrellas","Buenas, mi experiencia va un poco condicionada con la experiencia que tenia de la marca dolce gusto...

Compré esta porque estaba muy muy barata, y las capsulas son más o menos igual de caras que las de la competencia asi que...

Total, que esta máquina estropea una 1 de cada 5 capsulas. La pones, le das al boton y se pone en rojo. Pones otra, y funciona... Pero si pruebas a usar la que ha agujereado pero no usado, no funciona... Pésimo.

Total, que los 25€ que pagué por ella, con todos los cafés que he perdido (tomo bastante) ya me ha salido por alrededor de unos 60€... Otro día compro otra marca...

Mi consejo es que gastéis algo más en otra marca que después lo agradecerá vuestro bolsillo.

PD: No la devuelvo porque tiré la caja.",Xavi,Revisado en España el 31 de agosto de 2020
no compreis esto a no ser que querais tener mil problemas con amazon.,"1,0 de 5 estrellas","Te dan 7 codigos de 5€ (no acumulables), así que tienes que hacer pedidos individuales y se aplica el descuento en cada uno.
Vamos, que te descuentan 5€ las supuestas 7 veces siguientes que pidas esos tipos de cafe.

Y digo supuestamente porque, de los 7 codigos, solo me ha salido como no utilizado 1 de ellos.
Tampoco he podido elegir el descafeinado que aparece como sí incluido en la promoción...

No sale a cuenta.

Al final después de pelearme seis veces con amazon devuelvo el producto pues no me dan solución a este problema...

La primera vez que tengo que devolver un producto xq amazon no cumple su promesa.

MENUDA DECEPCIÓN CON AMAZON Y CON TASSIMO",Charly,Revisado en España el 7 de julio de 2018
Fácil,"1,0 de 5 estrellas","Doy mi opinión sobre el aparato, a la cafetera dedico las cinco estrellas. Si tuviera que valorar el envío, no le doy ni una. ¿ que es eso de enviarla en su caja original y encima abierta?... falta total de profesionalidad.
La cafetera está muy bien, pequeña y muy sencilla de usar. El sabor de los cafés; algunos están buenos y otros no tanto, eso ya es cuestión de gustos. El expreso sabe de maravilla",Kadra,Revisado en España el 26 de noviembre de 2021
Decepción,"1,0 de 5 estrellas","Ha durado unos meses, la compramos para una empresa pequeña y claro, aprovechamos para pedir directamente a la web de fabricante cápsulas más “exoticas“ de lo que sueles encontrar en los supermercados y por aprovechar un vale descuento... no hemos llegado a acabar esas cápsulas y se ha estropeado, pones la cápsulas y no la lee... entonces claro, tienes que tirarla y probar con otra porque si se te ocurre poner de nuevo una cápsula abierta y funciona por casualidad pues se derrama el café/te por todos los huecos de la máquina.... ya estamos mirando nespressos, saludos",Miguel,Revisado en España el 26 de marzo de 2019
No compensa,"1,0 de 5 estrellas","Me ha defraudado mucho. El precio de la cafetera es muy competitivo, la cafetera en si está muy bien, ahora, las cápsulas son muy caras. En mi caso no compensa
Además te “regalan” un cupón de 20 euros (10 en primera compra y 10 en segunda) pero solo en compras online y con el añadido que en mi caso que vivo en Mallorca, aunque los gastos de envío me salen gratis, me cobran 15 euros de recargo por vivir en zona remota!! Esto aplica a todas las baleares
Estos detalles son los que ha hecho que devuelva la cafetera. No compensa",Tina,Revisado en España el 1 de junio de 2018
FALLO AL SEGUNDO MES,"1,0 de 5 estrellas","Des de el segundo mes de la compra dejó de funcionar, siempre con una luz roja permanente encendida.
Descalcificación echa tras una semana de la compra y la tengo guardada en la caja habiéndola usado solo 4-5 veces y sin recibir una solución por parte de esta empresa, ni me han facilitado un técnico ni reembolsado el dinero ni cambio por una nueva.
Nunca más pienso comprar ni este producto ni menos a esta empresa.",Miquel,Revisado en España el 12 de enero de 2021
Producto negativo,"1,0 de 5 estrellas","Desde el principio de comprarla, sale muy poco café, hace pocos días que la estamos utilizando y sale menos café todavía, no se pueden hacer cafés largos, pues no llega ni a llenar una taza pequeña, ni da la opción, de darle al botón para repetir la función con la misma cápsula. Tengo q poner 2 para hacer un café regular. No la recomiendo para nada. Hay veces q le das al botón para q salga el café y no funciona. Ya escribí al fabricante y no se dignan a contestar",PAT,Revisado en España el 17 de octubre de 2018
Decepcionada,"1,0 de 5 estrellas","La cagetera viene con unas instrucciones pésimas, sale muy poco café tienes que ooner dos capsulas para tener un cafe decente. Se encienden los pilotos rojos y no sabes porque, en el manual de instruciones no ecploca nada. Nos volvimos locos para arreglarlo. La compré en abril y hoy ha dejado de funcionar se ha abierto una capsula dentro y se ha ensuciado toda la cafetera. Voy a llamar a Amazón porque quizás esta unidad vino defectuosa porque no entiendo sino los comentarios tan buenos que tiene.",Cliente Amazon,Revisado en España el 1 de enero de 2019
Cafetera defectuosa,"1,0 de 5 estrellas","Compre las dos cafeteras una por error y la otra para uso, al usar la cafetera se salio toda el agua y el cafe; o sea que esta defectuosa;voy a Correos ya que vosotros me las enviasteis por ese medio y me dicen en Correos que tengo que pagar el importe completo de lo que pesen los dos paquetes que son bastante grandes y me sale muy caro. Les ruego me solucionen este problema. En espera de sus noticias. Reciban un saludo.",Mª. ANGELES GLEZ. DE ARA,Revisado en España el 12 de agosto de 2018
Decepcionante,"1,0 de 5 estrellas","La cafetera no es cómoda de usar, muchas veces da un error al colocar la segunda capsula para la segunda taza de café y no hay manera corregirlo. El sabor nos decepciono. Buscaremos una cafetera de otra marca.",Cliente Amazon,Revisado en España el 28 de junio de 2021
ENGAÑO,"1,0 de 5 estrellas","Le doy una sola estrella no por el producto, que sé que es bueno porque ya tengo otra igual, sino porque me siento engañada. Compre esta segunda máquina por la promoción de 7 códigos de5€ que regalaban para usar en cápsulas. No he podido canjear más que uno. El resto quería ir canjeándolos cada semana con la compra de más cápsulas y no me deja. El problema es que aún estoy esperando respuesta al correo que les escribí. Si no lo recibo la devolveré.",Rosana,Revisado en España el 5 de julio de 2018
"Hasta ahora encantada con Amazon, pero este problema me tiene enfadada","1,0 de 5 estrellas","En octubre compre la cafetera bosch , tassimo, tiene muy poco uso, pero ha dejado de funcionar, desde el primer día hace un ruido raro, hoy he estado descalcificandola y sigue mal, . Me podrían responder , gracias",Maria Jesus Sanchez Hernandez,Revisado en España el 18 de marzo de 2021
decepcionada,"1,0 de 5 estrellas","Tenia una Tassimo vieja y me la canvie por esta porque estaba muy contenta con esta cafetera. Pero resulta que esta me esta fallando. No hace la espuma que hacia al principio, el cafe sale con un gusto malo (y he cambiado con varias marcas i nada). Le he hecho varias limpiezas y la he descalificado varias veces tambien y sigue ocurriendo. Que puedo hacer? Nadie me pone solucion, no tengo manera de hacer una reclamacion...",Annuski,Revisado en España el 16 de noviembre de 2018
Mejor gastaste algo más a comprarte está,"1,0 de 5 estrellas",El primer mes muy bien todo cuando van pasando los meses 2 3 meses no llega a más no deja de dar problemas la mitad de las cápsulas las tienes que tirar por qué la máquina no las reconoce y muchas de ellas no puedes usar todo el contenido por qué se quedan dentro de la capsula,jesus G,Revisado en España el 3 de enero de 2020
Calidad no tiene,"1,0 de 5 estrellas",Mucho diseño poca utilidad malisima calidad con dos veces que hagas café largo se estropea ya el agua se estropea empezá a perderla y no haces más que gastar tres o cuatro pastillas de café para poder hacerte uno . Una asquerosidad NO RECOMENDABLE,Enrique,Revisado en España el 3 de septiembre de 2020
Dejo de funcionar en el primer servicio.,"1,0 de 5 estrellas","Creo que esta serie de fabricación de cafeteras puede ser defectuosa, pues la primera que fallo la cambie sin problemas por otra igual y esta segunda tambien fallo con los mismos sintomas que la primera en la primera puesta en uso. Yo desde hace 10 años uso estas Bosch y no he tenido problemas nunca. Por lo que desisti de volver a cambiarla por otra igual.",JUANIN,Revisado en España el 22 de mayo de 2019
Lealtad.,"1,0 de 5 estrellas","Se me ha roto el porta Cápsula, en menos de un mes y me dice pro componentes que me busque la vida con bosh con lo cual no se hacen cargo la devolución, vamos una estafa, no compréis ahi. No se hacen cargo de nada.",Silvia,Revisado en España el 4 de junio de 2020
Falta una pieza,"1,0 de 5 estrellas",Me falta el disco amarillo por lo que no la he podido ni poner en marcha,"Gonzalo Tores Elorza Coach Personal, deportivo y ejecutivo",Revisado en España el 27 de noviembre de 2021
Cafetera y su café muy corrientes,"1,0 de 5 estrellas","Cafetera muy mala, café peor no siempre sale el café correctamente, aparte tiene el inconveniente de que la cápsula de leche no la hay casi en ninguna tienda solo la sirven por Internet no la aconsejo en absoluto ni café ni la máquina",esecaioe,Revisado en España el 26 de junio de 2020
"No recomendable, las cápsulas explotan.","1,0 de 5 estrellas","Tras casi dos años de uso y múltiples explosiones de las cápsulas he de decir que no recomiendo para nada la compra de este producto, mil batallas de limpieza porque las cápsulas explotan aun haciendo mantenimiento casi a diario (con el disco amarillo de limpieza) y la descalcificación cuando toca... Una ruina",Sergio B.,Revisado en España el 13 de diciembre de 2019
LA PEOR CAFETERA,"1,0 de 5 estrellas","NÓ me ha gustado nada; no lee bien los codigos, derrama el cafe en polvo y te lo encuentras flotando en el agua o la leche.son las capsulas mas caras del mercado y para colmo no admite otras marcas, para llegar a hacer un cafe tienes que tirar 3 capsulas. NO LA RECOMIENDO EN ABSOLUTO",Teresa Cabrera Mora,Revisado en España el 26 de septiembre de 2019
TRES CAFETERAS Y NINGUNA FUNCIONA,"1,0 de 5 estrellas","Compré 2, ya que tenía buenas opiniones, una era para mí y otra para regalar.
Devolví una porque no funcionaba, me la descambiaron de momento.
La que me llegó nueva, tampoco funcionaba, la que regalé tampoco.
Pedí la devolución del dinero.
Debo decir que en la gestión no ha habido problemas.
Pero con respecto al producto no puedo dar buena opinión de el.",Eva,Revisado en España el 21 de marzo de 2019
Mal,"1,0 de 5 estrellas","Compre la cafetera por el precio, pero no consigo las cápsulas de café con leche si no es por Amazon. Estoy descontenta, puedo comprar cápsulas de otra marca o de marca Blanca y usarlas como instantáneas, la próxima vez voy a comprar un calentador de agua.",Cliente Amazon,Revisado en España el 17 de febrero de 2020
Sabe aguado. No la recomiendo.,"1,0 de 5 estrellas","Una basura pero bueno para el precio que tiene.... sabe aguado el café y precio de las cápsulas muy caras.
Yo la usó para el trabajo para días puntuales. Se me pasó el plazo de devolución, sino la hubiera devuelto.",Cliente,Revisado en España el 10 de junio de 2020
No la recomiendo,"1,0 de 5 estrellas",No la recomiendo !!! Con pico más de un mes y poco uso ya van dos veces que sake café por todos lados .no me gusta nada .,Alejandro,Revisado en España el 12 de febrero de 2021
Cafetera de cápsulas Tassimo,"1,0 de 5 estrellas","Es una cafetera muy práctica para llevarla de viaje, ya que no es ni muy grande ni muy pequeña. También es muy fácil de usar, solo tienes que poner la cápsula de café y presionar un botón.",Alba,Revisado en España el 1 de agosto de 2020
Disgustada,"1,0 de 5 estrellas","Muy descontenta. No funciona bien, me ha perdido agua en dos ocasiones y hay cápsulas que explotan. Se enciende la luz Roja y es complicado hacerte el café",Mar,Revisado en España el 12 de noviembre de 2020
Mal trato al paquete.,"1,0 de 5 estrellas",La caja venía abierta y es para un regalo lo que da muy mala impresión la cafetera no sé qué tal será pero cruzaré los dedos de que funciones pues el trato que le han dado al paquete no ha sido muy bueno.,Rubentrirunning,Revisado en España el 27 de diciembre de 2019
Mal funcionamiento,"1,0 de 5 estrellas",La he utilizado unas 5/6 veces y ya no funciona. Hace un ruido muy fuerte y los botones no funcionan correctamente. Toda una decepción.,Ana Muñoz,Revisado en España el 28 de enero de 2021
Me salió con fallo,"1,0 de 5 estrellas",Apesar que parecía una buena cafetera a las semana dejo de funcionar no calentaba..,JULISSA,Revisado en España el 21 de julio de 2021
PESIMO,"1,0 de 5 estrellas",En menos de 1 mes se ha roto.,Mercedes Herrera Sánchez,Revisado en España el 26 de noviembre de 2021
Hace mucho ruido,"1,0 de 5 estrellas",Hace mucho ruido y las cápsulas son bastante caras,Cliente Amazon,Revisado en España el 2 de noviembre de 2021
No es muy practica,"1,0 de 5 estrellas",no es muy manejable. Al poco de usar ya pierde agua.,Steve Carreté,Revisado en España el 8 de octubre de 2021
CAFETERA PARA TASSIMO BOSCH,"1,0 de 5 estrellas",Funciona fatal. Se atasca continuamente. Hay días que es imposible conseguir que funcione. Tenemos que apagarlo y dejarlo para otro día. En definitiva un error de compra. Desde luego no lo recomiendo.,Cliente Amazon,Revisado en España el 16 de junio de 2020
SE HA ESTROPEADO EN MENOS DE UN AÑO,"1,0 de 5 estrellas","No funciona bien, ha de de sacar cafes y no lo puedo utilizar",imanol,Revisado en España el 22 de junio de 2021
Llegó en mal estado,"1,0 de 5 estrellas",No la he podido usar ya que el producto llegó roto y en mal estado. La voy a devolver,Isabel MG,Revisado en España el 5 de enero de 2020
Gusto malissimo de la cápsulas,"1,0 de 5 estrellas","Pues la tengo en casa casi nadie toma el café es muy malo , no me gusto para nada . Lastima que he tirado el dinero . Dolce gusto era mejor en precio posibilidad de comprar en todas partes",Cesarina A.,Revisado en España el 29 de octubre de 2019
Decepción,"1,0 de 5 estrellas",No me funciona y las cápsulas son especiales muy desilusionada,🤗,Revisado en España el 9 de mayo de 2021
Mala opción,"1,0 de 5 estrellas",Sólo puedes usar pastillas Tassimo y a mi gusto tienen poca variedad. No puedes modificar a tu gusto la bebida ya que sólo puede prepararla tal cual la pastilla se lo indica. Habría preferido pagar más y tener una máquina con más libertad.,Daniel,Revisado en España el 19 de julio de 2018
Cápsulas carisimas,"1,0 de 5 estrellas","No existen cápsulas de café con leche descafeinado y además no hay compatibles y las que le sirven son muy caras
No merece la pena conprar esta cafetera",Isabel,Revisado en España el 29 de mayo de 2020
