title,rating,body,author,date
"LOVED IT for two months, now it’s DEAD!","1,0 de 5 estrellas","Updated review:
After using this constantly for a few months, it just died. Exactly 70 days after delivery. The Amazon warranty is 60 days. I am trying to get a replacement as it was wonderful while it worked.

Very disappointed.

Previous review:
Amazing! Time saver, so easy and keeps water hot for a while. No more filling tea kettle, waiting (for what seems like forever) for it to boil and rushing over to turn it off. This kettle heats in under 3 minutes to 100 degrees Centigrade (boiling) and then rests at that temperature until you are ready. It’s perfect.",KS,Revisado en los Estados Unidos el 13 de diciembre de 2018
!SAFETY HAZARD!,"1,0 de 5 estrellas","SAFETY HAZARD!

This kettle will overflow and spout boiling water out the top, even when the water level is below the max fill level. Turning the kettle off when this happens is dangerous and I have been burned by the water. It has damaged some countertop items and is incredibly frustrating. This is unacceptable at any price, especially $150. I am demanding a full refund on my unit.",Chadd Bergland,Revisado en los Estados Unidos el 20 de marzo de 2021
The second one broke.,"1,0 de 5 estrellas","Loved everything about it until it stopped working. Thought we maybe had bad luck with a defective one,
so we foolishly bought a second one. It just quit today. Unfortunately we also had encouraged some friends to buy one and their's had stopped. We are now sitting with two very well designed plant watering cans at a cost of over $300.
I highly recommend you stay far away from this product.",Scower,Revisado en los Estados Unidos el 27 de febrero de 2022
Looks cool but beyond that it's a sputtering mess like an old politician.,"1,0 de 5 estrellas","I wish I didn't throw the box away because I would have returned it. It's good looking, I'm a sucker for Red Dot design awards. There are two switches on the back that are flimsy and change without warning. The pot sputters and rattles on without making any sense like Joe Biden. The lid actually hovers around when it's boiling. Water stains galore from the water that comes out of the vent and settles in top of the lid. Makes a mess of the dark countertop too with all the sputtering water.",Chris S,Revisado en los Estados Unidos el 17 de noviembre de 2019
It exploded after 3 months,"1,0 de 5 estrellas","It was good and all when I received it but today I heard it exploded at the bottom. There was smoke coming out from those holes in the bottom and smelled like something burnt. I don't know what it was but the kettle does not heat up anymore. Every time I use it, I always clean it dry using hair dryer leaving not a single stain on it. The display is still working though.

I expect it to work much much longer than this.",N,Revisado en los Estados Unidos el 20 de enero de 2021
Worked great for a couple of months but now something is ...,"1,0 de 5 estrellas","Worked great for a couple of months but now something is going on and the electronics are freaking out. It randomly boils water when the temp was only set to 207, and when it happens the temp jumps all over the place, from 190 > 210 > 190 and keeps going, all while bubbling water all over over the place.

UPDATE: Fellow replaced the kettle immediately with a new one and sent a return label so I could send back old for their engineers to take a look at and figure out what went wrong, thanks!

SECOND UPDATE: Broken again with the same original issue.",B.Dub312,Revisado en los Estados Unidos el 5 de junio de 2018
"Awesome kettle, if you can get it to turn on","1,0 de 5 estrellas","When it works, it’s a great kettle. It heats quickly and maintains the set temperature. Unfortunately, 90% of the time it won’t turn on. It takes several times of unplugging it, plugging it back in and pressing the button to get it to turn on. Turning it off using the button is just as bad. I usually have to unplug it to turn it off.",Amazon Customer,Revisado en los Estados Unidos el 2 de octubre de 2021
Problèmes avec le thermostat,"1,0 de 5 estrellas","Bouilloire reçue le 4 mai de cette année et HS le 7 juin. Dommage pour moi, j’ai dépassé la date de retour ou d’échange de 4 jours. Jusqu’à ce qu’elle tombe en panne, parfaite pour permettre d’avoir la température désirée avec une montée en température progressive et sa fonction garde au chaud bien pratique.
Dommage qu’elle ne tienne pas sur la durée, le thermostat ne fonctionne plus après 1 mois d’utilisation. Donc 1 mois à 159 € c’est hors de prix.",BjDo,Revisado en Francia el 7 de junio de 2022
Dead on arrival,"1,0 de 5 estrellas","I considered getting the extra warranty based on others problems, but had 30 days to do that so figured I'd wait to see if it worked at all. Sure enough it doesn't. Also the water pours out very slowly. The reason I bought a new electric pour over kettle is that my old Bonavita has broken, but having a similar spout I was able to adjust the flow of that more. It could pour at a considerably faster rate than this, or a slower rate just by tilting it.",Lancaster,Revisado en los Estados Unidos el 12 de enero de 2020
Broken after two years,"1,0 de 5 estrellas","After two years of use, the fancy light that tells the temperature and on/off stopped working meaning that the indicator of whether the machine was constantly on or not didn't work. In a home with aged people, this renders this beautiful and highly-engineered product virtually useless. Correspondence with the manufacturer led to a denial of replacement other than a 10% discount on a new machine. Why I would buy a new machine from this company is beyond me.",Miles Wortman,Revisado en los Estados Unidos el 4 de enero de 2021
Tea kettle stops working unexpectedly!,"1,0 de 5 estrellas",This kettle looks awesome but stops working for no reason. I guess the base is faulty because I see a lot of complaints along these lines. Mine died after two years but I had some other issues with it not turning on before then. I contacted the company and they want me to buy another base for $50 and they acted like they were doing me a favor by ‘allowing’ me to buy it. No thanks!,beth MCCONNELL,Revisado en los Estados Unidos el 10 de marzo de 2021
the product is expensive but the QUILITY is so BAD,"1,0 de 5 estrellas","the product is expensive but the QUILITY is so bad. The cover inside is plastic , it's easy to broken to small piece and get in the water for drink , maybe have the plasticizer to injuries the healthy. I do not how to repot to Amazon and claim it .",Profusion Foods Inc.,Revisado en los Estados Unidos el 7 de mayo de 2022
Kettle Dead after 19 Months & No Customer Service,"1,0 de 5 estrellas","The kettle randomly stopped heating water after 19 months. I emailed customer support and they told me nothing can be done so now I just need to throw this into a landfill. No recycling, refurbishing, or repair programs. We cannot allow these new direct-to-consumer retail businesses to harm the environment making products with such short life-cycles and no recycling program. I know it looks nice, but if I could go back I'd save $100 and buy something that'll last longer.",Angela N,Revisado en los Estados Unidos el 16 de julio de 2020
Very not durable kettle,"1,0 de 5 estrellas","Waited the product for 1.5 month after I purchased in amazon.
However, worked great for about 1 month only. Then one day just stopped working and the kettle couldn't heating watering... I saw so many comment with the same issue.
Personally, this is the expensive kettle compare with other brand products with poor quality control. Please consider carefully before you buy it.",Mak Check Hin,Revisado en los Estados Unidos el 11 de julio de 2021
"Defective product, no customer support","1,0 de 5 estrellas","I would strongly advise against buying this tea kettle. I unboxed mine and followed the directions precisely. The lcd showed the desired water temperature, but the base would not heat. I tried plugging it into several different outlets, and carefully reseated the kettle in case that was the problem. Nothing worked. I sent Fellow's customer support more than one email but got no response. Either they don’t support their products sold through Amazon or the small startup company is simply not viable. The kettle is beautiful looking, and I was sad to have to return it.",D. Jacobs,Revisado en los Estados Unidos el 10 de mayo de 2018
Stopped working after 4 months,"1,0 de 5 estrellas","This was the best kettle I've ever owned for about 4 months. It suddenly stopped heating. The temp shows and the ""F"" is flashing as though it's heating, but it doesn't heat any more. I've unplugged, plugged in different outlets, reset everything I know how. I am outside of their tech support by a few weeks. I am hoping someone knows the trick to fix this or the company will stand by their product so I can change my review to 5 stars.",Lucy Matthews,Revisado en los Estados Unidos el 8 de mayo de 2019
Does NOTHING Beautifully,"1,0 de 5 estrellas","This did not work AT ALL. Yes, plugged into a working, double-tested plug. Yes, read all directions, and I am good at that. It flashed “Fellows” when plugged in (again affirming that plug worked), that went away and it made no response at all when I pushed the on button. Several tries. Others have had same complaint. Too bad. It’s really nice looking, lightweight, and supposedly has the features I’m looking for. My stars mean nothing because I could not test it.",Anonymous,Revisado en los Estados Unidos el 24 de febrero de 2019
Stopped Working less than 6 months in,"1,0 de 5 estrellas","This kettle stopped heating less than six months after purchase. The power comes on but nothing happens. Don't buy this kettle. Customer service has been unresponsive. For the money, this product shouldn't fail so quickly.",Amazon Customer,Revisado en los Estados Unidos el 26 de mayo de 2022
"Follow kettle, get one now!!","1,0 de 5 estrellas",This is a nice tea kettle. Too bad it's made like cheap crap. This kettle just stopped working on me for no reason. The electric part is broken. Won't turn on or power up. What an extremely expensive sub par product. I did love this kettle. But for the price and horrible quality control. Look for something else. Too many people have had the same issues. Fellows should stand behind there overpriced products if the want to keep any customers.,Mindful Alchemist,Revisado en los Estados Unidos el 12 de marzo de 2018
Loved this until it stopped working less than a year after purchase,"1,0 de 5 estrellas",Loved this product until it stopped working less than a year after it was purchased. It heats water faster than a stove-top kettle. I love that the interior is stainless steel. I also really like the modern design and think it's beautiful. Don't know what I'm going to do to replace it. Hate to spend so much money on something that doesn't work for very long,Alder,Revisado en los Estados Unidos el 5 de marzo de 2019
Every day i have to unplug it and plug it back in.,"1,0 de 5 estrellas",It takes forever to work in the morning. I have to unplug it and plug it back in all the time and sometimes that doesn’t even work. This is the most dysfunctional kettle I’ve ever had and also the most expensive. If I could give it 0 stars I would.,Afua W.,Revisado en los Estados Unidos el 21 de septiembre de 2021
Broke after three uses.,"1,0 de 5 estrellas","Yes it does look very nice. But after it was used three times, the ""no water"" error appeared (despite the fact that there was plenty of water) and it stopped working. Apparently this is a common problem I love well designed things...but well designed things should work.",moviesandbooks,Revisado en los Estados Unidos el 26 de septiembre de 2020
Not working - no response from Fellow.,"1,0 de 5 estrellas","I've contacted Fellow twice now as our kettle doesn't turn on half the time, then doesn't turn off the other half of the time. Would like a replacement because I think it's just this particular machine - but I can't get a response back! Very frustrated.",DWF,Revisado en los Estados Unidos el 22 de septiembre de 2021
Broken after only 2 years,"1,0 de 5 estrellas","I’ve had this product for 2 years, it started out great but now the hot plate won’t work and the water doesn’t heat. It should have lasted much longer than 2 years, especially for the price!",Amazon Customer,Revisado en los Estados Unidos el 1 de marzo de 2022
Dead on Arrival,"1,0 de 5 estrellas","I received the Fellows stag EKG kettle today. I read the instructions and plugged it in. The Wellcome logo flashed on the LCD screen for a fraction of a second and then went out. As per instructions, I pressed the main ‘on button’ for three seconds and nothing happened. This expensive kettle was dead in the water. I will be returning it.","Jerry E. Rogers, M.D.",Revisado en los Estados Unidos el 17 de febrero de 2019
Stopped working after 5 months,"1,0 de 5 estrellas","Bought this 5 months ago and it has completely broke. It started by saying “no water” instead of heating,l. I had to unplugged and replugged and it worked for a couple weeks. Then it just stopped heating all together. Useless after 5 months!!?!?!!",Jade Abner,Revisado en los Estados Unidos el 3 de abril de 2021
Dangerous product. Regularly boils over.,"1,0 de 5 estrellas",One star for appearance only. Kettle has issues regulating temperature - regularly boils over (yet reads 76 Celsius... huh??). Does not keep temp after it reaches its target temp. I’m very mindful to not overfill this kettle and yet we still have issues. Leaks a lot when you pour from it. Disappointing.,Erin Fromherz,Revisado en los Estados Unidos el 13 de marzo de 2020
A beautiful paperweight,"1,0 de 5 estrellas","So excited to receive this beautiful kettle, but two of us could not get it to switch on. Alas. It is beautiful and utterly useless. Back it goes!",Andre,Revisado en los Estados Unidos el 29 de mayo de 2022
poor quality for the price,"1,0 de 5 estrellas","I was looking forward to using this but I'm pretty disappointed in the quality overall. The materials seem cheaper than I expected for the price point.
The handle and base are plastic and seem poorly assembled, with imperfections. The spout came with a chip and looks like whatever is coating the metal on the inside has peeled away in spots or wasn't finished. I will be returning this item.",Amazon Customer,Revisado en los Estados Unidos el 4 de marzo de 2018
Fails after a couple of months,"1,0 de 5 estrellas","Warning ! Looks amazing and works well - for a little bit. After a couple months started going crazy - boiling water when we set to 92-95 Celsius. Goes into full boiling mode but still says temperature 70-80s

A shame. Nice design, terrible quality control",Marcelo,Revisado en los Estados Unidos el 9 de octubre de 2020
No Customer Support,"1,0 de 5 estrellas","Dead in the water. This product was wonderful up until the point it said there’s “no water” when clearly there’s water. Tried contacting Customer support still waiting on response, Um about a month ago. Warranty? Forget about it. Oh? You won an award? Maybe you can turn that award into support. The product was nice but not nice enough that it’s a ticking time bomb.",Jon,Revisado en los Estados Unidos el 12 de junio de 2018
$80 per year. Bad support.,"1,0 de 5 estrellas",Worked great for two years. Stopped heating. Was told it was out of warranty. Customer support is only part time so waited 3 days to be told only option was $60 replacement part that was out of stock until June.,Samuel Arenson,Revisado en los Estados Unidos el 3 de abril de 2021
6 weeks in - already malfunctioning,"1,0 de 5 estrellas",No longer any power to heat up kettle.,Josh Barber,Revisado en Canadá el 17 de enero de 2021
Fell apart in less than a year,"1,0 de 5 estrellas",I loved this kettle but less than a year after purchase the lid has fallen apart. I feel like the construction of the lid is not up to the quality standards you would expect for the price. Hopefully the seller can reach out to me so that we can remedy the situation and I can improve this review.,cts101,Revisado en los Estados Unidos el 17 de octubre de 2018
Made in China. So disappointing.,"1,0 de 5 estrellas",I spent lots of money on this thinking I was buying a product not manufactured in China. It was made in China. Returned.,Amazon Buyer,Revisado en los Estados Unidos el 11 de mayo de 2022
Not built to last,"1,0 de 5 estrellas","Performed well for a couple of months, and then the thermostat quit working. My wife tried to have company replace, but I think she gave up. I should have believed all the negative reviews. This is not a well built product.",Isaiah 9:2,Revisado en los Estados Unidos el 23 de abril de 2020
Not So Warm For Long,"1,0 de 5 estrellas",I love the aesthetic appeal of this kettle. It worked great for about three months. Now it doesn’t heat to the desired temperature or stay hot. I hope they exchange it and I simply got a dud of a kettle.,Marti H.,Revisado en los Estados Unidos el 20 de agosto de 2020
"Garbage kettle, but it’s pretty. Pretty, pretty garbage.","1,0 de 5 estrellas","Don’t buy this kettle. Worked great for about 2 1/2 months. Then one day just stopped working. Wouldn’t heat water at all. Yes, there’s a warranty, but who wants that hassle less than three months in—especially since this kettle is twice as expensive as other comparable kettles from better manufacturers. Looks great, sorely disappointing.",Suki Weller,Revisado en los Estados Unidos el 13 de mayo de 2018
Quit working in 6 months,"1,0 de 5 estrellas","I bought this item November 21, 2018. Today is May 10, 2019. $150 and the machine has quit heating after 6 months. It is gorgeous and fits the aesthetic of my space perfectly. But what the spent on aesthetic they needed to put into quality control. Such a shame.",elephantparade,Revisado en los Estados Unidos el 10 de mayo de 2019
"Looks good, but doesn't last","1,0 de 5 estrellas","I've had this for 6 months, and one day I go to turn it on and the display is all jacked. Nothing hit it or got it wet..I would expect longer use for the price point.",Bog,Revisado en los Estados Unidos el 14 de octubre de 2020
Inside of Kettle degrades over time,"1,0 de 5 estrellas","I've had this kettle for less than 2 years, and the base of the inside of the kettle is degrading such that it's leaving flakes of metal in my drink. Unsafe for use.",Adam,Revisado en los Estados Unidos el 10 de enero de 2021
DONT BUY!! POOR QUALITY. POOR CUSTOMER SERVICE POOR WARRANTY,"1,0 de 5 estrellas",The kettle stopped working after 18 months. The no water sensor went on and will not hear water. Customer service is email only and non responsive. Warranty only one year and now it’s a pretty black piece of metal.,Objective,Revisado en los Estados Unidos el 29 de abril de 2020
Display stopped working after 2 uses,"1,0 de 5 estrellas",I don’t have anything else to say about this product. Display backlight comes on but doesn’t show anything. I only got two uses out of this with the display working.,David W. Scott,Revisado en los Estados Unidos el 11 de diciembre de 2021
Arrived Nonfunctional,"1,0 de 5 estrellas","Was excited to try this one out, but wanted to leave a review in case helpful for others. Arrived with the infamous ""No Water"" issue. Didn't get a single use out of it. Hope this helps!",AC,Revisado en los Estados Unidos el 29 de julio de 2020
Simply does not work!,"1,0 de 5 estrellas",The kettle simply stopped heating water (stopped working) after a few times of use. Do not waste your money and buy something else.,Vahagn,Revisado en los Estados Unidos el 3 de agosto de 2021
Don't Buy This,"1,0 de 5 estrellas","Don't buy this! The first one delivered didn't work. It's replacement lasted a little over 12 months then it conked out!
Fellow did not respond to my email.
Buy a Cosori instead at less than half the price",Mary Hill,Revisado en los Estados Unidos el 24 de enero de 2020
Temperature Issues,"1,0 de 5 estrellas",Great product when it works. Constant temperature issues causing the water to boil over if you do not watch closely. They need to fix this problem as it is a well-known issue.,Craig Hickman,Revisado en los Estados Unidos el 15 de junio de 2020
It worked one time but then it would not start,"1,0 de 5 estrellas",Most expensive kettle on the market and it stopped working the second time I plugged it in. Made in China. I sent it back.,John E Urban,Revisado en los Estados Unidos el 31 de diciembre de 2021
Stopped working 3 months in,"1,0 de 5 estrellas",Recieved my stagg march 2018 and 3 months later it stopped heating. Loved everything about it but will not be purchasing an item way more expensive than it's competitors just to have it stop working 3 months later. I noticed other reviewers with the same problem.,Amazon Customer,Revisado en los Estados Unidos el 1 de junio de 2018
"Purchased on April 28, 2019 stopped working today","1,0 de 5 estrellas","I paid almost $200 dollars for this and it stopped working today. That is less than six months of light use.

I love the kettle - it's beautiful and fast, but four months and then failure is unacceptable.",JLH,Revisado en los Estados Unidos el 6 de agosto de 2019
Stopped working within a month of purchase.,"1,0 de 5 estrellas",Stopped working within a month of purchase.,Patricia Mustacich,Revisado en Canadá el 3 de mayo de 2019
Brand new one only work for a day,"1,0 de 5 estrellas",It does not! Not worth buying,Maureen T,Revisado en los Estados Unidos el 10 de enero de 2022
"What an overpriced, mediocre kettle","2,0 de 5 estrellas","I've used a collection of different electric kettles from different moves, staying places, and recently replacing our Breville that broke when the glass shattered. This has been one of the most disappointing though

Pros:
- It looks nice
- It's not glass so shouldn't break like our last one
- It gets the water hotter

Cons:
- It's super pricey for the feel of it, lots of plastic
- The one dial button is not responsive, pressing it sometimes produces no result and spinning it to get to the temp you want it annoying.
- The temperature you set it to is not respected. You want boiling 212 water? Prepare to have water shooting out and boiling well past that (yes even when the kettle is below the max line and above the min line)
- Did you empty the kettle and place it back down? Better make sure that you turned it off with the non responsive control button as there's no safeguards to make sure it doesn't try to heat an empty kettle.
- The lid is difficult to use safely after having recently used the kettle, prepare to get burned.

Overall would recommend buyers look elsewhere - thanks for reading the ramblings of one disappointed buyer who wished they'd returned it in the return window.",Todd,Revisado en los Estados Unidos el 18 de julio de 2022
Major disappointment,"2,0 de 5 estrellas","This kettle, while beautiful, is not worth the premium price. It is extremely susceptible to changes in boiling point of water based on location. I am in a high elevation area, where our boiling point is 202-204. If i set the kettle to 204 or higher, it spits and spews like crazy because it reaches over boil. It is a very normal and standard feature for kettles to have automatic stops for overboil. My old bonavita gooseneck just never reached a higher temperature if I set it over boil because it clearly had a stop, and that was almost half the price of this kettle. This really does seem like a safety hazard having used it for a few months now, and I am extremely disappointed. As soon as it shows its first signs of malfunction, I am going to go back to something that won't boil over. I am really disappointed because it is a really beautiful kettle, and I keep my kettle out at all times, so it was great to feel like it was adding to the decor of my kitchen in addition to having function. Hopefully they will fix the overboil issues and offer a discount to customers who have this much more dangerous version of the kettle.",J. Rathbun,Revisado en los Estados Unidos el 5 de noviembre de 2021
Great kettle but isn't made to last.,"2,0 de 5 estrellas","I bought this in late December 2021 in matte black. Perfect to match my kitchen and I loved the sleek look but I wanted to wait to review for longevity purposes. The kettle has died, exactly 1.5 years later. The lid is comprised of a plastic handle portion and a stainless steel inset. These two products have separated on mine. So when you lift the lid, the stainless steel portion stays sitting in the pot. No epoxy, resin, glue etc. will hold it back together as water seems to sit between the layers and hang out. Rather unfortunate given the price of this product. Considering my old, ugly $20 kettle from my college days is still firing just fine 10+ years later. So I can't say for the cost that I would recommend this product.",Resch Reads,Revisado en los Estados Unidos el 19 de junio de 2023
Two units short lived,"2,0 de 5 estrellas","We first purchased in Nov 2020, we were stretching to meet the price, but figured it would last…. Well, it hasn’t. Base failed to power on at just under a year old, they sent us a new one for free. Happy customers. Now, base is just over a year old again, no power, same problem. Company this time says, it has been more than a year since purchase, sorry gotta buy it a new base for $80. Not even offering it at cost. We use this for one pot of water a day. Really? For the premium price this is crazy. Great for a short while, but clearly not built to last.",Kim Allen,Revisado en los Estados Unidos el 12 de junio de 2023
