title,rating,body,author,date
Updated to 5 stars - great product and great service!,"5,0 de 5 estrellas","3/28/23 Edit:
After I posted my first review Tiken contacted me saying that they thought I’d received a defective product, and offering a replacement. The replacement arrived within a few days at no charge to me.

I tested the new carafe by filling with boiling water (no preheat) and pouring out a cup every half hour for 1.5 hours. After 1.5 hours the water was still so hot it burned my finger. Good enough for me!

We have used the new carafe for a week to hold hot coffee and even though we only fill it 1/4 full it says hot long enough for our mornings. We think the vacuum was broken on the first carafe received. Hopefully the new vacuum will last a while!

If your carafe doesn’t keep liquids hot, hopefully you can request a refund. 😬 Thank you, Tiken!

——
First review:

There’s no star category for thermal quality, so I used “flavor” star category. One star for how warm it keeps the liquid contents..

I was looking for a non-glass carafe so I can steep hot tea in it and cool it down a little bit with cool water without breaking (I’ve broken two glass-lined carafes that way). Unfortunately this carafe doesn’t keep the tea warm for long enough.

So now we use this carafe for pour-over coffee in the mornings, and even pre-heated with boiling water we still have to cover the carafe with a towel to keep the coffee decently warm for the hour or so we are drinking coffee in the morning.

I wouldn’t recommend… maybe it’s too cheap? But $30 seems like enough for decent quality. 🤷🏻‍♀️",Katie,Revisado en los Estados Unidos el 27 de enero de 2023
"Keeps liquids HOT (see my ""Note"")","5,0 de 5 estrellas","I need to have HOT water on hand due to a health issue that causes a chronic dry cough and this insulated thermal hot liquid carafe is exactly what I've needed. It's handsome to look at... kind of important to me since I keep it beside me... and extremely well made. Best part is it keeps my hot water HOT for at least 9 hours if filled ""off the boil"" and a solid 15-18 hours if brought to a full boil (after 15 hours, water will be HOT, but not scalding).

Just before going to bed, I always take the lid off and turn the carafe upside down on a small rack to dry over night. All in all, I'm quite happy with my ""Tiken Thermal Insulated Vacuum Coffee Carafe""
and wish I'd bought it yonks ago.

Note:
The water in the carafe stays hotter MUCH longer if you fill it with HOT tap water to pre-heat it while you're bringing your kettle to a full boil. Then just empty your pre-warmed carafe out when you're ready to fill it with your boiling water. Also be sure to put the lid on properly. While that sounds like a no-brainer, apparently one user found their water cooling off way too fast either due to the lid not being on all the way allowing heat to escape OR the pour spout was somehow left open (it should auto close when you take your thumb off).",rainydays,Revisado en los Estados Unidos el 20 de febrero de 2023
Keeps my coffee hot,"5,0 de 5 estrellas","My husband and I sit in the living room in the morning and have some coffee every day. Before I bought this carafe, I used to have to get up and go to the kitchen every time I needed a refill. It’s a real pleasure to sit and catch up on the news and have my coffee right there.",ellen,Revisado en los Estados Unidos el 14 de marzo de 2024
Thermoskanne,"5,0 de 5 estrellas","Diese Thermoskanne benutze ich schon ein paar Monate und bin immer noch sehr zufrieden.
Mit dem Wasser, dass ich morgens gekocht habe, kann ich mir abends immer noch einen Tee aufsetzen.
Die Handhabung ist einfach, sowie die Reinigung.",Creativ,Revisado en Alemania el 19 de marzo de 2024
"Top, hält über Stunden warm!","5,0 de 5 estrellas","Ich nutze die Kanne nun seit einer Woche und bin vollauf zufrieden.
Ich habe mir das 2L Modell gekauft, welche natürlich in gefülltem Zustand recht schwer ist. Aber die Kanne steht stabil, lässt sich gut ausschenken und das Beste mein Tee hält den ganzen Tag über warm. Ich mache mir morgens die kanne voll und kann abends noch einen dampfenen Tee genießen.
Ich bin überzeugt.

Seit gestern macht die Kanne bei fast leerem Zustand Geräusche, ich werde das weiter beobachten. Aber die Isolierung ist in meinen Augen top!",S. K.,Revisado en Alemania el 12 de enero de 2024
Thermal Jug,"5,0 de 5 estrellas","After my previous review I contacted Tiken regarding the carafe not keeping the contents hot. They responded promptly and asked for the Amazon order no. I sent the invoice details, from the Amazon order history. I received a replacement yesterday which was within a week of my complaint. I have given a 5* rating for their excellent customer service. Time will tell if it lasts longer than the original.",JDB,Revisado en Reino Unido el 23 de diciembre de 2023
Excellent choice,"5,0 de 5 estrellas","I first encountered a Tiken thermal carafe in an Afghani restaurant in St. Louis, and was astonished to find that this pot kept my mint tea scalding hot from my first cup to my last. When it was time to replace my thermal carafe for coffee at home, this was what I ordered. And it does a great job for keeping coffee very hot for most of a day. Highly recommended.",TVO,Revisado en los Estados Unidos el 19 de enero de 2024
Just what I needed,"5,0 de 5 estrellas",Ideal for me after coming out of hospital Just filled with freshly boiled it lasted over 24hrs saved having to keep boiling a kettle. Haven't filled it with coffee or tea already made Excellent purchase.,Barry Salisbury,Revisado en Reino Unido el 31 de enero de 2024
Isolierkanne,"5,0 de 5 estrellas","Die Kanne hält was sie verspricht.Der Kaffee bleibt sehr lange heiß,ob nun über den angegebenen Zeitraum,wie beschrieben kann ich nicht sagen,da der Kaffee vorher schon ausgetrunken wurde.Aber über 6 Stunden,war bisher die längste Zeit, allemal.Ausserdem ist die Kanne absolut rutschfest.Kann man nur empfehlen.Werde wohl noch eine Zweite kaufen.
Vielen Dank",noset185,Revisado en Alemania el 8 de febrero de 2024
Buy the larger one,"5,0 de 5 estrellas","This works as advertised, but 34 oz is much smaller than you think. It does not hold a coffee pot's worth of coffee. Having said that, it keeps the 34 oz hot for a day and pours well.",C. Marie Bowen,Revisado en los Estados Unidos el 9 de febrero de 2024
