title,rating,body,author,date
Top,"5,0 de 5 estrellas","Genial producto, un poco caro",Adrià,Revisado en España el 21 de noviembre de 2022
Ruido eléctrico,"2,0 de 5 estrellas","El acabado del mango deja bastante que desear para un producto tan caro. La base hacía un ruido extraño al enchufarla, sin siquiera encenderla. Se fue de vuelta a amazon antes de llegar a probarla",Abel,Revisado en España el 16 de febrero de 2022
Fellow es lamentable,"1,0 de 5 estrellas","Le doy una estrella porque no se si no se le puede dar ninguna. No he comprado este producto en Amazon. Pero es la fellow kettle stag. Solo quiero compartir que no merece la pena ese dinero por una tetera. Nada más abrirla le fallaba el display mostrando la temperatura solo en F y no en C. Y tampoco alcanza la temperatura maxima. Después de pasarme un mes de emails y vídeos con el servicio técnico de Fellow, confirmaron que tendrían que cambiarme la base y al pasarle mis datos personales me contestaron que solo cubren USA y Canada y que me busque la vida con el distribuidor donde lo compré.

Ah y al primer uso ya le salen como puntitos blancos dentro si no lo limpias meticulosamente tras cada uso...

Un mes perdido, casi 200€ menos y todo por tener un simple aparato que hierve agua pero no da ninguna de las características que dice tener. Repito esto no ha sido comprado en Amazon ni en este vendedor, pero es la marca Fellow la que para mi no merece ni un euro de vuestros bolsillos.

Me molesto en poner esta reseña para que nadie caiga en engaños, no sé por que tiene tantas estrellas cuando nos ha dado tantos fallos a tanta gente...",Alejandra C.S.,Revisado en España el 22 de enero de 2021
Muy buen hervidor para V60... mientras funciona,"3,0 de 5 estrellas","Ha funcionado perfectamente hasta el tercer mes después de la compra, cuando el control del a temperatura se ha vuelto loco, saltando en milisegundos de 87 a 99 a 90, por ejemplo, y no haciendo ni caso de la temperatura seleccionada con ""hold"" (programaba para mantener una temperatura de 94 ºC y se pasaba a 97 ºC

Ya es bastante malo que un hervidor de este precio dure 3 meses, pero es que para colmo no hay servicio técnico en España, por lo que he tenido que enviarlo a Francia para que lo arreglen ¡y me dicen que tardará como un mes!

Eso sí, la comunicación con el vendedor ha sido muy buena y me ha remitido una etiqueta pre-pagada para que no me cueste el envío.",eleme,Revisado en España el 11 de marzo de 2020
Bad controls can leave kettle heating after water evaporates,"3,0 de 5 estrellas","In general, I like this kettle. It initially did a good job of heating to a setpoint. It has a timer which is nice, but also a problem. There is only a single button on the kettle, it controls both on/off and, when held for a few seconds, activates the timer. The issue is when you select it to turn it off, after the timer is running, it only disables the timer, but the kettle still heats. There is no safety shutoff, so when the water evaporates or is boiled off, it continues to heat. This damages the heat sensor and it no longer maintains temperature. This is surprisingly easy to do and, for that reason, I believe it is a design flaw. Timer control and kettle on/off should be different controls.",Wendi Hagood,Revisado en los Estados Unidos el 12 de julio de 2024
"Great for 3 years, then RIP","4,0 de 5 estrellas","Not as durable as multiple cheaper electric kettles I've bought over the last 15 years....but really nice to use, fast to heat, accurate temps for finicky teas, just the right size. Rather sudden deterioration in temp control, started boiling regardless of set temp, not shutting off heating even at full boil. Recommended decalcination protocol appeared successful based on shiny clean metal appearance, but temp inaccuracy continued (or resumed, went through a week or two of mostly teas best infused with water at the boil). Not sure if it can be saved--have submitted a request to Fellow support--and not sure I will replace it with another one if it can't be saved.",Diane in Los Angeles,Revisado en los Estados Unidos el 10 de julio de 2024
Love the look. Heats quickly. Pours well,"5,0 de 5 estrellas",Pour over coffee making a welcome change,debris,Revisado en los Estados Unidos el 6 de julio de 2024
What I found,"5,0 de 5 estrellas","I see some had problems with this had stopped working after short time. Mine had stopped working after 2 days. What I did was hit the button quickly about a half dozen times and it started working again and has continued with no further problems. Sometimes the fix is very easy. Try it, it might work for you.",Merrill R. Mcalister,Revisado en los Estados Unidos el 5 de julio de 2024
Kettle,"5,0 de 5 estrellas",Buena máquina para la preparación de bebidas.,Andrés B Zavaleta Guerra,Revisado en México el 2 de julio de 2024
Temperature Hold,"3,0 de 5 estrellas","Generally a very good product; easy to set and control the temperature. Unfortunately the temperature hold button never worked from day one - it cannot be turned off. Also it takes too long to come up to temperature especially 100C for black tea and the pouring is too slow for my liking, even for coffee.",Manoja R.,Revisado en Alemania el 25 de junio de 2024
The Gold Standard,"5,0 de 5 estrellas",Probably the most popular kettle and for a good reason. It heats fast. It has really good flow control. It looks great and is elegant to use.,ALAN,Revisado en los Estados Unidos el 24 de junio de 2024
Great water kettle,"5,0 de 5 estrellas","Great water kettle, best kettle for making pour over coffee, easy to use, very well engineered, maintains water temperature well",Glen D. Poland,Revisado en los Estados Unidos el 20 de junio de 2024
MUY BUEN PRODUCTO,"5,0 de 5 estrellas",LO ESTA USANDO UNA AMIGA,JOSE LEANDRO GUZMAN,Revisado en los Estados Unidos el 20 de junio de 2024
Stopped working after 3 years,"1,0 de 5 estrellas",Ours stopped working after 3 years. The heating just doesn’t start and water stays cold forever. Do not invest in this.,Srikanth Raju,Revisado en los Estados Unidos el 19 de junio de 2024
Water capacity,"3,0 de 5 estrellas","Too small! Doesn’t hold enough water, water spills when pouring. Too expensive for what you get",Cuilly,Revisado en los Estados Unidos el 18 de junio de 2024
Bonne qualité et pratique,"5,0 de 5 estrellas",Facile d’utilisation et pratique de pouvoir choisir la températures. Bonne qualité,Marylou,Reseñado en Bélgica el 1 de junio de 2024
Function,"4,0 de 5 estrellas","The hold function is not that clear to the user
I thought the hold function should be held until the user cancels or turn off but it’s only an hour long and then turn off automatically",Albert L.,Revisado en los Estados Unidos el 25 de mayo de 2024
Awesome kettle for aeropress,"5,0 de 5 estrellas","I bought this one for making coffee with the aeropress. It heats very fast, especially when you don't fill it to the top. It's a bit expensive but you get what you pay for.",Amazon Customer,Revisado en Canadá el 18 de mayo de 2024
Can't complain ...,"4,0 de 5 estrellas",... Well my only complaint is that I didn't take advantage of those discount deals I had seen for these in the past. Well worth the cost though.,Mad Professional,Revisado en los Estados Unidos el 17 de mayo de 2024
Very unimpressed,"2,0 de 5 estrellas","Used this for a few years until the handle broke off, led screen would regularly become unreadable at times though it would always work after some resets before the handle broke

Poor quality for almost $200 kettle",Christian,Revisado en los Estados Unidos el 17 de mayo de 2024
Service après vente au top,"5,0 de 5 estrellas","Le design de la bouilloire est très élègant, le service après-vente est à l'écoute et vous aide en cas de soucis technique.",Florent,Revisado en Francia el 9 de mayo de 2024
Idéal pour un slow café,"5,0 de 5 estrellas","Associé à un chemex, c’est la bouilloire idéale pour régler la température au degré près, et ainsi ne pas ébouillanter votre café torréfié à température relativement basse.
À vous les vrais arômes de vos cafés!! Top.",DEMOTTIE Emeric,Revisado en Francia el 9 de mayo de 2024
Wedding gift,"5,0 de 5 estrellas",Bought this as a wedding gift. Was beautifully packaged. They loved it!,Ty,Revisado en Canadá el 6 de mayo de 2024
Belle. Rapide mais...,"4,0 de 5 estrellas","Sublime! Rapide ! Mais bec a verser lent.
Pas grave je l'aime trop",Nocta,Revisado en Francia el 1 de mayo de 2024
"Iconic design, cheap smelly plastics","3,0 de 5 estrellas","I suspect, and don’t disagree, that this design will stand the test of time; however, it is inexcusable at this price point for cheap plastics that still smell months later to be used in manufacturing. Infuriating that these cost what they do and have materials that smell like a Harvoe Freight store. This is my second one too because I do like them but c’mon.",Internet,Revisado en los Estados Unidos el 28 de abril de 2024
Great gift,"5,0 de 5 estrellas",Got this for my daughter in law! She's loving the kettle. The fact that it will keep water at temp set is amazing!,BD,Revisado en los Estados Unidos el 27 de abril de 2024
Defektes Gerät,"1,0 de 5 estrellas","Mir wurde ein defektes Gerät zugeschickt das ich natürlich zurückgesendet habe. Monate später kam dann eine Info von Amazon, das der Zustand des Gerätes nicht den Rückgabebedingungen entspricht mit dem Vermerk, das ich zukünftig keine Erstattungen mehr erhalten könnte.",Rscha,Revisado en Alemania el 7 de abril de 2024
Top Produkt,"5,0 de 5 estrellas","Wer guten Kaffee möchte, kommt an diesem Gerät nicht vorbei. Handlich, einfach zu bedienen und perfekt, um die richtigen Temperaturen für Kaffee und verschiedenen Tee-Sorten herzustellen. Kann ich nur wärmstens empfehlen ;.)",Ronny,Revisado en Alemania el 3 de abril de 2024
Love it!!,"5,0 de 5 estrellas",Can’t say enough great things about this product. It’s great quality and keeps the water warm at any temp you want. It also holds it there for hours. I recommend 10/10!!,Lenny,Revisado en los Estados Unidos el 2 de abril de 2024
Poorly designed and dangerous,"1,0 de 5 estrellas","Yeah it holds the corect temperature, but the steam holes burn your hand when you take the lid off to refill it (which you need to do frequently because it doesn't hold that much water - or to check the water level since you can't see from the outside). The hold feature is on by default, but you're not supposed to let it run dry (but you can't tell from the outside). If you turn the hold feature off, the screen is still on and it seems to boil anyway. The dial is cute, but switching beween 175 and 212 frequently without presets is annoying. It doesn't notify you when it reaches temp. It pours SLOWLY and is too small to brew and 8 cup chemex.",Moonwind,Revisado en los Estados Unidos el 2 de abril de 2024
Esthétique rime avec efficacité,"5,0 de 5 estrellas","Très bel objet, prix élevé, mais néanmoins un achat judicieux!",Dufour jean-antoine,Revisado en Canadá el 1 de abril de 2024
Poor durability,"2,0 de 5 estrellas","Worked fine for the first few months; after that, keep water boiling when you're not expecting it. After all the maintenance, the thermometer is still crazy.",Igor,Revisado en Polonia el 28 de marzo de 2024
It leaks from the lid on pouring position,"2,0 de 5 estrellas","Got the Fellow Stagg and it leaks from the lid in pouring position. Returned it and ordered the Fellow Pro, which supposedly has more sealing. At this price point, this should not happen.

Update: exchanged it for the Pro and that one does not leak. Works beautifully",Mom of two,Revisado en los Estados Unidos el 26 de marzo de 2024
Favorite,"5,0 de 5 estrellas","Love everything about this teapot(kettle?). The size, the soft stream from the “nose”, the temperature adjustment, the F/C degree display. The shape. The quiet presence on my counter. I have learned what water temperatures are pleasing for drinking in the warmest state. For me it’s 68C.",XOPOLLLO,Revisado en los Estados Unidos el 23 de marzo de 2024
"nice base, terrible kettle","3,0 de 5 estrellas","I have now owned the Fellow Stagg kettle for over a year. Initially I was quite pleased and even now I will admit that I like the build quality and the finish, however I don't think I realized just how slowly the pours water out or how turbulent the pouring is. I now happen to be shopping for another kettle so I can replace the this one because it pours too slowly.",Forrest,Revisado en los Estados Unidos el 10 de marzo de 2024
Amazing,"5,0 de 5 estrellas","If u are into coffee and tea at home I think it is must have, great design and amazing functions. ofc there could be cheaper version but since it is something to use for a long time , it definitely worth",Aaa,Revisado en Alemania el 8 de marzo de 2024
matte paint comes off easily,"2,0 de 5 estrellas","i've had this kettle for a year and it started showing signs of paint pealing off starting several months ago, even though i have never scrubbed it or used anything abrasive against it. i was too busy to leave a review earlier and kept ignoring it. then i decided i should leave a review and accept my annoyance and disappointment with this product. not good quality. in hindsight, i would not buy this kettle as the paint on it was not applied in a solid way. paint should not come off after intended use. i am disappointed. not worth it. i reached out to the manufacturer and they gave me a list of what not to do with the kettle. i had not done those things and still the paint had come off.",rozaf,Revisado en los Estados Unidos el 7 de marzo de 2024
Bellissimo,"5,0 de 5 estrellas",Bollitore con una precisione straordinaria,roberto liberati,Revisado en Italia el 5 de marzo de 2024
Scaling on the bottom lead content check,"3,0 de 5 estrellas",I see scaling occurring very often on this kettle base even after using a filter water from the refrigerator. Tried lime which helps to some degree. Also curious if there is any lead in your kettle given it’s manufactured in China. Do you have a material certification?,gaurav sen,Revisado en los Estados Unidos el 2 de marzo de 2024
Easy to use and great product,"5,0 de 5 estrellas","Easy temperature setting, precise handle and beautiful. If I wanted to be picky, the temperature display could be a little more modern though, the numbers are kind of pixelated.",Rodrigo Gassibe,Revisado en los Estados Unidos el 17 de febrero de 2024
Beautiful but there are issues.,"2,0 de 5 estrellas","I bought this for my wife for X-Mas. She had been asking me for a good electric kettle and this one seemed like it fit the bill.
With the first use we noticed that even though we had filled it below the max fill line water still bubbled up out of the top. You have to be very careful as the water gets heated to 212 degrees. There have been a few occasions where the water has burned us.
It got to the point where we both got pretty annoyed with it. I went to return it and I missed the window by two days.
In my opinion this is not worth the money. We have burned ourselves on multiple occasions. You have to get a paper towel and make sure all the water on the lid is completely gone before pouring.
Also because of the holes on the top water literally shoots out and gets all over the surrounding area. Oh and sometimes the lid starts to pop off. Honestly I am surprised there hasn’t been a recall on this.
I do NOT recommend.",Ben Blume,Revisado en los Estados Unidos el 12 de febrero de 2024
Melting Plastic Odor/Abysmal Customer Service,"1,0 de 5 estrellas","I love the smell of coffee brewing in the morning. If you do too, I would look elsewhere. Definitely form over function for this product. The base of the kettle is made with an inferior plastic that emanates a foul if not toxic smelling odor every time it is heated. Customer Service said smell would go away with use. Has not. Have tried replacing kettle multiple times to no avail. Fellow is not willing to refund (high) cost of the kettle as it was purchased from Amazon, but dragged their feet and trying to resolve the issues so I’m outside of Amazon’s return period. I’m going back to a Bonavita Kettle, but I’m out $165.",mRm,Revisado en los Estados Unidos el 7 de febrero de 2024
Kleine optische Mängel,"3,0 de 5 estrellas","Der Wasserkocher funktioniert soweit ganz gut. Leider hatte er aber ein paar optische Fehler. Ist eigentlich nicht weiter schlimm, aber bei dem hohen Preis dann doch ärgerlich…

Trotzdem würde ich eine Kaufempfehlung aussprechen!",Amazon Kunde,Revisado en Alemania el 6 de febrero de 2024
Mostly Good - But Poor... Slowly,"4,0 de 5 estrellas","Yes, I know it's ""Pour""... but ""Poor"" seemed more fitting. We do like this kettle. It has worked well for us and hasn't had any of the glitches others have reported. It heats water to a precise temperature fairly quickly and also looks great. However, the pour rate is incredibly slow if you don't want water on your counter. We have tried just about everything to prevent the water from leaking or wicking back down the kettle, but nothing works. Except pouring extremely slowly. This may be a feature of all gooseneck kettles, but this is the only one we've had. Also, I think it would be good to have an audible beep when it reaches the desired temp so you can step away while it's heating. Otherwise, nice kettle. They now offer a non-gooseneck version, and although I like the look of ours, I think I'd opt for the other one just to avoid spillage.",Keith Raker,Revisado en los Estados Unidos el 4 de febrero de 2024
Beautiful but very slow pour rate,"3,0 de 5 estrellas",This is a beautifully made gooseneck kettle. The temp setting dial is simple and easy to use. There are no bells and whistles despite the high price but I was ok with that given the unreliability of a cheaper brand that I tried twice before giving up. Unfortunately much as I wanted to love this kettle I did not have the patience to stick with it as the pour rate is incredibly slow. I could literally feel myself aging as I stood pouring! I switched it for a Mecity which has a much faster pour. Fingers crossed that it will not go on the fritz…,RB,Revisado en los Estados Unidos el 30 de enero de 2024
Stylish and works great!,"5,0 de 5 estrellas","I purchased this as a gift for my husband who makes pour over coffee almost every morning. He has absolutely loved it! It heats up quickly and keeps temperature well. It is very easy to pour and really doesn’t take up a lot of counter space. We have black granite countertops, and I have loved how this just blends in.",AshleyAnne,Revisado en los Estados Unidos el 29 de enero de 2024
Mil veces mejor que un brewista,"5,0 de 5 estrellas",La mejor manera de controlar el caudal.,Rodrigo Mora,Revisado en los Estados Unidos el 28 de enero de 2024
Premium kettle at a premium price!,"5,0 de 5 estrellas","Yes, it looks great on the countertop, so elegant that you won't want to put it away. (I wouldn't anyway, because I don't think it would stand up to much abuse.) It features 4-cup capacity, to the degree temperature control, a built-in stopwatch, and perfect flow for pour over coffee. And you had better love coffee, because that's all you'll use it for. The cost is significantly higher than others that do the same thing, but that's the price of being a coffee snob.",Richard LeBlanc,Revisado en Canadá el 16 de enero de 2024
really nice kettle,"5,0 de 5 estrellas","Looks great, pours very slowly and controlled.
A huge upgrade from a regular temp control kettle",Pablo V.,Revisado en Canadá el 12 de enero de 2024
It won't turn on,"1,0 de 5 estrellas","Just bought it, and it won't turn on no matter how long I push the button....... Very disappointed 😞",Alfred Park,Revisado en Canadá el 11 de enero de 2024
Sehr schöne Kanne,"5,0 de 5 estrellas","Eine sehr schöne Kanne, sehr stilvoll.
Sie kam bei uns pünktlich und in gutem Zustand an.",Clemenza,Revisado en Alemania el 11 de enero de 2024
"Works well, and Fellow is easy to interact with if you have problems","5,0 de 5 estrellas","I've had this as my primary kettle for 2 years. Works well and is easy to use. Fellow was also great to deal with when I had a problem: The dial button (to turn it on and off) started getting more and more flaky (sometimes it would take 2 or 3 presses to turn the kettle on or off); I contacted Fellow support, and they walked me through figuring out the exact revision of the base, then sent me a replacement for free. The new one works great. I'm still enjoying this kettle.

It is a pour-over style kettle, so it'll take a little while longer fill up a large mug or a french press than a typical kettle would. That's not a downside for me, though -- it's a great opportunity to take a few deep breaths. Then I enjoy my coffee/tea that much more!",Michael J. Kelly,Revisado en los Estados Unidos el 10 de enero de 2024
La meilleure bouilloire pour slow coffee,"5,0 de 5 estrellas","Étant un consommateur intense de slow coffee (V60 et chemex principalement) j’ai décidé de passer sur la rolls des bouilloires : la FELLOW.
Après deux d’utilisation je suis conquis et je recommande ce produit !
L’utilisation est d’une facilité déconcertante, le maintien de température est parfait, elle ne fait pas trop de bruit, bref c’est un régal.
C’est un budget mais vous ne serez pas déçus !",Hugo Wantz,Revisado en Francia el 31 de diciembre de 2023
Great kettle,"4,0 de 5 estrellas","I like its design and functions.
The only thing I am not happy about is that it is a bit heavy when dripping coffee.",Jeongah L.,Revisado en Canadá el 30 de diciembre de 2023
The king of gooseneck kettles…,"5,0 de 5 estrellas","After extensive research of gooseneck kettles for my pour over coffee, I continued to see the Fellow EKG pop up time and time again as the top of the line kettle for making coffee. I continued researching, but couldn’t get it out of the back of my mind even after being dissuaded by the price. I took a plunge, and it was worth every dollar. The counterbalance in the handle along with the shape makes it feel like it melts into my hand. It holds the temperature of my water extremely proficiently. It doesn’t have any weird and annoying beeps (which is such a huge positive). I will no longer use any other kettle and recommend the Fellow EKG completely.",Carl Peters,Revisado en los Estados Unidos el 30 de diciembre de 2023
Excellent for tea,"4,0 de 5 estrellas","Excellent kettle for tea. It has the temperature control you need to brew for specific teas.
It has a small capacity but consider that a feature; you're not overfilling it so the smaller amount of water comes to temperature faster.

Unfortunately one of the rubber feet ripped off mine so it wobbles now and customer support basically sent me back a shrug. I still use it an love it every day even though it's not really level any more.",Whitney,Revisado en los Estados Unidos el 30 de diciembre de 2023
Breaks for no reason,"1,0 de 5 estrellas","Overly restrictive flow and will not last, after a few years it gets the temp close and then calls it good enough. Does not do a single thing better than a 40$ kettle. Only buy this if you like buying expensive kettles and want to do it again in a few years.",Scott Caster,Revisado en los Estados Unidos el 29 de diciembre de 2023
"Used, Dirty, and missing an inside part","1,0 de 5 estrellas","I believe the Stagg EKG Gooseneck kettle was tampered with. It was shipped with another purchase and both items were Christmas presents and were shipped in the same box. When the kettle was opened, it was obvious that the box was opened prior to shipping. The kettle was dirty, used previously, and is missing an inside part. I would like to try to reorder the same product b/c of its high rating.",Kindle Customer,Revisado en los Estados Unidos el 28 de diciembre de 2023
Wonderful kettle,"5,0 de 5 estrellas","Nice looking, heats water fast and holds water to chosen temperature. Use this for coffee and tea. Came on time and appropriately packaged",Mary B.,Revisado en los Estados Unidos el 20 de diciembre de 2023
Great product.,"5,0 de 5 estrellas",Great product. Heats water quickly and holds well. Product came with a scratch but dose not effect how the product works.,Amazon Customer,Revisado en los Estados Unidos el 18 de diciembre de 2023
Pour over,"5,0 de 5 estrellas","I absolutely love this pour over pot, makes a fresh cup every time",Kathy Revette,Revisado en los Estados Unidos el 17 de diciembre de 2023
Manufacturing defects,"2,0 de 5 estrellas","Our last stagg ekg kettle lasted for years and recently stopped working.

We bought this a couple months ago to replace it and have found two manufacturing defects so far (lid doesn’t fit and the paint is chipping).",IS,Revisado en los Estados Unidos el 15 de diciembre de 2023
Broken because of major design flaw,"2,0 de 5 estrellas","I love this kettle, it's beautiful and works well except for one major design flaw. Whenever it get's unplugged it defaults back to it's highest temperature setting which makes the water boil and overflow out of the kettle. This happened a couple of times so we were cautious about it and then our power went out and after turning the kettle on and walking away not realizing it had been reset with the power outage it overflowed and soaked the entire unit. It didn't work for a few days so we assumed it was lost, but then we realized it was still heating the water but the small screen that displays the timer and temp is broken. So we can still use it, but it's not very convenient. We would love to buy a new one, but these are so pricey and I would hate to risk this happening again after investing so much :( If it wasn't for this it would be a 5 star review.",Rebecca,Revisado en los Estados Unidos el 7 de diciembre de 2023
