title,rating,body,author,date
Ottimo rapporto qualità prezzo,"3,0 de 5 estrellas","Spedizione veloce e curata nell'imballo.
Prodotto economico che rispetta le descrizioni e che funziona perfettamente.
Aspetti negativi l'impossibilità di rimuovere il portafiltro facilmente per poterlo lavare adeguatamente e il non poter separare il funzionamento della piastra scaldante da quello della bollitura acqua.
Cercando di smontare il portafiltro mi si è rotto ma ho potuto facilmente aggiustarlo e modificarlo per permetterre di smontarlo velocemente in modo di lavarlo.
La capienza è superiore a 2 tazze mug e i portafiltri corretti sono da 2 tazze che in carta si trovano nei supermercati ad un costo relativamente basso. Ho acquistato 100 filtri in carta da 2 tazze della Melitta nel supermercato vicino casa (Unes) ad euro 1.80.
Prodotto consigliato per chi ne fa un uso saltuario, per un uso specifico (tipo un'ufficio) mi affiderei a prodotti più costosi e con più funzioni.",Walter,Revisado en Italia el 29 de diciembre de 2016
dimensioni,"3,0 de 5 estrellas","Ricevuta oggi, non l'ho ancora utilizzata ma la prima sorpresa, negativa, è stata la capienza. Ovviamente è indicato che la caraffa può contenere fino a 0.6 l di caffè ma io ho prestato più attenzione al fatto che nella descrizione si parlasse di 6 tazze... No, essendo caffè americano, e non espresso, ogni caffettiera può contenere due tazze, 3 al massimo. Quindi può essere sempre un ottimo prodotto ma dipende dalle vostre esigenze... Sto pensando se restituirla e prendere quella più grane.",Nicoletta,Revisado en Italia el 30 de marzo de 2020
"A questo prezzo fa quello che deve fare, ma...","3,0 de 5 estrellas","Per gli amanti del caffè americano. Modello base, prezzo giusto, il sapore non è il massimo",Pasqualino Di Zenzo,Revisado en Italia el 29 de junio de 2022
Bon produit mais il manque une pièce à ma commande,"3,0 de 5 estrellas","J'ai commandé ce produit et j'en suis très satisfaite. Cependant, il manque le filtre réutilisable. Est-ce normal ?",Laurie B.,Revisado en Francia el 30 de noviembre de 2021
Mouais,"3,0 de 5 estrellas",La 1ère n'a pas fait long feu. Je mets ça sur le compte du tartre.. Je la rachète car il m'en faut une petite.,Byrka,Revisado en Francia el 9 de agosto de 2021
Produit satisfaisant,"3,0 de 5 estrellas",Je recherchais quelque chose de peu de tasse le café est bien chaud et qualité prix nikel le produit ne prend pas beaucoup de place,Mokhfi Karima,Revisado en Francia el 10 de julio de 2021
petite cafetiére minimaliste,"3,0 de 5 estrellas","très basique le réceptacle du filtre démontage pour nettoyage est fragile 2 petits axes en plastique pour pivoter
maintenant il fait du café prix trop élevé en regard du produit moins cher ailleurs.",verchiani serge,Revisado en Francia el 22 de marzo de 2021
Faible contenance,"3,0 de 5 estrellas",Faible contenance. Ca va quand on est à 2...,STEF,Revisado en Francia el 25 de agosto de 2021
Ok mais petit,"3,0 de 5 estrellas","Ok mais c'est vrai, c'est petit. Bon pour un consommateur unique et encore...",Jo,Revisado en Francia el 26 de agosto de 2021
Porte-filtre trop petit pour les filtres à café n°2 !,"3,0 de 5 estrellas","C'est une cafetière classique à filtre. Je regrette simplement que le porte-filtre (l'entonnoir) ne soit pas assez haut pour les filtres à café n°2 (de marque ""Plantation""). Je suis obligé de couper 1 cm en hauteur les filtres pour que ça passe lorsque je rabat le porte-filtre en plastique.
Pourquoi ce porte-filtre est-il si peu haut ? Pour faire des économie de matière plastique ?",Christophe,Revisado en Francia el 20 de octubre de 2018
Attention à la taille,"3,0 de 5 estrellas","Très petit récipient, attention",Mr. Christophe THERY,Revisado en Francia el 13 de febrero de 2022
"Prodotto difettoso, restituito","3,0 de 5 estrellas","Lo sportello con l'imbuto si apre da solo durante il funzionamento; probabilmente il calore provoca una dilatazione del fermo. Peccato perché sarebbe un ottimo prodotto, di dimensioni compatte, con prezzo interessante.",Roberto P.,Revisado en Italia el 11 de mayo de 2021
Petit,"3,0 de 5 estrellas",Trompeur car très petite écrit 6 tasse de mais petites tasse. Dommage,Vitrat D.,Revisado en Francia el 13 de abril de 2021
Ottima ma senza ricambi,"3,0 de 5 estrellas","È tutto perfetto!
Il caffè, il rumore appena percettibile, la velocità, la facilità di pulirla... Peccato che mi si sia rotta la caraffa e non c'è verso di acquistarla da sola senza spendere più dell'intera macchinetta stessa. Bah",S. Cap.,Revisado en Italia el 16 de enero de 2021
L’Essenziale,"3,0 de 5 estrellas","Di facile utilizzo e pulizia, occupa poco spazio, fa un caffè piacevole al gusto ed alla temperatura giusta. Non è il prodotto per chi cerca dettagli come corpo e robustezza d’atoma o intensità variabili",Sibilla,Revisado en Italia el 31 de enero de 2021
"Buon prodotto, mancano i filtri","3,0 de 5 estrellas","La caffettiera funziona bene, dopo averne provate altre sono soddisfatto. La capienza è ridotta ma va benissimo per 3 o 4 persone. Unica pecca è che manca il filtro, se uno non vuole usare i filtri di carta",Marco P. Pagani,Revisado en Italia el 13 de julio de 2020
Piccola,"3,0 de 5 estrellas","È da sei tazzine, non da 6 tazze grandi, quindi è molto più piccola rispetto a quello che aspettavo...
A quel prezzo la potevo acquistare anche in negozio",Giada sabellico,Revisado en Italia el 10 de marzo de 2021
Faible capacité,"3,0 de 5 estrellas","Produit semble de bonne qualité.
Retourné à Amazon car les capacité d'eau est très faible",Jp,Revisado en Francia el 8 de noviembre de 2020
Buona,"3,0 de 5 estrellas","Arrivata con un giorno di anticipo, perfettamente funzionante. Sono rimasta poco contenta del fatto che non avesse la confezione esterna d'imballaggio (busta amazon o postale) e che dunque lo scatolo fosse un po' danneggiato",Aleandra,Revisado en Italia el 8 de mayo de 2020
Buona,"3,0 de 5 estrellas",La macchina del caffè non è male. Solo un po’ difficile bella pulizia di alcune parti. Per il resto fa il suo dovere e in pochi istanti il caffè è pronto. Ci puoi mettere qualsiasi miscela tu desideri che va bene.,RobertoH3,Revisado en Italia el 31 de agosto de 2019
👍,"3,0 de 5 estrellas","Bella e facile da utilizzare, lascia il caffè caldo per una mezz'ora. Escono due tazze da caffè americano",Alessandra,Revisado en Italia el 31 de enero de 2021
Scatola aperta,"3,0 de 5 estrellas","La macchina è carina e funzione bene.
Unico neo che dispiace non poco che alla consegna notavo che la scatola di cartone era quella della mulinex a vista e già aperta.",Pablo,Revisado en Italia el 10 de enero de 2020
E' facile fare il caffé.,"3,0 de 5 estrellas","E' una macchinetta che fa il caffé all'americana, come piace a me. E' facile da pulire e semplice da usare. E' arrivata il giorno dopo che l'ho ordinata quindi trasporto OK: Grazie.",D'Alessandro,Revisado en Italia el 20 de julio de 2019
Piccola e leggera,"3,0 de 5 estrellas",Buona macchina per caffè americano ma senza lode. È piccola e leggera.,Andrella,Revisado en Italia el 11 de marzo de 2021
Cafetière qui fait son boulot. Un peu longue à mon goût.,"3,0 de 5 estrellas","Attention à la contenance, 600 ml uniquement soit 2 grands bols pas plus",Client d'Amazon,Revisado en Francia el 11 de agosto de 2020
non soddisfatta,"3,0 de 5 estrellas","Non sono soddisfatta per niente, non tanto dalla misura della macchina (che è piccola va bene per una persona) ma da fatto che il contenitore della polvere del caffè non si stacca. Inoltre dopo 2 settimane di utilizzo si è bloccato il passaggio (non ho ancora capito come) tra caraffa e contenitore ed è venuto fuori tutto il caffè, insomma non son granché soddisfatta. Ne ho avute altre due nella mia vita, la prima più di 10 anni fa e funzionavano molto meglio",Chiara,Revisado en Italia el 26 de noviembre de 2016
"Piccola e essenziale, ma lievemente difettata","3,0 de 5 estrellas","Occupa poco spazio e il caffè é esattamnte come lo aspettavo! Perfetta per almeno 3 tazze piene!
Unico difetto, é arrivata con il coperchio del vano acqua gia rotto, ovvero non sta piu attaccato ma lo levo e metto come un normale coperchio. Ninete di grave, ma decisamnte noioso!",Amazon Customer,Revisado en Italia el 5 de junio de 2018
Mini cafetière,"3,0 de 5 estrellas","Attention, c'est une mini-cafetière! 6 tasses maximum.
Tout fonctionne par ailleurs.",Deborah ZV,Revisado en Francia el 28 de septiembre de 2019
acquoso,"3,0 de 5 estrellas","uso la miscela starbucks verona. il caffè che esce è un pò ""lavato"".",Serena Spadaccini,Revisado en Italia el 29 de junio de 2020
Piccolina,"3,0 de 5 estrellas","Macchina piccola per le mie abitudini. Riesco a fare solo due tazze grandi di caffè. La macchina tiene il caffè in caldo per circa mezz'ora, poi si spegne. Quindi bisogna riaccenderla se non si beve il caffè subito. Per consumo immediato è efficiente.",Sabrina,Revisado en Italia el 13 de abril de 2018
gadget,"3,0 de 5 estrellas","bien! le café passe rapidement, il est bon, mais c'est du petit matériel, leger, peut-être fragile, mais pas cher et joli ...",Vivia,Revisado en Francia el 3 de julio de 2018
Pacco non imballato,"3,0 de 5 estrellas",Pacco arrivato NON imballato.. ma direttamente con la scatola del prodotto.. senza pulirball senza carta....speriamo funzioni tutto,Giorgia Forteleoni,Revisado en Italia el 12 de diciembre de 2019
"Un peu déçu,","3,0 de 5 estrellas",Un peu petit mais pas mal,matthieu dath,Revisado en Francia el 11 de julio de 2019
problemi coi ricambi,"3,0 de 5 estrellas","La caffettiera è perfetta, comoda e funzionante, il problema è stato che, dopo poco tempo dall'acquisto, la brocca è caduta frantumandosi ed è stato impossibile trovare il pezzo di ricambio da nessuna parte: o non ce l'hanno oppure, come nel caso del servizio clienti Moulinex, neppune rispondono alle mail. Risultato: non si può usare più. Bella fregatura.",Antonia,Revisado en Italia el 28 de abril de 2017
Bonne cafetière,"3,0 de 5 estrellas",Bonne cafetière,Foxracing666,Revisado en Francia el 22 de agosto de 2019
occhio,"3,0 de 5 estrellas",calcolate che oggi ho preso un’altra macchinetta caffè .. lascio a voi giudicare,cristian.popa,Revisado en Italia el 17 de diciembre de 2019
Poco resistente,"3,0 de 5 estrellas",Purtroppo si è rotta dopo neppure un anno di utilizzo😕,Emy,Revisado en Italia el 19 de enero de 2020
Che bisogna procurarsi i filtri in contemporanea,"3,0 de 5 estrellas",Sicuramente rapporto qualità prezzo di contro mi aspettavo che almeno un filtro di carta x il caffè fosse a disposizione nella confezione...poco costo gran risultato,Marco Nodari,Revisado en Italia el 14 de noviembre de 2018
LE PRIX,"3,0 de 5 estrellas",RAS,Client d'Amazon,Revisado en Francia el 19 de mayo de 2019
Magnificaa,"3,0 de 5 estrellas",Magnifica,Alexandra Marilyn Vela Sandoval,Revisado en Italia el 10 de diciembre de 2020
senza infamia senza lode,"3,0 de 5 estrellas","non mi posso lamentare, avendola pagata poco più di 20 euro. però va detto che con una spesa non troppo superiore...si può avere qualche comfort in più. Penso al filtro, assente nella confezione e di non facile reperibilità viste le piccole dimensioni, e ad una maggiore capienza , visto che in questo caso non si arriva alle tre tazze ( da circa 200 ml ) .",fabio massoni,Revisado en Italia el 11 de diciembre de 2015
"Unico difetto, non mantiene caldo il caffè.","3,0 de 5 estrellas","La macchinetta come rapporto qualità /prezzo è buona. Peccato che non avendo la basetta riscaldata, non mantiene caldo il caffè durante la giornata.",Antonio Russo,Revisado en Italia el 6 de abril de 2018
Va bene,"3,0 de 5 estrellas",Qualità prezzo ok,Cliente Amazon,Revisado en Italia el 8 de noviembre de 2019
Bene ma....,"3,0 de 5 estrellas","Molto piccola e la caraffa perde sempre liquido quando si versa; ad ogni inclinazione possibile.
Però è velocissima ed il caffè lo fa buono.",MatteoD,Revisado en Italia el 27 de enero de 2018
Prezzo conveniente ma manca il filtro,"3,0 de 5 estrellas","Il prezzo è conveniente e la macchina funziona bene, peccato che manca il filtro e quello non usa e getta della dimensione giusta mi è costato altri 25 euro",Cliente Amazon,Revisado en Italia el 9 de septiembre de 2017
Macchina da caffè americano,"3,0 de 5 estrellas","Buon prodotto, semplice ma funzionale, fa il caffè (buono) e lo tiene riscaldato per 30 minuti, poco ingombrante e veloce. Unica nota negativa, non si estrae il cestello del filtro. Ne consiglio l'acquisto.",Angela Zamberlan,Revisado en Italia el 19 de febrero de 2017
Comoda per chi non ha gran pretese,"3,0 de 5 estrellas",Prodotto discreto ma non ha nessuna funzione in più,Enza Santoro,Revisado en Italia el 9 de marzo de 2019
Dipende dall'uso,"3,0 de 5 estrellas","Modello base e semplicissimo, ma non lo ricomprerei. Non ha la segnalazione acustica quando il caffè è pronto, non è possibile (o per lo meno alquanto criptico) togliere il porta filtro e lavarlo...",MM,Revisado en Italia el 20 de agosto de 2016
lo abbiamo sostituito,"3,0 de 5 estrellas",purtroppo la fotografia ci ha ingannati pensavamo fosse piu grande e il numero di tazze indicato cioe' 15 ci faceva pensare a tazze da caffe americano e non a tazzine da espresso,gigi,Revisado en Italia el 20 de diciembre de 2016
non c'è filtro,"3,0 de 5 estrellas","non c'era un filltro dentro,come avete scritto,ho comperato un filltro che e arrivato poko fa ma e troppo grande.
E adesso cosa faccio????",Cliente Amazon,Revisado en Italia el 2 de marzo de 2017
Poteva essere migliore,"3,0 de 5 estrellas","Visto che in germania a 15 euro si trovano prodotti equivalenti, ma dalla manutenzione più semplice, direi che si poteva vendere ad un prezzo inferiore. Per il resto mantiene quello che promette.",mizi,Revisado en Italia el 5 de abril de 2016
Prodotto nella media.,"3,0 de 5 estrellas","Il plasticame con cui è prodotto è comunque ben assemblato, funziona bene e per il prezzo non si poteva avere di meglio.
Spedizione perfetta con Prime!",Cliente Amazon,Revisado en Italia el 12 de diciembre de 2015
buon prodotto,"3,0 de 5 estrellas","Arrivato nella data indicata, con confezione integra. Buon prodotto, l'unico neo è il contenitore del caffe che non ha l'imbuto asportabile per la pulizia a fondo",simona,Revisado en Italia el 16 de noviembre de 2015
la calidad de los productos,"4,0 de 5 estrellas",lo uso a diario y me satisface su rendimiento,antonio,Revisado en España el 16 de marzo de 2019
"Pequeña, pero eficiente.","4,0 de 5 estrellas","Una cafetera de goteo normal, tal cual se anuncia, funciona muy bien, no tenemos ningún problema con ella, recomendable para hacer cantidad pequeña de café.",Jose,Revisado en España el 19 de enero de 2017
Utilitario,"4,0 de 5 estrellas",Pequeño pero practico,ricardo,Revisado en España el 13 de agosto de 2019
"bien, pero viene sin filtro","4,0 de 5 estrellas","La cafetera es pequeñita y monisima pero deberian advertir que no trae el filtro para el cafe, detalle que me parece más que importante.",Cristina Trinidad,Revisado en España el 15 de septiembre de 2015
"Cafetera correcta , sencilla, hace el café rapido","4,0 de 5 estrellas","Está bien, es sencilla, hace el café rapido y ocupa muy poco espacio. Da para 6 tazas, la jarra parece fragil",Enric,Revisado en España el 16 de octubre de 2016
Fuciona,"4,0 de 5 estrellas",Todo bien,Cliente Amazon,Revisado en España el 18 de marzo de 2019
Kaffemaskin,"4,0 de 5 estrellas","Liten, fin, lite svårt att ta bort och tvätta men bra ändå.",Cecilia,Reseñado en Suecia el 14 de febrero de 2024
Four Stars,"4,0 de 5 estrellas",very good but little small,Aris,Revisado en Reino Unido el 23 de septiembre de 2017
super,"4,0 de 5 estrellas","elle est superbe, elle fait le job et ne prend pas de place. Facile d'utilisation.",Darlya,Revisado en Francia el 6 de diciembre de 2022
simple mais fonctionnelle,"4,0 de 5 estrellas","idéal pour avoir un café chaud en peu de temps ,léger facile à manipuler et ne prend pas de place .",cat bour,Revisado en Francia el 14 de junio de 2024
Prodotto eccellente,"4,0 de 5 estrellas","Funziona bene per ora, speriamo che duri.",Giorgio Zito,Revisado en Italia el 18 de mayo de 2024
Zweckdienlich und funktional,"4,0 de 5 estrellas","Da unsere alte Kaffeemaschine wirklich in die Jahre gekommen war und zu lecken anfing, wurde sie kurzerhand ausgetauscht. In der Regel bin ich der einzige Kaffeetrinker hier, manchmal noch meine Freundin oder eben Gäste; daher haben wir uns für dieses kleine Modell mit 600 Millilitern Fassungsvermögen entschieden – das macht etwa zweieinhalb Becher (nicht Tassen, wer braucht schon Tassen?). Normalerweise reicht das, ansonsten kann man ja auch fix noch eine zweite Fuhre kochen.

Optisch ist die Maschine ansprechend, auch die Größe ist angenehm und so passt sie super in ihre Ecke, ohne die Küche zu dominieren. Die Verarbeitung ist in Ordnung und zweckdienlich. Insgesamt bin ich zufrieden.

Da es aber irgendwie niemals die perfekte Kaffeemaschine gibt, ganz gleich, in welchem Preissegment man sich umschaut, läuft auch diese hier unter dem Motto »Irgendwas ist halt immer«. Zwei kleine Kritikpunkte. Wenn man die Kanne zu schnell ausgießt, tropft bzw. plörrt sie, was insbesondere beim Wassereinfüllen mit der Kanne leicht passieren kann. Darüber hinaus ist die automatische Abschaltung nach dreißig Minuten etwas kurz, finde ich.

Ansonsten aber eine tolle und kleine und recht günstige zweckdienliche Kaffeemaschine für alle, die in überschaubaren Mengen einfach fix einen Kaffee kochen möchten.",Zen-Cola,Revisado en Alemania el 18 de febrero de 2020
Ottimo rapporto qualità prezzo,"4,0 de 5 estrellas","Presa in offerta. Fa un ottimo caffè americano velocemente: E' un po' plasticosa. Manca il filtro sia monouso che lavabile, quindi bisogna acquistarlo a parte .I filtri trovano su amazon a prezzo accessibile, quindi se volete usarla subito all'arrivo provvedete ad acquistarli in contemporanea.",Domenico,Revisado en Italia el 27 de febrero de 2024
Très bien,"4,0 de 5 estrellas","Mignonne avec son petit format. Très bien. Le seule chose qui m'agace c'est que quand je sors la verseuse, cela entraîne le support du filtre qui s'ouvre. Obligée de le tenir. Il faut aussi appuyer 2 fois pour qu'elle s'allume, mais c'est peut-être une sécurité. Mais c'est tout, j'en suis très contente. Rapide. Mignonne, pratique, le café est bon.",poupounette,Revisado en Francia el 20 de agosto de 2021
brauchbar,"4,0 de 5 estrellas",gut so,sandowski,Revisado en Alemania el 17 de febrero de 2024
Semplice da usare,"4,0 de 5 estrellas","Peccato che nella confezione non era compreso il filtro per il caffè, neanche uno di carta per poter provare subito la macchina, ho dovuto aspettare di acquistarli, per il resto è molto semplice proprio basilare.",Giuseppa,Revisado en Italia el 21 de julio de 2024
CONFIDO IN POSSIBILI RICAMBIO IN CASO DI ROTTURA VETRO,"4,0 de 5 estrellas","Ho dovuto comprare questa macchina perchè avevo rotto la caraffa della precedente, di altra marca. Incredibile che non esistano caraffe di ricambio! alla faccia del rispetto ambientale, ho cercato tra le caraffe universali ma nessuna andava bene. Spero che la Moulinex possa, in caso di necessità, fornire pezzi di ricambio!",Andrea A,Revisado en Italia el 20 de junio de 2024
HANNO DETTO CHE E' OTTIMA,"4,0 de 5 estrellas","HO ACQUISTATO QUESTA MACCHINA DEL CAFFE' AMERICANO PER FARE UN REGALO, INFATTI HO ASPETTATO UN PO' PER SCRIVERE LA RECENSIONE. CHI LA HA USATA HA DETTO CHE E' MOLTO SEMPLICE DA UTILIZZARE ED ESCE UN BUON CAFFE'. NATURALMENTE NON E' ITALIANA E QUINDI NON E' ABITUATA A BEVE IL NOSTRO OTTIMO CAFFE' RISTRETTO.",Fabio,Revisado en Italia el 21 de mayo de 2024
Caffè americano,"4,0 de 5 estrellas","Macchinetta per caffè americano molto semplice da fare funzionare e molto semplice da pulire.
Mi sarebbe piaciuto il filtro fosse compreso.
Ne ho acquistato uno riutilizzabile.",Cliente Amazon,Revisado en Italia el 24 de mayo de 2024
Buon prodotto,"4,0 de 5 estrellas","Buon prodotto, funziona perfettamente e il caffè è ottimo",Marta,Revisado en Italia el 20 de abril de 2024
Ottimo,"4,0 de 5 estrellas",La semplicità,TEXLUCIANO,Revisado en Italia el 31 de marzo de 2024
comoda,"4,0 de 5 estrellas","Il caffè e ben caldo e mantiene la temperatura.
E' facile da pulire
Peccato che non è compreso il filtro, ma è solo un dettaglio",davide,Revisado en Italia el 1 de marzo de 2024
Cafetière,"4,0 de 5 estrellas",Déçu de la taille,ROLIN Sandrine,Revisado en Francia el 17 de enero de 2024
buon prodotto,"4,0 de 5 estrellas","Buon caffe americano, consigliata",Cliente Amazon,Revisado en Italia el 26 de enero de 2024
Ottimo anche x orzo,"4,0 de 5 estrellas",La trovo comoda sia x orzo che caffè amiricano. Negativo il fatto che non è provvisto di filtro,Riccardo,Revisado en Italia el 6 de diciembre de 2023
Durata: 5 anni (quasi),"4,0 de 5 estrellas","Dunque, a distanza di 5 anni ha cominciato a non pompare più l'acqua dal serbatoio al caffè, in questo istante sto scrivendo la recensione e scegliendo la mia nuova macchina - la accendo una volta al giorno e ho fatto 3 volte la decalcificazione in questi anni, quindi non so se la durata è conforme alle aspettative, per me ci può stare.
Da segnalare che la caraffa si è rotta dopo circa 3 anni, il vetro è molto sottile e delicato.
Nel complesso? Per quello che l'ho pagata (29€ nel 2018) mi ritengo abbastanza soddisfatto.",Mikhail,Revisado en Italia el 20 de mayo de 2023
Bien,"4,0 de 5 estrellas",Fonctionne très bien,Alain,Revisado en Francia el 15 de noviembre de 2023
Funktion,"4,0 de 5 estrellas","ist für Einzelpersonen ganz ok. Nach Filterkorb Reinigung sollte dieser wieder leichter eingehängt werden.
ist ein bisschen Fummelei !",Hillerbrand Hubert,Revisado en Alemania el 15 de diciembre de 2023
Cafetière 6 tasses,"4,0 de 5 estrellas","J'en ai déjà une dont je suis très satisfait, j'ai racheté celle-ci pour l'avoir en cas de panne ou de casse, je n'imagine pas un petit déjeuner ou un après-repas sans café.",popof62,Revisado en Francia el 13 de agosto de 2023
bon produit,"4,0 de 5 estrellas","En remplacement du modèle précédent blanc légèrement différent, utilisé pendant 10 ans.
Correspond à mon attente. Il a été nécessaire de monter le système anti goutte livré en pièces détachées par Amazon. Il faut acheter ou retailler le filtre permanent de la cafetière précédente.",bricoleur,Revisado en Francia el 22 de junio de 2023
Chip ma fa' tutto quello che deve.,"4,0 de 5 estrellas","Materiali molto scarsi le plastiche intendo ma nonostante tutto fa' bene quel che deve, e' la prima che compro non ero sicuro di usarla molto invece la uso 2 volte al giorno con l'orzo e sta' durando, nonostante al primo tocco pensassi si spaccasse per le plastiche debulucce, magari con il senno di poi prenderla un po' meglio usandola spesso sarebbe stato meglio ma ormai finche' dura, molto comodo il sistema salva goccia permette di togliere la caraffa mentre fa' il caffe'.",Francesco,Revisado en Italia el 28 de noviembre de 2022
Kaffee schmeckt,"4,0 de 5 estrellas","Soweit alles gut.
Nur: Leider ist auf der Kanne keine Tassenanzeige.
Das ist beim Mitbewerber besser.",Peter,Revisado en Alemania el 10 de octubre de 2023
Ottima per esigenze basic,"4,0 de 5 estrellas","La macchina è piccola e leggera, sicuramente non trasmette l'impressione di un oggetto indistruttibile, ma è vero altresì che devo farci il caffè e non il bungee jumping, immagino sarà sufficiente starci giusto un po' attenti. Il caffè, dopo le prime tre o quattro volte esce piuttosto soddisfacente; ka caraffa dà l'impressione di essere molto piccola, ma ne escono tranquillamente tre belle mug piene. La pulizia è facile poiché il cassettino del caffè si smonta e rimonta facilmente per lavarlo. Non vi è filtro in dotazione e bisogna usare quelli in carta della misura 2. Quello che per qualcuno (letto in altre recensioni) risulta essere un difetto, ossia lo spegnimento automatico dopo 30 minuti, è per me è un grande vantaggio, poiché di solito preparo il caffè la sera per berlo freddo la mattina e mi capitava invece molto spesso con la mia vecchia macchina di lasciarla accesa tutta la notte, con odiose conseguenze e spreco di energia. Pertanto, se vi serve un oggetto poco ingombrante e poco rumoroso che in pochi minuti prepara 3 tazze di caffè e poi si spegne automaticamente, questo è decisamente un ottimo acquisto. Se invece le vostre esigenze sono meno basic, mi rivolgerei, al contrario, verso altri acquisti.",Diletta,Revisado en Italia el 8 de octubre de 2019
La mia macchina da caffè all'americana,"4,0 de 5 estrellas","Premetto che sono una neofita del caffè di questo tipo, ma devo dire che è sono soddisfatta: facile da usare, da pulire, il caffè per me ha buon gusto, è piccola quindi adatta a piccoli spazi. Inizialmente ho comprato i filtri in carta n.2 ma volevo qualcosa che durasse di più e sono passata ad un filtro in rete tipo colino, quindi meno usa e getta. Facile da pulire la brocca, io aspetto sempre che si raffreddi prima di lavarla perché il vetro mi sembra molto sottile e il porta filtro è facilmente staccabile per pulirlo. Il prezzo è ottimo, io l'ho comprato nell'outlet di amazon pagandolo una sciocchezza quindi ancora più felice.",nemodill,Revisado en Italia el 16 de diciembre de 2021
