title,rating,body,author,date
Una manera diferente de hacer un buen café,"5,0 de 5 estrellas","Me gusta su forma, su practicidad, su manejabilidad. Y me gusta cómo sale el café, que si es bueno, está bien rico.",Amaia,Revisado en España el 25 de octubre de 2021
Robusta y elegante,"5,0 de 5 estrellas",Muy buena calidad. Elegante y muy práctica. Cumple perfectamente su función y es preciosa!,Cliente Amazon_1,Revisado en España el 17 de agosto de 2021
Tanta cápsula y tanta historia,"5,0 de 5 estrellas","Vivimos a toda pastilla y lo queremos todo para ya!. Pues bien con esta cafetera harás el café tú mismo, tranquilamente y en menos de diez minutos ya lo estarás saboreando. Lo que sí que convendría es un hervidor de agua con cuello de cisne para ir echando el agua mejor y más comodamente.
Por lo demás, genial!",Zorro Veloz,Revisado en España el 22 de junio de 2021
Hario,"5,0 de 5 estrellas","Es que no hay más, este marca no tiene un objeto que no esté bien hecho. Si estás buscando un cono este es un 10/10.",Julian M,Revisado en España el 6 de junio de 2021
SORPRENDENTE,"5,0 de 5 estrellas","SOPRENDIDO. Material sólido (porcelana), fácil de limpiar, es muy fácil y sencillo de usar y el sabor del café es totalmente distinto a cualquier otro método de extracción. Sencillo: hervir agua en tetera, situar filtro adecuado (tamaño y diseño) al V60, hechar la cantidad deseada de café molido (viene con cuchara medidora) y echar el agua hervida. Se recomienda primeramente aclarar el filtro ora arrastrar impurezas y realizar la técnica “propia” del V60 (preinfusión o blum y después el resto del agua). Simplemente situando el V60 en la taza donde vas a degustar el café, suficiente. No necesita más accesorios. Si deseas preparar más cantidad o un café más ligero, etc; es jugar con las cantidades de agua, café o de un recipiente donde verter el líquido mientras infusionas el café en vez de la taza. ESPECTACULAR el sabor que se saca del café. Literalmente: una infusión. MUY RECOMENDADO.",Enrike,Revisado en España el 6 de mayo de 2021
Calidad-precio nivel legendario,"5,0 de 5 estrellas","Filtro, el V60 este y la jarra de cristal de una cafetera vieja y pa' que más.
Las 3 B, bueno, bonito y barato",PabloPrado,Revisado en España el 30 de marzo de 2021
perfect,"5,0 de 5 estrellas",perfect,Sendas,Revisado en España el 16 de enero de 2021
Bonito y práctico,"5,0 de 5 estrellas","Me parece muy buen producto. Su tamaño es ideal para 1ó 2 personas. No obstante, hoy en día hubiese comprado el de plástico por ser más versátil y resistente, pudiéndolo llevar de viaje por su poco peso",Jose Alberto Monreal Nï¿½ï¿½ez,Revisado en España el 5 de noviembre de 2020
Lo que buscaba... ahora el café es otra historia,"5,0 de 5 estrellas",Fantástica calidad y justo lo que buscaba. Muy contenta. Lo recomiendo.,Marta,Revisado en España el 3 de septiembre de 2020
"Muy buen producto, como todo lo de Hario","5,0 de 5 estrellas","Tengo bastantes productos de Hario, como siempre, muy buena calidad!!",Esperanza,Revisado en España el 22 de julio de 2020
La calidad del producto.,"5,0 de 5 estrellas","Muy buena calidad, excelente.",Cliente Amazon,Revisado en España el 30 de diciembre de 2019
Excelente,"5,0 de 5 estrellas","Estoy enamorado de mi V60, excelente café, fácil de limpiar, cafe limpio y de gran sabor !",Cliente de Amazon,Revisado en España el 9 de diciembre de 2019
Excelente!,"5,0 de 5 estrellas",Una de las mejores formas de extraer café,DanLandaz,Revisado en España el 16 de septiembre de 2019
Gran calidad,"5,0 de 5 estrellas",Perfecta para el café de filtro,Maria José,Revisado en España el 28 de julio de 2019
Para los amante del café,"5,0 de 5 estrellas","estoy muy contenta!
Como una amante del café!",Eliane nunes,Revisado en España el 19 de marzo de 2019
Cumple su función,"5,0 de 5 estrellas","Poco hay que decir de este V60.

Con los filtros adecuados a su tamaño y un buen café, sale delicioso.

Cometí el error de no comprar la jarra a juego (o un kit que vienen ambos) y la que yo tengo no encaja del todo bien. Aún así funciona de maravilla y lo recomiendo. Ha sido todo un descubrimiento.",GatoMelon,Revisado en España el 2 de agosto de 2018
Diseño perfecto,"5,0 de 5 estrellas","Hace un café muy rico.
Se comporta de forma muy estable sobre el vaso gracias a la guía inferior y a su peso de buena cerámica. La parte inferior hace las veces de tapa, ayudando a que quede cerrado el recipiente manteniendo el calor del café. Antes usaba uno comprado en Tiger y no hay color, se caía fácilmente y el café se enfriaba enseguida.",san,Revisado en España el 28 de marzo de 2016
Genial,"5,0 de 5 estrellas",Exactamente como se describe el producto. El café que sale tipo melita es suave pro muy sabroso. La calidad de la cerámica japonesa es muy buena.,María Jesús Picot Castro,Revisado en España el 31 de julio de 2015
none,"5,0 de 5 estrellas",best NO 1,Hong Kim,Revisado en los Estados Unidos el 6 de julio de 2024
"Great purchase. Stays clean, don't stain, filters coffee better than round pan type.","5,0 de 5 estrellas",I love that all you have to do is rinse this thing. I still don't see any coffee stains. Great purchase.,FloridaJo,Revisado en los Estados Unidos el 15 de junio de 2024
Best pour over ever,"5,0 de 5 estrellas",Love this - it's perfectly shaped and has enough room to make about 4-6 cups. The material is dense and holds the heat. Take a few minutes to watch the little video - they give some great tips. Makes great coffee and clean up is a snap.,Piper,Revisado en los Estados Unidos el 11 de junio de 2024
Good pour over,"5,0 de 5 estrellas","Solid product. Ridges allow for air to escape while you pour your coffee over into your mug/cup/thermos.

Step 1 wet your conical coffee filter
Step 2 put in grounds
Step 3 pour over coffee in spiraling fashion

Done in 3 minutes start to end",Ben Y.,Revisado en los Estados Unidos el 9 de junio de 2024
"5 years, still going strong","5,0 de 5 estrellas","I've rinsed this thing into cold water while it was still hot so many times and yet there's not a single crack on it. Makes reliable pour overs, though do take note of the singular, large hole at the bottom. You'll have to pour water a bit differently with that in mind. I recommend looking up how to pour over a v60.",Amazon Customer,Revisado en los Estados Unidos el 6 de junio de 2024
It’s glass be carefull,"5,0 de 5 estrellas",I like the weight and feel of the coffee maker,scott harbaugh,Revisado en los Estados Unidos el 5 de junio de 2024
Comodo,"5,0 de 5 estrellas",Buon prodotto a prezzo giusto,Bogdan Pielesiak,Revisado en Italia el 16 de mayo de 2024
Quality,"5,0 de 5 estrellas",Quality ceramic material. Works great for a truly rich cup of coffee. Dishwasher safe.,Mark O.,Revisado en los Estados Unidos el 5 de mayo de 2024
Chemex Filter,"5,0 de 5 estrellas",Chemex Filters fit the 02 perfectly,Pete,Revisado en los Estados Unidos el 3 de mayo de 2024
Nothing out does the v60,"5,0 de 5 estrellas",Perfect for any coffee addict to make a great cup of coffee,Cody Torgerud,Revisado en los Estados Unidos el 29 de abril de 2024
計量スプーンがついてない？,"5,0 de 5 estrellas",商品説明には付属品としてＶ60計量スプーンと記載されているが入ってなかった。困るよね。,Amazon カスタマー,Revisado en Japón el 26 de abril de 2024
Brews Flavorful Coffee!,"5,0 de 5 estrellas","I use to have Hario Dripper at work and Chemex at home. Both brew great coffee, although Hario may brew a few seconds faster. Bought a new Hario Dripper and the Hario glass server. Use a ""Coffee Sock"" cotton brew filter (found on Amazon). Rinse thoroughly after use. Change every 6-months. Highly Recommend Hario coffee system. Brews great coffee. Easy to clean.",Denim Blue,Revisado en los Estados Unidos el 25 de abril de 2024
Great Product,"5,0 de 5 estrellas",Super convenient to clean and use. Highly recommend for someone getting into pour over.,Kip Roland,Revisado en los Estados Unidos el 24 de abril de 2024
Works great.,"5,0 de 5 estrellas","Makes a great cup of coffee. Not much more to really say about it. It does what it’s supposed to and you don’t have to worry about drinking plastic particles, although it’s probably too late for our bodies anyway. Still…",Georgie'sGirl,Revisado en los Estados Unidos el 18 de abril de 2024
Me llegó quebrado,"5,0 de 5 estrellas","Mi filtro me llego quebrado, por favor ponerle mas seguridad al momento de enviar filtros o sus productos",Amazon Customer,Revisado en los Estados Unidos el 14 de abril de 2024
"Recomendo, de acordo com as expectativas.","5,0 de 5 estrellas","Recomendo, de acordo com as expectativas.",Itamar Santos de Andrade,Revisado en Brasil el 11 de abril de 2024
普通のペーパーフィルターでも問題なく使用できます早いが味は良い,"5,0 de 5 estrellas","2007年に購入して以来ずっとカリタのドリッパーと併用して使用し続けてきました。
その結果やはり長持ちしていいものは良かったです。
気に入った点
1.　早い
2.　おいしい
3.　陶磁器が丈夫かつ長持ちする
4.　普通のパーパーフィルターでも全く問題なく淹れれた
気に入らなかった点
1.　やはり普通のに比べて違和感がある
2.　濃い飲み物は早くドリップされるので作りにくい
3.　少し重いかも
4.　底の円形が大きく小さなカップには収まらない
総じて結論から申し上げますと満足です。
要するに、普通のペーパーフィルターで大丈夫で早く淹れれて味も良い。
独特の味・フレーバーがしますが特殊な濃いものを淹れるのでなければ問題なく使用できる。
ということでした。
長く使用してきましたが丈夫で長持ちしきれいに保てて気に入りのドリッパーです。
やはり、カリタと一緒に使用し続けてきましたがいいものはいいですね。
ということです。",Faith,Revisado en Japón el 8 de abril de 2024
Last 4.5 years before cracking,"4,0 de 5 estrellas","Last 4.5 years before cracking down the side, though it’s still usable. Decent quality and has helped me enjoy amazing pour overs.",wutagai,Revisado en los Estados Unidos el 6 de abril de 2024
Healthier Brew with Hario V60 Ceramic Coffee Dripper,"5,0 de 5 estrellas","After experimenting with several pour-over devices, including plastic models, I've made a pivotal switch to the Hario V60 Ceramic Coffee Dripper. This decision was heavily influenced by concerns over microplastics and their potential harm to our health. The switch to ceramic not only aligns with a healthier lifestyle but also enhances my coffee brewing experience.

The V60’s design offers incredible control over the brewing process, accommodating both beginners and coffee aficionados. Its ceramic construction maintains a consistent brew temperature, ensuring each cup is crafted to perfection. Additionally, the sleek, white ceramic dripper isn’t just functional—it adds a touch of elegance to my coffee ritual.

In short, the Hario V60 Ceramic Coffee Dripper has not only elevated my coffee game but also provided peace of mind by minimizing health risks associated with plastic use. It’s a worthwhile switch for anyone looking to improve both their coffee quality and their well-being.",Michael W. Shum,Revisado en los Estados Unidos el 29 de marzo de 2024
"Purchased as a gift, niece very happy","5,0 de 5 estrellas","Well made, did its job well.... happier with ceramic than plastic.",MGW,Revisado en los Estados Unidos el 27 de marzo de 2024
Literally my favorite Amazon purchase!!!,"5,0 de 5 estrellas","After using Kcups for years, I finally decided to give pour over coffee a try. So I picked up a pound of ground Philz coffee, ordered this and also the filters made for this and gave it a try. It’s literally the best coffee I’ve ever made at home! And no more using many plastic Kcups every day. The filter and grounds are compostable and I have an electric tea kettle so warming up the water to right temperature is super easy and fast. I’m a coffee addict and highly recommend you giving this a try! The coffee is better, it’s a “greener” way to make coffee and clean up is so easy!!",Lisa,Revisado en los Estados Unidos el 25 de marzo de 2024
Plastic Free,"4,0 de 5 estrellas","I'm trying to cut down on my plastic use, so when I needed a V60, I plumped for this one despite James Hoffman's disapproval. It does take a little more 'warming' than a plastic one would, but that is relatively easily achieved by running it - and the filter paper - under the hot tap - or by using the surplus water which most people will already have in their kettle.
It seems much more robust than plastic - and has a nice 'feel' to it.",Wierdostomps,Revisado en Reino Unido el 24 de marzo de 2024
"Easy ,efficient and cost effective- no plastic parts and easy to clean","5,0 de 5 estrellas",Takes up almost no space on counter. Makes wonderful drip coffee. I use a small glass carafe with this,I ordered 2 sets for a total of 4 lanterns. Only 2 came and they charged me for 4. Then after 3 days they stopped working! Couldn’t get help from Amazon so I’m thinking of canceling me membership! Ugh! Embarrassed as this was a Mother’s Day gift!,Revisado en los Estados Unidos el 21 de marzo de 2024
"Viel zu winzig, komplett rund; 1x4-Filter passt nicht","1,0 de 5 estrellas","Irgendwie hatte ich ja noch Hoffnung, als ich nach langem Hin und Her dann diesen ""Hario VDC-02W V60 Kaffeefilterhalter, Porzellan, Größe 2, 1-4 Tassen, 300ml, weiß"" auswählte. Zuhause ausgepackt traf mich dann der Irrtum mit der vollen Breitseite: Dieser Filterhalter ist nie und nimmer für ""4 Tassen"" geeignet, denn er ist winzig! Und seine runde Form verhindert die sinnvolle Aufnahme eines in Deutschland üblichen Papierfilters.

FAZIT
Dieses Produkt mag in Japan funktionieren. Dort ist ja manches ein bisschen kleiner. Zudem gibt es dort offensichtlich runde Filtertüten. Hier in Germany ist das ganz anders.

Keine Kaufempfehlung!",motivkontrast,Revisado en Alemania el 13 de marzo de 2024
Overhyped,"1,0 de 5 estrellas","I was SO disappointed that the whole in the bottom of this dripper is SOOOOO large, that the water literally runs thru it so fast that there is little time for the water to coffee grounds interface to actually tooooo short for ""brewing"" to happen And the paper filters tear at the bottom from the lack of resistance to the water flow",Dokioki,Revisado en los Estados Unidos el 29 de febrero de 2024
The gold standard for drip coffee,"4,0 de 5 estrellas",High quality.,Amazon Customer,Revisado en los Estados Unidos el 20 de febrero de 2024
Good product,"5,0 de 5 estrellas",On time,Robert Byers,Revisado en los Estados Unidos el 19 de febrero de 2024
9年目になりました,"5,0 de 5 estrellas","2015年4月に購入してから9年になりますが、まだまだ立派な現役です。
このサーバーで淹れるとコーヒーがまろやかで広がりのある味わいになります。サーバーでこうも違うものかと、不思議です。たまに違うサーバーで淹れますが、やっぱりハリオがいい。
落として縁が欠けましたが、問題なく使えています。これからも人生を一緒に過ごしてほしい仲間です。",guranobi,Revisado en Japón el 9 de febrero de 2024
Porta filtro de porcelana de excelente qualidade,"5,0 de 5 estrellas","Porta filtro de porcelana de excelente qualidade, mantendo a temperatura da água durante a filtragem do café. Por isso, melhor que preta filtro de plástico. Além disso, o utensílio é bonito, agradando quem gosta de preparar o café. Como todo produto da Hario, é de alta qualidade. Recomendo.",Eduardo Candido da,Revisado en Brasil el 9 de febrero de 2024
Wertig,"5,0 de 5 estrellas","Ist schon mein 2. Filterhalter. Sehr wertig, wie beschriben eine tolle Idee den Durchlauf des Kaffees nicht durch kleine Löcher zu begrenzen, sondern duch den Mahlgrad (darum hat dieser Filter ein großes loch).",rastelli,Revisado en Alemania el 8 de febrero de 2024
Worst coffee filter holder I have ever used.,"1,0 de 5 estrellas","As someone who has used mini mini forms of coffee filter holders over the years for pour over style coffee I can say without a doubt this is the worst one in existence.

There is frankly a giant hole in the bottom and no matter what kind of coffee filter you use it will burst and all of your coffee grounds will go into your cup.

This is a classic example of someone who designed something without ever using it.

It doesn't matter what material it is made out of if there is a giant hole in the bottom of it your coffee filter is going to burst and it's not going to turn out good and you're going to have a bad morning.

Skip this one entirely. Don't even look at it. Find one with smaller holes designed by somebody who actually drinks coffee.",Casey,Revisado en los Estados Unidos el 8 de febrero de 2024
La meilleure façon de faire du café,"5,0 de 5 estrellas",Le slow coffee est la meilleure façon de faire le café pour moi et ce système est excellent pour cette pratique. Je recommande vivement.,Yannick,Revisado en Francia el 1 de febrero de 2024
Beautiful & easy to use,"5,0 de 5 estrellas","A very elegant little pour-over filter holder. It's well-made, holds water hot and has a perfect size hole at the bottom. Personally, I prefer a Bialetti Mokka but my houseguests are very happy with this. I only wish they made it out of another material as porcelain gets smashed very quickly in my busy household. I am using the Hario brand filters so I can't tell you what it would be like using another kind but I am guessing that in a pinch, a folded paper towel might work too.",A. Meer,Revisado en los Estados Unidos el 31 de enero de 2024
汚れ知らずの白　スタンダード！,"5,0 de 5 estrellas",以前は、ガラス製を使っていましたが、案外、汚れが目立ちました。白にしたのですが、黄ばみにくいので、驚きました。シンプルで美しいスタイルに感動して、毎日の生活が楽しくなりました。,ブルーランナー,Revisado en Japón el 28 de enero de 2024
Coffee Drip...pour-over,"5,0 de 5 estrellas",Love this...the coffee is outstanding!,Chere,Revisado en los Estados Unidos el 27 de enero de 2024
Great minimalists coffee maker,"5,0 de 5 estrellas",Simple to use and versatile for pour over in a coffee mug or carafe. Great for use in a travel mug!,Carl Gregory,Revisado en los Estados Unidos el 23 de enero de 2024
Simply Superb,"5,0 de 5 estrellas",Simply Superb,Michael Johnson,Revisado en Reino Unido el 18 de enero de 2024
Surprisingly high quality,"5,0 de 5 estrellas","This is a great quality product, much better than comparable items.",JP,Revisado en los Estados Unidos el 9 de enero de 2024
Molto comodo,"5,0 de 5 estrellas",Pratico e comodo,Cliente Amazon,Revisado en Italia el 5 de enero de 2024
Fast and strong,"5,0 de 5 estrellas","Make sure you buy the right filters!

The big hole in the bottom makes the coffee flow quicker than more traditional pour over setups.",happy peeps,Revisado en los Estados Unidos el 4 de enero de 2024
Perfekt för v60 bryggning,"5,0 de 5 estrellas",Går utmärkt att brygga 4 koppar kaffe. Bra kvalitet och lätt att diska.,Mfor,Reseñado en Suecia el 27 de diciembre de 2023
My favorite way to make coffee,"5,0 de 5 estrellas",V60 pour over is my favorite way to make coffee. This is my second one. The first had a tragic fall; but had lasted several years. Great quality and long lasting; and makes an excellent cup of coffee.,Natalie,Revisado en los Estados Unidos el 23 de diciembre de 2023
ちょっと特殊,"4,0 de 5 estrellas",形状が普通のドリッパーと異なるので、どこでも買えるフィルターペーパーは使えない。また、ドリッパーの下部が小さいので、口径が大きいサーバーには使えない。サーバーもセットで買えばよかったかな？,モモのパパ,Revisado en Japón el 11 de diciembre de 2023
good coffee,"5,0 de 5 estrellas","I have purchased and used two sizes, and the grooves on the inside allow the extracted coffee to go into the cup without spilling. Since it is not made of plastic, it is safe to pour hot water on and also looks pretty. I have tried many different products, but this product is the best for making coffee.",sugarland,Revisado en los Estados Unidos el 8 de diciembre de 2023
Love it,"5,0 de 5 estrellas",I got this because I prefer the taste of pour over coffee compared to regular brewed coffee. It’s simple and easy to use.,Chloe S.,Revisado en los Estados Unidos el 6 de diciembre de 2023
Guter Keramikfilter,"4,0 de 5 estrellas",Guter und scheinbar robuster Keramikfilter. Der Kaffee schmeckt sehr gut.,Thomas,Revisado en Alemania el 5 de diciembre de 2023
"Used to do French Press, this is a smoother taste and how good coffee should be made always","5,0 de 5 estrellas","Used to do French Press, this is a smoother taste and how good coffee should be made always.",Amazon Customer,Revisado en los Estados Unidos el 30 de noviembre de 2023
Toller Kaffeefilterhalter,"5,0 de 5 estrellas",Zusammen mit dem Filter holt man mehr heraus. Material super. Danke.,Amazon Kunde,Revisado en Alemania el 25 de noviembre de 2023
The best for pour over,"5,0 de 5 estrellas","Makes the best pour over coffee. A friend who has a pop-up coffee shop has tested all the brands and swears this is the best. I agree and love it. I own two, one for home and one for travel",MyFavFork,Revisado en los Estados Unidos el 21 de noviembre de 2023
"Tolle Geschenk, für Kaffeeliebhaber","5,0 de 5 estrellas","Der Hario VDC-02W V60 Kaffeefilterhalter aus Porzellan in der Größe 2 ist eine exzellente Wahl für Kaffeeliebhaber. Sein schlichtes, weißes Design verleiht der Zubereitung einen Hauch von Eleganz. Mit einer Kapazität von 1-4 Tassen und 300ml bietet er die perfekte Größe für individuelle Bedürfnisse. Die Konstruktion aus hochwertigem Porzellan sorgt für eine optimale Temperaturstabilität während des Brühvorgangs. Die Form des V60 ermöglicht eine gleichmäßige Extraktion des Kaffeearomas, und das Ergebnis ist ein köstlicher Kaffee mit intensivem Geschmack. Ein Must-Have für Kaffeegenießer, die Qualität und Ästhetik gleichermaßen schätzen.",S,Revisado en Alemania el 18 de noviembre de 2023
Kaffee-Verschwender weil Abflussloch zu groß,"2,0 de 5 estrellas","Die Filter von Hario sind sehr gut, der Kaffee schmeckt tatsächlich besser. Mit dem Filterhalter bin ich allerdings überhaupt nicht einverstanden, das Loch, durch das der Kaffee abfließt, ist viel zu groß, deshalb wird der Kaffee zu dünn. Man müsste viel mehr Kaffee dosieren als gewohnt, um einen ordentlichen Geschmack zu erzielen, das empfinde ich als Verschwendung. Ich verwende deshalb die Hario Filter in einem üblichen Melitta-Kaffeefilterhalter aus Porzellan, und das klappt (und schmeckt) sehr gut. Tipp: Für die gebräuchlichste 1x4 Filterhaltergröße den Filter Hario VCF-03 verwenden, die VCF-02 sind etwas zu klein dafür.",M. Boehm,Revisado en Alemania el 3 de noviembre de 2023
Beste Kaffeefilter....,"5,0 de 5 estrellas","... Den ich bisher benutzt habe.
Mit den passenden filtern sehr gut.
Benutze ich seit dem Kauf nur noch und ich habe meine normale Filtermaschine in den Keller gepackt.",Linkenbock,Revisado en Alemania el 3 de noviembre de 2023
It works sometimes,"3,0 de 5 estrellas","Because this item is so popular, I went against my better judgement and purchased it. I generally use a chemex or those plastic one-cup cones. The one-cup cones I've used are inexpensive, yet properly made. There are generally a few tiny holes at the bottom that allow a perfect amount of coffee to filter through whilst holding the filter and grounds in place. It's not rocket science, so I'm surprised with how off this design is. To my surprise, this model works sometimes. I assumed the very large hole at the bottom wouldn't be supportive enough to hold the wet filter and grounds, but it sometimes does. The other half of the time, they all fall through into your cup - which isn't surprising at all. What is surprising is that this seems to be working for others. I'm at a loss. It's like seeing thousands of reviews for a product that requires a round peg to be jammed into a smaller square hole. How is everyone doing it? I feel gaslit.",amazonwoman,Revisado en los Estados Unidos el 29 de octubre de 2023
Very happy with this,"5,0 de 5 estrellas","I use this when I have guests or if I want just a ""regular"" coffee. Very happy with it. Works great and makes great tasting coffee.",Feather,Revisado en Reino Unido el 21 de octubre de 2023
"Looks great, can't wait to try","5,0 de 5 estrellas","Product was packaged very securely. Looks great, can't wait to put it to good use.",Joe D.,Revisado en los Estados Unidos el 21 de octubre de 2023
Works great-sturdy,"5,0 de 5 estrellas","I use this daily! The ridges help make the most of the pour-over... making sure things flow properly for best flavor. This goes great in the dish-washer when needed, very sturdy.",chris,Revisado en los Estados Unidos el 17 de octubre de 2023
Used it for years,"5,0 de 5 estrellas",This is the second one of these I bought. I broke my last one during a move from house to house and I knew I had to replace it. The filters for it are affordable and I love the pour over coffee taste. It's quick to setup and easy to clean. I even bought a red one for my wife!,James Martin,Revisado en los Estados Unidos el 10 de octubre de 2023
