title,rating,body,author,date
Buena cafetera,"5,0 de 5 estrellas","Desde el primer día a funcionado de maravilla, hace muy buen café.",antonio,Revisado en España el 21 de marzo de 2024
Falta el Filtro Permanente,"4,0 de 5 estrellas","Compre esta Cafetera porque es una marca que tiene un familiar y he conocido bien su fiabilidad, pero me ha sorprendido y decepcionado este modelo en concreto por un par de cosas. Primero y lo más importante es que no trae filtro permanente y en la explicación del producto no consta en ningún sitio. Y segundo el interruptor de encendido que trae no me convence mucho. No obstante, la cafetera funciona correctamente aunque tiene todavía poco uso, de ahí mi valoración.",Cliente Amazon,Revisado en España el 16 de marzo de 2024
Práctica,"5,0 de 5 estrellas",Bonita por su tamaño y de buen precio,Marcos,Revisado en España el 6 de marzo de 2024
Sencilla,"4,0 de 5 estrellas",Fue para un regalo. Manejo sencillo.,Inmaculada García,Revisado en España el 23 de diciembre de 2023
Rapido,"5,0 de 5 estrellas","Bien producto, hace rápido el café y es práctico",Cristina,Revisado en España el 15 de diciembre de 2023
Calidad precio,"5,0 de 5 estrellas",Rapida y buena.,Marcos,Revisado en España el 13 de diciembre de 2023
Buena cafetera,"4,0 de 5 estrellas",Muy buen café.... que más se le puede pedir.,Jacinto T. R.,Revisado en España el 4 de diciembre de 2023
Tamaño perfecto para una persona,"5,0 de 5 estrellas","Ocupa poco, es ligera y hace bien el café, para una persona o dos está bien, y da para 4 tazas grandes ó 6 normales, de cada vez.",Chanel,Revisado en España el 3 de diciembre de 2023
Bonita,"4,0 de 5 estrellas","Cafetera de goteo pequeña de seis tazas,que hace lo que debe sin más.",Maria,Revisado en España el 13 de noviembre de 2023
Cafetera,"1,0 de 5 estrellas",A un mes de usar empezo a soltar agua.Sale agua por abajo y ya no lo puedo usar.No recomiendo a comprar.,mirela,Revisado en España el 30 de octubre de 2023
Funciona muy bien,"5,0 de 5 estrellas",Es ideal para 1 persona,CMC,Revisado en España el 20 de agosto de 2023
Buena calidad precio,"5,0 de 5 estrellas",Tiene un tamaño ideal. Es muy fácil de usar y da alrededor de 6 tazas de café de buen tamaño. Muy buena compra.,Cliente Amazon,Revisado en España el 16 de agosto de 2023
Ya se ha roto,"1,0 de 5 estrellas",No ha llegado a 2 años lo que ha durado.,Faccelly,Revisado en España el 3 de agosto de 2023
Compacta y útil,"5,0 de 5 estrellas",Buen desempeño! Relación precio esta perfecta!,Tania David,Revisado en España el 1 de agosto de 2023
Cafetera desastre,"1,0 de 5 estrellas",Llegó con la tapa rota,Radu Edith,Revisado en España el 29 de julio de 2023
Práctico y fácil de limpiar.,"4,0 de 5 estrellas","Me gusta lo práctico y rápido que es, recomiendo el filtro reutilizable, se ahorra en filtros de papel y es fácil de limpiar.",Cliente Amazon,Revisado en España el 23 de julio de 2023
Ezcelente producto,"5,0 de 5 estrellas",Hace un café muy buenos y es muy facil de usar y limpiar.,Maria,Revisado en España el 3 de julio de 2023
Buenísima,"5,0 de 5 estrellas","Creó que la tengo hace 1 año. Funciona super bien, fácil de limpiar y de buena calidad!",Marina,Revisado en España el 26 de junio de 2023
Ótima para um casal,"5,0 de 5 estrellas","Que não bebe muito café pois é bem pequenina, pra nós foi ótimo!",Camila Moraes,Revisado en España el 12 de junio de 2023
"La Calidad,el precio y el envío,todo inmejorable y","5,0 de 5 estrellas",,Brigitte Braun,Revisado en España el 4 de junio de 2023
Desfrute de um Café Delicioso com Facilidade e Rapidez,"5,0 de 5 estrellas","Recentemente, adquiri a Moulinex Subito FG1508 Cafeteira de Filtro e fiquei muito satisfeito com o sabor, a rapidez e a praticidade que este aparelho oferece. Para quem aprecia um bom café filtrado e busca uma máquina eficiente e fácil de usar, a Subito FG1508 é uma excelente escolha.

Um dos pontos fortes desta cafeteira é a rapidez com que prepara o café. Em poucos minutos, consigo desfrutar de um café delicioso e aromático, perfeito para começar bem o dia. A capacidade de 1,25 litros permite preparar várias chávenas de café de uma só vez, tornando-a ideal para uso familiar ou para receber convidados.

A Moulinex Subito FG1508 Cafeteira de Filtro possui um design compacto e elegante, que se adapta facilmente a qualquer cozinha. Além disso, o filtro permanente e a jarra de vidro são removíveis e de fácil limpeza, tornando a manutenção do aparelho simples e rápida.

Outro recurso útil é a função de manter o café quente por até 30 minutos após o preparo. Isso garante que o café permaneça na temperatura ideal, mesmo que não seja consumido imediatamente.

Recomendo a Moulinex Subito FG1508 Cafeteira de Filtro a todos os amantes de café que procuram uma máquina prática e eficiente para preparar um delicioso café filtrado. Com esta cafeteira, desfrutar de um excelente café em casa torna-se uma experiência simples e agradável.",pedro d.,Revisado en España el 8 de mayo de 2023
Interruptor roto en menos de un ano,"2,0 de 5 estrellas","El producto vale el precio que tiene, sin grandes esperanzas. Es un producto con mucho plastico y calidad baja.
Lo que mas me sorprendio que me ha durado menos de un a;o el interruptor no se apaga, se ha quedado prendido hasta la eternidad, estoy esperando una solucion que me de Amazon.
Gracias",Jose,Revisado en España el 3 de mayo de 2023
Pequeña,"1,0 de 5 estrellas",La devolví,Maríjose,Revisado en España el 9 de abril de 2023
Simple y eficaz,"5,0 de 5 estrellas",Llegó con una pieza rajada pero todo fue muy fácil con el vendedor que me envió una nueva. De 10.,Cliente Amazon,Revisado en España el 4 de abril de 2023
Muy buena calidad precio,"5,0 de 5 estrellas",El café sale buenísimo y en un momento. La marca era una garantía pero el sabor es excelente.,A.,Revisado en España el 22 de febrero de 2023
Funciona bien,"4,0 de 5 estrellas","Es la misma que tenemos. De hecho la hemos pedido para tenerla como repuesto, dado que funciona bien.",Manuel,Revisado en España el 19 de febrero de 2023
Tamaño perfecto,"5,0 de 5 estrellas","Buscaba una cafetera que haga buen café pero pesueña, está fue un pedazo de acierto hace un café magnífico y rico, super recomendable",LospelosdeMiriam,Revisado en España el 19 de febrero de 2023
Pequeña y cómoda,"5,0 de 5 estrellas","La cafetera es pequeña, cumple perfectamente su función pero es para aproximadamente dos tazas grandes de café por tanda. La recomiendo.",ZavierLabs,Revisado en España el 15 de enero de 2023
Que funciona bien,"5,0 de 5 estrellas",Me gusta porque funciona bien.Anteriormente tuve una que funcionaba mal y la tuve que tirar.Es una pena que no traiga filtro,Cliente Kindle beatriz,Revisado en España el 14 de enero de 2023
Perfecto,"5,0 de 5 estrellas",Para una Persona perfecto y facil de usar en la mañana.,TT,Revisado en España el 12 de enero de 2023
El tamaño es perfecto pero gotea un poco,"4,0 de 5 estrellas",La utilizo todos los días y para dos o tres tazas es más que suficiente. Ocupa poco y se limpia bien. Lo que no me gusta es que gotea un poco.,Patricia a.,Revisado en España el 6 de diciembre de 2022
7 meses y ya no funciona.,"1,0 de 5 estrellas","Ha durado poco pra ser una primera marca. Después de 7 meses no cuela el agua, otro trasto más que hacen para que dure lo Justo y tengamos que volver a comprar. No lo recomiendo.",Matias E.,Revisado en España el 7 de noviembre de 2022
Fácil de usar,"5,0 de 5 estrellas","Tiene un tamaño mediano, perfecto para cualquier espacio, su uso es muy fácil y sale un café con aroma y muy rico, yo hago para dos tomas pero pongo 3 cucharitas medidoras, así hago un café con leche con bastante color, Tenía filtros de otra cafetera que sobresalen del depósito pero los recortó 1 cm. y sirven igual, Quiero comprar un filtro permanente pero por lo visto para esta máquina no hay y de los que venden en Amazon no sé si quedarán grandes. Esto último es el único inconveniente que le veo, aún y así la recomiendo 100%. Ah otra pega es no poder sacar el depósito donde va el filtro para lavarlo, pero con una bayeta limpia mojada se puede hacer.",M.Teresa,Revisado en España el 13 de octubre de 2022
Que me atienda mi y lleven cuanto antes,"5,0 de 5 estrellas","Me ha gustado y estoy contenta , pero la anterior me llegó rota , y ha donde puedo llevar , o que vengan a por ella , que tengo todo preparado , con la etiqueta que me mandaron , lo imprimí , y todo listo OK",Karmen,Revisado en España el 3 de octubre de 2022
Bueno,"5,0 de 5 estrellas",Para la utilidad que le doy esta perfecto. No es muy antigoteo. Pero para ser una cafetera va de maravilla,Maigualida solorzano,Revisado en España el 1 de octubre de 2022
Buena calidad,"4,0 de 5 estrellas",Cafetera de buena calidad la única pega que le pondría es que el sistema para sacar el filtro no es demasiado cómodo.,Alberto F.,Revisado en España el 24 de septiembre de 2022
Super interessante!,"5,0 de 5 estrellas",Apesar de pequena (como eu queria) as 6 chávenas de café são preparadas rapidamente. Ocupa pouco espaço e é bastante agradável em termos visuais. Vale cada cêntimo.,IVO RODRIGUES,Revisado en España el 29 de agosto de 2022
Buena cafetera,"4,0 de 5 estrellas","Es una buena cafetera en relación calidad precio, no de las mejores del mercado pero cumple",Alejandro,Revisado en España el 7 de julio de 2022
buen producto,"5,0 de 5 estrellas",cumple con su funcion .relacion calidad precio excelente,Cliente Amazon,Revisado en España el 5 de julio de 2022
Pequeña y perfecta,"5,0 de 5 estrellas",Me gusta el tamaño. Y el café sale perfecto. Más que satisfecha,Baez Sobrino Lorena,Revisado en España el 24 de mayo de 2022
un café súper rico y súper calentito.,"5,0 de 5 estrellas","Hace un café súper rico y súper calentito, estoy muy sorprendida. He comprado una segunda cafetera para mi otra residencia y son excelentes!!",Rocio P.,Revisado en España el 21 de mayo de 2022
Normalita,"4,0 de 5 estrellas","Para el uso que le doy, está bien. Quizás es un poco inestable porque a veces al cerrar el compartimiento del cafe, se abre y se derrama el agua. Me ha pasado alguna vez que otra. Por lo demás va genial y para el precio que tiene creo que vale la pena.",Tania,Revisado en España el 17 de mayo de 2022
Perfecta en calidad precio,"5,0 de 5 estrellas","La compré por encargo para una vecina que es mayor, muy exigente a la hora del café. Ella casi siempre le corrije al servicio cuando lo degusta en hostelería, así que no sabía cómo iba a parecerle esta compra. Han pasado ya varios meses, y resulta que está encantada con la calidad de la cafetera y sus resultados. Así que, un 10.",Angela I.,Revisado en España el 11 de mayo de 2022
Funciona algo lenta,"3,0 de 5 estrellas",Hace bien el cafe pero con una lentitud exasperante,Francisco Nieves,Revisado en España el 29 de abril de 2022
Mala,"1,0 de 5 estrellas",Ha funcionado solo 2 veces ahora vuelca el café,Carolina,Revisado en España el 18 de abril de 2022
Perfecta,"5,0 de 5 estrellas","Pequeña y muy fácil de usar, la de toda la vida",Maria,Revisado en España el 10 de abril de 2022
Es facil de utilizar y de limpiarla,"4,0 de 5 estrellas","Es una cafetera sencilla , pero es fácil de usar y hace un café correcto , es un poco ruidosa.",Avalles,Revisado en España el 7 de abril de 2022
Muy pequeña y sin filtro,"1,0 de 5 estrellas",La he devuelto por que es muy pequeña y viene sin filtro. Tampoco encuentro filtros de papel en ese tamaño tan pequeño. Lo unico bueno es que para la devolucion me la vienen a buscar a casa. Ni si quiera la he estrenado.,JOSE A.,Revisado en España el 11 de marzo de 2022
¡Era lo que buscaba!,"5,0 de 5 estrellas",Era lo que buscaba. Ocupa poco espacio. Liviana. Cuela rápido el café. Especial para pocas tazas. Me encanta.,Maye,Revisado en España el 7 de marzo de 2022
En general muy satisfecho,"5,0 de 5 estrellas",Muy buen producto,Cliente Amazon,Revisado en España el 7 de marzo de 2022
Muy satisfecho con la compra.,"5,0 de 5 estrellas",Buena relación calidad-precio. Tiene un diseño muy elegante. La volvería a comprar.,Spirit,Revisado en España el 4 de febrero de 2022
Práctica y funcional,"5,0 de 5 estrellas","Tamaño adecuado con buenos acabados, fácil de usar",J. R. M,Revisado en España el 28 de enero de 2022
Devolución iniciada,"3,0 de 5 estrellas","Es una cafetera bastante sencilla, pero pierde agua y no filtra completamente bien.",Raquel,Revisado en España el 24 de enero de 2022
100%recomendable,"5,0 de 5 estrellas","Calidad,precio,va estupendamente y hace un buen café.",Ana,Revisado en España el 23 de enero de 2022
Recomiendi,"5,0 de 5 estrellas","Es pequeña y no estorba en la cocina, da para bastantes tazas de cafe, la calidad de la jarra no se ve nota tan fragil, yo la lavo normal y todo ok.

Facil de limpiar y hace su cometido que es cafe.",Katherine,Revisado en España el 29 de diciembre de 2021
Muy contento,"5,0 de 5 estrellas","Facil de usar,
Bastante rápido,
Me hubiese gustado que viniera con un filtro para haber podido usarla al llegar",Cheo,Revisado en España el 24 de diciembre de 2021
Cumple su función perfectamente,"4,0 de 5 estrellas","La cafetera cumple su función, está genial.
Le doy 4 estrellas porque para encenderla tiene pulsador, entonces si quieres programarla con un enchufe, no podrías hacerlo.",Alexis Valdez,Revisado en España el 16 de diciembre de 2021
Muy buena cafetera de filtro para los que no tienen mucho espacio,"5,0 de 5 estrellas",Es una cafetera de filtro muy fácil de usar y que no ocupa mucho espacio. Da café suficiente para dos tazas grandes. Fácil de limpiar. Hace perfectamente su trabajo. El mecanismo antigoteo evita que la superficie se manche.,Alessandro,Revisado en España el 5 de diciembre de 2021
Buenas cafetera,"5,0 de 5 estrellas","Es una cafetera buena el café sale muy bien y sin problemas, fácil de usar y limpiar",Cliente Amazon,Revisado en España el 5 de diciembre de 2021
Bien,"5,0 de 5 estrellas","Tiene buen aspecto y el tamaño ideal para que no sobre café, no había leído que se necesitaran filtros desechable.",Marcos,Revisado en España el 3 de diciembre de 2021
SÚPER PRÁCTICA,"5,0 de 5 estrellas","Práctica, fácil de usar, de limpiar. No pongo 5 porque el cafe me parece con poco sabor, pero tengo que probar con otros, tal vez sea eso",C,Revisado en España el 18 de noviembre de 2021
Pequeña pero práctica,"5,0 de 5 estrellas","Es pronto para valorar, pues llevamos 2 días probándola. De momento muy bien!!. Es lo que esperábamos, rápida, silenciosa y práctica. Eso sí, uso para 3 o 4 personas, ya que si se carga con muchas cucharadas de café el filtro, se desbordará. Para nosotros dos y un par de invitados a casa, cumple sobradamente con su cometido. Además su manejo y limpiado no tiene mayor secreto.",MANUEL,Revisado en España el 25 de octubre de 2021
Buenísima relación calidad - precio,"5,0 de 5 estrellas","Tengo la cafetera desde hace más de uno año y funciona tan bien como el primer día. Café muy rico , es pequeña pero para 2-4 personas es perfecta y ocupa poco en la cocina.",Thais,Revisado en España el 10 de septiembre de 2021
Café rico y fácil de limpiar,"5,0 de 5 estrellas",Es una cafetera de tamaño pequeño yo le pongo un filtro de papel grande y uno pequeño para que no rebose el poso del café. A mí me encanta porque hace un café muy rico es muy fácil de limpiar. Prueba el truco de los dos filtros es genial.,Angeles F.,Revisado en España el 17 de agosto de 2021
Pequeña y práctica pero sin cesta de filtro,"5,0 de 5 estrellas","No me dí cuenta y al llegar vi que no traía cesta de filtro, si lo hubiera sabido no la habría comprado, pero con filtros de papel del super va muy bien también.",Gastón F,Revisado en España el 13 de agosto de 2021
Excelente cafetera a un buen precio,"5,0 de 5 estrellas",Facilidad de uso. Aunque es de plástico parece de buena calidad. No trae filtros pero se pueden usar filtros universales. Es ideal para 2 personas. Tenemos preparado un delicioso café en pocos minutos para varios días.,Antonio Crespo Fernandez,Revisado en España el 8 de agosto de 2021
La calidad,"4,0 de 5 estrellas",Es bonita y no muy grande no ocupa mucho espacio,David,Revisado en España el 2 de agosto de 2021
El filtro,"1,0 de 5 estrellas",La cafetera no tiene filtro y desearía saber que tipo de filtro le corresponde a esta cafetera.,VICTOR,Revisado en España el 29 de julio de 2021
Es muy bonita y funcional.,"5,0 de 5 estrellas","Me gusta mucho , es perfecta para gente que toma poco café , la recomiendo 100%",lucia cabrero,Revisado en España el 26 de julio de 2021
"Calidad precio, genial","5,0 de 5 estrellas","Todas las prestaciones que puede dar una cafetera de este tipo, para el precio esta genial",Cliente Amazon,Revisado en España el 17 de julio de 2021
Me gusta,"4,0 de 5 estrellas","Buen producto, lo he comprado reacondicionado y por ahora bien
Solo que tengo que apretar bien a la hora de encenderlo, de lo contrario.... Tengo que volver a pulsar
Espero que me dure porque es buena cafetera",sebastian m,Revisado en España el 7 de julio de 2021
Buen café,"5,0 de 5 estrellas","Es pequeña, importante para no tener un trasto más por la cocina, suficiente para cuatro personas. Hace buen café, rápido y bien caliente. No lleva filtro permanente, pero no me supone un problema prefiero los de papel que son más higiénicos.",JMCAMPA,Revisado en España el 18 de junio de 2021
Todo bien,"5,0 de 5 estrellas",Todo bien,Cliente Amazon,Revisado en España el 1 de junio de 2021
Recomendado,"5,0 de 5 estrellas","Buena cafetera ,buena marca ,sencilla, en dos semanas va perfecta sin ningún fallo",Sandra,Revisado en España el 8 de mayo de 2021
Comodidad y buen café,"5,0 de 5 estrellas","Es perfecta, fácil de usar y buen café",Antonia María Cantón Salmerón,Revisado en España el 18 de abril de 2021
Fácil,"4,0 de 5 estrellas",Fácil,robert auckland,Revisado en España el 11 de febrero de 2021
Servicio,"5,0 de 5 estrellas",Todo ok,Elena,Revisado en España el 3 de febrero de 2021
Ideal para cocinas pequeñas,"5,0 de 5 estrellas",Es la cafetera ideal para cocinas pequeñas. Es compacta y cumple su función. Buen producto.,Carolina,Revisado en España el 7 de enero de 2021
Buena cafetera pequeña,"4,0 de 5 estrellas",Esta cafetera va muy bien y ocupa poco espacio. Mantiene el calor durante un rato después de terminar de hacer el café. Si tuviera la funcion de calentarlo en cualquier momento le pondría 5 estrellas.,Galtzetinak,Revisado en España el 25 de diciembre de 2020
Cafetera,"1,0 de 5 estrellas",Estoy muy enfadada.le falta el filtro permanente...,Carmen,Revisado en España el 19 de diciembre de 2020
No compala,"1,0 de 5 estrellas",Esta macina es por 2 tazas de cafe americano y no por 6 como esta deciendo.los espanoles tienen ninguna idea como el cafe americano es sirven piensan que es lo mismo como espresso.,Manhattan,Revisado en España el 26 de noviembre de 2020
Perfecta,"5,0 de 5 estrellas",Es justo lo que esperábamos.,Angie sanchez,Revisado en España el 6 de noviembre de 2020
Util,"5,0 de 5 estrellas",Buena,rafa .,Revisado en España el 24 de octubre de 2020
Lo que quería,"5,0 de 5 estrellas",Funciona muy bien y es pequeñita,Michela,Revisado en España el 8 de octubre de 2020
Cafetera pequeña,"5,0 de 5 estrellas",Queria una cafetera pequeña y cumple con su función perfectamente no viene con filtro pero lo compre aparte y funciona genial,nadia costa,Revisado en España el 27 de septiembre de 2020
Hace buen café pero debería traer filtro,"4,0 de 5 estrellas",Hace un buen café pero sí tengo que decir algo en negativo es que no trae filtro,Lourdes,Revisado en España el 17 de septiembre de 2020
barato y bueno,"5,0 de 5 estrellas","por el precio y marca no se puede pedir mas, cuando se rompa otra por el precio que tiene.",juan,Revisado en España el 8 de septiembre de 2020
Pierde agua MUY DESCONTENTA,"1,0 de 5 estrellas","Había puesto una buena valoración, pero antes de 6 meses ya está perdiendo agua, aparece agua por abajo, no sé de dónde sale. Tuve una que me duró un montón de años y al final también perdía agua, por eso la cambié, ésta al principio muy bien, pero desde el mes de abril que me llegó hasta ahora no han pasado ni seis meses y ya está perdiendo agua por abajo, y mucha, Lo malo que si no me doy cuenta se mete por la cocina y me estropea la encimera",Maria Maraver,Revisado en España el 29 de agosto de 2020
Un buen produco,"5,0 de 5 estrellas","Está bien hecha, funciona correctamente y es barata.",RAMON,Revisado en España el 16 de agosto de 2020
La hemos tenido que devolver,"1,0 de 5 estrellas","No lleva filtro y los filtros de papel , por su sistema , se doblan y el café sale con posos. El diseño es bonito pero el café no sale bien .
La hemos devuelto",CARMEN,Revisado en España el 22 de julio de 2020
Compacta y funcional,"5,0 de 5 estrellas","Medida perfecta! Ocupa poco espacio. Fácil de usar y limpiar. Los filtros son desechables y hay que comprarlos a parte (son muy baratos).
Estoy súper encantada con ella.",Suolma,Revisado en España el 9 de julio de 2024
Comoda,"5,0 de 5 estrellas","Me gusta lo pequeña y limpia, creí que tenía a filtro",Mª Angeles,Revisado en España el 4 de julio de 2024
Paquete abierto. Faltaba en el contenido el filtro,"3,0 de 5 estrellas",La cafetera está muy bien. Pero el paquete no venía precintado ( la caja del producto directamente) y el filtro no estaba incluido,Javier Aparicio Delgado,Revisado en España el 31 de marzo de 2024
Muy Buena,"5,0 de 5 estrellas","Es una cafetera de uso diario, que no me ha generado ninguna complicacion,Es muy importante que el sistema de encendido y apagado no da insidencias como me había sucedido con otras cafeteras de diferentes marcas .",Esperando la Version en Español,Revisado en España el 22 de mayo de 2024
perfecto!,"5,0 de 5 estrellas","necesitas filtro número 2! (pequeño)
trabaja bien! bueno para 2-6 personas.",Adelina,Revisado en España el 7 de mayo de 2024
Normalita,"4,0 de 5 estrellas","Cumple su funcion , sin más",Cliente Amazon,Revisado en España el 8 de mayo de 2024
Tamaño perfecto,"5,0 de 5 estrellas",Todo,miguel angel molina castillo,Revisado en España el 10 de mayo de 2024
Boa qualidade,"5,0 de 5 estrellas","Tamanho ideal sem ocupar demasiado espaço. O café vem com ótimo sabor. Prática, bonita e funcional",Ana,Revisado en España el 21 de marzo de 2024
Justo como la descripción,"5,0 de 5 estrellas",Cumple muy bien su función.,Excelente,Revisado en España el 27 de marzo de 2024
Abstenerse de comprar,"1,0 de 5 estrellas",Lo recibí el 28 de febrero. La he usado menos de dos veces a la semana y ya está así. Se me acabó el periodo de devolución y no puedo reclamarlo. Yo miraría otra la verdad.,Cliente Amazon,Revisado en España el 20 de mayo de 2024
"Buena cafetera, perfecta para familia de 4","5,0 de 5 estrellas","Siempre he tomado café al levantarme y al fallar mi antigua cafetera busque algo sencillo y funcional...este modelo ha funcionado a la perfección.
Es pequeño y me gusta el toque de acero inox exterior, el compartimento del café es completamente desmontable, aunque a la hora de la verdad solo se abre para poner y quitar el filtro... una o dos veces al mes lo desmonto del todo y así evito que el café se solidifique en el plástico...aunque hay gente que dice que eso le da solera al café.
La jarra se ve delicada, como todas, es la parte más endeble del conjunto, aconsejo tratarla con cuidado y no darle golpes con el mármol u otros recipientes de cristal.
Por lo demás recomiendo su compra 100x100",Carlos,Revisado en España el 20 de febrero de 2017
Cafetera de goteo,"4,0 de 5 estrellas","Una cafetera de goteo como otras que he tenido, lo de que no lleve filtro yo, no lo veo un inconveniente, pues siempre he utilizado de papel.
Los que dicen que no se puede apagar, que lo hace sola a los 30 minutos, no es cierto, si das al interruptor de nuevo, después de hacerse el café, se apaga.
Por el precio que tiene la recomiendo, a ver cuanto me dura esta ya que estas cafeteras se acaban rompiendo por el contorno de la placa calentadora.",Natividad Gascón Baquedano,Revisado en España el 24 de octubre de 2017
Buena cafatera,"5,0 de 5 estrellas","Es una muy buena cafetera, fácil de usar y de limpiar. Pero has de tener en cuenta de que el filtro no viene, por lo que deberás comprar uno a parte. En mi caso la comprar junto con una oferta que venía el filtro, pero en realidad lo comprabas a parte. Al principio se salí el café y pensé que era debido a un fallo de la cafetera, pero era porque al cerrar la tapa una vez puesto el café hay que asegurarse de escuchar un clic y es la señal de que la cafetera está correctamente cerrada. Por lo demás la recomiendo ya que calidad precio es ideal.",RaulBADAJOZ,Revisado en España el 16 de agosto de 2018
Práctica y a buen precio.,"5,0 de 5 estrellas","La máquina funciona muy bien , si te gusta este tipo de café , la recomiendo. Llevo meses utilizándola a diario y el resultado es excelente, si te gusta el café más fuerte, alcanza con ponerle menos agua al recipiente y notaras la diferencia, yo habiendo comprado máquinas tipo nespresso, ya me decanto por esta opción, más económica y sin problemas que dan esas máquinas que hacen de todo, ( por supuesto es una opinion personal ) por cierto se adapto perfecto un filtro permanente que tenia de otra ufesa que tenia anterior a ésta.",Danielelchef,Revisado en España el 6 de diciembre de 2018
