title,rating,body,author,date
PRODUTO PERFEITO.,"5,0 de 5 estrellas",Nada a reclamar.,Marcelo Augusto Rodarte,Revisado en Brasil el 16 de julio de 2024
Maravilha,"5,0 de 5 estrellas","Chegou rápido, veio bem embalado. É excelente para quem gosta de um café bem feito. Pode comprar, vale a pena.",dcg,Revisado en Brasil el 16 de julio de 2024
Maravilhoso,"5,0 de 5 estrellas","Ótimo método, com ótima jarra (gosto que da pra ver o café caindo)",Enzo Erbert,Revisado en Brasil el 14 de julio de 2024
Ótimo,"5,0 de 5 estrellas","Qualidade do vidro é boa, não goteja ao terminar de servir. Suporte do filtro muito bom.",Leandro Brito,Revisado en Brasil el 13 de julio de 2024
Perfecta para empezar con el cafe de especialidad,"5,0 de 5 estrellas","Excelente, si quieres empezar en el mundo de los buenos cafes y de especialidad, ¡para mi! es la mejor opcion para preparar cafe de especialidad y obtener las mejores notas.",Leandro Nicolás Vergara,Revisado en México el 12 de julio de 2024
Ótimo produto.,"5,0 de 5 estrellas","Produto original. Chegou muito bem embalado, protegido com plástico bolhas e caixa de papelão extra. Estou muito satisfeito com a compra, recomendo.",Diego,Revisado en Brasil el 12 de julio de 2024
Ótimo produto,"5,0 de 5 estrellas","Produto original Hario, excelente custo benefício.",Marcos,Revisado en Brasil el 11 de julio de 2024
Perfeito,"5,0 de 5 estrellas","Superou minhas expectativas, feito com bons materiais, veio tudo certinho e chegou rápido.",Daniela Silva,Revisado en Brasil el 7 de julio de 2024
Kit de iniciación,"5,0 de 5 estrellas","Excelente kit de iniciación, trae las partes básicas para preparar tu café por método de infusión.",Ana Milena Tarra Reyes,Revisado en los Estados Unidos el 1 de julio de 2024
Vale a pena,"5,0 de 5 estrellas","O porta filtro é de acrílico, mas é original tudo muito bem feito, sem defeitos.",Rudiney,Revisado en Brasil el 27 de junio de 2024
Excelente,"5,0 de 5 estrellas","Kit original Hario, conforme anúncio.",Magali M.,Revisado en Brasil el 27 de junio de 2024
Ótima cafeteira,"5,0 de 5 estrellas","Ótima cafeteira. Tem qualidade excelente, fácil de manusear e limpar.",Daniel Piccoli Menolli,Revisado en Brasil el 25 de junio de 2024
Excelente produto.,"5,0 de 5 estrellas",Produto muito bom e de excelente qualidade.,Felype da Silva Delfino,Revisado en Brasil el 24 de junio de 2024
Produto de qualidade,"5,0 de 5 estrellas","Excelente produto, caneca em vidro e coador em acrílico grosso de boa qualidade, pra quem curte um café no metodo v60 é uma excelente escolha, recomendo.",Sidney,Revisado en Brasil el 23 de junio de 2024
Conforme anunciado,"5,0 de 5 estrellas","Produto de excelente qualidade, entregue dentro prazo e em perfeitas condições. Recomendo.",Carlos Mota,Revisado en Brasil el 20 de junio de 2024
"Produto excelente, mas expedição pecou na embalagem","5,0 de 5 estrellas","O produto é excelente, porém a equipe responsável pela expedição do produto, não condicionou o produto dentro de uma caixa de transporte, ou seja utilizou a caixa original sem almofadas e itens de proteção, por sorte não quebrou, e o pior, passaram a fita da Amazon em toda parte externa, fazendo com que a fita grudasse na embalagem original, e ao remover a fita, danificou a caixa inteira, nas 4 faces. Expedição PÉSSIMA.",Alexandre Magno,Revisado en Brasil el 17 de junio de 2024
Kit de Cafeteira Hario muito bom!!,"5,0 de 5 estrellas","Excelente Cafeteira. Excelente qualidade; aparenta ser bem durável. Auxilia no preparo do café, com praticidade e facilidade. Recomendo.",Claud Barbieri,Revisado en Brasil el 17 de junio de 2024
Ele é perfeito!,"5,0 de 5 estrellas",Produto excelente!,Não recebi e no status está como entregue 😤,Revisado en Brasil el 17 de junio de 2024
Excelente,"5,0 de 5 estrellas","Kit impecável, funcional e muito bonito 🤎",Isadora,Revisado en Brasil el 11 de junio de 2024
Kit melhor Custo x Benefício,"5,0 de 5 estrellas","Esse kit tem o melhor custo benefício, é possível extrair excelentes cafés via V60.",Lucas Pol,Revisado en Brasil el 29 de mayo de 2024
Ótimo kit v60 da Hario,"5,0 de 5 estrellas","Play Video
Chegou bem embalado, entrega muito rápida, produto de ótima qualidade, o dripper bem feito também sem rebarbas. Ótima indicação pra quem busca um kit v60!",Eduardo Sartori,Revisado en Brasil el 23 de mayo de 2024
Muito bom,"5,0 de 5 estrellas","Produto muito bom, qualidade do material atendeu as expectativas",thalita,Revisado en Brasil el 20 de mayo de 2024
Muito bom,"5,0 de 5 estrellas","Recomendo
Deixa um sabor excelente.
Produto veio bem imalado
O funil é de acrílico e a jarra é vidro",Fernanda,Revisado en Brasil el 20 de mayo de 2024
Buen producto,"5,0 de 5 estrellas","Ambos productos acordes a la descripción, funcionan perfecto y la jarra es muy útil.",Alexander Rincon Duarte,Revisado en los Estados Unidos el 13 de mayo de 2024
Ótimo produto,"5,0 de 5 estrellas",Design lindo e ótima forma de passar aquele café especial Domingo de manhã,Iderson,Revisado en Brasil el 11 de mayo de 2024
Ótimo qualidade,"5,0 de 5 estrellas","Recomendo fortemente, produto de excelente qualidade. Com a vasão maior do V60 é possível obter uma extração boa de maneira mais fácil se comparado ao Melita.",Fe1psJF,Revisado en Brasil el 10 de mayo de 2024
Excelente,"5,0 de 5 estrellas",Todo o kit é excelente. Original Hario. Ótimos materiais. Muito completo,Roberta Covosque Schultz,Revisado en Brasil el 10 de mayo de 2024
Fantástico!,"5,0 de 5 estrellas",Excelente material e de fácil limpeza!,Rubens Nagornni,Revisado en Brasil el 10 de mayo de 2024
Tutto ciò che serve per un perfetto V60,"5,0 de 5 estrellas","Hario Craft Kit V60 è un must-have per gli amanti del caffè che desiderano gustare specialty coffee direttamente a casa. Questo dispositivo è esattamente quello che troveresti in uno specialty coffee bar quando ordini un V60: utilizzato nel modo giusto produce una tazza di caffè straordinaria.

La semplicità di utilizzo del V60 è sorprendente. Il processo di estrazione del caffè è una vera forma d'arte, e con il Craft Kit V60 di Hario, diventa incredibilmente accessibile anche ai principianti. Il design consente un flusso uniforme dell'acqua attraverso il caffè macinato, garantendo un'estrazione e controllo ottimale per creare una tazza di caffè equilibrata e deliziosa.

Personalmente, sono rimasto colpito dalla qualità dei materiali utilizzati nel Craft Kit V60. La caraffa è bella, resistente e permette di osservare il processo di estrazione, mentre il dripper in plastica assicura una temperatura stabile durante l'infusione. Inoltre, il kit include anche filtri di carta.

Se sei un appassionato di caffè alla ricerca di un metodo di preparazione che offra risultati eccellenti e una vera esperienza da specialty coffee bar, questo kit è la scelta perfetta. Il piacere di sperimentare con questo fantastico dispositivo e di gustare ogni singola tazza di caffè che produce è impagabile.",be_lomax,Revisado en Italia el 8 de mayo de 2024
Igual a descrição,"5,0 de 5 estrellas","O produto chegou na caixa, completo, sem nenhum defeito. É de bastante qualidade",juliana,Revisado en Brasil el 3 de mayo de 2024
"Excelente, qualidade Hario","5,0 de 5 estrellas","Tudo muito bem embalado. De vidro, qualidade excelente.",Cliente Amazon,Revisado en Brasil el 1 de mayo de 2024
Praticidade,"5,0 de 5 estrellas",O kit já vem com a maioria dos itens necessários para fazer um bom café. Recomendo.,Thiago Cordeiro,Revisado en Brasil el 28 de abril de 2024
Muito bom !,"5,0 de 5 estrellas",Material de ótima qualidade .,Felipe Scrocco,Revisado en Brasil el 27 de abril de 2024
Amei,"5,0 de 5 estrellas",Muito prático e a qualidade é excelente!!,Tati,Revisado en Brasil el 27 de abril de 2024
vale a pena!,"5,0 de 5 estrellas","veio rapido e bem embalado, nao quebrou a jarra",Misael,Revisado en Brasil el 22 de abril de 2024
"Muito bacana, mas é só isso mesmo","3,0 de 5 estrellas","O kit é uma frivolidade. A necessidade mesmo era o coador V60. A proveitei a promoção do kit, para comprar tudo junto.
O encaixe é perfeito quando o pote está fechado, mas sem a tampa, fica frouxo. Isso não é um problema, mas imaginei que fosse ficar mais firme durante a extração do café.
Para evitar o arrefecimento precoce do café, deve-se escaldar o filtro com água bem quente, caso contrário o vidro resfria o café rápido demais, atrapalhando a experiência.
O ideal é extrair o café direto na xícara para se ter a temperatura e o frescor ideais. O coador é excelente, apesar de ser de plástico. Os filtros são perfeitos, mas o preço é bem salgado.
Enfim, se tivesse uma segunda chance, eu compraria somente o coador e os filtros, deixando a chaleira de lado.
Apesar de tudo, o kit é muito bonito, e para um evento tirar o café assim seria muito legal, mas fica só nisso mesmo.",Marcelo Almeida,Revisado en Brasil el 19 de abril de 2024
Otima qualidade! Produto muito bom.,"5,0 de 5 estrellas","Muito bonito e delicado, material transmite qualidade.",Agnno,Revisado en Brasil el 16 de abril de 2024
Produto Design com Alta Qualidade,"5,0 de 5 estrellas",Produto foi entregue dentro do prazo estipulado. A embalagem bastante compacta me surpreendeu por esperar algo maior. O tamanho da jarra aparentemente maior na foto mostra exatamente a quantidade indicada e a delicadeza do desenho para alocação e manuseio. O porta filtro traz o que é mostrado por baristas com a facilidade para uso diário. Não posso esquecer de mencionar que a tampa da jarra permite facilmente o uso e distribuição do café sem derramar ou pingar ao despejar numa xícara.,James,Revisado en Brasil el 13 de abril de 2024
Bom cafe,"3,0 de 5 estrellas",Funciona bem mas o custo do filtro de papel não compensa,Alexandre T,Revisado en Brasil el 13 de abril de 2024
Qualidade excelente,"5,0 de 5 estrellas",Produto muito bom e funcional! Amei,Nicéa magaly matias da silva,Revisado en Brasil el 6 de abril de 2024
El mejor café,"5,0 de 5 estrellas","Me encantó el sabor y la versatilidsd, se puede hacer caliente o helado. Una gran experiencia para disfrutar el café .",Esteban Ramírez Martínez,Revisado en México el 1 de abril de 2024
gostei muito,"5,0 de 5 estrellas",bom,Marconi Muzzio,Revisado en Brasil el 31 de marzo de 2024
V60,"5,0 de 5 estrellas",Amei!!,Joao Miguel,Revisado en Brasil el 30 de marzo de 2024
Hario just know what they are doing!,"5,0 de 5 estrellas",Great pour over kit! Just get it.,JRod,Revisado en los Estados Unidos el 27 de marzo de 2024
Cafetera,"4,0 de 5 estrellas","No tiene todas las medidas en la parte lateral, buen material",Heidi montemayor,Revisado en México el 26 de marzo de 2024
Tamanho perfeito!,"5,0 de 5 estrellas",Coo café com muito mais higiene e rapidez!,Luzianny D.,Revisado en Brasil el 22 de marzo de 2024
caprichado!,"4,0 de 5 estrellas","boa experiência! aqui no Bistrô CaZinha Dadê, na Canto Dadê Pousada e Bistrô, adoramos o cafezinho.",Canto Dadê,Revisado en Brasil el 20 de marzo de 2024
Cumpriu o prometido. RECOMENDO,"5,0 de 5 estrellas",Cumpriu a obrigação de entregar o que anunciou,WENDERSON AVELINO BRITTO,Revisado en Brasil el 18 de marzo de 2024
Great product,"5,0 de 5 estrellas","This is exactly what I needed. Great price, essential, basic but good quality, and fast delivery. Just one thing, although paper filter is the same Hario brand, but it seems slightly smaller than a plastic dripper. I wonder why...",YOUNGHEE PARK,Revisado en Australia el 17 de marzo de 2024
Recomendo,"5,0 de 5 estrellas",Gostei muito! Recomendo,Polyana,Revisado en Brasil el 16 de marzo de 2024
Muito bom.,"5,0 de 5 estrellas",Muito bonito para compor a mesa.,Welson J C Timoteo,Revisado en Brasil el 9 de marzo de 2024
Uma ótima relação custo-benefício,"4,0 de 5 estrellas","Parece estar em condições perfeitas. Embora ainda não o tenha utilizado, sinceramente não percebo mistérios entre este produto e outros de diferentes marcas. Ele aparenta ser de boa qualidade e oferecer uma ótima relação custo-benefício.",Thiago Cupollilo,Revisado en Brasil el 8 de marzo de 2024
Excelente,"5,0 de 5 estrellas",Mudou minha forma de fazer café… excelente,Sacchi,Revisado en Brasil el 6 de marzo de 2024
Thought the whole thing was glass,"2,0 de 5 estrellas","Never pour boiling water that you want to drink, into plastic",Nicola Castle,Revisado en Australia el 3 de marzo de 2024
Produto de qualidade,"5,0 de 5 estrellas","Gostei bastante, material resistente, bonito e que te ajuda a fazer café coado de qualidade.",EDIMILSON SOUSA,Revisado en Brasil el 28 de febrero de 2024
Excelente,"5,0 de 5 estrellas",Um excelente kit de café. A jarra é linda.,Naya Cristina Souza Oliveira,Revisado en Brasil el 24 de febrero de 2024
Muito bom,"5,0 de 5 estrellas","Cafeteira excelente, muito bonita, com pouco mais de 600 mL de capacidade, não veio com nenhuma avaria

O coedor V60 também muito bom, feito de acrílico, excelente para coagem média-fina e encaixa perfeitamente na cafeteira

O medidor também ajuda quem ainda não possui uma balança, com marcas em 8, 10 e 12 g",Cliente Kindle,Revisado en Brasil el 22 de febrero de 2024
Perfeita,"5,0 de 5 estrellas","O Café passado fica perfeito pelo método v60 vale a pena adquirir esta da Hario que é original, veio tudo certinho com manual e sem defeitos.",Diego D.,Revisado en Brasil el 20 de febrero de 2024
good,"5,0 de 5 estrellas",yes,Paula Leclerc,Revisado en los Estados Unidos el 19 de febrero de 2024
Ottimo alternativa al pezzo unico,"5,0 de 5 estrellas","Ciao, ne abbiamo provati parecchi, anche se il mio preferito era il pezzo unico questo risulta molto piu pratico, molto piu maneggevole piu facile da pulire e piu universale potendo riutilizzare la parte soto anche per altri scopi.

Inoltre nel caso si puo combinare sopra il filtro metallico con quello di carta a seconda dele necessità, in tutto per tutto molto sodisfatto di hario come al solito.",denis,Revisado en Italia el 19 de febrero de 2024
Produto excelente,"5,0 de 5 estrellas",Muito bacana!,Ingryde Araújo,Revisado en Brasil el 13 de febrero de 2024
Indispensável para amantes do café,"5,0 de 5 estrellas","Quem gosta de preparar um bom café ou está no hobby dos cafés de especialidade, esse item é um obrigatório!

O clássico V60 extrai um café mais rápido que o porta filtro da Melitta que se encontra em qualquer mercado e acentua as notas mais delicadas do bom café.

Além disso, por ser universalmente consagrado na comunidade do café mundial, você consegue pegar muitas receitas de campeonato para o método e replicá-las em casa.",João Pedro W. D. S.,Revisado en Brasil el 12 de febrero de 2024
Satisfeita com o produto,"5,0 de 5 estrellas",Totalmente satisfeita com o produto. Produto original e cumpre com todas as suas funcionalidades!,Priscila Valeixo,Revisado en Brasil el 6 de febrero de 2024
Café gostoso!,"5,0 de 5 estrellas",Muito bom. Importante frisar que a moagem do café tem que ser média.,Luiza Isper,Revisado en Brasil el 4 de febrero de 2024
Conforme,"5,0 de 5 estrellas",De acordo com o anúncio,Mateus,Revisado en Brasil el 2 de febrero de 2024
Pronto para um café?,"5,0 de 5 estrellas",Muito bom. É só escolher um bom café e alegrar os cafés da tarde.,Anderson Alcântara,Revisado en Brasil el 27 de enero de 2024
V-60,"5,0 de 5 estrellas",Gostei muito de conhecer mais uma forma de fazer café. O meu ficou delicioso,Alegria Benchimol,Revisado en Brasil el 23 de enero de 2024
Great for coffee lovers,"5,0 de 5 estrellas",Affordable and practical. Has been great for pour over coffee.,BenC,Revisado en los Estados Unidos el 22 de enero de 2024
otimo produto,"5,0 de 5 estrellas",Produto otimo estado e chegou bem rapido e bem embalado!,Caio Cesar Ferreira,Revisado en Brasil el 19 de enero de 2024
Aprendendo a dosar o café,"5,0 de 5 estrellas","Esteticamente é linda, ótimo para colocar no cantinho do café... na hora de fazer o café é preciso obedecer os tempos de coagem (não sei se essse é o termo correto), o método V60 é diferente do melitta convencional, então é preciso jogar a água no pó com tempo certinho pra poder extrair o melhor do café... e tbm é interessante usar um café de boa qualidade. No geral o produto é excelente, mas requer um café de qualidade na moagem correta e saber fazer a coagem corretamente.",Raquel dos Santos Souza,Revisado en Brasil el 18 de enero de 2024
Ultimate coffee experience,"5,0 de 5 estrellas",This is my new daily ''machine'' as part of the ultimate coffee brewing experience . You already made your research if you landed here and the answer is yes buy it without remorse now.,maxime lajeunesse,Revisado en Canadá el 18 de enero de 2024
Um kit excelente!,"5,0 de 5 estrellas","A cafeteira é de ótima qualidade, sem contar que é muito bonita! Os filtros também são ótimos e pra quem não faz ""cafés diferentes"" todo dia, acabam durante bastante!",Samuel,Revisado en Brasil el 17 de enero de 2024
Gostei muito da compra,"5,0 de 5 estrellas",Eu já estava querendo comprar a muito tempo. Chegou bem embalado e sem nenhuma avaria na caixa ou no produto.,Anderson Thiago de Oliveira,Revisado en Brasil el 14 de enero de 2024
Ótimo,"5,0 de 5 estrellas",Produto muito bom.,electrotronico,Revisado en Brasil el 14 de enero de 2024
"ótimo produto, entrega de baixo nível","5,0 de 5 estrellas","O produto é ótimo!
É um produto caro, mas ele é de um material muito bom.
Só a entrega que foi decepcionante, eles jogaram por cima do portão!! Tinham 2 itens de vidro, sorte que não quebrou!! Que absurdo",Cliente Kindle,Revisado en Brasil el 11 de enero de 2024
buen articulo,"5,0 de 5 estrellas",cumple con las expectativas para preparar un buen café filtrado,gerardo,Revisado en México el 5 de enero de 2024
Perfeito,"5,0 de 5 estrellas",Excelente produto,derikys,Revisado en Brasil el 5 de enero de 2024
De acordo com a expectativa,"5,0 de 5 estrellas","Produto de boa qualidade, entrega o que propõe.",Simone,Revisado en Brasil el 2 de enero de 2024
Prodo excelente,"5,0 de 5 estrellas",Muito bom indico,Carla R.,Revisado en Brasil el 30 de diciembre de 2023
Excelente,"5,0 de 5 estrellas",Adorei,Juliana Medeiros Paiva,Revisado en Brasil el 30 de diciembre de 2023
Excelente,"5,0 de 5 estrellas","Muito bom, perfeito",Guilherme,Revisado en Brasil el 30 de diciembre de 2023
Recomendo,"5,0 de 5 estrellas",Play Video,Laudislaine Araujo,Revisado en Brasil el 27 de diciembre de 2023
Qualidade,"5,0 de 5 estrellas","Jarra tem ótima qualidade e tamanho, coador de plástico é resistente. Compraria novamente.",Sabrina Almirall,Revisado en Brasil el 22 de diciembre de 2023
Bom,"5,0 de 5 estrellas",Bom,Lucas,Revisado en Brasil el 21 de diciembre de 2023
Muito bom,"5,0 de 5 estrellas","Excelente kit, entrega o informado, método bastante versátil.",Jardel A. G. Ferreira,Revisado en Brasil el 17 de diciembre de 2023
Ótimo.,"4,0 de 5 estrellas","Ótima qualidade, chegou perfeito e na data prevista. Estou muito satisfeito.",Luiz Cláudio,Revisado en Brasil el 16 de diciembre de 2023
Bom metodo. Porém caro.,"2,0 de 5 estrellas","Bom método. Porém o preço é salgado, tanto do produto quanto dos filtros. Acho que se não fosse um método japonês seria bem mais barato. Japonês acha que tudo deles é melhor. O melitao é tão bom quanto, por um custo muitíssimo baixo.",Wesley Silva Oliveira,Revisado en Brasil el 15 de diciembre de 2023
"Produto de excelente qualidade, porém a entrega deixa a desejar.","4,0 de 5 estrellas","O produto em si é ótimo, afinal, hario é hario. Contudo, houve problemas no serviço de entrega, que, além de chegar atrasado, apresentou falhas no sistema de rastreamento, mostrando que o pedido estava sendo encaminhado para Porto Alegre (moro no Espírito Santo).
No mais, excelente compra!",Dimitri,Revisado en Brasil el 15 de diciembre de 2023
Procedência bom,"5,0 de 5 estrellas",Produto funcionando bem como esperado.,Ruzio,Revisado en Brasil el 10 de diciembre de 2023
Excelente produto.,"5,0 de 5 estrellas",Excelente produto. Cumpre o que promete.,"Muito bom produto. Excelente qualidade, cumpre o q promete.",Revisado en Brasil el 9 de diciembre de 2023
Muito bom!,"5,0 de 5 estrellas","Adorei. O café fica muito saboroso neste método, dá mais destaque para a doçura e menos para o amargor. Boa qualidade do material. Recomendo.",Roseane,Revisado en España el 21 de marzo de 2024
Excelente,"5,0 de 5 estrellas","Excelente todo, el café queda excelente!

Alguien me podría indicar exactamente cuales son los filtros? Se me han acabado los que vienen y he comprado otros pero la verdad que no filtra el café igual.

Muchas gracias,",Diego Arasa,Revisado en España el 5 de octubre de 2023
mi kit de café favorito y siempre necesari,"5,0 de 5 estrellas","El kit de café Hario V60 es mi kit de café favorito y siempre lo necesito. Si se me rompe, lo compro de inmediato. Aunque podría ser un poco más barato, vale la pena el precio por la calidad y versatilidad del kit. Me encanta cómo hace el café filtrado y cómo se ve muy bonito en mi cocina. Si te gusta el café filtrado, sin duda, recomendaría este kit.",Bruna Mariano,Revisado en España el 22 de diciembre de 2022
Regalo de cumpleaños para mi hijo 🎁,"5,0 de 5 estrellas",La felicidad de poder hacer feliz a mi hijo con este regalazo... excelente cafetera,Graciela Susana Ardura,Revisado en España el 8 de noviembre de 2021
Mi nueva manera de tomar cafe,"5,0 de 5 estrellas","Esta es mi nueva manera de tomar mi cafe de mañana. No estaba seguro si me iba a gustar y siendo un “coffee snob” so bastante particular acerca de mi cafe. Esta cafetera cumple con el sabor, fácil uso y también es un proceso un poco relajante hacer el cafe en esta manera. No estaba convencido pero el precio y las reseñas ayudaron a convencerme. Puedes ajustar el cafe a tu gusto bastante fácilmente con un poco de experimentación.",Norman King,Revisado en España el 23 de marzo de 2022
¡Es Hario!,"5,0 de 5 estrellas","La alternativa más económica a un kit Hario para hacer café.
Eso sí, no es el portafiltros más bonito del mercado ni el más resistente, es de plástico y hay que ser conscientes de ello. ¡Pero es genial!",Miguel M.,Revisado en España el 19 de abril de 2023
Excelente producto y precio,"5,0 de 5 estrellas","Estoy experimentando en el mundo del café y un metodo basico es el V60.
Definitivamente hay que saberlo usar para poderle dar un bien sabor al café.
El producto es bueno, la marca definitivamente es un clasico dentro del mundo del café y todos los accesorios son de buena calidad.
El V60 es de plastico lo cual ayuda en el momento que no se tiene tanto cuidado al acomodarlo.
La jarra es de vidrio y mantiene el calor más tiempo a comparación de otro tipo de vidrio. Su asa es de plastico ya que es el producto mas basico de esta linea.
Sus filtros originales y de la calidad que frecuentan.",Jspence,Revisado en México el 14 de enero de 2021
Facile à utiliser,"5,0 de 5 estrellas","J’ai récemment décidé d’entamer une toute nouvelle étape de « coffee brewing » et grace à mon ami barista, j’ai découvert ce petit bijou!

J’ai juste envie de dire que c’est super relaxant de faire du café dedans et qu’une plus de ça, le café en sort tellement bon!!",Lou,Revisado en Francia el 12 de octubre de 2023
Good Looking Item,"5,0 de 5 estrellas","Does what it is made for, looks nice, and now enjoy my coffee fresh all the day",Angus,Revisado en Reino Unido el 9 de julio de 2023
Gut und preiswert,"5,0 de 5 estrellas","Sehr gute Qualität für kleines Geld.
Nun braucht man nur noch guten Kaffee, eine gute Mühle und gutes Wasser.",DietrichMB,Revisado en Alemania el 10 de septiembre de 2023
Great!,"5,0 de 5 estrellas","I think the quality of the brewer is better than the one I brought in China, it was red though.",Nier,Revisado en Canadá el 1 de enero de 2022
Perfect,"5,0 de 5 estrellas",Exactly the bundle I was after. I needed to start building my first coffee kit and this had all the components in one affordable bundle.,Bhav,Revisado en Reino Unido el 29 de mayo de 2023
Resistente. Café excelente.,"5,0 de 5 estrellas","Producto resistente, de muy buena calidad. Se produce un café que resalta los sabores y aromas. La recomendación es para el empaquetado. El artículo venía en su caja y dentro de caja de Amazon, pero sin protección adicional como bolsas con aire, ni siquiera papel que ayude a amortiguar golpes. Al tener una parte de vidrio deberían ser más cuidadosos; creí que el producto estaría estrellado o roto. En general, recomiendo la V60 100%.",Noe Gonzalez Rodriguez,Revisado en México el 30 de octubre de 2021
Ottimo prodotto,"5,0 de 5 estrellas",Prodotto di ottima fattura,Macrone,Revisado en Italia el 13 de agosto de 2023
Cafetière en verre,"5,0 de 5 estrellas",Bien pour ce faire son petit café,claude CATTY,Revisado en Francia el 28 de octubre de 2023
"Normalerweise gutes Produkt, unseres hat leider ein Produktionsfehler","3,0 de 5 estrellas","Materialfehler am oberen Rand! Glas ist dort wellig und nach ca. 1 Monat eingerissen. Kann die Kanne leider nicht zurückgeben. Ansonsten sind diese Kannen eigentlich gut, ist bereits unsere Dritte. Daher nur 3 Sterne",Amazon Kunde,Revisado en Alemania el 18 de diciembre de 2021
La simplicité d'une cafetière filtre par excellence !,"5,0 de 5 estrellas","Simple, vraiment efficace et fonctionnel ! Un bon kit d'initiation accompagné de plusieurs filtres et de tout le nécessaire pour se faire un bon café. Parfait pour découvrir cette technique qu'est la filtration.
La douceur aromatique d'un café filtre ""Japan Style"" ! (Hario marque japonaise dont la réputation n'est plus à faire dans le monde du café)
Manque plus qu'à se trouver un bon café...",Scoutchy,Revisado en Francia el 11 de noviembre de 2022
