title,rating,body,author,date
passage du café,"1,0 de 5 estrellas",Même avec peu de café dans le filtre on se retrouve toujours avec du mare de café dans notre tasse chose qui est très désagréable impossible de contacter le vendeur .....,Rabine Viviane,Revisado en Francia el 8 de febrero de 2019
TROP PETIT !!,"1,0 de 5 estrellas",ATTENTION TROP PETIT !!,Odile,Revisado en Francia el 21 de octubre de 2020
Pas bien du tout,"1,0 de 5 estrellas",Recu couvercle un peu casser,dethan,Revisado en Francia el 11 de septiembre de 2020
Delusione,"1,0 de 5 estrellas","Purtroppo acquistato e mai utilizzato. Ho effettuato i lavaggi con acqua prima dell'utilizzo, secondo le istruzioni d'uso, ripetuti e ripetuti ed ogni volta si sprigionava odore di plastica.",Monica,Revisado en Italia el 19 de abril de 2020
Pas top,"1,0 de 5 estrellas",Il ya bcq mieux niveau qualité et prix,Ouggar meriem,Revisado en Francia el 1 de marzo de 2020
En panne au bout de 5 mois,"1,0 de 5 estrellas","Tombe en panne au bout de 5 mois. LG refuse de faire fonctionner la garantie car article non référencé chez LG France.
A éviter !",Eric Boucq,Revisado en Francia el 22 de septiembre de 2018
cafetière,"1,0 de 5 estrellas",La cafetière ressemble à un objet de dinette du foulage de gueule surtout pour 26euros !je déconseille s'est pas du tout une 6 tasse !une étoile sa ne les vaut pas !,Client d'Amazon,Revisado en Francia el 7 de enero de 2018
No,"1,0 de 5 estrellas",Il caffè fa davvero schifo 😂,Stella,Revisado en Italia el 15 de noviembre de 2020
erreur dans le descriptif,"1,0 de 5 estrellas","Dans le détail des fonctionnalités de la cafetière, il est indiqué PROGRAMMABLE .
Or ce n'est pas le cas.",kaspar,Revisado en Francia el 21 de noviembre de 2018
Piccolo,"1,0 de 5 estrellas","Prodotto arrivato in ritardo
Piccolo
Inutile",Marocco Style,Revisado en Italia el 10 de septiembre de 2020
Acquisto inutile,"1,0 de 5 estrellas","Dopo il primo caffè ci si accorge dell’unitilita dell’acquisto.
Manda su solo acqua riscaldata al punto da far uscire dell’altra parte solo acqua colorata con un sapore molto leggere che si può avere versando un espresso fatto nella moka in mezzo litro d’acqua .
Da restituire subito ...",Yacine,Revisado en Italia el 25 de diciembre de 2018
Un giocattolino...,"1,0 de 5 estrellas","Poco spendi.. Poco prendi... Ha funzionato male da subito, restituita immediatamente. 5 Stelle solo per Amazon! Impeccabili! ⭐⭐⭐⭐⭐",Newyorkese 70🇺🇸,Revisado en Italia el 7 de diciembre de 2019
Deludente,"1,0 de 5 estrellas",Perde acqua da sotto.,Luigi,Revisado en Italia el 7 de agosto de 2020
Senza Filtro fisso,"1,0 de 5 estrellas",Meglio 5 euro in piu' ma con il filtro fisso lavabile .,michele,Revisado en Italia el 26 de marzo de 2020
Cafetière,"1,0 de 5 estrellas","Bonjour,
Je n'attendais pas du tout ce petit modèle pour le prix, mais bon, je n'ai pas fait attention dommage pour moi.",jimmy sannier,Revisado en Francia el 1 de febrero de 2018
Inutilizzabile,"1,0 de 5 estrellas","Manca il filtro, è inutilizzabile!",Mic.,Revisado en Italia el 26 de mayo de 2020
Un po’ ingannevole l’immagine,"1,0 de 5 estrellas",Carina ma Molto piccola come dimensioni,Silvia,Revisado en Italia el 21 de diciembre de 2019
Scarsa qualità,"1,0 de 5 estrellas",Dopo un mesetto ha smesso di funzionare,A. Carlo,Revisado en Italia el 17 de noviembre de 2019
No viene con il filtro di carta !!!! Al meno lo potevano dire prima 😒,"1,0 de 5 estrellas",La macchinetta e bellísima ma no dico che ci vuole un filtro di carte 🤷🏼‍♂️,fernando velez,Revisado en Italia el 27 de junio de 2019
Non sono soddisfatta,"1,0 de 5 estrellas","Mi aspettavo di più da questa marca, mi è arrivata la caffettiera nelle tempistiche corrette e nell'imballaggio, peccato che mancava il filtro permanente.",Roberta,Revisado en Italia el 4 de enero de 2019
Non la consiglio,"1,0 de 5 estrellas",Gocciola acqua,lilia,Revisado en Italia el 12 de septiembre de 2019
piccola,"1,0 de 5 estrellas",piccola,Cliente Amazon,Revisado en Italia el 7 de octubre de 2019
Dopo 1 anno posso dire che è terribile,"1,0 de 5 estrellas",Non la usiamo più perchè continua a fare il caffè che sa di plastica...terribile...va bene solo perchè è piccola ma per il resto è una baracca,Valeria123,Revisado en Italia el 13 de diciembre de 2017
decu,"1,0 de 5 estrellas",ils ont ecrits 6 tasse mais pas du tout cafetiere toute petite! ne pas se fier a la photo attention,Client d'Amazon,Revisado en Francia el 17 de octubre de 2015
Non è una 6 tazze,"1,0 de 5 estrellas","Non è certamente una 6 tazze per caffè americano (forse 6 tazzine per espresso). Al più è una 1 e mezza due. Non l'ho provata materialmente quindi non so dire nulla sul funzionamento ma, ripeto, è minuscola paragonata alla mia vecchia macchinetta per caffè americano (quella sì per 6 tazze). Come sempre servizio Amazon perfetto. Rispedita indietro immediatamente.",Helmut,Revisado en Italia el 26 de noviembre de 2016
l'immagine inganna,"1,0 de 5 estrellas","la caffettiera è venduta per 6 persone. sei tazze ma in realtà è da 2 tazze grandi e sei tazzine da caffe'. essendo fatta per il caffe' americano non potete venderla come da 6 tazze.
saluti",antonio Ragoz,Revisado en Italia el 11 de enero de 2017
Un po' deluso,"1,0 de 5 estrellas","Ordinato 13/12, arrivato il 16/12 (prime)
Ho acquistato il prodotto per fare un regalo, arrivato senza involucro, come si può evincere dalle foto, la confezione è danneggiata.
Ok, che ne periodo natalizio ci sono molti più ordini, ma il cliente abituale andrebbe comunque tutelato",Cliente Amazon,Revisado en Italia el 16 de diciembre de 2016
Attenzione,"1,0 de 5 estrellas",Non posso utilizzarla perché non è presente il filtro. Normalmente il filtro viene venduto assieme al prodotto. Colpa mia che non me ne sono accorto subito.,Michele,Revisado en Italia el 2 de abril de 2017
Restituita,"1,0 de 5 estrellas","Per me non andava bene,l'ho restituita senza utilizzarla perché è davvero molto piccola . La descrizione e' ingannevole si parla di 6 tazze ma l'unità di misura e la tazzina da caffè mentre il caffè americano si beve in mug",marina1961,Revisado en Italia el 12 de marzo de 2016
N Recomendada,"2,0 de 5 estrellas","Hace el café muy bien,el tamaño para una persona q viva sola , perfecto.Si no se queda pequeña.
Pero N la volvería a comprar,N trae filtro y creo que caen posos..
Así q ahora toca comprar filtro a parte.Asi q,N la recomiendo,sale cara.
Después de un tiempo utilizándola,se abre la tapa y cae todo el agua fuera, tengo q estar apretando para q no se abra y pueda hacer el café",Ana,Revisado en España el 24 de julio de 2018
Ha durado muy poco,"2,0 de 5 estrellas","He comprado esta cafetera hace menos de nueve meses y yà no funciona como en principio, ahora lleva muchissimo tiempo para que salga el café, aunque haya hecho la decalcificaciòn unas veces. Estoy muy decepcionada: sé que nada dura para siempre, pero otras cafeteras me han durado al menos un par de años...",Marina D'Elia,Revisado en España el 29 de septiembre de 2019
Decepción.,"2,0 de 5 estrellas",No trae filtro y he tenido que comprarlo aparte ( y aunque pedí el de su medida no le queda bien ) no me gusta usar los de papel. A veces se abre cuando està goteando el café. No la recomiendo.,MARIA,Revisado en España el 27 de abril de 2019
"Bien, pero...","2,0 de 5 estrellas",Funciona pero es un plástico de calidad muy pobre. Mirar bien el tipo de filtro que compres. La jarra no lleva marcas para indicar la cantidad de agua.,José,Revisado en España el 3 de julio de 2018
Taille trop petit,"2,0 de 5 estrellas",Cafetière minuscule,Marchal christophe,Revisado en Francia el 17 de junio de 2024
"Modèle cheap et mal conçu, à fuir","2,0 de 5 estrellas","- Bec verseur beaucoup trop petit, on en verse très souvent à côté à moins de se servir du café centimètre par centimètre
- Le bac à filtre à café est également trop petit pour la taille des filtres !! Qui a conçu un truc pareil !
- Le bouton marche à arrêt est très dur de base
- La plaque réchauffe très peu une cafetière froide, c'est très lent à réchauffer
- Bon point : il fait du café rapidement et faible encombrement",Fr Dupont,Revisado en Francia el 27 de octubre de 2023
prise pas compatible,"2,0 de 5 estrellas",En commandant sur Amazon Suisse l'appareil est arrivé avec une prise française et ce n'est pas la première fois je suis très déçu. J'ai donc retourné l'article et je ne commanderais plus d'articles électriques sur Amazon.,Majid P.,Revisado en Francia el 10 de febrero de 2024
Déception,"2,0 de 5 estrellas","Le verre est tellement fin que le récipient de la cafetière s est cassé en moins d un mois
Je vais donc ressortir ma vieille cafetière d une marque concurrente !",Béa,Revisado en Francia el 22 de enero de 2024
Buona,"2,0 de 5 estrellas","È stato un regalo gradito , funziona come deve ed è molto carina da vedere . Peccato che l’avevo acquistata con prime in un giorno e invece con poste italiane , come sempre , è arrivata 3 giorni dopo … regalata in ritardo",Sonia,Revisado en Italia el 30 de noviembre de 2023
MOYEN,"2,0 de 5 estrellas","Cette cafetière est toute mignonne, très joli désign, le bémol est que c'est la 2e fois que je l'ai, la première fois le porte filtre tenait mal et pour attraper la verseuse elle accroche et l'appareil a filtre ne tient pas correctement fermé quand on retire la cafetière ce qui provoque de faux mouvements et la verseuse nous échappe et vlan... on la cogne.. et elle se fendille, ce qui m'est arrivé..
je viens de recevoir une deuxième identique en rapport à ce problème et cela recommence, le filtre ne tient pas correctement fermé et la cafetière cause de faux mouvements d'ou ou l'on peut la cogner d'ou mes deux étoiles
Moulinex devrait revoir ce problème récurrent, car c'est la 2ème cafetière avec problème identique au 1er...",MOA,Revisado en Francia el 26 de octubre de 2019
Moulinex FG150813,"2,0 de 5 estrellas","Filter fallen häufig um, da der Schwenkfilter zu niedrig ist. Der Papierfilter wird beim Schliessen des Schwenkfilters durch den Wasserzulauf umgeknickt. Das heisse Wasser erreicht das Kaffeepulver nicht.
Also immer nochmals kontrollieren, ob der Filter auch richtig sitzt. Das ist sehr nervig. WMF hat das besser gelöst.",fineartist Uk,Revisado en Alemania el 30 de octubre de 2022
PASSABILE MA NIENTE DI CHE...,"2,0 de 5 estrellas","La macchinetta inizialmente non dava problemi. Dopo un mesetto di utilizzo la temperatura del liquido non è più bella calda. Io l'ho comprata per fare dell'orzo. Innanzitutto richiede molta quantità di miscela altrimenti berrete acqua sporca colorata -.-. Inoltre quando togliete la brocca da sotto o la inserite di nuovo dopo lavata fuoriesce della rimanenza dal filtro ancora bollente se non tolto subito o accumulata nel cestello. In pratica se nn fate in tempo vi cola tutto sulla base della macchinetta o sul piano cucina rendendo scomodo e una seccatura pulirla... -.-'' Per praticità, rapidità e prezzo è comoda ma tutto sommato spendendo qualcosina in più forse si trova di meglio. Mi aspettavo di più... se dovessi ricomprarla non la comprerei...",marco,Revisado en Italia el 6 de febrero de 2020
Cafetiere pour dinette,"2,0 de 5 estrellas","J'ai jamais vu une cafetière aussi petite. Elle fonctionne bien, RAS mais pour la dinette de mes enfants.",Greg,Revisado en Francia el 20 de diciembre de 2022
"Mmm, non una bella esperienza...","2,0 de 5 estrellas","Premetto che con la roba Moulinex mi sono sempre trovato bene, ma con questo articolo non ci siamo. L'acqua non è abbastanza calda, la pompa dell'acqua è lentissima, cola mentre il caffè scende nella brocca, scomoda da pulire e il sapore, sembra un ricordo del caffè. Giusto per rendere l'idea, il Nescafe solubile standard è molto più buono del caffè di questa macchina (io uso Illy). Non si può mettere sotto timer perché ha uno stupido pulsante per niente funzionale, ad ogni utilizzo la condensa crea un lago intorno alla macchinetta. Per giunta dopo qualche settimana, la pompa dell'acqua ha smesso di funzionare definitivamente. Conclusione : ho chiesto il reso. Sconsigliata.",Danilo,Revisado en Italia el 12 de diciembre de 2019
Buon Rapporto qualità prezzo,"2,0 de 5 estrellas","Arrivata re imballata (male) da Amazon
Si capiva che il primo cartone non aveva va tenuto

Manca il filtro
Ma francamente non si capisce se
Ci sarebbe dovuto essere

Ero tentata di rimandarli indietro

Poi L ho provata e per quello che L ho pagata non male",Sara Mar,Revisado en Italia el 9 de enero de 2022
porte filtre fragil,"2,0 de 5 estrellas","malgré la bonne forme estétique, le porte-filtre est extrèmement fragil chose pour laquelle, je ne recommande pas cet article",nadia,Revisado en Francia el 30 de octubre de 2022
Insufficiente,"2,0 de 5 estrellas",È una macchina valida ma manca di contenitore caffè e filtro permanente che vanno comprati a parte.,Gaetano Giavoni,Revisado en Italia el 8 de noviembre de 2022
Qualité médiocre,"2,0 de 5 estrellas","J'ai acheté cette cafetière voilà un an et demi, elle a bien fonctionné jusque là mais se met à fuir (eau) et doit donc être remplacée malgré le détartrage régulier tous les mois.

La garantie est de 2ans sauf les frais d'envoi rendent l'opération non rentable.

Du jetable en somme, à coté j'ai une cafetière Bosch depuis 20ans qui fonctionne toujours aussi bien.",RB,Revisado en Francia el 17 de septiembre de 2020
OTTIMO PRODOTTO MA SE SI ROMPE LA CARAFFA NON SI TROVA IL RICAMBIO,"2,0 de 5 estrellas","La macchina è ottima, peccato che dopo poche settimane ho rotto accidentalmente la caraffa e non è disponibile nemmeno sul sito del produttore (moulinex). A volerla riacquistare su amazon costa quando la macchina scontata (non meno di 26 euro). Una presa in giro.
Non lo riacquisterei mai più.",Hewson60,Revisado en Italia el 15 de mayo de 2021
Attention filtres non standards,"2,0 de 5 estrellas","L'appareil est vraiment petit. Soit, ça peut être intéressant si on n'a pas beaucoup de place. Par contre les filtres sont
hors standards et très durs à trouver pour un prix normal. On perd donc l’intérêt d’économiser sur le prix du modèle. Je le regrette. Par contre il fonctionne correctement tous les jours depuis 6 mois.",Shazz,Revisado en Francia el 26 de julio de 2019
"Molto ""giocattolo""....","2,0 de 5 estrellas","Saròà che prima avevo una Kenwood, che mi è durata moltissimi anni, questa la trovo fragile, plastica fragile, ho tolto il filtro per lavarlo e poi non stava più inserito, continuava a cadere. Visto che è una parte da lavare spesso, spero che non ricapiti. Purtroppo, la nuova Kenwood costa oltre i 70 euro. Se potete spendere, meglio acquistare qualcosa di più valido.",Felix,Revisado en Italia el 10 de abril de 2020
Cafetière qui fuit,"2,0 de 5 estrellas",Cafetière achète il y a trois elle fuit déjà impossible de verser son café correctement sans qu’elle fuit !,Justine Garnier,Revisado en Francia el 27 de agosto de 2021
Sconsiglio,"2,0 de 5 estrellas","Il caffè è pessimo ma la cosa peggiore è che c'è un residuo di caffè molto cospicuo che resta sia sul fondo della beocca, sia nel caffè e si finisce per berlo.
Non so se sia la mia o se è il modello.",Sabrina F.,Revisado en Italia el 15 de julio de 2020
Filtro scadente: polvere del caffè e fibre di carta nel caffè,"2,0 de 5 estrellas",Ho dovuto effettuare il reso dopo 1 mese. Filtro scadente: polvere del caffè e fibre di carta nel caffè. La macchina sembra un giocattolo,Tonino Stark,Revisado en Italia el 14 de noviembre de 2020
Non soddisfatto,"2,0 de 5 estrellas",L acqua prende il sapore della plastica se non metti il caffe,claudio,Revisado en Italia el 14 de marzo de 2021
"Il prezzo è un po’ “altino”, comunque lo consiglio","2,0 de 5 estrellas","Prodotto arrivato integro anche se mancava di confezione. Non aveva la seconda confezione da trasporto.
È arrivato come se l’avessi comprato al negozio.",Andreact78,Revisado en Italia el 23 de abril de 2020
DOPO 1 ANNO NON FUNZIONA PIU',"2,0 de 5 estrellas","Prodotto come da descrizione, ha funzionato decentemente per 1 anno e adesso ci mette 1 ora a fare 2 tazze di caffè. Sconsiglio vivamente.",ROBERTO,Revisado en Italia el 16 de enero de 2020
PICCOLISSIMA....e Fragilissima!,"2,0 de 5 estrellas","PICCOLISSIMA!
Talmente fragile che dopo averla usata due volte ho deciso di acquistarne una nuova....ovviamente differente.",pat So,Revisado en Italia el 21 de abril de 2020
Petit,"2,0 de 5 estrellas",Bien mais petit ca ressemble a une cafetière de voyage.,Malaury Marsault,Revisado en Francia el 15 de abril de 2019
👎,"2,0 de 5 estrellas",👎,DAVIDE,Revisado en Italia el 29 de mayo de 2020
Caffè,"2,0 de 5 estrellas",È di piccole dimensioni,Cliente Amazon,Revisado en Italia el 27 de noviembre de 2019
Moulinex FG150813 Subito,"2,0 de 5 estrellas",déçu par le bouton je croyais a un interrupteur mais c'est un bouton poussoir dommage car on ne peux pas lui mettre un programmateur.,bilou,Revisado en Francia el 1 de marzo de 2017
piccolissima e senza filtro,"2,0 de 5 estrellas","sarà che tutte quelle che ho avuto fin'ora l'hanno sempre avuto di dafault, ma mi ha stupita davvero molto non trovare il filtro! in più la misura della macchina è tra le più piccole, quindi i filtro generalmente in commercio sono più grandi e uno adatto è difficile da trovare.",erika,Revisado en Italia el 22 de octubre de 2016
moulinex fg1528,"2,0 de 5 estrellas","l'interruttore a tempo che spegne la macchina dopo mezz'ora la rende di fatto inutilizzabile, giacchè la ragione fondamentale del sistema caffè a filtro rispetto alla Moka è proprio quella di accendere la macchina ed avere sempre il caffè a disposizione senza preoccuparsi del tempo che passa.
La macchina precedente, quasi uguale, non aveva tale interruttore, non si capisce la ragione dell'introduzione della modifica.",adriano lesca,Revisado en Italia el 13 de diciembre de 2015
Prodotto veramente medio.,"2,0 de 5 estrellas","Ho scelto Moulinex per il nome e mi aspettavo veramente di meglio.
Basti dire che non e' smontabile e per lavarlo bisogna portarlo sotto il rubinetto tutto intero.

Inoltre l'alloggio filtro e' piccolo e il filtro permanente che avevo comperato assieme non ci sta.

Per il resto funziona, si, ma insomma... Moulinex mi e' scaduta.",Renato Croce,Revisado en Italia el 29 de diciembre de 2015
Filtro non pervenuto,"2,0 de 5 estrellas","Nella scatola non era presente il filtro, difficile trovare il ricambio separatamente (comunque costa quasi quanto la macchina stessa). Abbiamo dovuto comprare i filtri in carta e pagare altri 8€.",Diego Lucattini,Revisado en Italia el 11 de febrero de 2017
ou sont les 6 tasses???,"2,0 de 5 estrellas","je recherche toulours les six tasses noir inox comme sur le commentaire de la vente ""subito cafetière AVEC 6 tasses",Client d'Amazon,Revisado en Francia el 7 de septiembre de 2016
Falta filtro,"3,0 de 5 estrellas","Me parece muy mal que no incluya el filtro, tal como pone en las instrucciones",Juan,Revisado en España el 16 de enero de 2020
No era lo que esperaba,"3,0 de 5 estrellas","Me gusta porque es pequeña, pero vino con la tapadera de arriba rota. No la devuelvo por no hacer todo el papeleo.",Nuria,Revisado en España el 17 de abril de 2018
"Cafetera corecta, pero no trae ningún filtro","3,0 de 5 estrellas","Producto correcto, llegó puntual. No trae ningún tipo de filtro (papel o plástico), los filtros de papel universales para 4/6 tazas quedan un poco grandes.",Antón,Revisado en España el 18 de julio de 2017
Esta bien,"3,0 de 5 estrellas",Flata fletro dentro,Erica Agbonmhenlo,Revisado en España el 9 de noviembre de 2019
Es pequeño,"3,0 de 5 estrellas",Regular gotea cuando se quita la jarra,Esperanza,Revisado en España el 30 de marzo de 2019
Gott kaffe,"3,0 de 5 estrellas","Då den köptes som julklapp till min mor,
Så enligt henne är hon nöjd,känns o ser ut o va
Ett bra tillskott i köket,kaffet blir riktigt varmt vilket va ett stort plus,sen kändes o såg den lite exklusivare ut än tidigare kaffebryggare. Men är väl en smaksak, ser ut o va av god kvalitet o snygg",Jerker,Reseñado en Suecia el 31 de diciembre de 2023
Incomplete product descriptio..take note,"3,0 de 5 estrellas","This item comes with a European plug which is not noted in the description. It has mo permanent filter which is also not noted in the description.
It makes reasonable coffe, but had I know the two points listed I would not have purchased this item.",Graham G.,Revisado en Reino Unido el 8 de enero de 2017
Contenant,"3,0 de 5 estrellas",La cafetière est un peu petite,Goupy,Revisado en Francia el 16 de septiembre de 2023
IK HAD GROTERE INHOUD VAN DE TASSEN VERWACHT,"3,0 de 5 estrellas",IK HAD GROTERE INHOUD VAN DE TASSEN VERWACHT,Rita Huylebroeck,Reseñado en Bélgica el 20 de mayo de 2024
tres petite,"3,0 de 5 estrellas",cafetiere pour un petit dejeuner 4 tasses maxi,dominique moule,Revisado en Francia el 19 de julio de 2024
Quasi perfetto,"3,0 de 5 estrellas","Unica pecca il Filtro, non viene incluso!! E non dice nemmeno la misura per poterlo prenderlo separatamente",ronny calderon,Revisado en Italia el 9 de julio de 2024
Articolo mediocre,"3,0 de 5 estrellas","Rispetto ad altri brand competitor ha un limite nell'utilizzo del compartimento caffè.
Lo sgancio del cassettino per ricarica e pulizia non è molto funzionale.
Per il resto funziona correttamente.
Non adatta a chi ha poca manualità.",manuel,Revisado en Italia el 9 de mayo de 2024
Buon prodotto ma incompleto,"3,0 de 5 estrellas",Sembra un articolo di buena qualità ma è un peccato che non viene con il filtro come altre cafetiere purtroppo ho devuto comprare il filtro ciò che rappresenta un costo aggiuntivo circa di 10 euros,HECTOR MONTAÑO,Revisado en Italia el 6 de abril de 2024
Fonctionnelle,"3,0 de 5 estrellas","Le système de pivot au niveau du filtre est cassé en bas. Je soupconne un probleme de transport et/ou une insuffisance d emballage. C'etait un cadeau .Nous ne le renverrons pas, ayant mis un gros scotch noir .

sinon elle fonctionne bien !",BIBILOLO37,Revisado en Francia el 23 de septiembre de 2023
La consegna super veloce..,"3,0 de 5 estrellas","Tutto bello tutto apposto però Madonna senta un filtro potrebbe pure metterelo, vergognoso....",RABAH,Revisado en Italia el 14 de febrero de 2024
Nella confezione mancano i sacchetti filtri.,"3,0 de 5 estrellas",Per poter fare un buon caffè ho dovuto acquistare dei sacchetti filtro per evitare che la polvere di caffè passasse insieme all'acqua nel filtro.Secondo me sulle indicazioni doveva essere precisato.,Flax,Revisado en Italia el 26 de diciembre de 2023
Cafetière,"3,0 de 5 estrellas",En général avec une cafetière on fait du café,Dodole17,Revisado en Francia el 4 de diciembre de 2023
bien faire attention au capacite.,"3,0 de 5 estrellas","Bonjour,

je me suis fais avoir sur la capacité de cafetières, autrement fonctionne bien.",Épervier,Revisado en Francia el 18 de noviembre de 2023
Caffè d’orzo,"3,0 de 5 estrellas","NON HA FILTRO IN DOTAZIONE!!
Funziona bene per ora.
Il caffè non viene male,è veloce,abbastanza silenziosa. Costa poco",Vanna,Revisado en Italia el 21 de diciembre de 2023
Facile d'utilisation et rapide,"3,0 de 5 estrellas",Facile à utiliser,Philippe,Revisado en Francia el 15 de octubre de 2023
Pas mal mais petite taille,"3,0 de 5 estrellas",Le produit est bien par contre pour 2 tasses de café max 😅,Slim Ben Salem,Revisado en Francia el 12 de septiembre de 2023
"Bon, mais nécessite de la patience","3,0 de 5 estrellas","D'un point de vue qualitatif, l'appareil donne entière satisfaction, mais il faut malheureusement beaucoup de temps pour préparer deux tasses de café.","H&H, France",Revisado en Francia el 8 de mayo de 2023
je n'ai pas aimé,"3,0 de 5 estrellas","non programmable, à savoir car j'avais lu le contraire dans les commentaires",PUNTEL G.e,Revisado en Francia el 11 de enero de 2023
Peccato che non ha i filtri,"3,0 de 5 estrellas",L'ho restituito perché ci sono molti modelli che hanno il filtro già nella macchina per me risultava un po' problematico cambiare sempre i filtri trovarli era una spesa in più che non volevo affrontare anche se è piccola quando ci sono modelli che che hanno già i filtri,Sonia giannelli,Revisado en Italia el 15 de abril de 2022
Piccolo,"3,0 de 5 estrellas",L'articolo si presenta ben fatto e dal design come me l'aspettavo l'unica cosa che è più piccolo rispetto a quello che mi serviva realmente e ho dovuto restituirlo per uno più grande,Enza,Revisado en Italia el 23 de octubre de 2022
Mi aspettavo meglio!,"3,0 de 5 estrellas","Arrivata senza filtro, che comprato a parte costa 10 euro.
Sapore del caffè niente di eccezionale. Per ottenere qualcosa di decente bisogna utilizzare un sacco di polvere!",Francesca,Revisado en Italia el 21 de agosto de 2022
Un classico,"3,0 de 5 estrellas","da sempre, la più economica. Lo stesso modello della Severin è decisamente migliore e più pratico nelle operazioni, ma costa il 50 per cento in piu---",trio prime,Revisado en Italia el 13 de junio de 2022
"Caffè e macchina ottimi, la ditta...","3,0 de 5 estrellas","La macchina funziona e il caffè è ottimo.
Quello che non mi aspettavo di trovare è la totale mancanza di un filtro X i fondi, anche in forma cartacea, che costa due centesimi di euro. E nemmeno mi è stata fatta un’offerta X i filtri. Ma come si fa a vendere una macchina senza filtro?
Ho trovato la soluzione, ma la mancanza dice proprio tutto della ditta produttrice.
Peccato!",David C.,Revisado en Italia el 30 de diciembre de 2020
Pensavo fosse più grande,"3,0 de 5 estrellas",In pratica : una “mini macchina” per il Filter Kaffee .,IvMx,Revisado en Italia el 5 de diciembre de 2022
