title,rating,body,author,date
Dicht und hält lange warm,"5,0 de 5 estrellas","Ich bin mit dieser Thermoskanne sehr zufrieden, sie hält lange warm und ist dicht, was man von einigen anderen nicht behaupten kann.
Würde ich wieder kaufen.",Murmel,Revisado en Alemania el 20 de julio de 2024
Ottimo,"5,0 de 5 estrellas",Ottimo.,Luigi Mille,Revisado en Italia el 30 de enero de 2024
Belle qualité et chaud devant,"5,0 de 5 estrellas",Un produit isotherme de très bonne qualité et esthétique. On peut le poser sur une table parmi les couverts avec les infusettes en coffret pour que les invités se servent sans avoir à relancer la bouilloire pour réchauffer l'eau au gré des demandes pour la maîtresse de maison.,reineonline,Revisado en Francia el 4 de enero de 2024
Love this carafe!!,"5,0 de 5 estrellas",This is a great looking carafe that keeps our coffee hot to the last drop. Excellent product.,Lisa W.,Revisado en Canadá el 5 de febrero de 2024
Zeer tevreden,"5,0 de 5 estrellas",Mooie en handige kan. Houdt koffie warm en sist niet! Antislip ook prima,Aggie,Reseñado en Bélgica el 27 de agosto de 2023
1- Litre Thermal coffee carafe,"5,0 de 5 estrellas","WOW ...I was hesitant about buying a coffee carafe and searched for hours until I found the Tiken.

I'm so glad I purchased it and cannot believe how hot the coffee remains, even after almost 24 hours in the carafe.

Obviously, it wasn't scalding after that period of time, but it was still hot enough that I could only sip it (without any milk).

Fantastic addition to my kitchen and highly recommending it to anyone who needs to keep their coffee HOT for hours on end.",Moth72,Revisado en Australia el 2 de agosto de 2023
Ottima!!,"5,0 de 5 estrellas",Ho trovato la soluzione ottimale per servire insieme una quarantina di caffè preparando al mattino e mettendo nella caraffa termica. Dopo circa 6 ore era bollente e gli invitati soddisfatti,Cristina Pellegrino,Revisado en Italia el 2 de julio de 2023
Value for money,"5,0 de 5 estrellas",This thermal jug compares very well with similar items that appear to cost considerably more. Appears durable and well made. Came securely boxed with adequate instructions.,Paul R,Revisado en Australia el 1 de enero de 2024
coule,"2,0 de 5 estrellas",tien pas chaud,debauche,Reseñado en Bélgica el 24 de diciembre de 2023
Keeps the heat,"5,0 de 5 estrellas","I've purchased this jug to keep my tea hot in a very cold garden office while working from home.

It is brilliant, it is 6'C in my office and this jug keeps my tea piping hot for the whole day!

Good size and easy to use, much better than more expensive alternatives from very well known brands.",Dal,Revisado en Reino Unido el 12 de enero de 2024
Keeps coffee hot,"4,0 de 5 estrellas","I love the color, and it is great that it can hold a lot liquid. And the liquid stays very warm. But I do not like the handle, it is situated in such a place that one has to awkwardly hold the bottom of the container as well as the handle to pour. One has to have very, very, very strong wrists to hold it at such an angle to pour.",Reg,Revisado en Canadá el 21 de noviembre de 2023
(UPDATED) It Doesn't Keep Beverages Hot For Long,"4,0 de 5 estrellas","UPDATE (11-OCT-2022): I was wrong. Not entirely sure what happened, but now it is working. Maybe the lid wasn't on tight? I do not know but now it is holding (test) hot water at above 120° F (after adding it at 128° F) for well over 10 hours. I would like to apologize for my original review and I am not ashamed to have egg on my face from time to time.

Over the last 3 days, now, it has worked like a champ! Now I am actually in love with this product. It looks nice, works very well and has been keeping my coffee hot for at least 3 hours for a small batch. I cannot complain.

I would like to say that while I understand how some people find this difficult to clean, it really isn't that bad. I use a soft foam glass brush (like this: https://www.amazon.com/Cleaning-Plastic-Scrubber-Washing-Cleaner%EF%BC%882/dp/B08M6CWN7L/ref=sr_1_10?keywords=YDAZU&qid=1665496276&qu=eyJxc2MiOiIwLjAwIiwicXNhIjoiMC4wMCIsInFzcCI6IjAuMDAifQ%3D%3D&sr=8-10) to clean it (as well as my French press) with weak/mild soap solution and it cleans up easy enough. The lid itself looks hard to clean, but there is a small hole at the back of it that easily drains out water/soap used to clean it.

Right now, I couldn't be happier with it.
--------------------------------------------------------------------------------
(ORIGINAL REVIEW): I bought this to keep French press coffee hot, but this container barely manages to keep the coffee hot for more than 30 minutes. From the first use to the last use, it's just not doing what I bought it for.

Even when primed with hot water, it just won't keep things hot for long at all. Every cup after the first cup is lukewarm at the very best and downright cold at the worst. The coffee goes in around 180 degrees Fahrenheit.

I can't recommend this product because it's not doing what it promised.",The Alpha Akita,Revisado en los Estados Unidos el 8 de octubre de 2022
carafe à café isotherme,"4,0 de 5 estrellas",produit conforme à la description bonne contenance mais un peu dessus car ne garde pas la chaleur très longtemps,chrismene,Revisado en Francia el 19 de diciembre de 2023
Best jug ever,"5,0 de 5 estrellas","This jug is awesome stays boiling hot all day, and is still warm the next day. Absolutely love and recommend!!!",Kindle Customer,Revisado en Australia el 13 de octubre de 2023
Excellent jug,"5,0 de 5 estrellas",Keeps liquids hot or cold. Great size. Excellent addition to any home. Great to bring up to attic for drinks.,Lucy Costigan,Revisado en Reino Unido el 25 de marzo de 2024
Beau design,"5,0 de 5 estrellas","Eau chaude pendant 24h et l'eau était encore chaude, pas bouillante mais chaude.

Évidemment moin il y a du liquide chaud moins la chaleur se garde. Logique. Sinon. C'est un bon produit. Noir mat. Ne laisse pas beaucoup de traces de doigts.",tophe,Revisado en Francia el 27 de marzo de 2024
"So good, two different friends tried to keep it for themselves!","5,0 de 5 estrellas","It’s easy to clean, looks chic and modern, holds temps for about 12 hours (tea still warm 24 hours later). Loved it so much bought another backup one!",M.,Revisado en Canadá el 11 de febrero de 2024
value for money,"5,0 de 5 estrellas",Excellent thermal insulation performance,wei,Revisado en Australia el 26 de noviembre de 2023
Conserve bien la chaleur,"5,0 de 5 estrellas","1,5 litre de thé.",cevaer,Revisado en Francia el 14 de marzo de 2024
Well made!,"5,0 de 5 estrellas",It makes a nice cuppa tea in the morning & a nice cuppa tea every day. Just pour out the hot water & it will stay hot for your drink for long after your first slurrp.,Ginger man,Revisado en Reino Unido el 17 de marzo de 2024
Top quality,"5,0 de 5 estrellas",Glad I bought this one. keeps hot water for pretty long period. Seems like made of top quality product. I will buy it again if I need to and would recommend to all.,Suraz,Revisado en Reino Unido el 24 de enero de 2024
Keep the heat during the day,"5,0 de 5 estrellas","This bottle keeps the heat all day long, lightweight, easy to clean too.",raiza,Revisado en Australia el 21 de septiembre de 2023
Excellent Urn,"5,0 de 5 estrellas","Very easy to use and keeps water, tea, coffee etc hot for a long time. Base stays cool so you can put it anywhere!",Mulga,Revisado en Australia el 13 de julio de 2023
"I strongly recommend it to everyone, due to the quality and price of this magnificent product!","5,0 de 5 estrellas","An excellent thermal bottle, much better than I imagined. Keeps my coffee hot for hours. I strongly recommend it to everyone, due to the quality and price of this magnificent product!",Douglas Martins,Revisado en Canadá el 17 de noviembre de 2023
Keeps tea hot for hours,"5,0 de 5 estrellas","This is a great little kettle. I can make tea in the morning and it stays hot all day. I should have bought one long ago. No need to boil up a kettle for a cup of tea, just pour another one out. I use two teabags and fill with boiling water, and that's it.",Annalisa,Revisado en Reino Unido el 17 de julio de 2024
Positiv überrascht,"5,0 de 5 estrellas",Die Teekanne ist wirklich toll und hat mich total positiv überrascht! Der Tee bleibt über 12h heiß und 48h warm.,Marilen,Revisado en Alemania el 22 de julio de 2024
"Excellent at keeping coffee HOT! After two hours of book club meeting, coffee still hot!!!","5,0 de 5 estrellas","Bought this carafe to have plenty of coffee for my morning book club meeting. After two hour meeting, discovered that the coffee remaining in carafe was still HOT! Excellent product.

Suzanne",Suzanne,Revisado en los Estados Unidos el 20 de julio de 2024
works good so far.,"4,0 de 5 estrellas",keeps coffee hot and drinkable for a good 5hr haven't tried more than that.,Susan Kipl,Revisado en los Estados Unidos el 22 de julio de 2024
Perfect,"5,0 de 5 estrellas",Love it...love it...love it!!!,perry pellicotti,Revisado en los Estados Unidos el 18 de julio de 2024
Works pretty well keeping hot beverages hot; splatters some when pouring out,"4,0 de 5 estrellas","I like the shape of this thermal carafe, it is sturdy and I am confident it will not tip over. The neck is narrow, as is common with these items, but it does make the inside a challenge to clean -- I clean it as best I can after each use so tea stains don't build up. I have been using this every day for over a week now, and I can say from my experience that it works well at keeping hot tea hot. When it is full, it does a better job; when it is half full, the tea would probably not stay drinkably hot for more than 5 hours. This is perfectly fine for my uses. I am happy to report that it actually holds 1.09 liters by measure. The pour spout is activated by the thumb above the holding handle, and that also works very well. Edited after a few weeks to add: I find that when I am pouring from the carafe into a mug, the liquid does tend to splatter as it comes out, and some of it ends up on the counter. I haven't quite figured out why this happens, I am holding the trigger all the way down. It's only a nuisance, one half paper towel cleans it up, so I'm leaving the review at 4 stars.",Paul in SF,Revisado en los Estados Unidos el 25 de febrero de 2024
"Attractive, light weight and easy to pour!","5,0 de 5 estrellas","Love this carafe! It's attractive, non slip and light weight! So easy for me to handle and pour my tea! Keeps my tea nice and hot!",Maria LeBannister,Revisado en Canadá el 19 de julio de 2024
Gute Kanne,"4,0 de 5 estrellas","Habe ich verschenkt. Hält ca. 4 Stunden heiß.
Für den Sontags Kaffee Klatsch perfekt. Hatten sonst immer 2 billig Kannen im Gebrauch und jetzt passt alles in eine. 1.5 Liter , danach sieht die Kanne gar nicht aus.
Einziger Kritikpunkt ist das sich der Deckel etwas ansaugt wenn der Kaffee frisch eingefüllt ist so das man etwas kräftiger den Hebel drücken muss. Definitiv werde ich für mich die gleiche Kanne auch noch kaufen.",Holzfrosch Prinz,Revisado en Alemania el 21 de marzo de 2024
Warm water all day long!,"5,0 de 5 estrellas","I am not sure about others, but we love warm water all day long. This unit is really the one we were missing. We have kettle that we boil water in the morning. Then transfer that water in to this Carafes. Throughout the day, mix varying portion of water from Carafes and tap water to keep getting warm all day long. Once it gets empty - refill it again!

Technically speaking - it is pretty air tight once closed. Threads are innovative that valve stays always aligned with handle once closed. Seems a good quality spring for opening indeed helps get water out very easy.

Now - as anything that deals with hot beverages - not safe to be kept around kids who does not understand what cautions to take. We are using one unit since last 1 year and holding up very well. Now we have another unit to give it as gift we sure they would enjoy.

Thank you for the quality product!",Alay,Revisado en los Estados Unidos el 21 de enero de 2024
Excellent Company,"5,0 de 5 estrellas","Amazon sent me a used, dirty, moldy, stinky carafe. I was disappointed and left the company a negative review of their product. The Tiken Company contacted me with apologies, and a refund, as well as shipping me a Brand New Carafe from THEIR warehouse/shop. I have used the Tiken Carafe (2L size) several times. I prime it for hot liquids by filling it with boiling water and letting it sit for half an hour. Then I dump out the water, and pour in either coffee, or boiling water for the work day. After 8 hours, the coffee or water is still very hot to the touch, and I must let it cool a bit before drinking. This is excellent because I don't have to microwave it to warm it up. However, I am more impressed with the Tiken Company who puts their customers first, and has a healthy concern with being a reputable company.",JenaHoy,Revisado en los Estados Unidos el 31 de enero de 2024
Keeps drinks hot for hours!,"5,0 de 5 estrellas","I like to drink a lot of hot tea. But I don't like to make a cup each time I want a cup.
This carafe was the perfect solution. It holds 34 ounces, which is several cups of tea. I have come back to it 8 hours later and the tea was still hot. Not scalding hot, but still hot, not warm.
If you leave it overnight it will be cold the next morning. I make fresh tea each morning, so this is not an issue for me.
I fill the pot up with boiling water, put in 2 tea bags, and let it brew 3-4 minutes. That's right, you can get 34 oz of hot tea out of 2 tea bags. If you do it for 4-5 minutes it will be pretty strong tea.
So if you just need to keep some hot beverages hot for several hours, this carafe is the one for you.",Rich,Revisado en los Estados Unidos el 20 de enero de 2024
"Super Teekanne, würde ich wieder kaufen","4,0 de 5 estrellas","Ich habe lange nach einer Teekanne mit 1,5 l Fassungsvermögen gesucht und bin mit dieser hier fündig geworden. Sie macht einen sehr hochwertigen Eindruck. Durch ihr Gewicht ist sie ein wenig schwer, was aber gar nicht schlecht ist, da sie sich nicht so leicht umwerfen lässt. Auch mega gut ist, dass die Kanne einen rutschfesten Boden hat. So bleibt sie überall perfekt stehen. Der Tee bleibt sogar über Nacht sehr warm, was klasse ist. Es gibt nur einen Punkt Abzug und zwar, weil sie ständig quietscht, bis man den Knauf am Deckel drückt und Luft entweichen kann. Hab noch nicht rausgefunden warum das so ist.
Fazit: super Teekanne, die ich auf jeden Fall auch noch einmal fürs Büro bestellen werde! :)",S.H,Revisado en Alemania el 23 de diciembre de 2023
Pas mal pour le prix,"4,0 de 5 estrellas","Pas mal, jolie, garde un peu plus la chaleur. Pas le TOP mais pour cette pris je suis contente.",Noella,Revisado en Francia el 21 de enero de 2024
Deckel ist Fehlkonstruktion,"1,0 de 5 estrellas","Meine erste Flasche hat 6 Monate überlebt, die zweite nur 6 Wochen.
Der Hebel am Deckel besteht aus Plastik und bricht im inneren des Deckels ab, wenn zuviel Kraft aufgewendet werden muss. Wenn man z.B. sich ein Glas Tee eingießt, füllt der sich der nun freigewordene Raum in der Kanne mit kalter Luft. Diese erhitzt sich und dehnt sich aus. Dies erzeugt einen Überdruck in der Kanne. Wenn man nun den Hebel runterdrückt um wieder etwas herauszugießen, braucht man mehr Kraft als gewöhnlich, und der Hebel bricht früher oder später ab.
Die Kräfte die hier walten sind minimal, und von einer so teuren Kanne hätte ich vernünftige Sicherheitsmargen in der Konstruktion erwartet.

Davon abgesehen bin ich mit der Kanne zufrieden, aber ohne Deckel ist sie halt nutzlos.",Amazon Kunde,Revisado en Alemania el 3 de julio de 2023
"At first, this was a 5 star deal","1,0 de 5 estrellas","As the title says, I loved this when I first bought it 2 months ago. Now it's ready for the landfill. Yes, it keeps my coffee hot. BUT...you can NOT clean the lid and even after carefully rinsing and draining the liquid (coffee and a hot water rinse) it is starting to smell stinky. So that means this carafe is junk.",Jtap,Revisado en los Estados Unidos el 20 de enero de 2024
Not working after 9 months. No warranty. 30 day return only.,"1,0 de 5 estrellas","Looks great. I like how the lid closes into the proper position.

*** Well, it’s been just over 9 months and it no longer keeps the coffee hot. I can feel the heat of the contents on the outside of the carafe so it’s obvious that the carafe has lost its insulating properties. I should add that we have only cleaned it by hand-rinsing between uses and never put it into the dishwasher. I attempted to contacted Tiken through their website but they have not responded after several days. I searched their site for “warranty” but it appears that they only have a 30 day return policy and no warranty at all.",BPM,Revisado en los Estados Unidos el 6 de mayo de 2023
Looks good does NOT keep coffee hot in spite of preheating,"1,0 de 5 estrellas","Like the look, just doesn't work. Unfortunately cannot return as daughter disposed of the packaging.",Sasha,Revisado en Reino Unido el 12 de enero de 2024
Does not work,"1,0 de 5 estrellas",This is suppose to keep liquid hot for a long period of time. Well I don't consider 30 minutes long. It simply does not work and we received it for Christmas and did not try until after warranty period. Would love to send it back..,"Bayou State Homes, Inc.",Revisado en los Estados Unidos el 18 de febrero de 2024
Hält leider nicht die von vielen gelobte Isolierfähigkeit,"1,0 de 5 estrellas","Ich muss es so deutlich ausdrücken. Würde dieses Produkt weder nochmal kaufen , oder weiterempfehlen.",Amazon Kunde,Revisado en Alemania el 18 de enero de 2024
Deckel leider Plastikmist,"1,0 de 5 estrellas",Nach drei Monaten ist die erste Kanne kaputt gegangen (Deckel nach einmaligem runterfallen gebrochen). Kontakt mit dem Verkäufer ist gut. Bekam dann eine neue Kanne (Deckel hätte mir gereicht). Nun nach weiteren vier Monaten ist der Deckel der zweiten Kanne auch hin. Optik und Haptik schön. Leider nicht nachhaltig und daher nicht empfehlenswert.,Nelley,Revisado en Alemania el 16 de agosto de 2023
Does not keep liquids hot,"1,0 de 5 estrellas",Poured hot coffee in pot. Barely stayed warm after an hour.,JoAnn,Revisado en los Estados Unidos el 21 de marzo de 2024
Gute Kanne - schlechter Deckel,"1,0 de 5 estrellas","Im Mai gekauft - Anfang August ist der Ausdruckhebel für die Öffnung des Ventils zum Ausgießen abgebrochen. Wie man den anderen Rezensionen entnehmen kann, scheint das der Normalfall zu sein. Schade, denn die Kanne hat den Tee wirklich sehr, sehr lange warm gehalten.",Middelrath,Revisado en Alemania el 3 de agosto de 2023
A few hrs top,"1,0 de 5 estrellas",It keeps liquid inside hot for only a few hours. I was expecting it to last like at least several hours.,Mary,Revisado en los Estados Unidos el 9 de marzo de 2024
"Thermokanne Tiken 1,5ltr","1,0 de 5 estrellas",Edelmetallschrott hält ca.3std warm nie mehr wieder,Karl-Heinz Müller,Revisado en Alemania el 19 de noviembre de 2023
vermeitlich gute Kanne,"1,0 de 5 estrellas","Dezember 2022:Gute Kanne, hält sehr lange heiß.
Einziges Manko: Am Ausgiesser tropft es nach unten

August 2023: Muss die Rezession leider korrigieren.
Die Kanne hat eine Undichtigkeit und irgendwo in der Isolierung sammelt sich Flüssigkeit. Leider ist alles fest verklebt und man kann die Kanne nicht reinigen. Der Edelstahl an der Wand ist auch dauerhaft verfärbt und man kann es mit nichts reinigen.",Anne D.,Revisado en Alemania el 21 de febrero de 2023
Coffee giving headaches after sitting in this pot.,"1,0 de 5 estrellas","So disappointed.
I use glass walled carafes to hold my coffee after the coffee maker does its job.
I wanted something non breakable to use on trips.
We washed this brand new pot throughly with vinegar, rinsed it very well.
Put in brewed coffee.
Later, husband got a cup of coffee, after sipping, said he had a weird headache (he is not a complainer).
Same thing happened to me twice today.

The inside of the lid is also difficult to wash. But the immediate headaches are the reason for the return.",KayDee,Revisado en los Estados Unidos el 31 de julio de 2022
Tiken Isolierkanne,"1,0 de 5 estrellas",Nach 6 Wochen ist der Ausgießer-Hebel abgebrochen. Billiger Plastikschrott.,Amazon Kunde,Revisado en Alemania el 15 de agosto de 2023
Broken after a month using,"1,0 de 5 estrellas",The lid does not lock or open anymore used it for a month and now tea doesn’t come out of the lid,Mehrnaz Behbahani Nia,Revisado en Australia el 20 de septiembre de 2023
Leaks!,"1,0 de 5 estrellas","At first really loved this carafe. Positive keeps coffee warm to hot throughout the day. Negative after 3 months has started to drip and leaks. The lid is as tight as possible but when you stop pouring, coffee continues to run out of the spout. I would love if someone could tell me how to correct this. Very disappointed.",dd,Revisado en los Estados Unidos el 2 de mayo de 2023
Received a VERY USED PRODUCT,"1,0 de 5 estrellas","I opened the package and was immediately hit with an overwhelming smell of chai! I opened the carafe and there was still water ( not a lot) but someone attempted to clean the product.

Very disappointed AND now I have to go out of my way to return it",Ashley,Revisado en los Estados Unidos el 23 de enero de 2023
Beware - lost capability to retain heat after 3 months,"1,0 de 5 estrellas","Initially delighted with this purchase - however, within 3 months it has lost its capability to retain its heat and it’s now beyond the return date!",Bev,Revisado en Reino Unido el 26 de noviembre de 2022
stopped working,"1,0 de 5 estrellas",The item arrived looking good and worked for the first 40 days. At this point the the carafe lost its insulation properties (perhaps the vacuum seal failed). As soon as you fill the carafe with a hot liquid the outside becomes hot. The carafe was never dropped and was always hand washed. Since this occurred 10 days after the return policy expired I'm stuck with a nice looking but useless carafe.,steveltf3,Revisado en los Estados Unidos el 13 de junio de 2022
Unable to be cleaned,"1,0 de 5 estrellas",I loved this pitcher out of the box. Everything was 5 star until I read the cleaning instructions. The lid is designed so whatever is in the pitcher has to flow through the lid internally and there is no way to disassemble the lid to clean it. I was planning to use it for coffee creamer and the thought of not being able to thoroughly clean the lid is disgusting and a health hazard.,Linda,Revisado en los Estados Unidos el 17 de septiembre de 2021
Disappointing carafe,"1,0 de 5 estrellas","After a few months, the inside ring of this carafe is all corroded from the coffee.",Julie M,Revisado en los Estados Unidos el 4 de septiembre de 2023
No longer keeping warm and just past its return time,"1,0 de 5 estrellas","At first it kept the coffee very But I scrubbed it trying to get severe stains out and now clean it won't keep the coffee even lukewarm. So, was there a coating or something that was removed because I did not see anything come out when I cleaned it other than coffee stains. Of course my return time frame was up one month ago so now I have a coffee pot I can't use!",Dp,Revisado en los Estados Unidos el 21 de febrero de 2022
hot drink getting spoiled,"1,0 de 5 estrellas",It was working fine 2 months now any hot drink I am keeping its getting spoiled and has been causin stomach upset everytime I use,Sheriff,Revisado en los Estados Unidos el 28 de abril de 2023
Stopped working after only 3 months use,"1,0 de 5 estrellas","Looks like a good product but stopped keeping coffee hot after only 3 months. Amazon return policy is only 30 days, so apparently even Amazon knows this item is crap. Do not buy a Tiken carafe.",Amazon Customer,Revisado en los Estados Unidos el 23 de mayo de 2022
Poor quality- don't buy!,"1,0 de 5 estrellas","Not recommended!!
The opening system stuck after a few uses, and so it became useless! Absolutely no way to open it. What a waste.",Rose Y,Revisado en los Estados Unidos el 19 de noviembre de 2022
"Horrible, never keep liquids hot","1,0 de 5 estrellas","I bought this to keep my coffee hot, but was so disappointed! This product doesn’t work at all. It doesn’t keep coffee hot at all. I mean I would leave the coffee for 15 minutes and it’s no longer hot! I totally regretted buying this product, what a waste of money!!!!",S.M,Revisado en los Estados Unidos el 19 de noviembre de 2021
Don't hold hot coffe for 1hour,"1,0 de 5 estrellas","Peace of junk, do not hold hot drink for more than a hour.",felipeapfrj,Revisado en los Estados Unidos el 5 de diciembre de 2022
The lid is IMPOSSIBLE to get clean.,"1,0 de 5 estrellas",It’s easy enough and the size is good but the lid was designed that the liquid goes through it and you can’t clean it. So gross!!!,Tanya,Revisado en los Estados Unidos el 22 de abril de 2022
Does not keep coffee hot just barely warm,"1,0 de 5 estrellas","My coffee does not stay hot, just barely warm",nivia rodriguez,Revisado en los Estados Unidos el 12 de noviembre de 2022
I received a used and stinky one,"1,0 de 5 estrellas",Mine was used and smells very very bad. I tried to clean it but the smell is awful and didn't go away.,Yomna,Revisado en los Estados Unidos el 2 de noviembre de 2021
Don’t keep hot a lot of time,"1,0 de 5 estrellas",I have it saved.,Zohar,Revisado en los Estados Unidos el 27 de junio de 2022
Don't buy if you're looking for something that keeps hot liquid hot,"1,0 de 5 estrellas",Throwing this out as soon as replacement arrives. Utterly useless,Elmo Renoir,Revisado en los Estados Unidos el 19 de diciembre de 2021
