title,rating,body,author,date
Keeps Coffee Warm,"2,0 de 5 estrellas","I bought this because of the positive reviews. We like our coffee hot. Not burn your mouth hot, but hot! Had high hopes for this product. I filled the carafe with boiling water and let it sit for about ten minutes before emptying and adding freshly brewed coffee from my French Press (also made with boiling water). The first cup was ok, but after an hour it was not as hot. When I checked it four hours later it was hardly warm. Very disappointing, so going to send it back.",16 Bars,Revisado en los Estados Unidos el 5 de febrero de 2024
Makes annoying hissing sound as it fails to contain the hot air inside,"2,0 de 5 estrellas","I thought it could be good and had it besides me at my desk. After 30-60 minutes a hissing sound starts. It was puzzling what was making the sound at first until I discovered the noise was coming from the spout of this carafe. It suggests the product could not contain the hot air inside it and the air was pushing its way out, making a very annoying hissing sound. Really disappointing.",Tom292,Revisado en Reino Unido el 7 de diciembre de 2023
It was great at first but…,"2,0 de 5 estrellas","The first few times I used it, it was great! It kept my black coffee piping hot but after that, the temperature dropped drastically. I tried to figure out if we’d done something different but I couldn’t find anything. I’m so disappointed.",Camsmom,Revisado en los Estados Unidos el 5 de febrero de 2024
leider...,"2,0 de 5 estrellas","kühlen heisse Getränke zu schnell aus , max 2 Stunden. Keine Empfehlung.",andreaclaudia,Revisado en Alemania el 5 de febrero de 2024
Seal broke before first use,"2,0 de 5 estrellas","I really wish I had better things to say about this item. But it broke before I even had a chance to use it once! The plastic lever which opens/closes the seal when you depress the trigger snapped in half. And because it's such a small delicate part, there's no way for me to MacGyver this thing properly and fix it. No one wants epoxy-flavored tea and coffee. I loved the look, the feel, the price, and the quality of everything else, which is why this isn't getting a 1-star review. It's also the reason I'm even contemplating giving this purchase another chance-- I'm kind of torn.",Renée,Revisado en Canadá el 28 de septiembre de 2022
Doesn’t keep coffee hot for very long,"2,0 de 5 estrellas",Doesn’t perform as Stated.,Fred Poulin,Revisado en los Estados Unidos el 27 de febrero de 2024
Lasted 17 months,"2,0 de 5 estrellas","Bought this to keep my French press coffee warm and have used it daily since it arrived. Carafe worked really well for 17 months and the size was a perfect match for the French press ...until the release tab broke off as I was pouring a cup of coffee.

Prior to breaking, it would keep coffee hot for hours. We haven't dropped or handled it roughly, and always hand washed to maintain the thermal seals. It just seems the plastic release tab isn't strong enough to pull against the vacuum created by hot coffee.

It's a shame this didn't last. I'll definitely replace it, but not with a product from this company",WindyCity Grrrl,Revisado en los Estados Unidos el 4 de noviembre de 2022
Worked for 1 year,"2,0 de 5 estrellas",Worked only for one year and the power button stopped working.,Sham,Revisado en Canadá el 27 de julio de 2023
Dribbles,"2,0 de 5 estrellas","I liked this carafe when I first got it. But within a week of using it I discovered issues. Sometimes it’s too easy to screw the lid on incorrectly so you need to be very careful about that. And now when I go to pour coffee, it splatters coffee all over the counter even when I’m trying to be very careful. The price was inexpensive, but I wouldn’t waste my money on this brand again. It does however keep coffee hot for quite a while. If they could fix the pouring issue and the lid screw on issue it would be a great coffee carafe.",Lacey,Revisado en los Estados Unidos el 9 de febrero de 2022
Doesn’t Stay Hot,"2,0 de 5 estrellas","Built well, but doesn’t keep my coffee hot at all. More like warm and this is only after two hours. Sucks. Wish I could return but window is closed.",Amazoner,Revisado en los Estados Unidos el 26 de agosto de 2023
It does not keep things cool for long,"2,0 de 5 estrellas",I had a jug before this that was thermal and it kept things cool for 12 hours plus this does not as I guess I think the walls of the jug are too close together and then maybe some transference it's a shame because it's nice looking and everything else is good,Aaron,Revisado en Reino Unido el 1 de septiembre de 2022
Why is this so hard?,"2,0 de 5 estrellas","This is one of several carafes we've recently bought that are not worth having. Whereas we have had good carafes in years past, the recent ones, including this one, have been horrible. This one doesn't keep coffee hot for any length of time AND it has a terrible pour--it splatters! If you find one that works, please let me know",R. Forester,Revisado en los Estados Unidos el 3 de enero de 2022
It drips,"2,0 de 5 estrellas","The carafe does not keep coffee hot for very long, certainly not as long as advertised. The worse thing though is that it drips when pouring. A lot. Be prepared for drips to be flung all over. It doesn't matter if it's full or nearly empty, drops fall all around.",Chorister,Revisado en los Estados Unidos el 29 de marzo de 2022
Meh.,"2,0 de 5 estrellas",I found this to be adequate at keeping things hot. The spout was annoyingly drippy,emahon,Revisado en los Estados Unidos el 1 de marzo de 2023
Not what I expected,"2,0 de 5 estrellas",Carafe doesn’t keep beverage warm as long as I was expecting.,Scott Person,Revisado en los Estados Unidos el 11 de febrero de 2023
😞 disappointed in performance,"2,0 de 5 estrellas",Lukewarm after 4hrs. Not what I wanted,Patricia L.,Revisado en los Estados Unidos el 24 de febrero de 2023
Not insulated,"2,0 de 5 estrellas",This was a total waste of money. It does not keep anything hot for longer than 1 to 2 hours. Very disappointed,Pamela J Ward,Revisado en los Estados Unidos el 19 de febrero de 2022
Keeps liquid warm but not for long,"3,0 de 5 estrellas",Not that good and you can find similar at lower price from the market,Uzair zahid,Revisado en Reino Unido el 2 de marzo de 2024
Short term,"3,0 de 5 estrellas",Great container but the downsize that it wont stay hot hours later. Good container for large crowds which uses the contents within the first hour for max hot coffee.,Code33,Revisado en los Estados Unidos el 26 de marzo de 2024
Nichts Besonderes,"3,0 de 5 estrellas","Normale ThermosKanne 🤷 2L Halten Jetzt 12H GeTränke Heiß/Warm.

Der Deckel Ist Nur Etwas Komisch. Er Furzt Den Druck Raus Und SoMit Auch Die Ganze Wärme Raus 🤨 KA Ob Das So Sein Soll Oder Nicht.",ThePolishJoker,Revisado en Alemania el 26 de marzo de 2024
Kochen auch nur mit Wasser,"3,0 de 5 estrellas","Nach einigen Testberichten und auch Rezensionen hier bei Amazon waren die Erwartungen hoch. Nachdem wir die Kanne jetzt ein paar Wochen im Gebrauch haben muss ich sagen: Die kochen auch nur mit Wasser! Diese Kanne hält den Kaffe nicht merklich länger warm als ihre Vorgängerin. Und was mir beim Gebrauch auch negativ aufgefallen ist: Der Griff ist unangenehm dünn. Er macht zwar keinen fragilen Eindruck, aber ich möchte mit dieser Kanne keine 50 Meter durch die Gegend laufen.",Arno,Revisado en Alemania el 12 de enero de 2024
Déçue,"3,0 de 5 estrellas","très déçue car ne garde le café au chaud pas plus de 3h .
Pas recommandée pour vouloir conserver le café plus longtemps mon ancienne me manque !",Mamienadette,Revisado en Francia el 14 de diciembre de 2023
Keeps the coffee hot,"3,0 de 5 estrellas",But it dribbles badly and doesn’t pour neatly.,JailbirdStripes,Revisado en Canadá el 21 de noviembre de 2023
Looks nice but..,"3,0 de 5 estrellas",This is the perfect size for what I need but it doesn't keep coffee hot for more than 20 minutes. I've tried warming it with boiled water before adding the coffee but it doesn't make any difference. I'd return it if I hadn't used it a couple of times already.,Karen Junek,Revisado en Canadá el 12 de febrero de 2023
It looks good and cleans easily,"3,0 de 5 estrellas",I like the pot a lot but sadly it only keeps the water from the kettle hot enough to make a cup of tea with for a couple of hours. My previous thermos flask did a better job. Good for someone not looking for it to keep the water warm for very long.,Becky,Revisado en Reino Unido el 4 de enero de 2023
Disappointed,"3,0 de 5 estrellas","Based on high reviews I expected this to keep my coffee hot for longer than it does. I pre-heat it with boiling water while making my pour over coffee. As soon as the coffee is made, and still very hot, I fill the carafe. After 4 hours the coffee is lukewarm. I have to microwave it to make it drinkable. Now, during these four hours I've poured coffee from it a couple times, so the spout has been opened for the few seconds that takes, and the carafe hasn't remained full to the top. Perhaps that's the difference in the results I get, and those who claim it stays piping hot all day.",Chris,Revisado en los Estados Unidos el 29 de noviembre de 2022
Decent,"3,0 de 5 estrellas","After I preheat the carafe with boiling water, it keeps my coffee hot for about 2 hours, which is enough time for me. The spout drips a bit after pouring, which doesn't bother me terribly. I just keep the carafe on a piece of paper towel. If there is a carafe out there that works perfectly, I'd like to know about it.",Tamar,Revisado en los Estados Unidos el 4 de mayo de 2023
"Gute TK für einen Arbeitstag, nächster Tag lauwarm","3,0 de 5 estrellas","Habe die TK (schwarz) mal mit der für mich am besten getestete, praktische TK Leifheit (Silber) verglichen, diese TK hält für einen Arbeitstag sehr gut heiß, aber dann lässt sie stark nach, am nächsten Tag ist es kalt, mit der anderen ist das überhaupt nicht so, obwohl der Verschuss nicht so groß und tief in die Flasche geht, vielleicht deswegen ?!
Die Lieferung lag erstmal für Tage beim Zoll, China Lieferant, hatte ich vorher nicht gesehen",Lustkäufer,Revisado en Alemania el 1 de abril de 2023
Just alright,"3,0 de 5 estrellas","Does what it needs to do, but paint is chipping and it kinda sucks to clean",Becca,Revisado en los Estados Unidos el 19 de mayo de 2023
Okay,"3,0 de 5 estrellas","Ran hot water in thermos, put hot coffee in, but only lukewarm the next morning. Otherwise okay, just microwaving coffee again.",CB,Revisado en los Estados Unidos el 21 de mayo de 2023
Spout leaks,"3,0 de 5 estrellas",Coffee leaks down the side every time you pour. It's serviceable but I wouldn't buy it again.,Michael Besos,Revisado en Canadá el 21 de noviembre de 2022
Maybe if it’s full…,"3,0 de 5 estrellas","This does not keep coffee hot for any length of time. Maybe when it’s full, but once you pour a cup or two, it cools down. Defeats the purpose of a thermal carafe.",Helen T. Ricotta,Revisado en los Estados Unidos el 10 de marzo de 2023
Enttäuscht - leider tropft sie,"3,0 de 5 estrellas","Ich war von den Rezessionen hier sehr angetan, dass sie sehr lange heiß hält und tropfsicher sei. Sie hält wirklich lange heiß, aber........sie ist leider nicht tropfsicher. Sie tropft sogar mehr als unsere vorherige Kanne.
Man kann das Problem nur lösen, indem man die Kanne am Tassenrand abstreift. Schade. Enttäuschend",tinamalü,Revisado en Alemania el 25 de enero de 2023
Stopped holding heat despite preheating.,"3,0 de 5 estrellas",I've had this just 7 months and it no longer holds the temperature of fresh perked coffee. Is there replacement seals? Anyway to fix it?,Teresa McClanahan,Revisado en los Estados Unidos el 10 de diciembre de 2022
Nice coffee keeper,"3,0 de 5 estrellas",This coffee carafe looks nice on your counter and works fairly well. It does not keep liquids warm all day however. It will keep coffee warm for 3 hours but after that it cools off. The inside is not glass but a thermal metal.,Karen's Comments,Revisado en los Estados Unidos el 29 de marzo de 2022
Kinda small,"3,0 de 5 estrellas",This was smaller than I expected holds about a half a pot of coffee. Keeps it warm all day but not hot!,BB McGee,Revisado en los Estados Unidos el 5 de octubre de 2022
Disappointed,"3,0 de 5 estrellas","The way it was shipped (in a Bag) did Not protect the product from damage unfortunately. Product is usable, but doesn’t look as nice as it should. Plus it doesn’t keep the hot liquid hot for as long as I had hoped either.",Lone Moose Lodge,Revisado en los Estados Unidos el 9 de noviembre de 2021
Looks great and easy to use - Just doesn't keep hot coffee hot more than a few hours.,"3,0 de 5 estrellas",Nice design and easy to clean. Seems well made. It keeps coffee hot for a couple hours and pretty warm for a few more than that.,Amazon Customer,Revisado en los Estados Unidos el 4 de enero de 2022
"Not terrible, not great","3,0 de 5 estrellas","Pros: holds a lot, does keep coffee hot for a long time
Cons: not easy to clean, pours slowly and messily.
I wouldn't buy this again.",DoubleEll,Revisado en los Estados Unidos el 7 de enero de 2022
not happy with product,"3,0 de 5 estrellas",coffee does not taste good in this decanter,jl,Revisado en los Estados Unidos el 10 de abril de 2022
Left mess on counter,"3,0 de 5 estrellas",Did not for well. Returned.,Sharon OConnell,Revisado en los Estados Unidos el 13 de abril de 2022
Excellent for coffee,"4,0 de 5 estrellas",Working from home I get tired of going to the kitchen for more coffee. I make my coffee and fill this up and can enjoy my coffee without any interruptions in my workday. Keeps coffee hot for as long as I need it until gone. Gone over 3 hours and was still hot. The only slight issued is a little drippage after pouring. Excellent carafe!,North Ga Lover,Revisado en los Estados Unidos el 6 de enero de 2024
Hot Pot for lemon tea,"4,0 de 5 estrellas","I used it to keep the water hot so I can make fresh lemon tea . I just heat up the water and put it in the pot put the lid on , and take it upstairs to my room and I have hot water for hours. I love it.",Rebecca,Revisado en los Estados Unidos el 3 de diciembre de 2023
"Compact, easy to use, easy toclean.","4,0 de 5 estrellas",Wish it kept the coffee hot longer.,Shirley Wilson,Revisado en los Estados Unidos el 21 de enero de 2024
Gute Qualität,"4,0 de 5 estrellas",Die Kanne hält fast unglaubliche 24 std warm. Sie sieht zudem noch gut aus und der Preis ist auch ok.,Pumping Iron,Revisado en Alemania el 23 de enero de 2024
can keep warm for a about 4-6 hours,"4,0 de 5 estrellas","Hot water becomes warm in 4 to 6 hours. My other BottleWarx bottle can keep water hot for 12 hours. Anyway, it looks good and not too bad.",M Wong,Revisado en Canadá el 29 de enero de 2024
A bit hard to clean,"4,0 de 5 estrellas",This is a really nice carafe but a bit hard to clean. A bottle brush helps,Connie Fellows,Revisado en los Estados Unidos el 23 de diciembre de 2023
Keeps your coffee hot for at least 3 hours,"4,0 de 5 estrellas","I like it because it is beautiful and it just works. Keeps my coffee hot for at least 3 hours. After that it keeps warm, but not as hot. I tip it to check it is sealed and after a few drops it creates a vacuum. Need to make sure it is properly sealed when pouring. I'd recommend.",Amazon Customer,Revisado en los Estados Unidos el 25 de septiembre de 2023
Eine gute Kanne,"4,0 de 5 estrellas","Ist weiter zu empfehlen,hält lange den Kaffee heiß auch die letzte Tasse ist noch schön warm .",Sigrid Strommer,Revisado en Alemania el 14 de diciembre de 2023
So far so good,"4,0 de 5 estrellas","This is my third coffee carafe I bought on Amazon. The other two were different brands, but after about 6 months they didn't keep the coffee hot. It's starting to feel like cheap price cheap made. Amazon is turning into the online flea market. Im hoping that's not true with this buy. Prove me wrong Amazon. I wanted to give 5 stars but after 6 months I'll update.",Joe Carreno,Revisado en los Estados Unidos el 30 de julio de 2023
loved,"4,0 de 5 estrellas",really lasts long and holds in the heat for a long period of time,4YEO,Revisado en Reino Unido el 12 de octubre de 2023
Carafe à Café Isotherme,"4,0 de 5 estrellas","cuve de bonne qualité le café reste chaud tout la journée le bouchon est pratique et facile
petit bémol sur la poigne de moindre qualité risque de casse rapidement",morales geraldine,Revisado en Francia el 10 de septiembre de 2023
Nicely made,"4,0 de 5 estrellas",Could keep the coffee hotter,Coffee caraf,Revisado en los Estados Unidos el 7 de diciembre de 2023
Good enough,"4,0 de 5 estrellas","There is nothing special about this carafe, which is perfect for me. It keeps the coffee hot but I do warm it with hot water first. I wanted something not too tall, this is under 8"" in height. Two weird things: 1) It basically needs to be poured upside-down in order to get the liquid out as it is wide at the bottom, so that is a bit strange. The pour is kind of splashy as well, but not an issue per say. 2) The lid gets kind of gross, we use it for coffee and the coffee builds up in the lid and it is basically impossible to fully clean. Rinsing does not do the trick. I also prop the lid ""open"" with toothpicks so it will dry completely, otherwise the lid holds liquid. Not a deal breaker. Carafe is good enough.",I C B,Revisado en Canadá el 17 de noviembre de 2022
Correct pour un repas,"4,0 de 5 estrellas","Pour un repas, c'est parfait mettre de l'eau fraîche et glacée, pour moi ça tient 24h a peu près assez frais, elle est jolie et design, elle est utilisée que pour le froid ici",Drift,Revisado en Francia el 11 de agosto de 2023
Jolie,"4,0 de 5 estrellas","Petit thermo parfait pour tenir au chaud mon café il à l’air costaud à voir dans le temps
Je recommande",joelle pereira,Revisado en Francia el 17 de agosto de 2023
Top für den Preis,"4,0 de 5 estrellas","Lieferung der Kanne einwandfrei. Sie hält super den Tee heiß! Nicht nur warm! Schwachstelle- wie bei vielen Kannen- der Deckel: Er ist nach knapp 1 Jahr und intensiven Gebrauch am Ventil gebrochen, aber der Kundendienst des Verkäufers ist tatsächlich WOW- ich wollte einen Deckel nachkaufen und bekam für mich völlig kostenfrei eine komplett neue Kanne! Besser geht nicht!!! Vielen Dank dafür",Dr. Jöllenbeck,Revisado en Alemania el 30 de mayo de 2023
Eigentlich gut...,"4,0 de 5 estrellas","Eigentlich eine gute Kanne, wenn da nicht dieser instabile Griff wäre. Hier habe ich Bedenken dass er lange hält...",P.H.,Revisado en Alemania el 20 de julio de 2023
Good size opening lid and holds large quantity,"4,0 de 5 estrellas",Same as above,Amazon Customer,Revisado en Canadá el 2 de agosto de 2023
Works ok! Hot chai latte only for 6 hours.,"4,0 de 5 estrellas","After looking for a carafe I stumbled upon these impressive reviews, so I decided to go ahead and order one. I usually make Indian tea with milk and like to make several cups . The tea stayed hot for about 6 hours only. Also the flavor of tea was weird at the end of 6 hours. Not sure what’s going on !",roopam garg,Revisado en los Estados Unidos el 8 de agosto de 2022
"Funktioniert gut, manchmal Geräusche","4,0 de 5 estrellas","Macht hin und wieder Geräusche und manchmal tropft sie, ansonsten tut sie was sie soll, nämlich meinen Tee lange warm halten.",Nicole S.,Revisado en Alemania el 19 de abril de 2023
As advertised,"4,0 de 5 estrellas","Does exactly what I wanted. It keeps coffee hot for several hours. Longer and hotter if you preheat with hot water. Pouring is easy and it doesn't drip - this is important to me. Not super easy to clean, especially the lid. But rinsing seems to work OK.",Tom,Revisado en los Estados Unidos el 25 de junio de 2022
Perfect size,"4,0 de 5 estrellas","I like the looks, size, and ease of use of this carafe. I wanted a carafe that could hold up to 9 cups…the 9 cup mark on the coffee pot…and the 51 ounce carafe does this. It has a non slip bottom and holds heat very well. My only con is that the pour is sloppy and slower than my last carafe by a different maker. Despite this, I would recommend this carafe.",K. Quartly,Revisado en los Estados Unidos el 4 de octubre de 2021
thermoskanne,"4,0 de 5 estrellas",wie erwartet,hannelore Thiele,Revisado en Alemania el 6 de mayo de 2023
Very promptly,"4,0 de 5 estrellas",I like it very special,Andre Tettey,Revisado en Reino Unido el 24 de enero de 2023
Well made,"4,0 de 5 estrellas",Good feel in hand. Looks good,LA,Revisado en Canadá el 15 de diciembre de 2022
Good for me,"4,0 de 5 estrellas",,erdinc akkus,Revisado en Canadá el 28 de diciembre de 2022
"Keeps liquid very hot, but difficult to pour","4,0 de 5 estrellas","Keeps coffee hot for a long period of time; however, when pouring coffee into a cup it tends to splash outside of the cup on to the surface where my cup is sitting. That's the only thing I don't care for about this carafe.",Lynda Anderson,Revisado en los Estados Unidos el 2 de febrero de 2022
"Nice carafe, but pours unevenly.","4,0 de 5 estrellas","This is a nice carafe that keeps coffee hot for a long time. The only thing I don’t like about it is the way it pours. The coffee comes out in a tiny, uneven trickle. Also, be sure to clean the cap very well. I soak in soapy water and rinse well.",William J. Dennett,Revisado en los Estados Unidos el 7 de enero de 2022
Coffee Carafe,"4,0 de 5 estrellas",Easy to use. Keeps beverages hit for long time. Would buy again.,Jeff Crane,Revisado en Canadá el 17 de agosto de 2022
It is a nice product.,"4,0 de 5 estrellas","I like this product, except for the fact that it doesn't keep the liquid hot the whole day, as one of my other thermals do.",Katia Jacques Hawkins,Revisado en los Estados Unidos el 12 de mayo de 2022
it doesnt keep the water hot long enough.,"4,0 de 5 estrellas",disapointed with it hardly used poor purchase/,shamus carter,Revisado en Reino Unido el 15 de noviembre de 2022
Easy to use,"4,0 de 5 estrellas",Served it’s purpose for coffee bar,tony dixon,Revisado en los Estados Unidos el 10 de noviembre de 2022
Work Good,"4,0 de 5 estrellas",Great Price. Worked Very Well,ZaPPeR_mAn,Revisado en Canadá el 5 de septiembre de 2022
Well made so far. Just had for a few days,"4,0 de 5 estrellas",I have to take off the lid to get the rest of the coffee.,Eddie,Revisado en los Estados Unidos el 2 de noviembre de 2022
It serves its purpose very well,"4,0 de 5 estrellas",We bought it because our cup at a time coffee maker was leaking when dispensing. The key is to preheat the carafe with very hot water to prep it.,Kimariesings,Revisado en los Estados Unidos el 25 de enero de 2022
Coffee Carafe,"4,0 de 5 estrellas",If you put hot water in it and then coffee it keeps the coffee hot. The only down side to this carafe is that it always feels like its empty when there is still coffee left. Otherwise it's great!! I also love the fact that it's skidproof.,Judith Towell,Revisado en los Estados Unidos el 5 de julio de 2021
Well made carafe,"4,0 de 5 estrellas",Very well made. Keeps coffee hot all morning if you temper first. Carafe splatters a bit when poured.,Amazon Customer,Revisado en los Estados Unidos el 18 de julio de 2022
Good product,"4,0 de 5 estrellas",it keeps the tea hot for long time mostly up to 12 hours,Rose,Revisado en Reino Unido el 11 de agosto de 2022
Small but good for my needs,"4,0 de 5 estrellas",Kept my coffee hot for hours!,lynn,Revisado en los Estados Unidos el 10 de noviembre de 2022
Keeping coffee hot.,"4,0 de 5 estrellas","The coffee wasn’t piping hot after six hours. The ad said 12 hours. Usually we drink it up, but on a long distance drive, it wouldn’t be hot enough later in day.",Mary B,Revisado en los Estados Unidos el 11 de octubre de 2021
Moni,"4,0 de 5 estrellas",Frage: Wie reinigt man die Kaffeekanne innen? Mit der Hand kommt man ja nicht rein.,Amazon Kunde,Revisado en Alemania el 7 de septiembre de 2022
Worth the money!,"4,0 de 5 estrellas","I wish it kept the coffee hot longer. My only complaint really, it’s rugged,good looking, and the perfect size.",R.S.,Revisado en los Estados Unidos el 29 de septiembre de 2021
Keep it hot!!,"4,0 de 5 estrellas",Keeps liquids hot and it’s still small enough to set out on a serving space.,Amazons best friend,Revisado en los Estados Unidos el 14 de septiembre de 2021
How have I managed without this for so long !!,"5,0 de 5 estrellas","This is the best kitchen ""gadget"" I have bought in an age.
As a drinker of rooibos tea I can fill it up in the morning and it will last all day with just two bags..just top up with hot water and another bag throughout the day it WILL last !!
At night I have been making a full pot and taking it up to bed. Wake up in the morning and its still hot enough to enjoy a morning cuppa without going down to brew up..Perfect..
My only problem is why did I not buy one earlier!!",ABISHOP,Revisado en Reino Unido el 21 de enero de 2024
