title,rating,body,author,date
Bellissima,"5,0 de 5 estrellas","Ho preso quasi tutti i componenti necessari(ad eccezione del macinino) per filtrare il caffè con metodo V60 da Hario, ovvero bollitore, server, dripper e filtri..sono tutti di buona qualità e si abbinano l'un l'altro..contento dell'acquisto, consigliato senza remore",Luca A.,Revisado en Italia el 7 de octubre de 2021
Ottimo prodotto,"5,0 de 5 estrellas","Consiglio, ottimo prodotto, arrivato imballato bene ed in ottime condizioni. Fa il suo dovere.",Daniela,Revisado en Italia el 13 de marzo de 2021
tres bonne qualité,"5,0 de 5 estrellas","Parfait, permet de faire du café a l ancienne j ai ensuite acheté la cafetiere qui va en dessous c est vraiment tres original et de tres bonne qualité. Concernant les filtres hario ils sont bcp trop chers sur amazon (jusqu a un facteur 10 pr certains revendeurs du site... ) je m en suis donc procuré ailleurs",Pierre,Revisado en Francia el 20 de diciembre de 2014
Three Stars,"3,0 de 5 estrellas",A bit too heavy,Becca,Revisado en India el 6 de julio de 2018
Hatte erst Bedenken,"5,0 de 5 estrellas","Ich hatte zuerst Bedenken, da ich nur Keramikfilter mit zwei oder drei Löchern kannte und dieses Loch in der Mitte recht groß erschien. Ich dachte, dann nimmt das Wasser zu wenig vom Kaffeepulver auf und schmeckt nicht stark genug nach Kaffee aber die Bedenken sind vollkommener Quatsch gewesen. Ich habe mir dazu die passenden Papierfilter gekauft (handelsübliche Filter könnten dem Druck nicht Stand halten) und der Kaffee schmeckt erstklassig und viel besser als mit den bisherigen braunen Filtertüten. Das ""v"" im Namen steht wohl für die Kegelform und die 60 für den Neigungswinkel von 60 Grad. Auch die Rillen haben eine Bedeutung und sind dafür da, dass der Kaffee während des Aufbrühens in Bewegung bleibt. Ziemlich durchdacht das ganze. Habe den Kauf jedenfalls nicht bereut.",H. Krause,Revisado en Alemania el 9 de junio de 2016
Produto excelente e preço matador!,"5,0 de 5 estrellas",Produto de altíssima qualidade com preço matador e entrega no prazo.,Fabricio Monteiro,Revisado en Brasil el 10 de julio de 2018
The Best for any Coffee Drinker - Authentic & Ceramic,"5,0 de 5 estrellas","The best dripper out there! If you like pour over coffee you will love this. I placed an order on another site and mistakenly got a plastic one, which I notice they offer here as well. So if you're confused by some saying they are plastic, that is because they chose the plastic version. Anyways the plastic one is ok, but its plastic.

I re-ordered a ceramic one and it's very nice. Does not get dirty, and does not seem to stain. Heavy-weight and keeps the heat very well without cooling down my coffee. I use this with the 02 Carafe by Hario. This combination is the perfect size for two nice cups of coffee. This dripper could accommodate for a full pot of coffee if you were serving 6+ cups.

I do recommend using the Hario filters made for this, they are on amazon for $10 for 100, which might be a little more expencive but well worth the hassle free solution (no folding etc needed).",Matt M,Revisado en Canadá el 27 de septiembre de 2016
This gave me better control over the pour,"5,0 de 5 estrellas","For the past 25+ years, I have used the Black and Decker brew and go. http://www.amazon.com/gp/product/B00005MF9C?keywords=black%20and%20decker%20brew%20and%20go&qid=1449069961&ref_=sr_1_1&sr=8-1 They are cheap... usually run from $15 to $20... and last between 5 and 7 years. My current unit had stopped working efficiently... only processing about 3/4 of the water so it was time to replace it. When I opened the box, the smell of plastic took my breath away. I mean, it was really strong. I ran vinegar water through it several times, but the smell was as strong as ever. Got me to thinking about whether or not I REALLY wanted to use this plastic product for consumption... so off to the net I went and googled ""healthiest coffee"". Up came ""pour over coffee"". After some reading, and viewing several youtube video instructions, I sent for this dripper.
Yesterday was my first day to try it. Preparation of coffee using this method is a ritual... think Japanese Tea Ceremony. After you set the cone on the cup, you place the filter into the cone and gently pour boiling water over the filter. This moistens the filter enough to keep it in place AND it warms the coffee cup. Now... pour that water out. Add your coffee grounds to the filter and using a spoon, create a small crater in the center of the coffee grounds. The next step is to pour the just boiled water around the crater slowly using just enough to moisten all of the coffee... then wait for a bit... this is called the ""bloom"". Once the coffee is completely wet, continue to pour the water in... very slowly... in a circular motion. I couldn't get a slow enough pour from the kettle so I ended up pouring the water into a measuring cup and using that to pour the water into the cone. This gave me better control over the pour. (Make sure you have the right amount of water for the size of your cup/pot so you don't overflow.) Allow it to drip through on its own while you work on the rest of your breakfast... and your coffee is ready.
I was blown away by the freshness and purity of taste. I am a one cup of coffee a day gal, but as I was running my errands in the morning, all I could think of was just how delicious that cup of coffee was and the first thing I did when I got home was make another cup. The other thing I found is that I wanted to just sit, sip,and appreciate it. I use a coffee that is roasted here in town. It is more expensive than the canned at the store, but it is a lot more satisfying. So... use a good coffee. You will find that it is even more tasty than the designer stuff which means you will ultimately save money. Also, one video recommended using the bleached filters... blech! Why would you want to go through all of this effort just to ruin it by adding bleach to the mix? Use unbleached coffee filters. Make sure the package says unbleached and not ""brown"" because the brown ones are the bleached ones with added dye. Another thing, I am using unbleached coffee filters for a regular coffee maker and they work perfectly. They are a lot less expensive than the ones made especially for this cone shape. http://www.amazon.com/Melitta-Basket-Coffee-Filters-Natural/dp/B0052KUJKY/ref=sr_1_3?ie=UTF8&qid=1449071201&sr=8-3&keywords=unbleached+coffee+filters Once you pour the water into the cone to wet the coffee filter, it will naturally fold over to form itself to the shape of the cone. If it doesn't, just finish folding it over with your fingers. Enjoy!",Karmala,Revisado en los Estados Unidos el 2 de diciembre de 2015
The product description does not address either one of my complaints.,"1,0 de 5 estrellas","This product is a filter holder for pour over coffee. The description never said I may have to buy and use Hario filters which are impossible to find in my area and expensive. I'm in the so-called capitol of coffee products which means this would be a ridiculous purchase if I knew that. So I'm supposed to refold the dozens of Melitta filters I just bought from Amazon. They still do not fit adequately after doing so. The filter holder also does not allow the operator to see the coffee going into the cup so you have to remove it a few times while it is filtering to check it or it will overflow-very irritating and not efficient. Now, I'm told that I may have to pay a restocking fee and the shipping to return it. If I had found this in a store, I would not have purchased it. We own 2 Hario products and like them very much but this is not a good coffee filter and I do not want it.",Coffee Break 1,Revisado en los Estados Unidos el 24 de abril de 2020
"It’s a cult, not a coffee maker.","1,0 de 5 estrellas","There are myriad other pour over coffee makers, many of which have the virtue of not using proprietary filters to make coffee. This requires Japanese (Hairio, in fact!) filters and would not operate with any other filter I attempted to use. Know that if you purchase this you are committing to the Cult of Hario and be prepared to pay a premium. If that impresses you, great. If you just want to make pour over coffee, skip this as it will result in greater expense and inconvenience. I obtained a ceramic pour over at Starbucks that makes coffee as good as this does without the hassle of paying for obscure imported coffee filters.",A. Gum Ball Fan,Revisado en los Estados Unidos el 12 de julio de 2020
Not that great,"1,0 de 5 estrellas","I use a pour over to make my coffee every morning and have tried different ones. I dropped my last ceramic one and it broke, so I ordered this one. The problem I have is almost every time I use this one, the coffee filter comes undone in the bottom and all the grounds pour into the cup. The 3rd time it happened I chucked it in the trash. I think it’s a bad design flaw with this item. I’ve been using the same filters for years and have no problem with them. So I can’t recommend this product.",William,Revisado en los Estados Unidos el 18 de agosto de 2021
Not Functional,"1,0 de 5 estrellas","This was a gift, and the person who received it said that once the coffee grounds were placed in the filter and positioned, the water pouring caused the filter and grounds to slip through the hole into the cup. The hole is too big for an individual beverage serving. This person has another one that looks just like this and had no problem with it. She wanted the second one to take to another place. I do not recommend this specific one because of her problems with it.",Delapis,Revisado en los Estados Unidos el 15 de marzo de 2022
This is not the original Hario product,"1,0 de 5 estrellas","Does not come in the Hario box, no measuring cup, no little manual. This is a cheap inferior copy that looks the same from afar, but when you touch the dripper there are a lot of imperfections, it is not as delicate as the Hario one, there is no ""Made in Japan"" on the bottom and the ""02"" imprint on the side. I never thought that one has to be aware of fake products on Amazon, but apparently you do. Very disappointing indeed. After getting my dripper and having doubts about it's authenticity, I went to a coffee show where they sell Hario products. I bought the real dripper it right away. Only paid $3 more. The two products are worlds apart. I hope Amazon will remove this seller from their website.",Christian Vetter,Revisado en los Estados Unidos el 10 de abril de 2014
La qualité se perd..,"1,0 de 5 estrellas","L'article est tordu, pour les 60 degrés on repassera..

Dommage le précédent était très bien",elGrulito,Revisado en Francia el 2 de julio de 2023
Terrible Design. Flawed.,"1,0 de 5 estrellas","I'm really surprised to see so many positive reviews. The design of this item is seriously flawed. No matter what size or brand of coffee filter I used, the water nearly always broke through the bottom of the filter, taking coffe grinds with it, and I'd have to start all over. I had to double my filters each time. I finally replaced it with another one that has several small holes in the bottom, as opposed to this design, which has one (too) large hole at the bottom.",John Hoarty,Revisado en los Estados Unidos el 21 de mayo de 2020
Not reliable,"1,0 de 5 estrellas","It was okay until few weeks ago. But a crack came after few months. It was never dropped.
I contacted us customer service and they said it's out of warranty and they don't want to do anything.
Please note that manufacturer's warranty is 90-day only.
This means product quality may not be guaranteed after 90-day.
I ordered a new one from other vendor at much lower price but a longer warranty.",Jechan K.,Revisado en los Estados Unidos el 23 de febrero de 2022
"NOT as pictured, Possibly counterfeit or seconds","1,0 de 5 estrellas","I'm sure the Hario V60 02 dripper works just fine and is a good coffee dripper. I received mine from Update Products International. The dripper does not seem to be Hario quality and the shape and glazing is not perfect. The dripper also has no stamping of ""Hario 02"" or any clue about it's brand or origin. In the pictures, ""Hario 02"" is suppose to be stamped on the side of the dripper. The one I received has nothing. This is either a factory second or blatantly counterfeit. The only thing that says Hario is a inventory sticker that says Hario but is nothing more than a printed sticker... don't think that constitutes authenticity.",AmyH84,Revisado en los Estados Unidos el 17 de abril de 2014
"Teurer, aber nicht besser als andere.","1,0 de 5 estrellas","Habe mich von den vielen guten Rezensionen verleiten lassen diesen Filter zu kaufen. Die Enttäuschung war entsprend groß als ich ihn dann zum Einsatz gebracht habe. Der Kaffee schmeckt nicht anders als mit herkömmlichen Porzellanfiltern aufgebrühter. Preis und Leistung stehen hier in keinem Verhältnis. Wenn man dann noch die völlig überteuerten Filtertüten berücksichtigt, kann man fast von Abzocke reden. Von mir ganz klar keine Kaufempfehlung.",Martina Wellmann,Revisado en Alemania el 2 de octubre de 2021
No thanks,"1,0 de 5 estrellas","Your price of coffee is about to double, because every other pour-over will break thru and grinds will burst thru the giant hole on the bottom and into your coffee cup.

I used standard cone filters I’ve used in other pour overs, maybe this would work with their proprietary filters?

We replaced this with the Melita one and it’s been great so far.",A genXer,Revisado en los Estados Unidos el 26 de diciembre de 2021
not worth the money.,"1,0 de 5 estrellas","unfortunately because there is a only a single hole at the bottom of this coffee cone the grounds tear through the paper filter and end up in the coffee. For the price I would not consider this item worthwhile.
I will look for a pour over filter that contains mesh, to keep the grounds intact.",Amazon Customer,Revisado en los Estados Unidos el 4 de noviembre de 2022
Design has serious flaws,"1,0 de 5 estrellas","When it comes to a coffee dripper there are better choices than this particular model. I have two issues with it. Inside the funnel, the design is meant to ""hold the filter"" (I guess) but it is really problematic. If you don't give your filter a good soaking first you'll be battling the shape of the filter. Second, the drain hole is about the diameter of a quarter, coffee drips through this filter way too fast. I have several single brew drippers, I would say this is my least favorite. Furthermore, if you use Melitta filters, such as I use (widely available at grocery stores) you'll find that at least 50% of the time the bottoms ""blows out"" and you have a cup of grounds. No matter how slow you pour.",Fierce Badger,Revisado en los Estados Unidos el 13 de noviembre de 2014
Huge hole in bottom,"1,0 de 5 estrellas",Tried this for pour over coffee - did not work well. Huge hole in the bottom and the water rank right through the reusable Barista Warrior filter I bought specifically for this V60 dripper. Water went through at same speed as if there were no filter. Other drippers have a much smaller hole so that the coffee actually drips instead of gushing. Returned immediately.,Downeaster10101,Revisado en los Estados Unidos el 22 de diciembre de 2021
Worst coffee dripper ever!!!,"1,0 de 5 estrellas","This coffee maker is the bane of my existence. #2 filters do not fit in this drip, and cones are not easy to find. I end up with the filter breaking 25% of the time even with my origami technique to turning the #2 into a cone shape reinforcing the bottom of the filter. I use the word hate very carefully and deliberately. I HATE this coffee drip. User be warned!",David McGregor,Revisado en los Estados Unidos el 23 de enero de 2021
Looks like the real thing...not,"1,0 de 5 estrellas",I got a clean fresh white ceramic style to replace my brown plastic mellita filter. Expensive!!!! Purchase!! Unusable. The coffee pours straight through the bottom of the paper filter as the drain hole in the ceramic cup is way too big. Sometimes it doesn't tear. But it's a nuisance. I threw away the box so couldn't return. Irritating waste of money. Another Chinese number one copy. Looks like the real thing....not.,Amazing Grace,Revisado en los Estados Unidos el 31 de diciembre de 2020
Very small size and poor design,"1,0 de 5 estrellas","A very poor design - the filter opening is too large and water is draining too fast through the inserted paper filter resulting in a very weak coffee. Also, the size, even a larger 2 size, is very small.",Dina,Revisado en los Estados Unidos el 25 de marzo de 2023
Terrible design!,"1,0 de 5 estrellas","I have tried using every filter i can think of, mostly the #2 Mellita. 7 out of 10 times the hot water
pours right thru the grounds and tears the bottom of the filter, resulting in all the grounds pouring
into the coffee! I am tired of wasting expensive coffee. Returning!",Elizabeth N.,Revisado en los Estados Unidos el 4 de febrero de 2019
Melita #2 filters break,"1,0 de 5 estrellas","The hole on the bottom is too big. The standard #2 Melita filters break when you pour too much hot water in, and all your coffee grounds go in your mug. I'm buying a new ceramic model with 3 small holes. I have a plastic one like this and it works fine, but I want a ceramic one.",Ethan Kiczek,Revisado en los Estados Unidos el 7 de enero de 2022
Impostor,"1,0 de 5 estrellas","This is a fake. Not a real Hario.

It seemed odd that the coffee wasn't dripping straight down out of the dripper into my mug, so I looked into it more. Turns out, the hole in the bottom of my dripper was a smooth circle, as opposed to the jagged circle of real Harios. This leads the filter to get stuck on the edges of my dripper, so the stream of coffee doesn't drip straight down.

I mean, the thing works, but it can be a little messy. I want to do a blind taste test to see if I can tell the difference between the fake and a real Hario.",Portlandia,Revisado en los Estados Unidos el 9 de noviembre de 2014
Poorly designed dripper,"1,0 de 5 estrellas",Very poorly designed. See review by Elizabeth N. The hole in this dripper is 3/4 inch - too large for a slow drip. The water flows too fast and will cause the paper filter to easily break. Also it is designed only for conical filters so a Melita type filter does not fit. A much better designed dripper is one by Zero which i bought to replace the Hario 2.,Richard Goldsmith,Revisado en los Estados Unidos el 27 de diciembre de 2019
Hopefully third time's a charm.,"1,0 de 5 estrellas","I'd love to leave a review about how great this product is, and hopefully I will when I get shipped one that isn't broken upon arrival. 2nd one just arrived and the lip is chipped. Come on guys.",C. Edwards,Revisado en Canadá el 7 de septiembre de 2020
"Handelsübliche Filter Nr 2 oder 4 passen nicht, der Porzellanfilterhalter ist rund !","1,0 de 5 estrellas","Man muss beachten, daß der Porzellanfilterhalter rund ist.
Dadurch passen die handelsüblichen Papierfilter nicht und man muss umständlich zurecht falten was morgens
unter Zeitdruck schonmal nervig sein kann. Die Papierfilter von Hario die man nicht überall bekommt sind zudem viel zu teuer.
Hinzu kam, daß er nicht auf unsere Thermoskanne gepasst hat weil der untere Kreis des Porzellans zu groß ist.

Empfehlung: Der Porzellanfilterhalter von Melitta ist nicht rund, die normalen Papierfilter passen hier perfekt.",Testberichtleser,Revisado en Alemania el 15 de julio de 2015
"AWFUL, waste of money","1,0 de 5 estrellas","Interior or round & does Not support the filter, so filter gives way",Annie,Revisado en los Estados Unidos el 13 de mayo de 2023
Fake!,"1,0 de 5 estrellas","I have a original one from Japan and this is completely different.

Differences:

Made in Japan not printed in the ceramic dripper.

Came without original box and without good design stick.

Bottom hole.

internal splines poorly made.",RBB,Revisado en los Estados Unidos el 27 de marzo de 2014
Fake Hario,"1,0 de 5 estrellas",Product came in unlabeled cardboard box. Product itself has no 'Made in Japan' nor 'Hario 02' label in ceramic identifying it as genuine Hario product. Moreover inner grooves are ill-defined and poor quality.,tu q bui,Revisado en los Estados Unidos el 4 de abril de 2014
It’s broken,"1,0 de 5 estrellas",It came broken!,Abdullah Alsharif,Revisado en Reino Unido el 8 de junio de 2020
do not buy this if you like coffee,"1,0 de 5 estrellas","There is a big problem with the design of this ceramic coffee dripper: a properly designed product of this sort should have at the bottom a ""seam"" and a series of small holes. The seam accommodates the real shape of a folded cone filter, and the small holes prevent the coffee from dripping through too quickly. This device has neither feature -- it is entirely conical, so the filter doesn't fit properly, and it has a large round hole at the bottom, so the coffee drips through quickly without having enough time to brew. Highly not recommended.",Ben Goldberg,Revisado en los Estados Unidos el 17 de noviembre de 2012
Poor design causes filters to break resulting in grounds spilling into my cup.,"1,0 de 5 estrellas","This dripper is inferior to the other one that I had before. The large hole in the bottom causes the filter to break, and I'm left with a cup of sludge. I returned this item but still only received half the refund.

Buy a dripper with the three smaller holes instead of one large one.",Jay Regan,Revisado en los Estados Unidos el 6 de mayo de 2018
"Do not buy, completely useless!","1,0 de 5 estrellas",Completely useless! The drip hole is 5 times too large so the water speeds thru and doesn't extract the coffee ground properly. If you don't pour the water in super slow then most filters tear and you end up with a lot of grounds in your weak coffee from using this. Extremely disappointed. My previous model had a smaller hole and an extra lip at the bottom to hold the filter and grounds in place.,Amazon Customer,Revisado en los Estados Unidos el 12 de diciembre de 2014
Didn't like at all,"1,0 de 5 estrellas","I was trying to get away from plastic, have had a plastic Melitta one for years, but this thing had such a huge dripping hole, the coffee filter would burst with the weight of the water and coffee, and I'd wind I with a cup of grounds. I could have used two filters I guess, but I just went back to my good ole plastic one, easier to use!",Carolyn Glenn,Revisado en los Estados Unidos el 18 de octubre de 2015
Knock off sent,"1,0 de 5 estrellas","I don't know about everyone else but I was sent a copy of the Hario. Even if it works just as well as an original I'm sending it back. Pretty annoying. If your coffee dripper doesn't have ""Hario"" and ""Made in Japan"" on it, you have a copy as well.",Lori,Revisado en los Estados Unidos el 24 de abril de 2014
Broken item.,"1,0 de 5 estrellas",The item is broken upon arrival. Very disappointed.,Ligen,Revisado en Canadá el 25 de junio de 2020
Arrived stained,"1,0 de 5 estrellas",Arrived stained with no measuring spoon.,Tracy,Revisado en los Estados Unidos el 19 de enero de 2023
Do not like this at all,"1,0 de 5 estrellas","Do not like this at all. Used once and will go back to my boba vita. This one has no close valve so the coffee goes straight through. I guess if you like super weak coffee, this may work. But I seriously wonder who came up with this lame design? Whoever it was, is not a coffee lover.",southernbelle2012,Revisado en los Estados Unidos el 17 de junio de 2018
This is NOT THE CERAMIC V60!,"1,0 de 5 estrellas","This product is falsely advertised, this is the much cheaper plastic version of the v60 (size 02). Buy elsewhere.",Ronald D. Harrison,Revisado en Canadá el 6 de octubre de 2018
"Cracked, chipped and used!","1,0 de 5 estrellas","Disappointed. I just received it today. It’s cracked, chipped and is stained like it was previously used. It will be going back and I will not be exchanging for another one.",Terri T,Revisado en los Estados Unidos el 22 de junio de 2021
This could actually hurt you,"1,0 de 5 estrellas",This pour over came with the handle shattered in the box and I cut my thumb on its jagged edge when I was opening it. The pour over box was crushed but it was inside a larger un damaged box so it was broken BEFORE shipping.,Joey,Revisado en los Estados Unidos el 19 de febrero de 2020
Tiny dripper for tiny people?,"1,0 de 5 estrellas",This is a very small coffee dripper. I like a 10oz cup of coffee and don’t want to have to make it two times to get the right amount. Also you are locked into buying this brands tiny filters at a premium price. Not gonna be doing that. Returned.,Lacrosse Mom's manchanic,Revisado en los Estados Unidos el 15 de septiembre de 2018
I really wanted to like this...,"1,0 de 5 estrellas",But the water runs through too fast and the coffee is weak. I even sprung for their super pricy filters. Am returning.,Christine R Correll,Revisado en los Estados Unidos el 6 de febrero de 2022
Hario Ceramic Drip Filter Funnel,"1,0 de 5 estrellas","The hole in the bottom of the funnel is huge. I have tried two different paper filters in it and as soon as the boiling water is poured into the coffee the paper tears and the coffee grounds fall into the cup. It is a mess and a waste of good coffee. I used Melitta Bamboo filters and Trader Joe's brand of unbleached paper filters. Our plastic Melitta coffee funnel has a small hole in the bottom so this doesn't happen. We wanted to move away from plastic, the ceramic Hario is a total rip off and a waste of money! It does not work!!!",Cathy S.,Revisado en Canadá el 8 de diciembre de 2013
