title,rating,body,author,date
ENCANTADA,"5,0 de 5 estrellas","De momento la he probado. Ha venido muy bien embalada. Es súper blanca, muy bonita. El café sale muy rico. Viene con pegatinas que se quitan perfectamente. Por ponerle una pega el filtro del café se coloca sobre puesto. No queda encajado para poder tirar lo posos. En cuanto lo colocas boca abajo sale directamente. Lo bueno que no cuesta trabajo sacarlo como en otros para limpiarlo. Recomiendo por lo bonita y efectiva. Además es muy rápida.",Estoy contenta. Tengo 2 perros y me parecía importante las fundas individuales así me queda libre un asiento para una persona. Viene incorporado el cinturón. Contenta con el envío y el producto,Revisado en España el 13 de julio de 2024
💥Nota: Sobresaliente💥,"5,0 de 5 estrellas","¡Hola a todos! Quería compartir mi experiencia con la cafetera Cecotec Cafelizzia 790 Steel Duo. Si estás buscando una cafetera express casera, esta podría ser una gran opción después de realizar un estudio de mercado comprando otras.

Yo usaba de cápsulas, pero después de probar el cambio... sin duda, me quedo con este tipo de cafeteras. 👍🏻

Desde que la tengo, preparar café cada mañana se ha convertido en algo que realmente disfruto. Con sus 1350 W de potencia y una presión de 20 bares, esta pequeña máquina hace espressos y cappuccinos que no tienen nada que envidiar a los de las cafeterías.

Lo que más me gusta es lo fácil que es de usar. El modo automático para 1 o 2 cafés es súper práctico cuando estás medio dormido por la mañana. Y el vaporizador orientable es genial para hacer espuma de leche; ahora me siento como un barista profesional haciendo cappuccinos en casa ☺️

Otra cosa genial es el accesorio para cápsulas. Es muy útil cuando no tienes tiempo para moler café o si tienes visitas que prefieren sabores diferentes.
Por otro lado, he leído las típicas averías que puede tener con el uso del tiempo y realmente son fáciles de solventar por uno mismo.

Recomiendo, NO usar agua del grifo, le daremos más vida al producto, tiene tubos delgados y así evitamos obstrucción con el paso del tiempo, aunque, como cualquier otro aparato de casa, hay que conocer como mantenerlo. 😊

En resumen, la Cecotec Cafelizzia 790 no solo hace un café delicioso, sino que también es fácil de usar y muy versátil. Si estás pensando en comprar una cafetera express, definitivamente te recomendaría esta, te va a encantar 😊👍🏻

Aprovecho para recomendar una marca y tipo de café molido, que me ha enamorado, os dejo su nombre por si queréis echar un vistazo (Buenísimo):

""Lavazza, Qualità Oro, Café Molido Natural, Ideal para Cafetera Italiana, de Filtro y Francesa, con Notas Aromáticas de Frutas y Flores, 100% Arábica, Intensidad 5, Tueste Medio""",VdVegeta,Revisado en España el 30 de diciembre de 2023
Buena cafetera,"5,0 de 5 estrellas","Después de bastante tiempo usándola, tenemos que decir que estamos muy contentos, hace buen café, es muy bonita estéticamente, sus medidas son ideales y no necesitamos ni una cafetera más cara, ni somos sibaritas exigentes. Es dúo, pero sinceramente no hacía falta. Lo que pasa es que teníamos excedente de cápsulas y no queríamos tirarlas, con lo que al ser dúo hemos ido dando salida a todas esas cápsulas de las que ya nunca más queremos saber nada. El depósitos de agua es accesible y de buena capacidad. La volveríamos a comprar sin dudarlo.",Mei,Revisado en España el 18 de junio de 2024
Espuma sin usar accesorio espumador. Sabor.,"5,0 de 5 estrellas","Después de varios meses de uso, sigo encantada. Hace cafe con mucha espuma. Yo caliento leche en microondas y después pongo la taza para el café. Hace una espuma increíble.",Rosa,Revisado en España el 4 de agosto de 2024
Pequeño tamaño y rapidez de calentamiento,"5,0 de 5 estrellas","Me gusta su forma, ocupa poco, rapidez de calentamiento y la crema que hace. Recomiendo el café ""Volcán de Oro""",julieta,Revisado en España el 6 de agosto de 2024
👌,"5,0 de 5 estrellas","Funciona perfectamente, super contento, la compré al verla a un amigo, además en oferta sin en manómetro ( este la tenía y no vale la pena, no sirve para nada).
No hace mucho ruido, no vibra, se limpia muy fácilmente, muchos pros y ni ningún pero...",Aifos,Revisado en España el 11 de julio de 2024
Genial,"5,0 de 5 estrellas","Me habían hablado muy mal de la marcha, y me ha sorprendido para bien. He tenido automáticas que hacían el café peor.",Cliente Amazon,Revisado en España el 31 de julio de 2024
Supercontenta,"5,0 de 5 estrellas","Después de varios usos puedo decir que hace un café excelente, que funciona a la perfección aunque aún no le he pillado el truco al espumador de leche. 10/10",Natalia Garcia Sánchez,Revisado en España el 26 de julio de 2024
Cafetera genial para amantes del café,"5,0 de 5 estrellas","Nos encontramos con una cafetera de la marca Cecotec, la cual es una opción perfecta para aquellos amantes del café que buscan una experiencia de café de alta calidad, ya sea en casa o en el trabajo. Con su tecnología de 20 bares de presión y su brazo portafiltros con doble salida y dos filtros, esta cafetera garantiza un café de alta calidad, con un sabor intenso y equilibrado (aunque también dependerá de la variedad de café que utilices, claro está).

El diseño elegante y atractivo que presenta la convierte en una añadido atractivo para cualquier cocina. Además, su construcción de alta calidad y su acabado brillante la hacen resistente y fácil de limpiar.

La tecnología de 20 bares de presión de la cafetera permite una extracción uniforme y consistente de café, por lo que cada taza de café tendrá un sabor intenso y equilibrado. Además, el brazo portafiltros con doble salida y dos filtros permite la preparación de dos tazas de café al mismo tiempo, lo que es perfecto para quienes necesiten una solución rápida y eficaz por las mañanas.

El depósito extra de la Cecotec Cafetera Express Cafelizzia 790 Shiny también es una característica clave que permite una mayor flexibilidad en la preparación de café. Con una capacidad de hasta 1,5 litros, el depósito extra permite la preparación de varias tazas de café sin tener que rellenar constantemente el agua.

Por si no fuera poco, esta cafetera es realmente fácil de usar y cuenta con una serie de funciones prácticas, como la opción de controlar la temperatura del café y la cantidad de café que se prepara en cada taza. También cuenta con una pantalla LED clara y fácil de leer que muestra información sobre el proceso de preparación.

A modo de conclusión, esta cafetera de Cecotec es una elección más que acertada para quienes quieran obtener una experiencia de preparación de café de alta calidad. Con su tecnología de 20 bares de presión, su brazo portafiltros con doble salida y dos filtros, y su depósito extra, esta cafetera garantiza un café de alta calidad, con un sabor intenso y equilibrado. Además, su diseño elegante y atractivo es un plus a tener en cuenta.",Will The Cat,Revisado en España el 2 de febrero de 2023
Excelente relación calidad-precio.,"5,0 de 5 estrellas","Cafetera muy práctica puedes poner cualquier tipo de taza que no choca, con la anterior era un problema las tazas altas. Es mucho más silenciosa que la anterior y el café sale espumoso y bueno.",Violeta,Revisado en España el 15 de julio de 2024
Buena calidad y acabados,"5,0 de 5 estrellas","Buena calidad y acabados, y buen funcionamiento. Calidad precio buena.",Ainoa,Revisado en España el 7 de agosto de 2024
Me encanta,"5,0 de 5 estrellas","El café lo hace buenísimo, la recomiendo.
Si la primera vez que la utilizáis no tira el agua dejarla que se enfríe unas horas y luego volvéis a usarla y ya funciona perfectamente, no sé porque pasa eso pero en dos cafeteras que he comprado me ha pasado. Por lo demás perfecto.",Juan,Revisado en España el 1 de julio de 2024
Todo lo que tiene que tener una cafetera,"5,0 de 5 estrellas","Café rico y con espuma, fácil de limpiar y usar. De diez",Karlos,Revisado en España el 2 de agosto de 2024
Su tamaño ideal para mí cocina.,"5,0 de 5 estrellas","Te tomas un café de mejor calidad que en una cafetería.
Excelente elección la mía",rafael,Revisado en España el 30 de julio de 2024
Funciona perfectamente,"5,0 de 5 estrellas","Hace un buen café es funcional y no se atasca
Le hago entre 6y8 cafés diarios como minimo",German Ignacio Garcia Rodriguez,Revisado en España el 27 de julio de 2024
Gran espuma y cuerpo,"5,0 de 5 estrellas","Pues depende del café y demás..., pero la he sustituto por una saeco averiada y no puedo estar más contento. Bastante espuma y buena máquina.",manu_sierra86,Revisado en España el 16 de julio de 2024
Precio,"5,0 de 5 estrellas",Me encanta muy cómoda buen café y buen precio,MARICARMEN,Revisado en España el 31 de julio de 2024
Genial,"5,0 de 5 estrellas","Simplemente muy buen equipo, como es lógico se debe de usar un café adecuado, preferiblemente uno recomendado para su uso en este tipo de cafetera para obtener un mejor sabor y aroma (algunas marcas de café tienen una serie hecha expresamente para este tipo de cafeteras). Todo funciona muy bien y es perfecta para su uso doméstico. Realmente muy contento con la compra.",Marco Aurelio Toledo Arandia,Revisado en España el 5 de junio de 2024
Impecável,"5,0 de 5 estrellas",Artigo chegou impecável e funciona perfeitamente bem! O Café sai cremoso e é muito fácil de usar!,Fsantos,Revisado en España el 17 de julio de 2024
Hace un café muy bueno,"5,0 de 5 estrellas",Buena máquina no le tenía mucha fe y funciona bien otra cosa será ver si es duradera y fiable pero hace muy buen cafe,Jesus T.,Revisado en España el 11 de julio de 2024
Buen producto,"5,0 de 5 estrellas",Calidad precio inmejorable,Javier,Revisado en España el 4 de agosto de 2024
excelente producto,"5,0 de 5 estrellas",maravillosa y muy buen vendedor muy bien empacado,Samael,Revisado en España el 22 de julio de 2024
Mejor de lo que esperaba,"5,0 de 5 estrellas","Pues tal cual el titulo, llevaba tiempo buscado una que no fuera muy cara pero que tuviera lo minimo de calidad y creo que di en el clavo. Solo llevo unos dias con ella para saber si con el tiempo seguira igual de buena pero por ahora cumple con su funcion. Lo mas que me sorprende es que tenga el apagado automático y programable para la salida del cafe, eso es algo que me interesaba y que muy pocas lo tenían en ese rango de precio.el cafe sale bien, segun lo prenses y el tipo y granulado pero sale perfecto como se puede ver en el video. Espero que dure y me vaya bien con ella. Yo la recomiendo.",josempg,Revisado en España el 11 de abril de 2024
"Compacta, ahorras en espacio. Facilidad de uso. No vibra","5,0 de 5 estrellas","Me abstengo de poner fotos ya que la cafetera es tal cual se nos muestra en las imágenes de muestra. Es compacta, de ancho es inferior a la mayoría de otras cafeteras. El depósito, sin ser de gran capacidad, es sencillo de quitar, sin complicaciones, se rellena rápido y se vuelve a colocar de inmediato.

Nos permite hace o bien 1 expreso o 2 a la vez. Si te gusta el café largo, no hay problema, le das a la doble taza y pones un solo vaso. El teimpo de espera desde que pones la cazoleta y le das a calentar para que empiece a salir el café es muy corto. En funcionamiento no vivbra como otras, pero sí que hace algo de ruido, pero eso es algo normal. aunque he de admitir que el ruido es menor que otras cafeteras, incluso de la misma marca.

En cuanto a cómo sale el café... me da risa leer si hace café malo o bueno. Nadie pone que si usa un café de 1€ el paquete le sale super estupendo. Eso es así, si usas café barato, saldrá café barato. Y no hay más. La cafetera solo hace pasar el agua por la cazoleta con mejor o peor presión, por lo que hace más o menos crema. A ver si dejamos de decir tonterías.
Esa es otra cuestión, la presión con la que sele el agua caliente y pasa a través del café molido y el filtro. En éste caso solo puedo decir que es excelente, ya que eso se nota en que una vez quitamos la cazoleta, incluso segundos después de salir el café, veremos que no hay ese ""charco"" o residuo de agua encima del café. Está, por así decirlo seco, o sea, que toso el agua ya ha pasado por el café y ha caído en la taza. Ahí se nota la presión correcta de la cafetera.

Resumiendo, es más cara que otras similares y de marca reconocida, o incluso de la misma marca, pero en cuanto a ahorro de espacio y de calidad, la recomiendo sin dudarlo",R. C. García,Revisado en España el 19 de junio de 2022
Buen producto,"5,0 de 5 estrellas",Se ve un producto de buena calidad muy bonito y elegante funciona perfectamente,Lenin Rodriguez,Revisado en España el 7 de julio de 2024
Muy buen. Buena espuma,"5,0 de 5 estrellas","Es una cafetera bastante estrecha, es fácil de ubicar en la cocina. Instalación y puesta en marcha fácil, viene descrito en el manual.
Al tener 20 bares hace bien de espuma (y persistente), algo más de medio centímetro, tanto con la dosificación de una como 2 'tazas'. Sólo he usado el casquillo de 2ta,as, porque me gusta el sabor de café intenso, pero el casquillo de una taza, seguramente haga la misma o más espuma
La cantidad de expreso que quieres, se puede ajustar manteniendo el botón pulsado hasta la medida que se quiere, luego ya queda memorizado
La cafetera es bastante silenciosa y poca vibración, no hay que aguantar el vaso para que no salga corriendo
El depósito de agua no es muy grande, pero suficiente
El mango, en mi opinión, es bastante grande.",Josep,Revisado en España el 3 de marzo de 2024
Facil y limpio de usar,"5,0 de 5 estrellas",Me ha parecido fácil de usar y bastante limpio. La cafetera es ideal pero no se si debería de calentar el cafe un poco más. Punto malo es la parte de arriba que no lo veo útil para calentar vasos pero si lo veo bueno para dejar los filtros y el brazo.... Cafe muy buenos,Donald,Revisado en España el 23 de mayo de 2024
Estupenda,"5,0 de 5 estrellas","Magnífica, un café fresco una molienda fina, y te saca un express con ratio1.2, 1.3 magnífico, y puedes hacerte a la idea de los fallos de prensado gracias al manómetro, a parte de que calcules el tiempo de extracción, pero en general estupenda. Anteriormente había adquirido una automática pero no merece la pena, si te gusta el café auténtico. La automática mueble muy grueso y sale el café aguado, a parte del desperdicio de agua que tiene cada vez que enciendes y apagas. Con está expreso , no hay esos problemas, solo tienes que hacer varios intentos hasta conseguir sacar el café que te gusta.",Jasm,Revisado en España el 6 de abril de 2024
Genial relación calidad precio,"5,0 de 5 estrellas","Estoy bastante contento con ella. Al principio hay que ajustarla a tu gusto, cantidad de café que pones y cantidad de agua que sale. El calentador de leche funciona muy bien, aunque para mucha leche hay que tener paciencia. Arranca muy rápido, y mientras cargas el café ya está preparada. Y para la leche igual. Lo único es que si calientas leche y luego quieres hacer otro café tienes que esperar unos minutos a que se enfríe. Llevo más de un año haciendo 3-6 cafés diarios y de momento genial. Cafetera ideal para empezar a hacer café expreso o si tampoco te quieres complicar mucho al hacer un café digno",Oscar S,Revisado en España el 19 de marzo de 2024
Buen café a buen precio,"5,0 de 5 estrellas","Fácil de usar y de limpiar. El café lo hace sin problema. El tema de la espumar o calentar leche es otra cosa , pero con máquinas tan pequeñas imagino que es complicado. Si quieres espuma o calentar leche tiene que se muy poca cantidad. Además la máquina necesita enfriarse y entre que haces el café, calientas la leche y ya tienes frío el café. Si es para una o dos personas no habrá problema pero si quieres hacer café para más con su espumilla es mejor que compres una máquina aparte para hacer espuma.
Al principio costaba un poco ajustar el filtro del café en la máquina, pero esa resistencia inicial ha ido a menos y ahora está más cómodo.
El tamaño está muy bien para cocinas pequeñas. Muy estrecha, cabe en cualquier rincón. El diseño también es muy agradable.",Alberto Banet,Revisado en España el 8 de febrero de 2024
BUENA CALIDAD Y FACIL USO,"5,0 de 5 estrellas","Compre esta cafetera para estas pasadas Navidades , desde entonces la usamos toda la familia a diario , facil uso , buen cafe. Buen Precio . La recomiendo",Lopez Jimenez,Revisado en España el 9 de junio de 2024
Buen producto,"5,0 de 5 estrellas","Fácil de usar, muy rápido calentamiento y hace buen café",JLBF,Revisado en España el 21 de junio de 2024
Estupendo,"5,0 de 5 estrellas",Buen funcionamiento y fácil,Susana,Revisado en España el 25 de junio de 2024
Hace buen cafe,"5,0 de 5 estrellas","He cambiado a esta cafetera, por se me había estropeado otra que tenía y reconozco que esta hace muy buen café. Se calienta muy rápida y no mete mucho ruido como había leído por ahí. Me gusta mucho la estética y como queda en la cocina. Y por ese precio es una de las mejores que hay ahora en el mercado.",aitor,Revisado en España el 29 de abril de 2024
Café igual que en los bares,"5,0 de 5 estrellas","Estoy encantadísima con esta cafetera...me animé a comprarla porque estaba deseando tomar un café lo más parecido a un bar después de tener una de cápsulas. Sabía que iba a mejorar un poquito pero debo admitir que me he llevado el sorpreson de mi vida..el café sale exactamente igual que en los bares y no exagero soy muy muy cafetera es verdad que uso café en grano que me vende un bar amigo así que uso uno bueno y lo muelo yo misma con el molinillo y a lo mejor es por todo esto pero nada que envidiar a un bar. Dudé un poco de algún comentario aunque la mayoría eran buenos por eso me decidí y no me arrepiento.tarda solo 30 segundos en calentarse y si es verdad que leí y pasa que se calienta la máquina al usar el vapor de leche pero bueno solo tengo que esperar 1 minuto tampoco na del otro mundo y ya puedes seguir echando café..
En fin que si sois como yo una cafetera a más no poder porque me encanta el café y soy muy estricta no os vais arrepentir estoy contentísima de tomarme este pedazo de café con crema y aroma que sale de esta máquina en el sofá de mi casa.",Cliente Amazon,Revisado en España el 9 de junio de 2023
Genial. Cafe delicioso,"5,0 de 5 estrellas",Uso simple y practico,MARTA R.,Revisado en España el 20 de junio de 2024
Cafetera cumbia,"5,0 de 5 estrellas","Hola ,dudé por cuál cafetera decidirme por las opiniones.Y tengo que decir que estoy súper contenta.Funciona genial no he tenido ningún problema.Y el sabor del café nada que ver con las cápsulas,aunque también dependerá de la calidad del café.Os la recomiendo 100%",Ana m.,Revisado en España el 24 de abril de 2024
Excelente maquina de café,"5,0 de 5 estrellas","Recomendo, tira um café muito bom e com espuma",Hugo,Revisado en España el 14 de junio de 2024
Primera impresión buena,"5,0 de 5 estrellas","Primera impresión es buena, no soy muy amante de esta marca sobretodo de sus robots pero le he dado una oportunidad en otros aparatos y la primera impresión es muy buena.
☕️saca un buen café con espumita, ahora no esperes un café de bar. Pero para ser de uso doméstico está genial.
El vapor y el agua caliente funcionan muy bien.
El tanque para el agua es grande y con buena capacidad de fácil acceso y fácil de instalar,
Estéticamente es preciosa.
Me gusta el detalle que tiene arriba para colocar las tazas si lo deseas.
También destaco la opción que tiene para modificar el tiempo de salida del café para mí el que viene predeterminado de fábrica es corto porq me gusta el café largo y que esto se pueda modificar es un puntazo.
Veremos cómo se comporta con el paso del tiempo, pero de momento feliz con mi compra,",Thor,Revisado en España el 7 de diciembre de 2023
Uma boa escolha,"5,0 de 5 estrellas","Já a funcionar há 2 meses, sem qualquer problema. Equipamento bonito e funcional. Embora existam duas opções disponível (mais e menos água), a quantidade de café que sai em cada uma delas é programável (ver manual).
Quem gosta de café bem quente, pode deixar sair apenas água por alguns segundos, para aquecer o circuito, para os cafés seguintes, claro que isso não se aplica.",mc,Revisado en España el 16 de marzo de 2024
Excelente por el precio,"5,0 de 5 estrellas","La compré de devolución, aunque yo creo que era nueva y solamente faltaba la caja, me parece una cafetera magnífica, es muy poco ruidosa, he probado y tenido varias y esta es muy silenciosa en comparación, viene con dos cabezales para uno o dos cafés, en mi caso he comprado otro sin presurizar, sale sin espuma pero mucho mejor de sabor. En cuanto al vapor que la gente se queja de que hay que esperar 20 minutos para volverla a usar, en las instrucciones pone claramente que después de usar el vapor, saques agua caliente, y automáticamente vuelve a estar operativa, he sacado cafés teniendo visita y he sacado 9-10 cafés seguidos cada uno hirviendo su leche, y según quitas el vaporizador que se queda parpadeando, le das a agua caliente y al segundo puedes volver a usarla. Punto a favor que puedas ajustar la medida de los cafés, en mi caso que me gustan fuertes media taza, pero los puedes ajustar como tú quieras. Por lo demás es bonita y ocupa muy poco",Pablo maquinon,Revisado en España el 14 de octubre de 2023
Muy contenta con mi cafetera,"5,0 de 5 estrellas","Me daba algo de miedo comprarla, ya que he visto comentarios de personas a las que les había llegado una máquina usada, que si no salía el café caliente, que si las pegatinas no se despegaban bien y se quitaba el esmalte al retirarlas... Mi experiencia ha sido diferente:
Hice varias veces la limpieza que recomiendan en las instrucciones, después de esto probé a hacer varios cafés, todo funciona correctamente y el café sale caliente, con su espumita, vamos, como de una cafetería! Caben perfectamente dos vasos si quieres hacer dos simultáneamente, viene con un filtro más profundo y otro más pequeño según el número de cafés que quieras hacer. A mí sí me sale bien calentito de momento. Es muy fácil e intuitivo de usar. El diseño es muy bonito y el precio aceptable. Por unos euros más se puede extender la garantía y esa es la opción que he escogido. Hasta ahora usaba una nespresso y la diferencia de sabor es abismal, está claro que luego depende de la calidad del café que escojas, si usas molinillo o lo compras ya molido... De momento, super satisfecha con el producto.",Cliente Amazon,Revisado en España el 18 de agosto de 2023
Perfecta,"5,0 de 5 estrellas","Perfecta para una o dos personas.Acabado elegante,pequeña y el café sale espectacular.",Cristina,Revisado en España el 9 de junio de 2024
Me encanta el diseño y el cafe que sale,"5,0 de 5 estrellas","Solo puedo valorar que es preciosa y en esta semana espero cogerle el truco al cafe.
Y despues de 1 semana no puedo estar mas contenta ,el cafe buenísimo y el diseño como podeis apreciar en el video preciosa.
Por ponerle una pega: Si uso el calentador de leche,tengo que esperar un ratito a que se enfrie para poder hacer cafe,Asi que he optado por calentarla en el micro.Por lo demas encantada",Patricia Marin Lopez,Revisado en España el 2 de marzo de 2024
En general buena compra con algún matiz,"5,0 de 5 estrellas","Me encanta su diseño, queda muy en mi cocina. Me decanté por la negra. Después de un mes puedo decir que estoy contento con la compra pese a que la cazoleta de una dosis para hacer un solo café por algún extraño motivo no funciona correctamente. Está como obstruida y no sale el café por sus orificios sino que se desborda por los lados de la cabeza del mango junto por donde se encaja. El primer café que hicimos con esta cazoleta salió perfectamente pero ese fue el único que conseguí que hiciese bien. No lo veo un problema pues la cazoleta para dos cafés es la que siempre acabo usando en este tipo de cafeteras. Una dosis se me queda cortito, aguado a veces para mi gusto. En la de dos dosis en seguida la adaptas a tus preferencias añadiendo o quitando un poco de café en la próxima ocasión.

El funcionamiento no puede ser más simple: lleva dibujada en un botón una taza y cuando la luz deja de parpadear y se pone fija pulsas para un café y el segundo café es similar pero simplemente tarda más en disparar y hace un café más largo y fuerte o dos más suaves al mismo tiempo.

Por último si la primera bez que la usas compruebas que pese a que estás notando que la cafetera hace ruido pero no sale café con mucho cuidado de no quemarte gira la rueda del vapor un poquito hasta que drene y salga un poquito de agua. Espera un poquito y vuelve a pulsar el botón del café y esta vez sí te lo hará con seguridad.",Sonia Martínez,Revisado en España el 31 de diciembre de 2021
Hace un café exquisito.,"5,0 de 5 estrellas","Además de ser una cafetera muy estética, el café sale exquisito, con una espuma muy cremosa, incluso con marcas de café de segunda. El sistema de calentamiento con vapor te permite calentar la leche y hacerla espumosa/cremosa. Diría que es la mejor cafetera que he tenido ¡y he tenido unas cuantas!",API,Revisado en España el 22 de abril de 2024
Calidad/Precio sorprendente,"5,0 de 5 estrellas","Muy contento, se calienta rápido, y hace muy bien la espuma de leche.
El café sale bueno, pero hay que ponerle buen café y molido fino",Adri,Revisado en España el 5 de mayo de 2024
Compacto y cómodo de usar,"5,0 de 5 estrellas",Si,Luis,Revisado en España el 20 de junio de 2024
