title,rating,body,author,date
Cafetera expressos,"5,0 de 5 estrellas","Se me estropeó mi cafetera de café saeco poemia ( 11 años me ha durado ), viendo las cafeteras de expresso que había similares a mi anterior cafetera, me decidí por la cecotec y fue un acierto buena relación calidad-precio, hace un cafe espectacular con su espumita y calienta la leche también bien , en casa estamos contentos con su rendimiento diario de cafe .",Emilio,Revisado en España el 17 de marzo de 2024
Muy recomendable,"5,0 de 5 estrellas","Soy muy cafetero y pareja igual, podemos tomarnos 3/4 cafes cada uno al día, teníamos una nespresso de hace 10 años de cápsulas y la reventamos de tanto uso. Nos decidimos a comprar una cafetera de cafe molido porque la verdad que están mas buenos los cafes si le pillas el toque. Suelo mirar mucho las reseñas y no me decidía por ninguna, veía unos comentarios de “expertos” cafeteros que si los bares de presión que si el cafe no es perfecto y decía no me atrevo a comprarla. Un día cansado de darle vueltas me decidí por este modelo, es cierto que la cantidad y presión con la pongas el cafe en el mango, el modelo de cafe todo eso influye, pero estoy muy muy contento con la elección, cecotec no me paga por decir esto pero es muy muy fácil de usar, el cafe sale con una textura muy buena y el espumador me va genial, el cafe no tiene nada que ver con el de cápsulas. Es cierto que no llega al nivel de las cafeteras de cafeterias pero si quieres cambiar de cápsulas a este tipo te lo aconsejo 100% fácil de limpiar y no tiene nada que ver con los de capsulas. Ya depende de la marca de cafe que pongas la cantidad del cazo para mas o menos intenso, pero si estas en duda no te lo pienses por el precio que tiene esta hasta barata. Ahora estoy usando el caffe intenso 100% arabico de la marca illy, lo compro en Carrefour y utilizo el cazo doble de cafe para un cafe y es una maravilla.",Eduardo,Revisado en España el 4 de febrero de 2022
Cafetera,"5,0 de 5 estrellas","Me encanta, hace un café delicioso",Nayma Samper,Revisado en España el 7 de junio de 2024
¡Bravo Cecotec 790 Steel Pro!,"5,0 de 5 estrellas","Elegí durante mucho tiempo, comparando cafeteras de Bomba y cafeteras Automáticas del Top-10 de 2021. Como resultado, la elección se hizo deliberadamente. ¡Y lo adiviné! La Cecotec 790 Steel Pro es la cafetera ideal en términos de relación calidad-precio. He Elido entre Cecotec Barista Pro (254 euros), Sage Appliances SES875BSS (591 euros) y De'longhi Dedica (179 euros). Cecotec Barista Pro resultó ser demasiado complejo y engorroso para uso personal en el casa. El SAGE, con su chirrido, ruido, incomodidad y 600 euros, parecía innecesario. En la cocina, es mejor no generar suciedad y ruido, solo comprar un paquete de café molido. También puedo comprar un tamper perfecto por 15 euros, que será mucho más elegante y con mango de madera que el Sage incluido. Como resultado, quedaron dos candidatos, Cecotec Steel Pro y De'longhi. 90 euros contra 179. Teniendo en cuenta que la primera opción son 20 barriles contra 15 para De'longhi. Decidí arriesgarme y tomé la decisión correcta. Mi café ahora - es una espuma espesa y densa. Mi espuma de leche es tan impresionante como en la cafetería de enfrente. Mi café está molido grueso y se prepara muy bien a 9-10 bares. Y esto ya es genial. Se puede reducir la molienda, aumentando así la presión. Y habrá más espuma. Pero lo principal aquí es encontrar la zona óptima. Lo he estado usando durante una semana y estoy muy satisfecho con la compra. Sin embargo, vale la pena señalar que si la apariencia es importante para usted, De'longhi Dedica se ve más bonita y mejor para los ojos. Aunque inferior en características técnicas.
¡Victoria completa en la competición por 89 euros!",Sergey N.,Revisado en España el 3 de abril de 2021
Buena calidad,"5,0 de 5 estrellas",Cafetera de acero de buena calidad con calienta tazas hace buen cafe con buena crema calienta bien la leche con el vaporizador y tiene un precio inmejorable mucho mas barata que en tiendas calidad precio lo recomiendo sin ninguna duda,Javier,Revisado en España el 10 de abril de 2024
Era lo que buscaba,"5,0 de 5 estrellas","Buscaba una cafetera express que no fuera demasiado costosa, había probado una de Ufesa que terminé devolviendo. La presión en correcta, genera espuma, sale caliente. Llevo usándola hace 6 meses y de momento ninguna incidencia. Espero que dure muchos años.",Sol,Revisado en España el 3 de abril de 2024
Buena compra,"5,0 de 5 estrellas","Solo puedo decir una cosa….Ecoooo, cuando arribo a casa…. Café cecotec.",Juan,Revisado en España el 23 de mayo de 2024
Silenciosa y Buen Cafe,"5,0 de 5 estrellas","Segunda cafetera cecotec. El modelo anterior hacia mucho ruido. Este modelo es mucho mejor ya que saca un mejor cafe y el ruido que hace es minimo. Suena incluso algo menos que una cafetera de capsulas nescafe picolo.

Por el precio que tiene, la recomiendo ya que el cafe que sale es bueno (hay que tener en cuenta la calidad del cafe que se compra) y el funcionamiento en general de la maquina esta bien.",Daniel,Revisado en España el 9 de febrero de 2024
Estupenda relación calidad-precio,"5,0 de 5 estrellas","Por su precio cumple con su función, no hace demasaido ruido y sale un cafe perfecto. A quien le guste un cafe espumoso esta cafetera es de lo mejor de los que he tenido hasta ahora. Tiene un diseño elegante y es fácil de limpiar. Además es compacto en cuanto al ancho.",Bastet,Revisado en España el 18 de marzo de 2024
Hace buen café,"5,0 de 5 estrellas","Me gusta el es pequeña,el café queda delicioso 😋 espumoso la recomiendo siempre",Candida Valencia Álvarez,Revisado en España el 3 de mayo de 2024
Preciosa,"5,0 de 5 estrellas","Me encanta q sea blanca . Queda super bien en mi cocina aunq la foto no esté en su sitio actual.
Pros:
-en menos de un minuto ya está lista para usarla
-super bonita
-arriba tiene una plataforma para calentar las tazas
-puedes hacer uno o dos cafés
-fácil de limpiar
-leche espumosa
-buen café
-no hace mucho ruido
-puedes hacer capuchinos
Contras:
Sinceramente no le encontré ninguno aún",Arantxa,Revisado en España el 8 de febrero de 2024
Cafetera,"5,0 de 5 estrellas","Estuve comparando muchas y creo q hice una elección muy buena, funciona perfectamente, tiene un bonito diseño q ocupa menos espacio, fácil de limpiar y más aún de usar. Ahora sí disfruto de mi café en casa todos los días",Rosario Alcázar,Revisado en España el 17 de abril de 2024
Rapidez,"5,0 de 5 estrellas","Me encanta esta cafetera espreso.
Hay que cogerle el punto al tiempo y a la cantidad de café y prensado, pero una vez hecho esto, tienes un delicioso café en casa. Y además con leche espumada, capuchino!!
Ah, y sin contaminar con cápsulas.
No se le puede pedir más por el precio que tiene.
La mayoría de defectos que aparecen señalados en los comentarios, tienen solución con unos sencillos pasos en el libro de instrucciones.",Cliente,Revisado en España el 15 de febrero de 2024
Buena cafetera,"5,0 de 5 estrellas","Cafetera básica para empezar , fácil de usar y montar",Francesc Alegre,Revisado en España el 21 de mayo de 2024
Genial!,"5,0 de 5 estrellas",Hace muy buen café. Gran compra!,Simón,Revisado en España el 23 de mayo de 2024
Buena,"5,0 de 5 estrellas",Buena cafetera,antoniamonty,Revisado en España el 3 de junio de 2024
Buena máquina de café express,"5,0 de 5 estrellas","Me decidí a comprar esta máquina para una segunda vivienda que tengo, donde tenía una de cápsulas Nespresso, en mi primera vivienda llevo más de 20 años con máquinas de café express manuales, pues harto de las cápsulas, precio y basura que generan, me puse a mirar máquinas de café manuales a precios razonables y que no ocuparan mucho espacio, después de leer opiniones en distintos sitios me decidí por esta, y la verdad es que me ha sorprendido para bien, hace un café muy bueno, tiene los botones de 1 o 2 cafés a la vez y tú puedes programar cómo los quieres de largos( de agua me refiero) y se apaga sola, parece una tontería pero no lo es, espuma correctamente y además es muy bonito el diseño, o sea, yo la volvería a comprar, por cierto, ya la tengo hace tres meses, me he esperado a tener una mínima experiencia con el producto.",Jose Luis,Revisado en España el 17 de junio de 2023
Buena máquina,"5,0 de 5 estrellas","Buen café, rápido, buena presión.

El tubo de vapor es atrezzo, mejor centrarse en solo hacer café.",javier,Revisado en España el 10 de mayo de 2024
Mucho mejor que anteriores modelos de Cecotec y otras marcas también,"5,0 de 5 estrellas","Antes de esta cafetera expresso utilice otra de la misma marca pero la mitad de precio. En mi opinión ha mejorado en todos los aspectos.
Las ventajas que he encontrado en este modelo respecto a anteriores son las siguientes:

-Compacta y a pesar de estrechez tiene un depósito de agua de gran capacidad y en la bandeja hay espacio para dos tazas de tamaño genérico.
-El café es bueno, intenso y con cuerpo, también saca su espuma/crema al café ya sea de café recién molido o no. No soy barista pero sé cuando un café es mierda, aguachirri o mediocre y no lo son.
-La cafetera es configurable y puedes personalizar la duración de ambos botones de café y así hacerlos más largos o cortos. (En el vídeo de ejemplo el botón pulsador está configurado).
-El vaporizador de leche funciona perfectamente tanto para calentar agua como cualquier tipo de leche.
-Desconozco si es por su potencia u otra razón una vez encendida es rápida en estar lista para preparar café o vaporizar. Una vez finalizado el proceso vuellñve a estar preparada en escasos segundos. Por lo que puedes hacer varios cafés sin problema.
-La vibración de la máquina una vez encendida es nula lo que evita las tazas de muevan o vuelquen, ya sean grandes o pequeñas. Parece surrealista pero hay cafeteras que vibran en la bandeja donde colocas la taza.
-El diseño es atractivo muy similar a modelos de otras marcas, su manómetro es útil te indica la presión de trabajo a la que está la cafetera mientras el café se hace.
-Compatible con café molido y monodosis de papel tipo Senseo. Ambas soluciones ecológicas.

En general cálidad/precio 100% además es marca española, que no todo puede comprarse chino o alemán.",rupe88,Revisado en España el 1 de septiembre de 2021
Perfecta para uso doméstico,"5,0 de 5 estrellas","La verdad no entiendo muchas opiniones,el producto precio, calidad está muy bien,el café de cafetería,no sale muy caliente si no se calienta bien,con sacar una dosis de agua antes sola suficiente si lo quieres más caliente,si sacas dos seguidos perfecto.El tema es dejar que caliente la bomba.Si se siguen las intrucciones el café es estupendo ,importante prensar con el utensilio que trae en el recipiente y no hay más.",jose,Revisado en España el 1 de febrero de 2024
Pues funciona estupendamente,"5,0 de 5 estrellas","Compré hace tiempo una De'longhi Dedica con la que estoy muy contento, y hace un mes compré una cecotec para probar. Funciona estupendamente, comparable con la delonghi; diría que es más fácil de usar. El café lo hace muy, muy cremoso y en menos de un minuto. Lo mismo con la nube de leche.
Esperemos que dure (creo que las cafeteras domésticas tienen ese punto débil; a mí se me rompió la cápsula de presión de una saeco). En fin, por el momento muy recomendable.",Jorge Lopez-Abad,Revisado en España el 29 de diciembre de 2023
Café como en el bar,"5,0 de 5 estrellas","He esperado varios meses antes de hacer esta reseña ya que quería comprobar todo bien, y la verdad que tras 3 meses de uso, funciona como el primer día, café excelente con mucha espuma.
Muy contento con este producto!",Santi,Revisado en España el 13 de marzo de 2024
"Hace buen café, es bonita, no ocupa demasiado, precio razonable, depósito huele a plástico","5,0 de 5 estrellas","Estoy muy contento con la cafetera, puedes hacer una o dos tazas, la calidad se ve muy buena y el aspecto me encanta y hace juego con otros electrodomésticos de superficie metálica. La pedí con manómetro que queda bonito pero no sé si sirve para mucho saber la presión.

La única pega es el depósito del agua que incluso después de meses de uso sigue oliendo a ""plástico nuevo"", lo cual pasa con muchos otros aparatos y es obviamente debido a algún producto químico usado en la fabricación y el cual no me hace gracia que pueda transferirse al agua, de modo que para evitarlo lo vacío y lo dejo abierto para que se ventile tras cada uso",Cliente Amazon,Revisado en España el 1 de octubre de 2023
Mi Cumbia Cafelizzia 890 Gray.,"5,0 de 5 estrellas","Perfecta mi Cafelizzia 890 de Cecotec. Muy contento con la compra y el servicio de entrega muy rápido, Les perado. Aunque la caja llegó algo golpeada estaba todo perfecto y sin daños. Ahora a probarla y disfrutar de un uen café. Más adelante come tare mi experiencia con esta Cecotec. Gracias.",Miguel Angel Carpio,Revisado en España el 4 de febrero de 2024
"Bonita, silenciosa y buen café","5,0 de 5 estrellas","Al comprarse está cafetera hay que tener claro el precio que tiene, no es de las más baratas, pero en absoluto de las caras, si eres un barista quizá está cafetera te sepa a poco, pero si eres alguien a quien le gusta el buen café esta es tu opción. Es realmente rápida calentándose y tiene una presión bastante decente, así que saca muy bien el sabor del café y una buena espuma.

Había leído en otros comentarios que el vaporizador de la leche se estropeaba o que perdía agua por el depósito, pero yo siguiendo las instrucciones del manual no he tenido ningún problema, la tengo ya unos 4 meses y estoy muy contento.",Miguel,Revisado en España el 9 de septiembre de 2023
Muy chula!,"5,0 de 5 estrellas","Llevo tres semanas con ella y de momento genial. Hay q tener cuidado q me pasó al principio por no leerme las instrucciones que sí llenas demasiado el brazo del café, la cafetera hace como que funciona pero no echa el café por un mecanismo de seguridad para no rebosar. No hay q llenarlo mucho sino como dejando un espacio cm se considera y eso puede hacer creer que la cafetera no funciona cuando no es así, es q lo has llenado más del máximo. Lo digo porque leí comentarios aquí de gente q creía q estaba rota, me llegó a mi la cafetera y pensé lo mismo q estaba rota, hasta q lo leí en las instrucciones q lo llené demasiado.
Apenas hace ruido al hacer el café. Aún no domino yo la espuma de la leche. Se nota que es de calidad el material. Como pequeña pega, viene con muchas pegatinas que hay q quitar, luego la cafetera pesa poco q eso está genial pero a la hora de poner el brazo del café se mueve y hay q aguantarla, y el café sale caliente pero podría salir mucho más. Pero por lo general estoy súper contenta, de momento. Sino fuese así más adelante ya escribiría en este comentario lo contrario ☺️",alba,Revisado en España el 24 de agosto de 2021
Todo bien,"5,0 de 5 estrellas","Llevo una semana usándola y de momento todo bien, el café sale con crema y caliente.",Cliente Amazon,Revisado en España el 8 de mayo de 2024
El café muy bueno,"5,0 de 5 estrellas",Por calidad/precio creo que está muy bien,José Manuel Sánchez,Revisado en España el 16 de mayo de 2024
Buena calidad 👌,"5,0 de 5 estrellas","Estoy contenta con la compra, me ha gustado todo, diseño, funcionamiento y calidad. Un 10👏👏",R B,Revisado en España el 4 de mayo de 2024
"Práctica, funcional y compacta, ocupa poco espacio.","5,0 de 5 estrellas","Práctica, funcional y compacta, ocupa poco espacio. Muy contento con el vendedor Bargain Hunt LDA. Lo recomiendo.",Cliente Amazon,Revisado en España el 4 de mayo de 2024
Muy buena cafetera,"5,0 de 5 estrellas","Funciona genial, el café está rico y se calienta muy rápido. ¡Importante hacer bien la primera limpieza o no os funcionará!",Patricia Martínez,Revisado en España el 21 de abril de 2024
Hace unos expressos riquísimos,"5,0 de 5 estrellas","Se me rompió la mía después de varios años darle muchísimo uso (en mi casa se hacen unos 10 cafés diarios) y opté por comprar el mismo modelo. En casa nos encanta esta cafetera. Es fácil de usar y limpiar y ocupa poco espacio.
Tiene un a relación calidad-precio buenísima. Comprar una cafetera de 20 bares de presión por este precio es genial. Hace unos expressos cremosos muy ricos y tiene botón para hacer 1 ó 2 que se puede personalizar la cantidad de café que echa, además tiene arriba calienta tazas y también tiene espumador de leche (que también se puede usar para echar agua caliente para infusiones).
El espumador es lo que menos me gusta pero por este precio no se puede pedir nada mejor, simplemente cumple.",Esther,Revisado en España el 12 de abril de 2023
Café de Calidad con Estilo y Simplicidad,"5,0 de 5 estrellas","La Cafetera ha superado mis expectativas. Su diseño elegante se integra perfectamente en mi cocina, y la facilidad de uso hace que preparar un café delicioso sea un proceso rápido y sin complicaciones. La calidad del espresso que produce es impresionante, convirtiéndola en una elección acertada para aquellos que buscan una cafetera express fiable y con estilo. ¡Muy satisfecho con mi compra!",Juan Pablo Alvarez,Revisado en España el 19 de enero de 2024
Super práctica y compacta,"5,0 de 5 estrellas","Una cafetera muy práctica y compacta que hace muy buen café. La presión es la adecuada y la opción para hacer cafés de diferente potencia es muy cómoda. Además, es muy cuca y queda muy bien en casi cualquier cocina.",Juan,Revisado en España el 11 de marzo de 2024
Gran cafetera,"5,0 de 5 estrellas","Tras varios meses de uso y comprarla con ciertas dudas por las reseñas leídas, he de decir que no he encontrado ningún problema en esta cafetera. Por el precio que tiene es más que correcto.",Javier Gonzalez Rodriguez,Revisado en España el 14 de marzo de 2024
Un molt bon article a un preu assequible,"5,0 de 5 estrellas","Amb la recomanació de la meva parella, que ja la tenia, vaig fer el pas i la vaig comparar, tot substituint-ne una altra amb menor potència, que m'havia durat una mica més de dos anys però que ja no feia un cafè de qualitat.

I no puc estar-ne més content. Molt fàcil de fer, el cafè, amb una qualitat (pel meu gust) excepcional.",Jaume P,Revisado en España el 26 de enero de 2024
Café buenísimo,"5,0 de 5 estrellas","Compré está cafetera y estoy muy contenta, la calidad de los materiales es buena, el café es excelente, se calienta muy rápido y no hace mucho ruido. Me encanta su tamaño porque ocupa muy poco y la parte de arriba que es para calentar las tazas se calienta mucho, no como otras que apenas se nota. Respecto a otros comentarios que dicen que el interior de la cazoleta del mango es de plástico... No lo veo un inconveniente ya que mi antigua Krups también es de plástico y sigue dando guerra. Yo la pedí en blanco y queda muy bonita en mi cocina. La recomiendo 100%",Estefania,Revisado en España el 7 de julio de 2023
Cafetera Nespresso Cecotec,"5,0 de 5 estrellas","Bonita elegante, poco ruidosa y hace un café perfecto, yo utilizo café en grano recién molido hace buena crema y con el vaporizador se prepara un buen capuchino le daría un nueve de 10",Cliente Amazon,Revisado en España el 18 de febrero de 2024
ESTUPENDA Y PRACTICA,"5,0 de 5 estrellas","La unica pega que se le puede poner es pasar de modo cafe, a modo vapor para calentar leche por ejemplo y hacer espuma, requiere reiniciar la maquina.",Cliente Amazon,Revisado en España el 17 de marzo de 2024
Un café (pará mí)😊,"5,0 de 5 estrellas",Me encanta es un buen capricho y cumple con lo ofrecido,Montserrat escobar,Revisado en España el 9 de abril de 2024
Buen café,"5,0 de 5 estrellas",El café sale buenísimo y la cafetera es muy fácil de usar y limpiar.,Mayra,Revisado en España el 6 de abril de 2024
Excelente,"5,0 de 5 estrellas","Cafetera muy potente, de gran calidad como todo lo que he probado de Cecotec, y con un tamaño reducido que viene muy bien para cocinas pequeñas",Fernando Almazan,Revisado en España el 15 de marzo de 2024
